"18-RC-286388","Ecumen","Region 18, Minneapolis, Minnesota","Open","11/16/2021","","","Owatonna","MN","A","Revised Single Labor Org","Initial","05/03/2022",16,NA,"United Food and Commercial Workers Local 663",6,"",NA,"",NA,6,NA,"",1,"Y","","Included:  All full time and regular part time Resident Assistants, including Resident Leads, Dining Assistants, Cooks, and Housekeeping employees, including Housekeeping Leads, employed by the Employer in Owatonna, Minnesota. 

Excluded:  All Managers, and Guards and Supervisors as defined by the Act, as amended, and all other employees. 
","","","",17,"","","Included: All RAs (nursing staff), dining assistants, and housekeepers Excluded: All maintenance employees, activity assistants, on-call employees, and Supervisors, managers, and guards as defined by the National Labor Relations Act",16,44.047613,-93.223724,"Owatonna, MN 55060",1,"place","TIGER/Line® dataset from the US Census Bureau","Owatonna","Steele County","MN","55060","US",1,43.7939257698284,-93.6917906008499
"18-RC-293227","Starbucks Corporation","Region 18, Minneapolis, Minnesota","Open","03/30/2022","","","Minneapolis","MN","A","Single Labor Organization","Initial","06/14/2022",19,NA,"Chicago and Midwest Regional Joint Board, Workers United/SEIU",5,"",NA,"",NA,6,11,"",NA,"","","Included: All full-time and regular part-time Baristas and Shift Supervisors employed by the Employer at 5351 Lyndale Ave S, Minneapolis, Minnesota 55419 (Store 822); 

Excluded: Store managers, Office Clericals, Professional Employees, and Guards and Supervisors as defined by the Act. 
","","","",NA,"","","",NA,44.984577,-93.269097,"Minneapolis, MN 55401",1,"place","TIGER/Line® dataset from the US Census Bureau","Minneapolis","Hennepin County","MN","55401","US",1,44.5383604556308,-93.3728531506964
"18-RC-304165","Dyno Nobel, Inc.","Region 18, Minneapolis, Minnesota","Open","09/27/2022","","","Ishpeming","MI","","","","",NA,NA,"United Steel, Paper and Forestry, Rubber, Manufacturing, Energy, Allied Industrial and Service Workers International Union AFL-CIO, CLC",NA,"",NA,"",NA,NA,NA,"",NA,"","","","","","",11,"","","Included: Operator, Lead Operator, Lead Plant Operator, Semi Driver, Blaster, and Mechanic.

Excluded: All other employees including office, clerical, supervisors, and Guards as defined by the Act.",NA,46.43869,-87.709096,"Ishpeming, MI 49849",1,"place","TIGER/Line® dataset from the US Census Bureau","Ishpeming","Marquette County","MI","49849","US",1,46.7285809354117,-88.1700235066759
"18-RC-304169","Freeway Auto Center LLC d/b/a Kia of Duluth","Region 18, Minneapolis, Minnesota","Open","09/27/2022","","","Duluth","MN","A","Single Labor Organization","Initial","11/03/2022",16,NA,"District Lodge 77, International Association of Machinists and Aerospace Workers, AFL-CIO",6,"",NA,"",NA,7,13,"",NA,"","","Included:  All full-time and regular part-time service technicians, recon detailers, service advisors, parts department counterpersons, and parts department manager employed by the Employer at its Duluth, Minnesota facility, located at 1701 W. Michigan Street, Duluth, MN.

Excluded: all other employees, office clerical employees, service warranty administrator, professional employees, auto salespersons, confidential employees, and guards and supervisors as defined in the National Labor Relations Act.
","","","",NA,"","","",NA,47.005566,-92.001934,"Duluth, MN 55801",1,"place","TIGER/Line® dataset from the US Census Bureau","Duluth","St. Louis County","MN","55801","US",1,46.8298081036121,-91.6046982849367
"18-RC-304279","Allina Health System d/b/a Courage Kenny Rehabilitation Institute","Region 18, Minneapolis, Minnesota","Open","09/27/2022","","","Golden Valley","MN","","","","",NA,NA,"Service Employees International Union - Healthcare Minnesota and Iowa",NA,"",NA,"",NA,NA,NA,"",NA,"","","","","","",56,"","","Included: nursing aides, therapy aides, recreational aides, dietary aides, health unit coordinators, licensed practical nurses. Excluded: All guards, supervisors, managerial employees, all other employees as defined by the act.",NA,45.005499,-93.379151,"Golden Valley, MN 55427",0.9,"place","TIGER/Line® dataset from the US Census Bureau","Golden Valley","Hennepin County","MN","55427","US",1,44.6582465302573,-93.4913003568644
"18-RC-304672","Englert Civic Theatre, Inc.","Region 18, Minneapolis, Minnesota","Open","10/05/2022","","","Iowa City","IA","","","","",NA,NA,"IATSE, Local 690",NA,"",NA,"",NA,NA,NA,"",NA,"","","","","","",19,"","","Included: All full-time and part-time stagehands and technicians employed by the Englert Civic Theatre, Inc., who worked at least one event or show between July 1, 2021 and June 30, 2022, including carpenters, riggers, lighting technicians, audio technicians, fly rail operators, truck loaders, and other similar technical positions engaged in the loading in, operation and loading out of equipment used in connection with live entertainment events presented at the Englert Theatre. 
Excluded: All other employees including office clerical employees, guards, and supervisors as defined in the Act.
",NA,41.634209,-91.49905,"Iowa City, IA 52240",1,"place","TIGER/Line® dataset from the US Census Bureau","Iowa City","Johnson County","IA","52240","US",1,41.1484762162037,-91.6051340105638
"18-RC-304934","Starbucks Corporation","Region 18, Minneapolis, Minnesota","Open","10/11/2022","","","Green Bay","WI","","","","",NA,NA,"Chicago and Midwest Regional Joint Board, Workers United/SEIU",NA,"",NA,"",NA,NA,NA,"",NA,"","","","","","",21,"","","Included:
All full-time and regular part-time Baristas and Shift Supervisors
Excluded:
Store managers, Office Clericals, Guards, Professional Employees, and Supervisors",NA,44.480778,-88.016063,"Green Bay, WI 54301",1,"place","TIGER/Line® dataset from the US Census Bureau","Green Bay","Brown County","WI","54301","US",1,44.0675123123537,-88.0943124649757
"18-RC-306129","DAIRY FARMERS AMERICA, INGREDIENT SOLUTION","Region 18, Minneapolis, Minnesota","Open","10/28/2022","","","Dalbo","MN","","","","",NA,NA,"MILK DRIVERS AND DAIRY EMPLOYEES, TEAMSTERS LOCAL 471",NA,"",NA,"",NA,NA,NA,"",NA,"","","","","","",59,"","","Included: Production, Lab, Maintenance Mechanics, Warehouse, and Lead Persons

Excluded: None",NA,45.660954,-93.430806,"Dalbo, MN 55017",1,"place","TIGER/Line® dataset from the US Census Bureau","Dalbo","Isanti County","MN","55017","US",1,45.8269420350344,-93.2101195542888
"18-RC-306175","John Henry Foster Minnesota, Inc.","Region 18, Minneapolis, Minnesota","Open","10/28/2022","","","Eagan","MN","","","","",NA,NA,"Pipefitters Local 455",NA,"",NA,"",NA,NA,NA,"",NA,"","","","","","",4,"","","Included: All full-time and regular part-time installation and piping specialists employed by the Employer at its Eagan, Minnesota facility. Excluded: All other employees, service technicians, office clerical employees, guards, and supervisors as defined in the Act.",NA,44.802791,-93.167768,"Eagan, MN 55122",1,"place","TIGER/Line® dataset from the US Census Bureau","Eagan","Dakota County","MN","55122","US",1,44.7809001576442,-92.8405666116894
"18-RC-306203","Noble Knight Games","Region 18, Minneapolis, Minnesota","Open","10/31/2022","","","Fitchburg","WI","","","","",NA,NA,"Communications Workers of America, AFL-CIO",NA,"",NA,"",NA,NA,NA,"",NA,"","","","","","",70,"","","Included: All full-time and part-time regular employees working at or out of 2b.
Excluded: All Guards and Supervisors as defined by the Act.",NA,NA,NA,NA,NA,NA,NA,NA,NA,NA,NA,NA,1,NA,NA
"18-RC-306683","Mission Point Nursing Home of Ishpeming","Region 18, Minneapolis, Minnesota","Open","11/03/2022","","","Ishpeming","MI","","","","",NA,NA,"SEIU Healthcare Michigan",NA,"",NA,"",NA,NA,NA,"",NA,"","","","","","",13,"","","Included:  All full-time, part-time, on call Licensed Practical Nurses as an Armour-Globe.

Excluded:  All PRN License Practical Nurses, all Business, Office, Clerical employees, Professional employees, supervisors and Managers.

NOTE:  This is a filing for an Armour-Globe election to add LPNs to an existing unit represented by the union (SEIU HCMI) at the facility.  That unit currently consists of all full-time and part-time nurses aides, kitchen employees, housekeeping employees, laundry employees, and activities employees.",NA,46.43869,-87.709096,"Ishpeming, MI 49849",1,"place","TIGER/Line® dataset from the US Census Bureau","Ishpeming","Marquette County","MI","49849","US",1,46.4707930030027,-88.034891822544
"18-RD-298751","Cuyuna Regional Medical Center","Region 18, Minneapolis, Minnesota","Open","07/01/2022","","","Crosby","MN","","","","",NA,NA,"SEIU Healthcare Minnesota",NA,"",NA,"",NA,NA,NA,"",NA,"","","","","","",97,"","","Included:  All full-time and regular part-time technical employees including, but not limited to technical employees working in the Laboratory, Respiratory Therapy, Physical Therapy and Radiology Departments, Licensed Practical Nurses, Engineers, Certified Occupational Therapy Assistants, Pharmacy Technicians and Accredited Records Technicians.

Excluded:  Registered Nurses, Registered Physical Therapists, Supervisors and all other employees.",NA,46.48218,-93.95776,"Crosby, MN 56441",1,"place","TIGER/Line® dataset from the US Census Bureau","Crosby","Crow Wing County","MN","56441","US",1,46.9417210244074,-94.4522976345422
"18-RD-298798","Cuyuna Regional Medical Center","Region 18, Minneapolis, Minnesota","Open","07/01/2022","","","Crosby","MN","","","","",NA,NA,"SEIU Healthcare Minnesota",NA,"",NA,"",NA,NA,NA,"",NA,"","","","","","",97,"","","Included:  Clerical employees working in the Business Office or Medical Records Department.

Excluded:  Payroll Clerk, Bookkeeper, Supervisors and all other employees.",NA,46.48218,-93.95776,"Crosby, MN 56441",1,"place","TIGER/Line® dataset from the US Census Bureau","Crosby","Crow Wing County","MN","56441","US",1,46.9631584837998,-93.6446328378322
"18-RD-303682","Goodwill Retail Services, Inc.","Region 18, Minneapolis, Minnesota","Open","09/19/2022","","","Sturtevant","WI","","","","",NA,NA,"SEIU",NA,"",NA,"",NA,NA,NA,"",NA,"","","","","","",16,"","","Included:  Semi & Straight Truckdrivers in Retail Transportation Dept.
",NA,42.712962,-87.934013,"Sturtevant, WI 53177",1,"place","TIGER/Line® dataset from the US Census Bureau","Sturtevant","Racine County","WI","53177","US",1,43.092647102962,-88.0152329008651
"18-RD-304180","Merrill Manufacturing Corporation","Region 18, Minneapolis, Minnesota","Open","09/27/2022","","","Merrill","WI","","","","",NA,NA,"District Lodge 10, International Association of Machinists and Aerospace Workers",NA,"",NA,"",NA,NA,NA,"",NA,"","","","","","",27,"","","Included:  

Excluded:  Clerical employees, guards and supervisors as defined in the National Labor Relations Act, as amended.",NA,45.217518,-89.713291,"Merrill, WI 54452",1,"place","TIGER/Line® dataset from the US Census Bureau","Merrill","Lincoln County","WI","54452","US",1,45.1439920857761,-89.9716925629254
"18-RM-306698","Gilcrest Jewett, a division of US LBM Holdings, LLC","Region 18, Minneapolis, Minnesota","Open","11/07/2022","","","Des Moines","IA","","","","",NA,NA,"Chauffeurs, Teamsters and Helpers Local Union No. 238",NA,"",NA,"",NA,NA,NA,"",NA,"","","","","","",4,"","","Included:  Working foremen, fork lift operators, truck drivers (straight and semi), straddle buggy operators, hydraulic boom operators, and permanent employees engaged exclusively in the yards as yard helpers.

Excluded:  Casual employees, clerks, salesmen, office, and other employees who incidental to their regular duties may handle lumber or perform other work in the yard.",NA,41.672687,-93.572173,"Des Moines, IA 50301",1,"place","TIGER/Line® dataset from the US Census Bureau","Des Moines","Polk County","IA","50301","US",1,42.1102349714945,-93.2148742977656
"19-RC-282395","United Rentals (North America), Inc.","Region 19, Seattle, Washington","Open","09/02/2021","","","Tukwila","WA","A","Single Labor Organization","Initial","11/23/2021",17,NA,"Teamsters Local Union No. 174 affiliated with the International Brotherhood of Teamsters",6,"",NA,"",NA,9,15,"",2,"","","All full-time and regular part-time equipment delivery drivers employed by the Employer and working out of its Seattle Metro Hub locations in Everett, Kirkland, Seattle, Tukwila, Tacoma and Bonney Lake, Washington; excluding all other employees, warehouse employees, office clerical employees, managers and guards, and supervisors as defined by the Act.


","","","",17,"","","Included:  

All full-time and part-time equipment delivery drivers employed by the employer at facility's located in Everett, Kirkland, Seattle, Tukwila, Tacoma and Bonney Lake, WA (Seattle Metro Hub).

Excluded: 

All other employees, including warehouse, office clerical, guards, and supervisors as defined by the Act.",17,47.473988,-122.260956,"Tukwila, WA 98138",0.9,"place","TIGER/Line® dataset from the US Census Bureau","Tukwila","King County","WA","98138","US",1,47.4876661942565,-122.116996022569
"19-RC-287149","Safeway, Inc.","Region 19, Seattle, Washington","Open","12/02/2021","","","Longview","WA","","","","",NA,NA,"United Food and Commercial Workers International Local 555, AFL-CIO",NA,"",NA,"",NA,NA,NA,"",NA,"","","","","","",5,"","","Included: All pharmacy clerk and tech employees. Excluded: All Pharmacists and supervisors as defined by the Act.",NA,46.181872,-123.057597,"Longview, WA 98632",1,"place","TIGER/Line® dataset from the US Census Bureau","Longview","Cowlitz County","WA","98632","US",1,45.7556383549371,-122.58867567064
"19-RC-287293","Albertsons LLC","Region 19, Seattle, Washington","Open","12/06/2021","","","Klamath Falls","OR","","","","",NA,NA,"United Food and Commercial Workers Union Local 555",NA,"",NA,"",NA,NA,NA,"",NA,"","","","","","",5,"","","Included:  All pharmacy clerks and tech employees.  Excluded:  All pharmacists and supervisors as defined by the Act.",NA,42.293293,-121.816873,"Klamath Falls, OR 97601",1,"place","TIGER/Line® dataset from the US Census Bureau","Klamath Falls","Klamath County","OR","97601","US",1,41.858214783749,-121.52604091074
"19-RC-287294","Safeway, Inc.","Region 19, Seattle, Washington","Open","12/06/2021","","","Cottage Grove","OR","","","","",NA,NA,"United Food and Commercial Workers Union Local 555",NA,"",NA,"",NA,NA,NA,"",NA,"","","","","","",5,"","","Included:  All pharmacy clerk and tech employees.  Excluded:  All pharmacists and supervisors as defined by the Act.",NA,43.72893,-123.049498,"Cottage Grove, OR 97424",1,"place","TIGER/Line® dataset from the US Census Bureau","Cottage Grove","Lane County","OR","97424","US",1,44.0062608656178,-122.813381768348
"19-RC-288422","Safeway, Inc.","Region 19, Seattle, Washington","Open","01/04/2022","","","Grants Pass","OR","","","","",NA,NA,"United Food and Commercial Workers Local 555",NA,"",NA,"",NA,NA,NA,"",NA,"","","","","","",3,"","","Included: All pharmacy clerk and tech employees. Excluded: All pharmacists and supervisors as defined by the Act.",NA,42.535654,-123.338332,"Grants Pass, OR 97526",1,"place","TIGER/Line® dataset from the US Census Bureau","Grants Pass","Josephine County","OR","97526","US",1,42.5457456135125,-122.866379140222
"19-RC-292922","Connections Education LLC d/b/a Washington Connections Academy","Region 19, Seattle, Washington","Open","03/25/2022","","","Tumwater","WA","A","Single Labor Organization","Initial","05/25/2022",103,NA,"Service Employees International Union, Local 925",43,"",NA,"",NA,47,90,"",NA,"","SEIU Local 925","All full-time and regular part-time professional non-administrative certificated employees employed by the Employer and working at its online campus operating out of Tumwater, Washington including those in following classifications: K-12 Teacher, Lead Teacher, Coordinator Teacher, EL Specialist, WSLP Coordinator, State Testing Coordinator, 504 Coordinator, and School Counselor; excluding all non-professional employees, office clerical employees, administrative assistants, administrators, Assistant Principal, Principal, Specialist Teachers, Master Teachers, managerial employees, and guards and supervisors as defined by the Act.  

","","","",104,"","SEIU Local 925","Included: All full-time and regular part-time certificated staff employed by Washington Connections Academy. Excluded: Administrators, non-certificated staff, and all other employees, guards, managers and supervisors as defined by the Act.",103,47.087554,-123.021968,"Tumwater, WA 98502",0.9,"place","TIGER/Line® dataset from the US Census Bureau","Tumwater","Thurston County","WA","98502","US",1,47.4250723183234,-123.258661879357
"19-RC-295095","Franciscan Medical Group","Region 19, Seattle, Washington","Open","05/02/2022","","","Seattle","WA","A","Single Labor Organization","Initial","09/01/2022",57,NA,"Union of American Physicians and Dentists",21,"",NA,"",NA,23,44,"",1,"","","Included:  All full-time, part-time, and per diem MDs, PAs and ARNPs employed by the Employer at the following locations:


St. Joseph Prompt Care
1812 J St., Suite 120, Tacoma, WA 98405

Burien Prompt Care
16045 1st Ave S, 1st Floor Burien, WA 98148

Canyon Road Prompt Care
15214 Canyon Rd E Puyallup, WA 98375

Gig Harbor Prompt Care
4700 Fosdick Dr. NW, Suite 102 Gig Harbor, WA 98335

Bonney Lake Prompt Care
9230 Sky Island Dr. E Bonney Lake, WA

University Place Urgent Care
3556 Marketplace W, Suite 109 University Place, WA 98466

Federal Way Urgent Care
31675 Pacific Hwy S Federal Way, WA 98003

West Seattle Urgent Care
4755 Fauntleroy Way SW, Suite 110, Seattle, WA 98116

Puyallup Urgent Care
12005 Meridian Ave E, Suite 101, Puyallup, WA

Bainbridge Island Urgent Care
1344 Wintergreen Ln NE, Suite 100, Bainbridge Island, WA

Belfair Urgent Care
21 North Romance Hill Rd, Belfair, WA

Port Orchard Urgent Care
450 S Kitsap Blvd, Suite 100, Port Orchard, WA

Excluded:  All other employees, urgent care medical directors, non-professional employees, managerial employees, office clerical employees, and guards and supervisors as defined in the Act.
","","","",45,"","","Included: All full time, part time, and per diem MD, PAs and ARNP employed at Attachment loc. Excluded: All other employees, supervisors, non-professional employees, as defined by the Act.",57,47.610902,-122.336422,"Seattle, WA 98101",1,"place","TIGER/Line® dataset from the US Census Bureau","Seattle","King County","WA","98101","US",1,47.2436386582118,-122.156895731263
"19-RC-295849","Starbucks Corporation","Region 19, Seattle, Washington","Open","05/13/2022","","","Seattle","WA","","","","",NA,NA,"Workers United",NA,"",NA,"",NA,NA,NA,"",NA,"","","","","","",24,"","Workers United","",24,47.610902,-122.336422,"Seattle, WA 98101",1,"place","TIGER/Line® dataset from the US Census Bureau","Seattle","King County","WA","98101","US",1,47.7376039358929,-122.367048449501
"19-RC-296056","Saint Alphonsus Medical Center - Ontario, Inc.","Region 19, Seattle, Washington","Open","05/18/2022","","","Ontario","OR","A","Single Labor Organization","Initial","10/19/2022",76,2,"Oregon Nurses Association",16,"",NA,"",NA,44,60,"",1,"","","Included:  All full-time and regular part-time Registered Nurses who perform patient care duties at the Employer’s acute care hospital located at 351 SW 9th St., Ontario Oregon.

Excluded:  All Registered Nurses working in the positions of Educator, Infection Control, Risk Manager, Case Manager/UR Clinical Documentation Specialist, and Clinical Resource Coordinator, Registered Nurses working as nurses, administrative personnel, all other employees, and guards and supervisors as defined by the Act.
","","","",NA,"","","",NA,44.093127,-117.079896,"Ontario, OR 97914",1,"place","TIGER/Line® dataset from the US Census Bureau","Ontario","Malheur County","OR","97914","US",1,44.198408787226,-117.520639427956
"19-RC-296206","Ridgemont Terrace, Inc. d/b/a Stafford Healthcare at Ridgemont","Region 19, Seattle, Washington","Open","05/20/2022","","","Port Orchard","WA","A","Single Labor Organization","Initial","07/14/2022",73,NA,"Service Employees International Union Local 775",23,"",NA,"",NA,22,45,"",4,"Y","","All full-time, regular part-time, and on-call employees employed by the Employer and working at or out of its skilled nursing facility located at 2051 Pottery Ave., Port Orchard, Washington, in the following classifications: nursing assistants, dietary aides, universal aides, activity assistants, cooks, housekeeping helpers, laundry helpers, and van drivers; excluding all other employees, managers, confidential employees, professional employees, registered and licensed nurses, office clerical employees, apartments customer service, maintenance assistants, medical records assistants, technical employees,  schedulers, and guards and supervisors as defined by the Act. 
","","","",78,"","","Included: All full-time, part-time, on-call and float pool employees employed by Stafford at the Port Orchard facility who provide care related services to residents including nursing assistants, dietary aides, universal aides, activity aides, restorative aides, cooks, housekeeping, laundry and any other similar job titles or classification. Also, any other service classifications established hereafter where eligibility remains consistent with the National Labor Relations Act (NLRA) shall be included.  Excluded: All other employees not providing direct care service to residents employed by the Employer, managers, confidential employees, registered nurses, office clerical employees, professional employees, technical employees, receptionists, guards, schedulers, and supervisors as defined in NLRA.",73,47.542664,-122.587102,"Port Orchard, WA 98366",1,"place","TIGER/Line® dataset from the US Census Bureau","Port Orchard","Kitsap County","WA","98366","US",1,47.4897418722316,-122.80269970219
"19-RC-296616","New Seasons Market LLC","Region 19, Seattle, Washington","Open","05/27/2022","","","Hillsboro","OR","A","Single Labor Organization","Initial","09/01/2022",108,1,"United Food and Commercial Workers Local 555",37,"",NA,"",NA,60,97,"",3,"","United Food & Commercial Workers, Local 555","INCLUDED: All full-time and regular part-time employees, including Assistant Department Managers , Leads, and Culinary Events Specialists employed by the Employer at its store located at 1453 NE 61st Avenue, Hillsboro, Oregon.

EXCLUDED: All Managers, Assistant Store Managers, Store Chefs, managerial employees, all other employees, and guards and supervisors as defined by the Act.
","","","",100,"","United Food & Commercial Workers, Local 555","Included: All Asst. Managers, Grocery, Bakery, Deli, Produce, and Meat Department Employees. Excluded: All Managers, Culinary event specialist, guards, supervisors as defined by the Act.",108,45.458397,-122.977963,"Hillsboro, OR 97123",1,"place","TIGER/Line® dataset from the US Census Bureau","Hillsboro","Washington County","OR","97123","US",1,45.1866071765741,-122.515787794184
"19-RC-296659","Providence Milwaukie Hospital","Region 19, Seattle, Washington","Open","05/27/2022","","","Milwaukie","OR","","","","",NA,NA,"Oregon Nurses Association",NA,"",NA,"",NA,NA,NA,"",NA,"","","","","","",3,"","","Included: Wound Ostomy Nurses to be included in existing RN bargaining unit. Excluded: Supervisors and Managers as defined by the Act.",NA,45.446231,-122.639261,"Milwaukie, OR 97222",0.9,"place","TIGER/Line® dataset from the US Census Bureau","Milwaukie","Clackamas County","OR","97222","US",1,45.8220770055105,-122.583990411276
"19-RC-297140","Starbucks Corporation","Region 19, Seattle, Washington","Open","06/06/2022","","","Seattle","WA","","","","",NA,NA,"Workers United",NA,"",NA,"",NA,NA,NA,"",NA,"","","","","","",22,"","","Included: All full-time and regular part-time Baristas, Shift Supervisors. Excluded: Store Managers, Asst. Store Managers, office clericals, guards, and supervisors as defined by the Act.",NA,47.610902,-122.336422,"Seattle, WA 98101",1,"place","TIGER/Line® dataset from the US Census Bureau","Seattle","King County","WA","98101","US",1,47.9138988151823,-121.924623349834
"19-RC-298772","Starbucks Corporation","Region 19, Seattle, Washington","Open","07/06/2022","","","Springfield","OR","A","Single Labor Organization","Initial","09/20/2022",18,NA,"Workers United",5,"",NA,"",NA,3,8,"",NA,"","Workers United a/w SEIU","INCLUDED: All full-time and regular part-time baristas and shift supervisors employed by the Employer at its store located at 1810 Pioneer Pkwy W., Springfield, OR 97477. 

EXCLUDED: All store managers, assistant store managers, office clericals, confidential employees, managerial employees, and all other employees, professional employees, and guards and supervisors as defined in the Act.
","","","",19,"","Workers United a/w SEIU","Included: All full-time and regular part-time Baristas, Shift Supervisors. Excluded: Store Managers, Asst. Store Managers, office clericals, guards, and supervisors as defined by the Act.",18,44.058465,-123.011597,"Springfield, OR 97477",1,"place","TIGER/Line® dataset from the US Census Bureau","Springfield","Lane County","OR","97477","US",1,44.3839585601726,-122.601327259497
