"22-RC-297330","3, LLC","Region 22, Newark, New Jersey","Open","06/07/2022","","","Kearny","NJ","A","Single Labor Organization","Initial","10/24/2022",15,2,"New Jersey Building Laborers District Council",NA,"",NA,"",NA,NA,6,"",6,"Y","","Included: All full-time and regular part-time laborers employed by the Employer throughout the State of New Jersey.
Excluded: All office clerical employees, drivers, confidential employees, superintendents, foremen, guards, professional employees and supervisors as defined in the Act, and all other employees.","","","",NA,"","","",NA,40.75175,-74.122937,"Kearny, NJ 07032",1,"place","TIGER/Line® dataset from the US Census Bureau","Kearny","Hudson County","NJ","7032","US",1,41.1926825472079,-73.9567273795764
"22-RC-305489","Union Fresh Start, LLC d/b/a Serenity at Summit – Delphi Health Group","Region 22, Newark, New Jersey","Open","10/18/2022","","","Union","NJ","","","","",NA,NA,"Alliance Frontline Workers Union",NA,"",NA,"",NA,NA,NA,"",NA,"","","","","","",23,"","","INCLUDED:  Behavorial Health Technicians and Lead Behavioral Health Technicians

EXCLUDED:  Supervisors, Assistant Managers, Managers, Safety Officers, Nurses, Clinicians",NA,40.692651,-74.269841,"Union, NJ 07083",1,"place","TIGER/Line® dataset from the US Census Bureau","Union","Union County","NJ","7083","US",1,40.6032539139366,-74.7403458890319
"22-RC-311933","Shimmick Construction Company, Inc.","Region 22, Newark, New Jersey","Open","01/25/2023","","","Irvine","CA","","","","",NA,NA,"Local 352, National Association of Transportation Supervisors",NA,"",NA,"",NA,NA,NA,"",NA,"","","","","","",7,"","","INCLUDED:  All Train Masters

EXCLUDED:  All other employees",NA,33.757245,-117.750414,"Irvine, CA 92602",1,"place","TIGER/Line® dataset from the US Census Bureau","Irvine","Orange County","CA","92602","US",1,33.8568568334588,-117.617344211196
"22-RC-318664","Lodi Volunteer Ambulance Rescue Squad, Inc.","Region 22, Newark, New Jersey","Open","05/23/2023","","","Lodi","NJ","","","","",NA,NA,"International Association of EMT's and Paramedics /NAGE/ SEIU Local 5000",NA,"",NA,"",NA,NA,NA,"",NA,"","","","","","",14,"","","INCLUDED:  All full time, part time, and per diem emergency medical technicians

EXCLUDED:  Managers, executives, and supervisors as defined in the National Labor Relations Act.",NA,40.878349,-74.081335,"Lodi, NJ 07644",1,"place","TIGER/Line® dataset from the US Census Bureau","Lodi","Bergen County","NJ","7644","US",1,41.2505750864452,-74.51728536841
"22-RC-320562","A-V SERVICES, INC.","Region 22, Newark, New Jersey","Open","06/23/2023","","","Fairfield","NJ","","","","",NA,NA,"International Alliance of Theatrical Stage Employees, Local 59, AFL-CIO",NA,"",NA,"",NA,NA,NA,"",NA,"","","","","","",4,"","","INCLUDED:  Full-time Audio-Visual Technicians employed in Jersey City, NJ

EXCLUDED:  Supervisory and all other employees.",NA,40.875948,-74.29681,"Fairfield, NJ 07004",1,"place","TIGER/Line® dataset from the US Census Bureau","Fairfield","Essex County","NJ","7004","US",1,40.6314268663983,-74.533693756239
"22-RC-320571","Summit Health Management LLC","Region 22, Newark, New Jersey","Open","06/26/2023","","","Berkeley Heights","NJ","","","","",NA,NA,"International Association of Machinists and Aerospace Workers District 15/Local 447",NA,"",NA,"",NA,NA,NA,"",NA,"","","","","","",10,"","","INCLUDED:  All full time and part time Facility Maintenance Employees

EXCLUDED:  Office clerical, professional, managerial, guards and supervisors as defined by the Act.",NA,40.675451,-74.422196,"Berkeley Heights, NJ 07922",1,"place","TIGER/Line® dataset from the US Census Bureau","Berkeley Heights","Union County","NJ","7922","US",1,41.1737250136329,-74.0857801839015
"22-RC-320590","JP Brunswick, LLC","Region 22, Newark, New Jersey","Open","06/26/2023","","","New Brunswick","NJ","","","","",NA,NA,"United Food and Commercial Workers Union  Local 152",NA,"",NA,"",NA,NA,NA,"",NA,"","","","","","",17,"","","INCLUDED:  All full time and regular part time baristas, lead baristas, shift leads, and key holders.

EXCLUDED:  All other employees, supervisors and guards as defined by the Act.",NA,40.486754,-74.444395,"New Brunswick, NJ 08901",1,"place","TIGER/Line® dataset from the US Census Bureau","New Brunswick","Middlesex County","NJ","8901","US",1,40.737071549333,-74.7765326880631
"22-RC-321062","STARBUCKS CORPORATION","Region 22, Newark, New Jersey","Open","07/03/2023","","","Ledgewood","NJ","","","","",NA,NA,"Workers United",NA,"",NA,"",NA,NA,NA,"",NA,"","","","","","",25,"","","INCLUDED:  All full-time and regular part-time baristas and shift supervisors.

EXCLUDED:  Store managers, assistant store managers, office clericals, guards, and supervisors as defined by the National Labor Relations Act.",NA,40.88121,-74.65599,"Ledgewood, NJ 07852",1,"place","TIGER/Line® dataset from the US Census Bureau","Ledgewood","Morris County","NJ","7852","US",1,40.6574289516798,-74.8377521788941
"22-RC-321516","Bigis Global Integrated Solution","Region 22, Newark, New Jersey","Open","07/11/2023","","","Secaucus","NJ","","","","",NA,NA,"INTERNATIONAL UNION OF OPERATING ENGINEERS LOCAL 68, 68A, 68B, 68C, 68D",NA,"",NA,"",NA,NA,NA,"",NA,"","","","","","",6,"","","INCLUDED:  All Critical Facility Engineers and Lead Critical Facility Engineers

EXCLUDED:  All other employees among whom are Office Clerical Employees, Professionals",NA,40.78885,-74.056035,"Secaucus, NJ 07094",1,"place","TIGER/Line® dataset from the US Census Bureau","Secaucus","Hudson County","NJ","7094","US",1,40.8325066863209,-73.7727603729422
"22-RD-190318","Laminated Board, Inc.","Region 22, Newark, New Jersey","Open","12/21/2016","","","Linden","NJ","","","","",NA,NA,"Retail, Wholesale, Department Store Union, Local 262 (RWDSU/UFCW)",NA,"",NA,"",NA,NA,NA,"",NA,"","","","","","",38,"","","Included:  All full time and regular part time mechanics & Warehouse employees.
Excluded:  Office clerical employees, confidential employees, officers, managers, professional  guards and supervisors.",NA,40.626953,-74.250939,"Linden, NJ 07036",1,"place","TIGER/Line® dataset from the US Census Bureau","Linden","Union County","NJ","7036","US",1,41.0256742728243,-74.5852443513672
"22-RD-304996","JSK Parsippany, LLC d/b/a Fairfield Inn & Suites by Marriott","Region 22, Newark, New Jersey","Open","10/11/2022","","","Paterson","NJ","","","","",NA,NA,"New York Hotel & Motel Trades Council",NA,"",NA,"",NA,NA,NA,"",NA,"","","","","","",19,"","","INCLUDED:  All F/T & P/T  Maintenance Techs, Breakfast Host, Houseman and Housekeepers

EXCLUDED:  All other as defined in the Act",NA,40.911999,-74.170965,"Paterson, NJ 07501",1,"place","TIGER/Line® dataset from the US Census Bureau","Paterson","Passaic County","NJ","7501","US",1,41.3218492711859,-74.3321988428386
"22-RD-309942","Simpson & Brown, Inc.","Region 22, Newark, New Jersey","Open","01/06/2023","","","Perth Amboy","NJ","","","","",NA,NA,"Teamsters Local 469",NA,"",NA,"",NA,NA,NA,"",NA,"","","","","","",4,"","","INCLUDED:  All full-time and regular part-time truck drivers employed by the Employer 

EXCLUDED:  All office clerical employees, dispatchers, trade employees, yard employees, professional employees, guards",NA,40.520654,-74.279144,"Perth Amboy, NJ 08861",1,"place","TIGER/Line® dataset from the US Census Bureau","Perth Amboy","Middlesex County","NJ","8861","US",1,40.3192874676389,-74.1314330612949
"22-RD-315731","The Arc Mercer","Region 22, Newark, New Jersey","Open","04/07/2023","","","Ewing","NJ","A","Single Labor Organization","Initial","06/02/2023",139,1,"Communication Workers of America , Local 1040",14,"",NA,"",NA,17,31,"",NA,"","Communication Workers of America , Local 1040","INCLUDED:	All nonsupervisory, non-administrative, nonprofessional full-time and regular part-time and per diem, and floater and aides, employed by the Employer at its Mercer County locations, who provide direct care and services to consumers, including nonsupervisory, non-administrative, nonprofessional direct support professionals (DSPs), DSP Floats, Medical Direct Support Professional (Medical DSPs), Overnight DSP, and Behavioral Direct Support Professional (Behavioral DSPs), and also including nonsupervisory, non-administrative, nonprofessional non-DSP employees employed by the Employer at its Mercer County locations in the titles of drivers, laborers, crew leaders, food services employees, and behavioral day program employees, and all substitutes in such positions employed by the Employer at its Mercer County locations.

EXCLUDED:	All office clerical employees, administrative employees, day camp employees, managerial employees, (including Assistant Group Home Managers/Shift Group Home Managers), professional employees, guards and supervisors as defined in the Act, including Food Service Supervisor, Assistant Driver Supervisor, Shift Supervisors, Professional, Clinical, and Clerical Employees including Community Direct Support Professionals' whose services are reimbursed under Fee for Service as in home community-based supports. 

","","","",120,"","Communication Workers of America , Local 1040","INCLUDED:  Direct support professionals, drivers, laborers, crew leaders, food services employees, behavioral employees

EXCLUDED:  Office clerical Employees, admin Employees, professional Employees, day camp Employees, guards, mgmt",139,NA,NA,NA,NA,NA,NA,NA,NA,NA,NA,NA,1,NA,NA
"22-RD-318652","ABC Supply Co., Inc.","Region 22, Newark, New Jersey","Open","05/24/2023","","","Avenel","NJ","A","Single Labor Organization","","07/12/2023",NA,NA,"International Brotherhood of Teamsters, Local 560",NA,"",NA,"",NA,NA,NA,"",NA,"","","INCLUDED:	All full-time and part-time employees employed by the Employer at its locations located in Riverdale, Randolph, Clifton, Rahway, and Avenel, New Jersey, including Delivery Material Handlers, Warehouse Material Handlers, Warehouse Material Handlers & Non-CDL Drivers, Delivery Drivers I (Class B Truck), Delivery Drivers II (Class A Truck or Class B Knuckle boom/Boom Certified), and Warehouse Foremen. 

EXCLUDED:   All office clericals, directors, guards and supervisors as defined in the Act, and all other employees.

I","","","",40,"","","INCLUDED:  Truck drivers, chauffeurs, foremen, forklift operators, and warehouse workers who work at Employer's five (Avenel, NJ; Rahway, NJ; Randolph, NJ; Riverdale, NJ; Clifton, NJ)

EXCLUDED:  Supervisors and guards",NA,40.582845,-74.27524,"Avenel, NJ 07001",1,"place","TIGER/Line® dataset from the US Census Bureau","Avenel","Middlesex County","NJ","7001","US",1,40.1438318029132,-73.8899468506107
"22-RD-319718","Maschio's Food Services, Inc.","Region 22, Newark, New Jersey","Open","06/09/2023","","","Chester","NJ","","","","",NA,NA,"32BJ SEIU",NA,"",NA,"",NA,NA,NA,"",NA,"","","","","","",39,"","","INCLUDED:  Food Service Workers & Drivers

EXCLUDED:  Managers, Supervisors & Administrators",NA,40.782111,-74.683861,"Chester, NJ 07930",1,"place","TIGER/Line® dataset from the US Census Bureau","Chester","Morris County","NJ","7930","US",1,41.1349145520576,-74.7841153098293
"22-RD-321496","Gavan Graham Electrical Products","Region 22, Newark, New Jersey","Open","07/06/2023","","","Union","NJ","","","","",NA,NA,"I.B.E.W., LOCAL 1158",NA,"",NA,"",NA,NA,NA,"",NA,"","","","","","",14,"","","INCLUDED:  Paint, Fab, Assembly, wiring, shipping/receiving

EXCLUDED:  Welding",NA,40.692651,-74.269841,"Union, NJ 07083",1,"place","TIGER/Line® dataset from the US Census Bureau","Union","Union County","NJ","7083","US",1,40.8537792923259,-74.0141955504939
"22-RM-311853","POMPTONIAN FOOD SERVICE","Region 22, Newark, New Jersey","Open","02/08/2023","","","Springfield","NJ","","","","",NA,NA,"Service Employees International Union, Local 32BJ",NA,"",NA,"",NA,NA,NA,"",NA,"","","","","","",21,"","","INCLUDED:  All F/T and regular P/T food services workers

EXCLUDED: All other employees, guards & supervisors as defined in the Act",NA,40.701101,-74.316301,"Springfield, NJ 07081",1,"place","TIGER/Line® dataset from the US Census Bureau","Springfield","Union County","NJ","7081","US",1,40.7517485104485,-74.4295992426789
"22-UD-000401","New York Fast Ferry","Region 22, Newark, New Jersey","Open","10/12/2001","","","Highlands","NJ","","","","",NA,NA,"LOCAL 333, UNITED MARINE DIVISION, ILA",NA,"",NA,"",NA,NA,NA,"",NA,"","","","","","",15,"",""," Inc. Full-Time and regular part-time employees, including, but not limited, to Port Captain, Galley, Engine, Mechanic and Deck(Captain, Mate and Deckland)

Exc. All office , clerical, mangerial employees and supervisors as defined by the act.",NA,40.40372,-73.99153,"Highlands, NJ 07732",1,"place","TIGER/Line® dataset from the US Census Bureau","Highlands","Monmouth County","NJ","7732","US",1,40.5399715764777,-73.9557265716146
"25-RC-243735","Needham Excavating, Inc.","Region 25, Indianapolis, Indiana","Open","06/21/2019","","","Walcott","IA","A","Single Labor Organization","Initial","07/12/2019",17,NA,"International Union of Operating Engineers, Local 150, AFL-CIO",3,"",NA,"",NA,5,8,"",9,"","","Included:  All full-time and regular part-time heavy equipment operators employed by the Employer at its facility located at 137 North Main Street, Walcott, Iowa, 52773:
Excluded:  All other employees, and office clerical employees, managers, and guards and supervisors as defined in the Act.","","","",9,"","","Included: all full-time heavy equipment operators; Excluded: Other classifications, supervisors, managers, office clerical, and guards.",17,41.61358,-90.753478,"Walcott, IA 52773",1,"place","TIGER/Line® dataset from the US Census Bureau","Walcott","Scott County","IA","52773","US",1,41.3109281753375,-91.0102933738976
"25-RC-279310","Hall Aluminum Products, Inc.","Region 25, Indianapolis, Indiana","Open","06/30/2021","","","Fort Wayne","IN","A","Single Labor Organization","Initial","08/24/2021",63,2,"International Union of Painters and Allied Trades, District Council 91",17,"",NA,"",NA,25,42,"",6,"","","INCLUDED: All full-time and regular part-time glaziers, architectural metal workers, and architectural glass workers employed by the Employer at its Fort Wayne, Indiana facility,  
EXCLUDED: All janitorial employees, office clerical employees, professional employees, managers, temporary employees, and guards and supervisors as defined in the Act.","","","",43,"","","Included:  All full and part-time glaziers, architectural metal and glass workers

Excluded:  All statutory exemptions and shop employees",63,41.093763,-85.070713,"Fort Wayne, IN 46801",1,"place","TIGER/Line® dataset from the US Census Bureau","Fort Wayne","Allen County","IN","46801","US",1,40.7997344533389,-85.4703968789899
"25-RC-295115","Starbucks Corporation","Region 25, Indianapolis, Indiana","Open","05/03/2022","","","Peoria","IL","A","Single Labor Organization","Initial","07/12/2022",8,NA,"Chicago and Midwest Regional Joint Board, Workers United/SEIU",2,"",NA,"",NA,2,4,"",NA,"","","Included:  All full-time and regular part-time baristas and shift supervisors employed by the Employer at its store located at 707 W Pioneer Parkway, Peoria, IL.  
Excluded:  All store managers, assistant store managers, office clerical employees, confidential employees, managerial employees, professional employees, guards and supervisors as defined in the Act, and all other employees.","","","",21,"","","Included: All full-time and regular part-time Baristas and Shift Supervisors

Excluded: Store Managers, Office Clericals, Guards, Professional Employees, and Supervisors",8,40.693137,-89.589847,"Peoria, IL 61601",1,"place","TIGER/Line® dataset from the US Census Bureau","Peoria","Peoria County","IL","61601","US",1,40.4142691911309,-89.5868707582456
"25-RC-297000","SOLV Energy, LLC and Aerotek, Inc. Joint-Employers","Region 25, Indianapolis, Indiana","Open","06/03/2022","","","Bass Lake","IN","A","Single Labor Organization","Initial","12/07/2022",78,NA,"International Union of Operating Engineers Local 150, AFL-CIO",6,"",NA,"",NA,22,28,"",41,"Y","","Included:  All regular full- and part-time excavator operators, skid steer operators, loader operators, 12k telehandlers, pile driver operators, fuel/water truck tractor operators, rubber tire roller operators, street sweeper operators, leads, and mechanics jointly employed by Aerotek, Inc. and SOLV Energy LLC at the Mammoth North Solar project. 

Excluded:  All office clerical employees, safety employees, professional employees, managers, foremen, quality control employees, temporary employees, general laborers, and guards and supervisors as defined in the Act.","","","",25,"","","Included: All regular full- and part-time heavy equipment operators and mechanics.  Excluded:  All supervisors, guards, and clericals, as defined by the Act.",78,NA,NA,NA,NA,NA,NA,NA,NA,NA,NA,NA,1,NA,NA
"25-RC-312351","FCA US, LLC d/b/a Stellantis","Region 25, Indianapolis, Indiana","Open","02/16/2023","","","Kokomo","IN","","","","",NA,NA,"International Union United Automobile Aerospace and Agricultural Implement Workers of America (UAW), AFL-CIO",NA,"",NA,"",NA,NA,NA,"",NA,"","","","","","",5,"","","Included: Full-Time and Regular Part-Time Supplier Quality Engineers employed by the Employer at its Kokomo and Tipton facilities (Kokomo Engine Plant, Kokomo Transmisssion Plants 1 and 2, Indiana Transmission Plant, Tipton Transmission Plant). The Petitioner is seeking a self-determination election to include the petitioned-for employees within an existing unit of engineering employees at these Kokomo and Tipton Facilities. 

Excluded: All Managers and guards and supervisors as defined in the Act, and all other employees.",NA,40.506851,-86.171054,"Kokomo, IN 46901",1,"place","TIGER/Line® dataset from the US Census Bureau","Kokomo","Howard County","IN","46901","US",1,40.8258365897799,-86.0933733367943
"25-RC-318917","Rockford Symphony Orchestras, Inc.","Region 25, Indianapolis, Indiana","Open","05/30/2023","","","Rockford","IL","","","","",NA,NA,"Chicago Federation of Musicians, Local 10-208 AFM",NA,"",NA,"",NA,NA,NA,"",NA,"","","","","","",120,"","","Included: All musicians employed by the Employer to render services as musicians in the Rockford Symphony Orchestra
Excluded: Non-instrumental performers, administrative staff, stage crew, production staff, box office employees, ushers, and managerial employees",NA,42.33342,-89.157198,"Rockford, IL 61101",1,"place","TIGER/Line® dataset from the US Census Bureau","Rockford","Winnebago County","IL","61101","US",1,42.0911879408714,-89.2907269664566
"25-RC-320310","Admiral Metals Servicenter Company, Incorporated.","Region 25, Indianapolis, Indiana","Open","06/21/2023","","","South Bend","IN","","","","",NA,NA,"International Brotherhood of Teamsters, Chauffeurs, Warehousemen, and Helpers of America Local 364",NA,"",NA,"",NA,NA,NA,"",NA,"","","","","","",2,"","","Included: Warehousemen and truck drivers.
Excluded: All other employees, salesmen, guards, professional employees and supervisors as defined in the act.",NA,41.673383,-86.251654,"South Bend, IN 46601",1,"place","TIGER/Line® dataset from the US Census Bureau","South Bend","St. Joseph County","IN","46601","US",1,41.4589281132637,-85.8431006436952
"25-RC-321010","Starbucks Corporation","Region 25, Indianapolis, Indiana","Open","06/30/2023","","","Bloomington","IN","","","","",NA,NA,"Chicago and Midwest Regional Joint Board, Workers United/SEIU",NA,"",NA,"",NA,NA,NA,"",NA,"","","","","","",27,"","","Included: All full-time and regular part-time Baristas and Shift Supervisors

Excluded: Store managers, Office Clericals, Guards, Professional Employees, and Supervisors",NA,39.07881,-86.435094,"Bloomington, IN 47401",1,"place","TIGER/Line® dataset from the US Census Bureau","Bloomington","Monroe County","IN","47401","US",1,39.5258913020598,-86.5329651238131
"25-RC-321553","CanPack","Region 25, Indianapolis, Indiana","Open","07/12/2023","","","Muncie","IN","","","","",NA,NA,"Teamsters Local 135",NA,"",NA,"",NA,NA,NA,"",NA,"","","","","","",124,"","","Included: All full-time and regular part-time production employees in classifications of Deco Tech, Front End Tech, Palletizer Tech, Process Tech, QC/Final, Quality Controller, Scrap Tech, Spray/Necker Tech, Photo Light, and Janitor.

Excluded: Maintenance employees in the classifications of Tool Room Tech, Maintenance Tech, Machinist, and Electrical Tech; warehouse employees in the classifications of Industrial Truck Operator, Forklift Lead, and Warehouse Coordinators; office clerical employees; managerial employees; guards and supervisors as defined in the Act; and all other employees.",NA,40.142124,-85.389874,"Muncie, IN 47302",1,"place","TIGER/Line® dataset from the US Census Bureau","Muncie","Delaware County","IN","47302","US",1,40.1774506249876,-85.4371753950978
"25-RD-301657","Regional Ready Mix, LLC","Region 25, Indianapolis, Indiana","Open","08/18/2022","","","Rochelle","IL","A","Single Labor Organization","Initial","10/19/2022",27,NA,"IUOE, Local 150",7,"",NA,"",NA,1,8,"",13,"Y","","Included: All full-time and regular part-time plant operators, mechanics, concrete belt-placers, conveyor operators, loader operators, concrete pumping operators, maintenance workers, electricians, truck-drivers and oilers employed by the Employer at its facility located at 15051 E. Lind Road, Rochelle, IL 61068.

Excluded: all office clerical employees, management employees, guards and supervisors as defined in the Act, and all other employees.
","","","",13,"","","Included: FT/PT plant operators, mechanics, operators, maintenance, truck drivers

Excluded: All other employees of the company",27,42.007405,-89.100359,"Rochelle, IL 61068",1,"place","TIGER/Line® dataset from the US Census Bureau","Rochelle","Ogle County","IL","61068","US",1,41.6147956067759,-89.411759413746
"25-RD-320464","Silgan Plastics Corporation","Region 25, Indianapolis, Indiana","Open","06/22/2023","","","Seymour","IN","","","","",NA,NA,"USW Local 822",NA,"",NA,"",NA,NA,NA,"",NA,"","","","","","",9,"","","Included: 
 160

Excluded:
  30",NA,38.944827,-86.010789,"Seymour, IN 47274",1,"place","TIGER/Line® dataset from the US Census Bureau","Seymour","Jackson County","IN","47274","US",1,38.5621726807155,-85.7859666913647
"27-RC-283492","Staker & Parson Companies d/b/a Jack B. Parson Ready Mix Concrete","Region 27, Denver, Colorado","Open","09/24/2021","","","Draper","UT","A","Single Labor Organization","Initial","12/10/2021",266,5,"Independent Union of Concrete Handlers, Drivers and Operators",139,"",NA,"",NA,69,208,"",8,"","Independent Union of Concrete Handlers, Drivers and Operators","Include: All full-time and regular part-time Ready Mix Drivers employed by the Employer in (1) the following counties in Utah: Utah, Wasatch, Summit, Salt Lake, Tooele, Davis, Weber, Box Elder, and Cache, and (2) the following counties in Idaho: Bear Lake and Caribou. Exclude: All non-ready mix drivers, office clerical employees, managerial employees, professional employees guards, and Supervisors, as defined by the Act.","","","",220,"","Independent Union of Concrete Handlers, Drivers and Operators","Include: Ready Mix employees in Northern Utah and Southern Idaho. Exclude: office/clerical, guards, supervisors, and professional employees",266,40.506148,-111.869671,"Draper, UT 84020",1,"place","TIGER/Line® dataset from the US Census Bureau","Draper","Salt Lake County","UT","84020","US",1,40.5527674241308,-111.998672351539
"27-RC-292261","Starbucks Corporation","Region 27, Denver, Colorado","Open","03/15/2022","","","Colorado Springs","CO","A","Revised Single Labor Org","Initial","02/09/2023",29,NA,"Chicago and Midwest Regional Joint Board, Workers United/SEIU",10,"",NA,"",NA,10,20,"",NA,"","","Include: All full-time and regular part-time baristas and shift supervisors employed by the Employer at its Store #10897 located in Colorado Springs, CO. Exclude: All Store Managers, office clerical employees, confidential employees, managerial employees, professional employees, guards, and supervisors, as defined in the Act.","","","",27,"","","Include: All full-time and regular part-time Baristas and Shift Supervisors. Exclude: Store managers, Office Clericals, Guards, Professional Employees, and Supervisors",29,38.828893,-104.809929,"Colorado Springs, CO 80903",1,"place","TIGER/Line® dataset from the US Census Bureau","Colorado Springs","El Paso County","CO","80903","US",1,39.2108520122439,-105.220015328164
"27-RC-309425","Right Now Heating, Cooling & Plumbing, LLC","Region 27, Denver, Colorado","Open","12/23/2022","","","Caldwell","ID","A","Single Labor Organization","Initial","01/25/2023",15,NA,"United Association of Journeymen and Apprentices of the Plumbers and Pipe Fitting Industry of the United States and Canada Local 296",NA,"",NA,"",NA,14,20,"",6,"","","Include: All full-time and regular part-time lead plumbers, plumbers, plumbing helpers, and plumbing apprentices employed by the Employer out of its Caldwell, Idaho facility. Exclude: Office clerical employees, HVAC technicians, comfort advisors, professional employees, managers, guards, and supervisors, as defined in the Act, and all other employees.","","","",23,"","","Included:  All full time and regular part time Lead Plumbers, Plumbers, Plumbing Helpers, and Plumbing Apprentices employed by the Employer out of its Caldwell, Idaho office.

Excluded:  All other employees, HVAC technicians, comfort advisors, clericals, professionals, guards, managers and supervisors as defined by the Act.",15,43.661908,-116.65629,"Caldwell, ID 83605",1,"place","TIGER/Line® dataset from the US Census Bureau","Caldwell","Canyon County","ID","83605","US",1,43.9144770621696,-116.348979168267
