"28-RC-288928","Resorts World Las Vegas LLC","Region 28, Phoenix, Arizona","Open","01/12/2022","","","Las Vegas","NV","A","Single Labor Organization","Initial","03/09/2022",9,NA,"International Union of Operating Engineers, Local 501 AFL-CIO",4,"",NA,"",NA,4,8,"",NA,"","","INCLUDED:  All full-time and regular part-time Gaming Technicians employed by the Employer in Las Vegas, Nevada.

EXCLUDED: All other employees, office clerical employees, sales employees, professional employees, guards, and supervisors as defined in the Act.","","","",9,"","","Included: All regular full-time and regular part-time employees working at the Gaming Technician Department in the following classifications: Lead Gaming Tech and Gaming Tech. 
Excluded: All Secretarial, office Clerical, sales and all managers, supervisors and guards as defined in the National Labor Relations Act.",9,36.17372,-115.10647,"Las Vegas, NV 89101",1,"place","TIGER/Line® dataset from the US Census Bureau","Las Vegas","Clark County","NV","89101","US",1,36.1592752201625,-115.074541950832
"28-RC-288965","MVM Inc.","Region 28, Phoenix, Arizona","Open","01/13/2022","","","Phoenix","AZ","A","Single Labor Organization","Initial","03/10/2022",92,3,"International Union, Security, Police and Fire Professionals of America (SPFPA)",15,"",NA,"",NA,34,49,"",NA,"","","INCLUDED:  All full-time and regular part-time Child and Family Protection Care Specialists performing guard duties as defined in Section 9(b)(3) of the National Labor Relations, employed by the Employer in Phoenix, Arizona. 

EXCLUDED:  All other employees, office clerical employees, confidential employees
professional employees, managers, and supervisors as defined in the Act. 
","","","",98,"","","Included: All Full-Time and Part-Time Armed and Unarmed Child and Family Protection Care Specialist and Transportation Officers Performing Guard Duties as Defined in Section 9(b)(3) Of the National Labor Relations Act, Employed by MVM Inc @ 1890 East Indian School Road, Phoenix, AZ 85016
Excluded: All Office Clerical Employees, Professional Employees and Supervisors as Defined By The Act. 
",92,33.703967,-112.351835,"Phoenix, AZ 85001",1,"place","TIGER/Line® dataset from the US Census Bureau","Phoenix","Maricopa County","AZ","85001","US",1,33.7171454237456,-111.985997729373
"28-RC-290201","Resorts World Las Vegas LLC","Region 28, Phoenix, Arizona","Open","02/07/2022","","","Las Vegas","NV","","","","",NA,NA,"International Union of Operating Engineers Local 501 AFL-CIO",NA,"",NA,"",NA,NA,NA,"",NA,"","","","","","",96,"","","Included: All regular full-time and regular part-time employees working in the Facilities Maintenance department in the following classifications: Lead Tech Facilities, Technician Facilities I, Technician Facilities II, Laborer.
Excluded: All secretarial, office clerical, sales and all managers, supervisors and guards as defined in the National Labor Relations Act.",NA,36.17372,-115.10647,"Las Vegas, NV 89101",1,"place","TIGER/Line® dataset from the US Census Bureau","Las Vegas","Clark County","NV","89101","US",1,36.4944973414906,-114.94859023369
"28-RC-290472","Black Iron Reinforcing, LLC","Region 28, Phoenix, Arizona","Open","02/10/2022","","","Las Vegas","NV","","","","",NA,NA,"District Council of Iron Workers of the State of California and Vicinity",NA,"",NA,"",NA,NA,NA,"",NA,"","","","","","",60,"","","INCLUDED:  All full-time and regular part-time field ironworkers

EXCLUDED:  All supervisors, clericals and guards as defined by the Act.",NA,36.17372,-115.10647,"Las Vegas, NV 89101",1,"place","TIGER/Line® dataset from the US Census Bureau","Las Vegas","Clark County","NV","89101","US",1,36.3272467771687,-115.313086303185
"28-RC-291029","Starbucks Corporation","Region 28, Phoenix, Arizona","Open","02/22/2022","","","Phoenix","AZ","A","Single Labor Organization","Initial","05/05/2022",31,NA,"Workers United",6,"",NA,"",NA,8,14,"",7,"Y","","INCLUDED:  All full-time and regular part-time Baristas and Shift Supervisors employed by the Employer at its Store # 62567 located at 7000 East Mayo Boulevard, #28, Phoenix, Arizona.

EXCLUDED:  Office clerical employees, guards, professional employees and supervisors as defined in the Act.
","","","",23,"","","Included: all full time and regular part time Baristas, Shift Supervisors, and Assistant Store Managers. 

Excluded: Store Managers, office clericals, guards, and supervisors as defined in the Act. 
",31,33.703967,-112.351835,"Phoenix, AZ 85001",1,"place","TIGER/Line® dataset from the US Census Bureau","Phoenix","Maricopa County","AZ","85001","US",1,33.3725097131597,-111.940703317194
"28-RC-291218","Foothills Fire Protection, Inc.","Region 28, Phoenix, Arizona","Open","02/24/2022","","","Scottsdale","AZ","","","","",NA,NA,"Road Sprinkler Fitters Local 669",NA,"",NA,"",NA,NA,NA,"",NA,"","","","","","",7,"","","Included: All full-time and regular part-time sprinkler fitters and helpers employed by the Employer in its tenant improvement department at its 7435 E. Karen Drive, Scottsdale, Arizona facility. 

Excluded: All other employees, office clerical employees, guards and supervisors as defined by the Act.",NA,33.534451,-111.887354,"Scottsdale, AZ 85250",1,"place","TIGER/Line® dataset from the US Census Bureau","Scottsdale","Maricopa County","AZ","85250","US",1,33.5343382280121,-112.188957034372
"28-RC-291280","Starbucks Corporation","Region 28, Phoenix, Arizona","Open","02/25/2022","","","Phoenix","AZ","","","","",NA,NA,"Workers United a/w SEIU",NA,"",NA,"",NA,NA,NA,"",NA,"","","","","","",22,"","Workers United","INCLUDED: All full-time and regular part-time Baristas and Shift
Supervisors employed by the Employer at its store # 14560 located at 17045 North 7th Street, Phoenix, Arizona.

EXCLUDED: Office clerical employees, guards, professional employees and supervisors as defined in the Act.",28,33.703967,-112.351835,"Phoenix, AZ 85001",1,"place","TIGER/Line® dataset from the US Census Bureau","Phoenix","Maricopa County","AZ","85001","US",1,33.7220095327271,-112.179757222437
"28-RC-292558","Quarterline Consulting Services, LLC","Region 28, Phoenix, Arizona","Open","03/18/2022","","","Albuquerque","NM","","","","",NA,NA,"International Association of Machinists and Aerospace Workers, Local Lodge 794",NA,"",NA,"",NA,NA,NA,"",NA,"","","","","","",7,"","","INCLUDED:  All full-time, regular part-time, on-call, Chiropractors, Clinical Pharmacists, Dietitians, Medical Laboratory Technicians, Pharmacy Technicians, Physical Therapists, Physical Therapy Assistants, Psychologists, Social Workers, and Counselors employed by the Employer at its facility located on Kirtland Air Force Base, Albuquerque, NM.

EXCLUDED: Managers, Supervisors, Clerical Workers, and all other employees including professional employees, managerial employees, guards, supervisors and other employees as defined by the Act.
",NA,35.199592,-106.644831,"Albuquerque, NM 87101",1,"place","TIGER/Line® dataset from the US Census Bureau","Albuquerque","Sandoval County","NM","87101","US",1,35.4217131770084,-107.064125945663
"28-RC-294474","Catalina Hills Botanical Care, Inc. d/b/a Curaleaf Midtown","Region 28, Phoenix, Arizona","Open","04/21/2022","","","Phoenix","AZ","A","Single Labor Organization","Initial","06/30/2022",28,NA,"United Food & Commercial Workers International Union, Local 99, AFL-CIO",13,"",NA,"",NA,6,20,"",1,"","United Food and Commercial Workers Union, Local 99","INCLUDED:  All full-time and regular part-time Store Associates employed by the Employer at its facility located in Phoenix, Arizona. 

EXCLUDED:  All other employees, office clerical employees, professional employees, Store Associate Leads, managers, guards, and supervisors as defined in the Act.
","","","",29,"","United Food and Commercial Workers Union, Local 99","Included: All regular, part-time, and full-time store associates
Excluded: All other employees, guards, managers, and supervisors as defined in the Act",28,33.703967,-112.351835,"Phoenix, AZ 85001",1,"place","TIGER/Line® dataset from the US Census Bureau","Phoenix","Maricopa County","AZ","85001","US",1,33.7964311008023,-112.835767114672
"28-RC-295386","Starbucks Corporation","Region 28, Phoenix, Arizona","Open","05/06/2022","","","Phoenix","AZ","","","","",NA,NA,"Workers United, affiliated with SEIU",NA,"",NA,"",NA,NA,NA,"",NA,"","","","","","",35,"","","Involved: All full time and regular part-time Baristas, Shift Supervisors, and Assistant Store Managers employed by the Employer at its facility currently located at 837 North 7th Avenue, Phoenix, Arizona 85007

Excluded: All Store Managers, Officer Clericals, Guards and Supervisors as defined by the Act",NA,33.703967,-112.351835,"Phoenix, AZ 85001",1,"place","TIGER/Line® dataset from the US Census Bureau","Phoenix","Maricopa County","AZ","85001","US",1,33.2229136075972,-112.234830320251
"28-RC-295837","KBL Reinforcing Inc.","Region 28, Phoenix, Arizona","Open","05/13/2022","","","Las Vegas","NV","","","","",NA,NA,"District Council of Iron Workers of the State of California, International Association of Bridge, Structural, Ornamental and Reinforcing Iron Workers",NA,"",NA,"",NA,NA,NA,"",NA,"","","","","","",68,"","","Included: All Field Ironworkers
Excluded: All supervisors, managers, clericals and guards under the Act.",NA,36.17372,-115.10647,"Las Vegas, NV 89101",1,"place","TIGER/Line® dataset from the US Census Bureau","Las Vegas","Clark County","NV","89101","US",1,35.7501058417049,-114.679035587005
"28-RC-296310","The Healing Healthcare 3, Inc. d/b/a Curaleaf Camelback Dispensary","Region 28, Phoenix, Arizona","Open","05/20/2022","","","Phoenix","AZ","","","","",NA,NA,"United Food and Commercial Workers International Union, Local 99",NA,"",NA,"",NA,NA,NA,"",NA,"","","","","","",28,"","","Included: All full-time and regular part-time Store Associates employed by the employer at its facility located in Phoenix, Arizona

Excluded: All other employees, office clerical, professional employees, Store Associate Leads, managers, guards, and supervisors as defined in the Act",NA,33.703967,-112.351835,"Phoenix, AZ 85001",1,"place","TIGER/Line® dataset from the US Census Bureau","Phoenix","Maricopa County","AZ","85001","US",1,33.6546236363852,-111.997580857619
"28-RC-296657","Diversified Protection Corporation","Region 28, Phoenix, Arizona","Open","05/24/2022","","","Las Cruces","NM","","","","",NA,NA,"United Government Security Officers of America International Union and its Local 327",NA,"",NA,"",NA,NA,NA,"",NA,"","","","","","",13,"","","INCLUDED:  all full-time and part-time armed and unarmed security officers employed by the employer

EXCLUDED:  clerical, managerial, salaried, and supervisory personnel as defined by the Act.",NA,32.290052,-106.753893,"Las Cruces, NM 88001",1,"place","TIGER/Line® dataset from the US Census Bureau","Las Cruces","Doña Ana County","NM","88001","US",1,31.9204726706118,-107.005393019804
"28-RC-296947","Wolf Creek Federal Services, Inc.","Region 28, Phoenix, Arizona","Open","06/01/2022","","","Las Cruces","NM","A","Single Labor Organization","Initial","07/13/2022",5,NA,"International Association of Fire Fighters Local 10099",5,"",NA,"",NA,NA,5,"",NA,"","International Association of Fire Fighters Local 10099","INCLUDED: All full-time and regular part-time Dispatchers and Lead Dispatchers employed by the Employer in Las Cruces, New Mexico. 

EXCLUDED: All other officers, on-call employees, office clerical employees, guards and supervisors as defined in the Act.","","","",5,"","International Association of Fire Fighters Local 10099","Included: Dispatch personal including lead dispatcher 
Excluded: All other officers, supervisors, guards and clerical covered under the Act",5,32.290052,-106.753893,"Las Cruces, NM 88001",1,"place","TIGER/Line® dataset from the US Census Bureau","Las Cruces","Doña Ana County","NM","88001","US",1,32.5150986034748,-107.151593216388
"28-RC-296969","VZL Staffing Services, LLC d/b/a Zen Leaf Chandler","Region 28, Phoenix, Arizona","Open","06/01/2022","","","Chandler","AZ","","","","",NA,NA,"United Food & Commercial Workers International Union, Local 99, AFL-CIO, CLC",NA,"",NA,"",NA,NA,NA,"",NA,"","","","","","",51,"","","Involved: Cannabis Advisor (budtender), Inventory Specialist, Packager Specialist, Delivery Driver and Agent in Charge (Team Leads)
Excluded: All other employees, office clerical, professional employees, managers, guards, and supervisors as defined in the Act",NA,33.324113,-111.878217,"Chandler, AZ 85224",1,"place","TIGER/Line® dataset from the US Census Bureau","Chandler","Maricopa County","AZ","85224","US",1,33.2563435095848,-111.450770349426
"28-RC-297543","CoreCivic of Tennessee, LLC d/b/a Nevada Southern Detention Center","Region 28, Phoenix, Arizona","Open","06/13/2022","","","Pahrump","NV","","","","",NA,NA,"International Union, Security, Police and Fire Professionals of America (SPFPA)",NA,"",NA,"",NA,NA,NA,"",NA,"","","","","","",140,"","","Included: All full-time and part-time armed and unarmed detention officers performing guard duties as defined in Section 9(b)(3) of the National Labor Relations Act, employed by Core Civic at 2190 E. Mesquite Ave., Pahrump, NV 89060
Excluded: All office clerical employees, professional employees and supervisors as defined by the Act",NA,36.655797,-116.004795,"Pahrump, NV 89041",1,"place","TIGER/Line® dataset from the US Census Bureau","Pahrump","Nye County","NV","89041","US",1,36.2254285634996,-116.107989887517
"28-RC-297812","The Strat Hotel, Casino, & Tower","Region 28, Phoenix, Arizona","Open","06/15/2022","","","Las Vegas","NV","","","","",NA,NA,"International Alliance of Theatrical Stage Employees Local 720",NA,"",NA,"",NA,NA,NA,"",NA,"","","","","","",6,"","","Included: Rigger Jump Masters
Excluded: All other employees, supervisors and managers as defined by the Act",NA,36.17372,-115.10647,"Las Vegas, NV 89101",1,"place","TIGER/Line® dataset from the US Census Bureau","Las Vegas","Clark County","NV","89101","US",1,36.6476306504712,-114.985686358066
"28-RC-298614","Raytheon Technologies","Region 28, Phoenix, Arizona","Open","06/30/2022","","","White Sands Missile Range","NM","","","","",NA,NA,"International Association of Machinists & Aerospace Workers, Local Lodge 2515",NA,"",NA,"",NA,NA,NA,"",NA,"","","","","","",15,"","","Included: All full time, regular part time, and on call Leader Technicians, Data Analysts, Staff Technicians, System Engineers, Principal Specialists, employed by the employer in the Missile Engineering Building at White Sands Missile Range, NM

Excluded: All other employees including professional employees, managerial employees, guards, supervisors, and other employees as defined by the Act",NA,32.383871,-106.493675,"White Sands Missile Range, NM 88002",1,"place","TIGER/Line® dataset from the US Census Bureau","White Sands Missile Range","Doña Ana County","NM","88002","US",1,32.5429735514062,-106.743361359195
"28-RC-299178","Starbucks Corporation","Region 28, Phoenix, Arizona","Open","07/11/2022","","","Albuquerque","NM","","","","",NA,NA,"Workers United a/w SEIU",NA,"",NA,"",NA,NA,NA,"",NA,"","","","","","",31,"","","Included: All full time and regular part time Baristas, Shift Supervisors, and Assistant Store Managers employed by the Employer at its facility currently located at 1000 Rio Grande Blvd NW, Albuquerque, NM 87104

Excluded: All Store Managers, Office Clericals, Guards and Supervisors as defined by the Act",NA,35.199592,-106.644831,"Albuquerque, NM 87101",1,"place","TIGER/Line® dataset from the US Census Bureau","Albuquerque","Sandoval County","NM","87101","US",1,34.811275606403,-106.49924746562
"28-RC-299183","Alpha","Region 28, Phoenix, Arizona","Open","07/11/2022","","","Tempe","AZ","","","","",NA,NA,"International Brotherhood of Electrical Workers, Local 640",NA,"",NA,"",NA,NA,NA,"",NA,"","","","","","",5,"","","Included: This petition seeks a representation election for the full time Electronic Technicians engaged in repair of power supply units and the full time Customer Service Warehousers at the Tempe, AZ facility

Excluded: All other employees at the Tempe, AZ facility, including office clerical employees, professional employees, guards, and supervisors as defined by the Act",NA,33.401395,-111.931298,"Tempe, AZ 85280",1,"place","TIGER/Line® dataset from the US Census Bureau","Tempe","Maricopa County","AZ","85280","US",1,33.7484161743843,-111.761257663795
"28-RC-299392","Warner Brothers Television dba 4423 Productions","Region 28, Phoenix, Arizona","Open","07/13/2022","","","Albuquerque","NM","","","","",NA,NA,"International Brotherhood of Teamsters Local 492",NA,"",NA,"",NA,NA,NA,"",NA,"","","","","","",8,"","","Included: Chef Assistant/Driver, Chef Assistant, all full-time

Excluded: Chef Driver",NA,35.199592,-106.644831,"Albuquerque, NM 87101",1,"place","TIGER/Line® dataset from the US Census Bureau","Albuquerque","Sandoval County","NM","87101","US",1,35.457498160783,-107.026225172553
"28-RC-299453","Albertsons/United Supermarkets","Region 28, Phoenix, Arizona","Open","07/14/2022","","","Carlsbad","NM","","","","",NA,NA,"United Food & Commercial Workers, Local 1564",NA,"",NA,"",NA,NA,NA,"",NA,"","","","","","",11,"","","Included: All full-time and part-time coffee bar clerks, the lead and assistant lead 

Excluded: All other employees, guards, demonstrators, and supervisors as defined by the act",NA,32.416897,-104.46539,"Carlsbad, NM 88220",1,"place","TIGER/Line® dataset from the US Census Bureau","Carlsbad","Eddy County","NM","88220","US",1,32.3874383701013,-104.5564053531
"28-RC-299479","Zen Leaf Local Joint","Region 28, Phoenix, Arizona","Open","07/14/2022","","","Phoenix","AZ","","","","",NA,NA,"United Food & Commercial Workers International Union, Local 99, AFL-CIO, CLC",NA,"",NA,"",NA,NA,NA,"",NA,"","","","","","",17,"","","INCLUDED:  All full-time and part-time Cannabis Advisors (Budtenders), Inventory Specialists, Packager Specialists, and Agents in Charge.

EXCLUDED:  All other employees, including confidential employees, office clerical employees, professional employees, managerial employees, guards, and supervisors as defined by the Act.",NA,33.703967,-112.351835,"Phoenix, AZ 85001",1,"place","TIGER/Line® dataset from the US Census Bureau","Phoenix","Maricopa County","AZ","85001","US",1,33.5612087336982,-112.48069528504
"28-RC-299480","Management & Training Corporation","Region 28, Phoenix, Arizona","Open","07/15/2022","","","Chaparral","NM","","","","",NA,NA,"International Union, Security, Police, and Fire Professionals of America (SPFPA)",NA,"",NA,"",NA,NA,NA,"",NA,"","","","","","",150,"","","Included: All full-time and part-time armed and unarmed detention and corrections officers performing guard duties as defined in Section 9(b)93) of the National Labor Relations Act, employed by management & training corporation @ 10 McGregor Range Rd, Chaparral, NM 88081.

Excluded: All office clerical employees, professional employees and supervisors as defined by the Act.",NA,32.002669,-106.390867,"Chaparral, NM 88081",0.9,"place","TIGER/Line® dataset from the US Census Bureau","Chaparral","Doña Ana County","NM","88081","US",1,32.297187018607,-106.112568884177
"28-RD-273582","Station Casinos LLC d/b/a Palms Casino Resort","Region 28, Phoenix, Arizona","Open","03/03/2021","","","Las Vegas","NV","","","","",NA,NA,"District Council No. 16 of the International Union of Painters and Allied Trades",NA,"",NA,"",NA,NA,NA,"",NA,"","","","","","",19,"","","INCLUDED:  Maintenance engineers, junior engineers, painters and carpenters employed at the facility

EXCLUDED:  All other employees, office clericals, professional employees, guards and supervisors under the Act.",NA,36.17372,-115.10647,"Las Vegas, NV 89101",1,"place","TIGER/Line® dataset from the US Census Bureau","Las Vegas","Clark County","NV","89101","US",1,36.2590108836678,-115.085924049841
"28-RD-292426","NP Red Rock LLC","Region 28, Phoenix, Arizona","Open","03/17/2022","","","Las Vegas","NV","","","","",NA,NA,"International Union of Operating Engineers Local 501",NA,"",NA,"",NA,NA,NA,"",NA,"","","","","","",14,"","","Included: All full-time and regular part-time slot technicians and utility slot technicians employed by the Employer at its facility in Las Vegas, Nevada

Excluded: all other employees, office clerical employees, guards and supervisors as defined in the National Labor Relations Act",NA,36.17372,-115.10647,"Las Vegas, NV 89101",1,"place","TIGER/Line® dataset from the US Census Bureau","Las Vegas","Clark County","NV","89101","US",1,36.1572316395261,-114.739782206948
"28-RD-294046","American Medical Response","Region 28, Phoenix, Arizona","Open","04/13/2022","","","Roswell","NM","","","","",NA,NA,"American Federation of State, County, and Municipal Employees Council 18, AFL-CIO",NA,"",NA,"",NA,NA,NA,"",NA,"","","","","","",19,"","","Included: All full-time and part-time EMT's, Paramedics, and Office Administrators performing under the Employers 911 Contract with the city of Roswell
Excluded: All other Employees, Guards and Supervisors as defined by the National Labor Relations Act (NLRA)",NA,33.637061,-104.377926,"Roswell, NM 88201",1,"place","TIGER/Line® dataset from the US Census Bureau","Roswell","Chaves County","NM","88201","US",1,33.9469761686765,-104.273096636009
"28-RD-295263","Valley Hospital Medical Center","Region 28, Phoenix, Arizona","Open","05/02/2022","","","Las Vegas","NV","","","","",NA,NA,"Local Joint Executive Board of Las Vegas, Culinary Workers Union, Local 226, and Bartenders Union, Local 165, affiliated with Unite Here",NA,"",NA,"",NA,NA,NA,"",NA,"","","","","","",92,"","","Included: All employees working in the following positions at Valley Hospital Medical Center, 620 Shadow Lane, Las Vegas, NV: Bakers, Cafeteria Dish-up, Cafeteria Lead Person, Cashier, Cook's Helper, Cook Trainee (first 45 days), Cook (after 45 days), Cook II, Dietetic Clerk, Dishwasher/Dish Machine Operator, F.S. Tray Worker, Floor-tock/Kitchen Runner, Griddle Cook (first 45 days, Cafeteria only), Griddle Cook (after 45 days, Cafeteria only), Housekeeping Attendant II, Kitchen Porter, Lead Attendant II, Lead Porter, Linen Attendant, Pantry Worker, Utility Attendant

Excluded: Employees who work at any other UHS facility including in Northern or Southern Nevada, as well as supervisors, management personnel, guards, and other excluded under the definitions contained in the NLRA",NA,36.17372,-115.10647,"Las Vegas, NV 89101",1,"place","TIGER/Line® dataset from the US Census Bureau","Las Vegas","Clark County","NV","89101","US",1,35.8751787908052,-115.567753111013
"28-RM-234875","American Medical Response of Maricopa, LLC dba AMR; Professional Medical Transport, Inc. dba PMT, Life Line, and AMR; and SW General Inc. dba Southwest Ambulance and AMR","Region 28, Phoenix, Arizona","Open","01/25/2019","","","Mesa","AZ","","","","",NA,NA,"International Association of Fire Fighters Local Industrial 60 (IAFF I-60)",NA,"",NA,"",NA,NA,NA,"",NA,"","","","","","",307,"","","Included: 3 units, full-time and regular part-time non-emergency EMTs, paramedics, and nurses

Excluded: On-call employees, supervisors, all other employees",NA,33.440695,-111.856967,"Mesa, AZ 85201",1,"place","TIGER/Line® dataset from the US Census Bureau","Mesa","Maricopa County","AZ","85201","US",1,33.433189763108,-112.243887640245
"28-RM-298192","California Hotel and Casino, a Nevada corporation (d/b/a Sam's Town Hotel, Gambling Hall and Bowling Center)","Region 28, Phoenix, Arizona","Open","06/22/2022","","","Las Vegas","NV","","","","",NA,NA,"International Union of Operating Engineers Local 501, AFL-CIO",NA,"",NA,"",NA,NA,NA,"",NA,"","","","","","",9,"","","Included: All full-time and regular part-time Engineers Maintenance and Technicians Maintenance employed by the Employer at its Boulder Highway facility in Las Vegas, Nevada

Excluded: All other employees, office clerical employees, professional employees, guards and supervisors as defined by the Act",NA,36.17372,-115.10647,"Las Vegas, NV 89101",1,"place","TIGER/Line® dataset from the US Census Bureau","Las Vegas","Clark County","NV","89101","US",1,35.7873361109898,-114.650362279733
"29-RC-250173","Kingsland/Winstar","Region 29, Brooklyn, New York","Open","10/18/2019","","","Maspeth","NY","","","","",NA,NA,"Local 1922, IBEW, AFL-CIO",NA,"",NA,"",NA,NA,NA,"",NA,"","","","","","",20,"","","Included: All Full Time and Regular Part Time Drivers and Helpers Excluded: All Supervisors, Guards and Clerical Employees, as defined in the Act",NA,40.722848,-73.908413,"Maspeth, NY 11378",1,"place","TIGER/Line® dataset from the US Census Bureau","Maspeth","Queens County","NY","11378","US",1,40.559410874727,-73.5330758784575
"29-RC-273752","Project Social Care Head Start, Inc.","Region 29, Brooklyn, New York","Open","03/05/2021","","","Brooklyn","NY","","","","",NA,NA,"District Council 37, AFSCME, AFL-CIO",NA,"",NA,"",NA,NA,NA,"",NA,"","","","","","",22,"","","Included: All full-time, part-time, float, and per-diem Lead Teachers, Assistant
Teachers, Teacher Aides, Floaters, Family Advocates, Cook/Janitor.
Excluded: All managerial employees, supervisors, security guards, and confidential
employees as specified by the Act.",NA,40.645099,-73.945032,"Brooklyn, NY 11256",0.67,"place","TIGER/Line® dataset from the US Census Bureau","Brooklyn","Kings County","NY","11256","US",1,40.6544531718088,-74.0323297070976
"29-RC-279096","MJ Melo Painting, Ltd","Region 29, Brooklyn, New York","Open","06/28/2021","","","Brooklyn","NY","","","","",NA,NA,"International Brotherhood Electrical Workers Local 1430",NA,"",NA,"",NA,NA,NA,"",NA,"","","","","","",16,"","","Employees included:
Full time and regular part time Painters

Employees Excluded:
All other employees",NA,40.645099,-73.945032,"Brooklyn, NY 11256",0.67,"place","TIGER/Line® dataset from the US Census Bureau","Brooklyn","Kings County","NY","11256","US",1,40.9860471982235,-74.1741037824362
