"07-RC-316456","Models and Tools","Region 07, Detroit, Michigan","Open","04/18/2023","","","Shelby","MI","","","","",NA,NA,"",NA,"",NA,"",NA,NA,NA,"",NA,"","","","","","",107,"","","Included: All employees employed by Models and Tools

Excluded:  all other employees, supervisors, managers, clerical, confidential",NA,43.638343,-86.349283,"Shelby, MI 49455",1,"place","TIGER/Line® dataset from the US Census Bureau","Shelby","Oceana County","MI","49455","US",1,44.0964885849111,-86.687798100535
"07-RC-317043","Regency at Willowbrook","Region 07, Detroit, Michigan","Open","04/28/2023","","","Flint","MI","","","","",NA,NA,"SEIU Healthcare Michigan",NA,"",NA,"",NA,NA,NA,"",NA,"","","","","","",22,"","","Included: All Full-time, Part-time and Contingent License Practical Nurses and Registered Nurses as an Armour-Globe

Excluded: All Administrators, Directors, Managers, and Supervisors",NA,42.965926,-83.780835,"Flint, MI 48501",1,"place","TIGER/Line® dataset from the US Census Bureau","Flint","Genesee County","MI","48501","US",1,43.2886561544976,-83.6058646132173
"07-RC-318095","WJBK-TV","Region 07, Detroit, Michigan","Open","05/10/2023","","","Southfield","MI","","","","",NA,NA,"National Association of Broadcast Employees and Technicians - Communications Workers of America (NABET-CWA) , AFL-CIO",NA,"",NA,"",NA,NA,NA,"",NA,"","","","","","",20,"","","Included: Armour-Globe election to include Producers and Per Diem Writers in existing unit 

Excluded: web team, assignment desk, sports producers, and all other excluded employees",NA,42.496949,-83.291078,"Southfield, MI 48034",1,"place","TIGER/Line® dataset from the US Census Bureau","Southfield","Oakland County","MI","48034","US",1,42.2400251712603,-82.8608380974236
"07-RC-319800","Trinity Health-Michigan d/b/a Trinity Health Ann Arbor Hospital","Region 07, Detroit, Michigan","Open","06/08/2023","","","Ypsilanti","MI","","","","",NA,NA,"SEIU Healthcare Michigan",NA,"",NA,"",NA,NA,NA,"",NA,"","","","","","",64,"","","Included: All Full-time, Part-time, and Contingent Lab Tech 1, Lab Tech 2, Patient Service
Representatives, Section Leads, and Trainers working at Trinity Outpatient Labs Ann Arbor, located at:
Reichert Center Lab 5333 McAuley Dr, Ypsilanti, MI 48197, Arbor Park Lab 4972 Clark Rd #101, Ypsilanti, MI 48197,
Domino’s Farms Lab 4200 Whitehall Dr Suite 230, Ann Arbor, MI 48105,
West Arbor Lab 4350 Jackson Rd Suite 110, Ann Arbor, MI 48103,
Cherry Hill Lab 49650 Cherry Hill Rd # 130, Canton, MI 48187,
Fowlerville Lab 202 E Van Riper Rd Ste 300, Fowlerville, MI 48836,
Milan Lab 870 E Arkona Rd Suite 130, Milan, MI 48160, Plymouth Lab 990 W Ann Arbor Trail Suite 208, Plymouth, MI 48170, Ann Arbor Oncology Lab 5303 Elliott Dr, Ypsilanti, MI 48197, Canton Oncology Lab 1600 Canton Ctr Rd, Canton, MI 48188

Excluded: All Directors, Managers, and Supervisors, and Agency/Traveler staff.
",NA,42.202139,-83.620494,"Ypsilanti, MI 48197",1,"place","TIGER/Line® dataset from the US Census Bureau","Ypsilanti","Washtenaw County","MI","48197","US",1,42.4290552205048,-83.2368687727405
"07-RC-320357","Starbucks Corporation","Region 07, Detroit, Michigan","Open","06/21/2023","","","Ann Arbor","MI","","","","",NA,NA,"Chicago and Midwest Regional Joint Board, Workers United/SEIU",NA,"",NA,"",NA,NA,NA,"",NA,"","","","","","",24,"","","Included:  All full-time and regular part-time Baristas and Shift Supervisors

Excluded:  Office clericals, Guards, Professional Employees and Supervisors",NA,42.266638,-83.849042,"Ann Arbor, MI 48103",1,"place","TIGER/Line® dataset from the US Census Bureau","Ann Arbor","Washtenaw County","MI","48103","US",1,42.6608351159074,-83.8080228618184
"07-RC-320978","Aramark Uniform & Career Apparel, LLC","Region 07, Detroit, Michigan","Open","06/29/2023","","","Wixom","MI","","","","",NA,NA,"Local 337, International Brotherhood of Teamsters (IBT)",NA,"",NA,"",NA,NA,NA,"",NA,"","","","","","",7,"","","Included: All Full and Part Time Employees under the RSS Classification

Excluded: Any and All Supervisors, Managers, Security Guards and others defined under Act",NA,42.520533,-83.549145,"Wixom, MI 48393",1,"place","TIGER/Line® dataset from the US Census Bureau","Wixom","Oakland County","MI","48393","US",1,42.0702191061547,-83.9539744303939
"07-RC-321102","CBRE, Inc.","Region 07, Detroit, Michigan","Open","06/30/2023","","","Lansing","MI","","","","",NA,NA,"Local 333, United Association of Journeymen and Apprentices of the Plumbing and Pipe Fitting Industry of the United States and Canada (UA), AFL-CIO, HVAC Mechanics",NA,"",NA,"",NA,NA,NA,"",NA,"","","","","","",7,"","","Included:  All full-time and regular part-time mobile HVAC/R engineers employed by the Employer and working on the Employer's Fifth Third Account at locations in Michigan. 

Excluded:  All other employees, managers, office clericals, guards and supervisors as defined in the Act.",NA,42.599184,-84.371973,"Lansing, MI 48901",1,"place","TIGER/Line® dataset from the US Census Bureau","Lansing","Ingham County","MI","48901","US",1,42.9090944019348,-84.8342445609148
"07-RC-321122","Playtech","Region 07, Detroit, Michigan","Open","07/05/2023","","","Southfield","MI","","","","",NA,NA,"International Union, United Automobile, Aerospace and Agricultural Implement Workers of America (UAW), AFL-CIO",NA,"",NA,"",NA,NA,NA,"",NA,"","","","","","",50,"","","Included: All Dealer classifications and Shufflers

Excluded: All levels of Management",NA,42.496949,-83.291078,"Southfield, MI 48034",1,"place","TIGER/Line® dataset from the US Census Bureau","Southfield","Oakland County","MI","48034","US",1,42.3519123510411,-83.3555855177308
"07-RC-321436","Dearborn Industrial Generation, LLC","Region 07, Detroit, Michigan","Open","06/29/2023","","","Dearborn","MI","","","","",NA,NA,"Michigan State Utility Workers Council, Utility Workers Union of America (UWUA), AFL-CIO",NA,"",NA,"",NA,NA,NA,"",NA,"","","","","","",29,"","","Included:  All full time, and regular part time employees working for the Employer out of 2400 Miller Road, Dearborn Michigan 48120, with the following job classifications: Control Room Operator, Senior Control Room Operator, Lead Control Room Operator, Outside Operator, Plant Operator, Senior Plant Operator, Shift Supervisor, Supervisor Operations, Senior Maintenance Tech, Lead Senior Maintenance Tech, Senior Materials Tech, Materials Tech, Senior Electrician, Electrician, Control Tech, High Voltage Electrician, IC&E Tech, Lead IC&E Tech, Mechanic, Warehouse Employee, and Shipping and Receiving Employee. 

Excluded:  All supervisors, guards, and other employes excluded under the Act.",NA,42.310037,-83.177625,"Dearborn, MI 48120",1,"place","TIGER/Line® dataset from the US Census Bureau","Dearborn","Wayne County","MI","48120","US",1,42.5607120072353,-83.1603390425332
"07-RC-321895","Brenntag Great Lakes, LLC","Region 07, Detroit, Michigan","Open","07/17/2023","","","Kentwood","MI","","","","",NA,NA,"General Teamsters Local Union No. 406, International Brotherhood of Teamsters",NA,"",NA,"",NA,NA,NA,"",NA,"","","","","","",3,"","","Included:  Drivers/Warehouse

Excluded:  Supervisors and Guards as defined by the Act.",NA,42.945748,-85.613839,"Kentwood, MI 49506",0.9,"place","TIGER/Line® dataset from the US Census Bureau","Kentwood","Kent County","MI","49506","US",1,43.205961022586,-86.0618343576811
"07-RD-282049","Maple-Drake Real Estate, LLC d/b/a Notting Hill of West Bloomfield","Region 07, Detroit, Michigan","Open","08/26/2021","","","West Bloomfield","MI","A","Single Labor Organization","Initial","11/29/2021",46,4,"SEIU Healthcare Michigan",12,"",NA,"",NA,9,21,"",3,"Y","SEIU Healthcare of Michigan","All full-time and regular part-time CNA employees, housekeeping employees, laundry employees, 
dietary aide employees, restorative aide employees, culinary aide employees, dietary cook employees,
activities aide employees, medical records employees, guest services employees and ward clerk
employees employed by the Employer at its facility located at 6535 Drake Road, West Bloomfield
Township, Michigan; but excluding all business officers, managers, dining room manages, managerial
employees, confidential employees, technical employees, professional employees, office personnel
employees, LPNs, RNs, executive chefs, registered dieticians, receptionists, casual employees, drivers,
social service employees, payroll employees, account management staff employees, central supply
employees, scheduler employees, maintenance employees, and guards and supervisors as defined in the
Act.
","","","",49,"","SEIU Healthcare of Michigan","Included: CNA, Kitchen, Laundry department, activities.  Excluded:  All other Employee's.",46,42.542715,-83.379535,"West Bloomfield, MI 48322",1,"place","TIGER/Line® dataset from the US Census Bureau","West Bloomfield","Oakland County","MI","48322","US",1,42.8037034529375,-83.269324477922
"07-RD-321373","McLaren Oakland Hospital","Region 07, Detroit, Michigan","Open","07/07/2023","","","Pontiac","MI","","","","",NA,NA,"Local 412, International Union, United Automobile, Aerospace and Agricultural Implement Workers of America (UAW), AFL-CIO",NA,"",NA,"",NA,NA,NA,"",NA,"","","","","","",60,"","","Included:  LPN's, telemetry techs, surgical techs, med techs working as histo techs, cyto techs, cardiology techs, bio-med techs, nuclear med techs, x-ray techs, respiratory therapists,  ct techs, cardio special procedures techs, cardio sonographers, cardiocath techs, ultrasound techs, mammography techs, and EEG techs

Excluded:  Physicians, RN's professional employees, all other med techs, skilled maintenance employees, business office clerical employees, guards, and all other employees in classifications not specified here, and supervisors as defined by the ACT.",NA,42.670272,-83.289036,"Pontiac, MI 48340",1,"place","TIGER/Line® dataset from the US Census Bureau","Pontiac","Oakland County","MI","48340","US",1,42.3956681001988,-83.6831031693999
"08-RC-284759","Kenyon College","Region 08, Cleveland, Ohio","Open","10/18/2021","","","Gambier","OH","","","","",NA,NA,"United Electrical, Radio and Machine Workers of America (UE)",NA,"",NA,"",NA,NA,NA,"",NA,"","","","","","",600,"","","Included: All student employees of Kenyon College
Excluded: All managerial employees, guards, professional employees and supervisors as defined by the Act, and all other employees",NA,40.338527,-82.348673,"Gambier, OH 43022",1,"place","TIGER/Line® dataset from the US Census Bureau","Gambier","Knox County","OH","43022","US",1,39.9877621558991,-82.3563909719228
"08-RC-295583","Trane Technologies Company LLC","Region 08, Cleveland, Ohio","Open","05/11/2022","","","Valley View","OH","A","Single Labor Organization","Initial","07/12/2022",34,NA,"Pipefitters Local 120",11,"",NA,"",NA,19,30,"",3,"","","All full-time and regular part-time journeyperson and apprentice Contracting Install Technicians, HVAC Service Technicians, and HVAC Service Technician Leads employed by the Employer at its 9555 Rockside Road, Valley View, Ohio 44125 location; excluding all other employees, office clerical employees, professional employees, guards, and supervisors as defined in the Act.
Others Permitted to Vote:
The parties have agreed that the Contracting Install Technician Lead and the Contracting Install Project Specialist may vote in the election, but their ballots will be challenged since their eligibility has not been resolved.  No decision has been made regarding whether the individuals in the Contracting Install Technician Lead and the Contracting Install Project Specialist classifications are included in, or excluded from, the bargaining unit.  The eligibility or inclusion of these individuals will be resolved, if necessary, following the election. 
","","","",39,"","","All full-time and regular part-time journeyperson and apprentice contracting install technicians, field service technicians, service technician team leaders, contracting control technicians, and service control technicians employed by the Employer at its Valley View, Ohio facility; excluding all other employees, office clerical employees, professional employees, guards and supervisors as defined by the Act.",34,39.965619,-83.072408,"Valleyview, OH 43204",0.8,"place","TIGER/Line® dataset from the US Census Bureau","Valleyview","Franklin County","OH","43204","US",1,40.4632301007854,-83.1277828542443
"08-RC-310348","Total Line Refrigeration, Inc.","Region 08, Cleveland, Ohio","Open","01/13/2023","","","Avon Lake","OH","","","","",NA,NA,"Plumbers and Steamfitters Local 42",NA,"",NA,"",NA,NA,NA,"",NA,"","","","","","",16,"","","Included: All full-time and regular part-time HVAC refrigeration installation employees employed by the Employer at its 33530 Pin Oak Parkway, Avon Lake, Ohio facility. Excluded: All other employees, office clerical employees, managerial employees, guards and supervisors as defined by the Act.",NA,41.49674,-82.017527,"Avon Lake, OH 44012",1,"place","TIGER/Line® dataset from the US Census Bureau","Avon Lake","Lorain County","OH","44012","US",1,41.5562584559934,-82.1989674136967
"08-RC-310615","Spartan Warehouse and Distribution Company Incorporated d/b/a Spartan Logistics","Region 08, Cleveland, Ohio","Open","01/19/2023","","","Northwood","OH","","","","",NA,NA,"International Brotherhood of Teamsters Local Union No. 20",NA,"",NA,"",NA,NA,NA,"",NA,"","","","","","",14,"","","Included: All full-time and regular part-time Forklift Operators and Warehouse Auditors employed by the Employer at its Northwood, Ohio location. 

Excluding: All office clerical employees, professional employees, guards and supervisors as defined in the Act.",NA,41.603711,-83.47049,"Northwood, OH 43619",1,"place","TIGER/Line® dataset from the US Census Bureau","Northwood","Wood County","OH","43619","US",1,41.6764375400346,-83.5116663819866
"08-RC-317667","Program Productions, Inc.","Region 08, Cleveland, Ohio","Open","05/09/2023","","","Cleveland","OH","A","Single Labor Organization","Initial","07/06/2023",135,1,"International Alliance of Theatrical Stage Employees, Moving Picture Technicians, Artists and Allied Crafts,  of the United States, its Territories and Canada, AFL, CIO, CLC",73,"",NA,"",NA,31,104,"",1,"","International Alliance of Theatrical Stage Employees, Moving Picture Technicians, Artists and Allied Crafts, of the United States, its Territories and Canada, AFL-CIO, CLC","Included:  All freelance broadcast technicians, including Technical Directors (TD), Audio Mixers (A1), Audio Assistants (A2), Video Technicians (V1), Assistant Video Technicians (V2), Graphics Operators, Graphic Coordinators, Font Coordinators, Camera Operators (jib, stationary, mobile, and remotely operated cameras), Capture/Playback Operators (Videotape Operators [VTR], Digital Recording Device Operators [DDR], EVS Technicians, ERO Technicians) Score Box Operators, Utility Technicians, Stage Managers, Statisticians [Stats Technicians], Phone ADs, Production Assistants, Runners, and others in similar technical positions performing work, including pre-production, production and post-production work in connection with the telecasting of events at remote locations within 60 miles of Progressive Field/Rocket Mortgage Field House located at 2401 Ontario Street/1 Center Court, Cleveland, OH 44115.

Excluded:  All other employees, office clerical employees, guards, professional employees, and supervisors as defined in the Act.","","","",94,"","International Alliance of Theatrical Stage Employees, Moving Picture Technicians, Artists and Allied Crafts, of the United States, its Territories and Canada, AFL-CIO, CLC","INCLUDED: All freelance broadcast technicians, including Technical Directors (TD), Audio Mixers (A1), Audio Assistants (A2), Video Technicians (V1), Assistant Video Technicians (V2), Graphics Operators, Graphic Coordinators, Font Coordinators, Camera Operators (jib, stationary, mobile, and remotely operated cameras), Capture/Playback Operators (Videotape Operators [VTR], Digital Recording Device Operators [DDR], EVS Technicians, ERO Technicians) Score Box Operators, Utility Technicians, Stage Managers, Statisticians [Stats Technicians], Phone ADs, Production Assistants, Runners, and others in similar technical positions performing work, including pre-production, production and post-production work in connection with the telecasting of events at remote locations within 60 miles of Progressive Field/Rocket Mortgage Field House (2401 Ontario Street/1 Center Court, Cleveland, OH 44115.) EXCLUDED: All other employees, office clerical employees, guards, professional employees, and supervisors as defined in the Act",135,41.489381,-81.667486,"Cleveland, OH 44101",1,"place","TIGER/Line® dataset from the US Census Bureau","Cleveland","Cuyahoga County","OH","44101","US",1,41.2814406569311,-81.6966231073108
"08-RC-320022","Easter's Plumbing, LLC","Region 08, Cleveland, Ohio","Open","06/14/2023","","","Martin","OH","A","Single Labor Organization","Initial","07/06/2023",NA,NA,"Plumbers, Steamfitters, and Service Mechanics Local Union 50",NA,"",NA,"",NA,NA,NA,"",NA,"","","","","","",4,"","","All full-time and regular part-time plumbers and their helpers employed by Easter’s 
Plumbing, LLC out of its 5418 N Elliston-Trowbridge Road, Martin, OH facility; all other employees, managers, office clericals, professionals, guards, and 
supervisors as defined in the Act.",NA,41.569398,-83.311577,"Martin, OH 43445",1,"place","TIGER/Line® dataset from the US Census Bureau","Martin","Ottawa County","OH","43445","US",1,41.9512214959617,-83.3910417773728
"08-RC-320753","Momentive Performance Materials Quartz, Inc. d/b/a Momentive Technologies","Region 08, Cleveland, Ohio","Open","06/27/2023","","","Strongsville","OH","","","","",NA,NA,"IUE-CWA",NA,"",NA,"",NA,NA,NA,"",NA,"","","","","","",115,"","","All regular full-time and regular part-time production and maintenance employees; all office clerical employees, managerial employees, confidential employees, guards, and supervisors as defined under the National Labor Relations Act.",NA,41.313268,-81.831656,"Strongsville, OH 44136",1,"place","TIGER/Line® dataset from the US Census Bureau","Strongsville","Cuyahoga County","OH","44136","US",1,41.0831249544591,-81.3820015242142
"08-RC-321356","Ohio Machinery Co. d.b.a. Ohio CAT","Region 08, Cleveland, Ohio","Open","07/07/2023","","","Broadview Heights","OH","","","","",NA,NA,"International Union of Operating Engineers, Local 18",NA,"",NA,"",NA,NA,NA,"",NA,"","","","","","",35,"","","Included: All full-time and regular part-time equipment delivery drivers working at all Ohio CAT locations in Ohio and Kentucky. Excluded: All other employees including all parts drivers, sales representatives, dispatchers, temporary employees, office clericals, guards, and supervisors as defined in the Act.",NA,41.314053,-81.673099,"Broadview Heights, OH 44147",1,"place","TIGER/Line® dataset from the US Census Bureau","Broadview Heights","Cuyahoga County","OH","44147","US",1,41.0611674322772,-81.7403887039913
"08-RC-321543","Linde Welding Gas & Equipment Center","Region 08, Cleveland, Ohio","Open","07/10/2023","","","Youngstown","OH","","","","",NA,NA,"Teamsters Local No. 377",NA,"",NA,"",NA,NA,NA,"",NA,"","","","","","",4,"","","Included: All full-time drivers; Excluded: All management defined under the Act, store clerks, floaters and warehouse leaders.",NA,41.017082,-80.802854,"Youngstown, OH 44501",1,"place","TIGER/Line® dataset from the US Census Bureau","Youngstown","Mahoning County","OH","44501","US",1,41.3155456712354,-81.0292211311084
"08-RD-310824","Lutheran Hospital","Region 08, Cleveland, Ohio","Open","01/24/2023","","","Cleveland","OH","A","Single Labor Organization","Initial","02/22/2023",167,1,"Service Employees International Union, District 1199 WV/KY/OH, The Healthcare and Social Service Union",70,"",NA,"",NA,61,131,"",1,"","Service Employees International Union, District 1199 WV/KY/OH The Health Care and Social Service Union, CTW, CLC","All dietary employees, laundry employees, housekeeping employees, maintenance employees, central supply employees including the technician, physical therapy assistants and aides, and nursing service employees, including Licensed Practical Nurses, nursing department assistants (transporters), nursing department assistant IIs, nursing department assistant IIIs, behavioral health technicians, and division clerks, but excluding all office clerical employees, dietary clerical employees, coffee shop employee, student nurses, technical students, mail room employees, all other technical employees, orderlies, stores clerk, stockman, driver, darkroom aide, Registered Nurses and all other professional employees, guards and supervisors as defined in the National Labor Relations Act of 1974, and as amended.","","","",191,"","Service Employees International Union, District 1199 WV/KY/OH The Health Care and Social Service Union, CTW, CLC","Included:
All dietary employees, laundry employees, housekeeping employees, maintenance employees,
central supply employees including the technician, physical therapy assistants and aides, and
nursing service employees, including Licensed Practical Nurses, nursing department assistants
(transporters), nursing department assistant IIs, nursing department assistant IIIs, behavioral health
technicians, and division clerks.
Excluded:
All office clerical employees, dietary clerical employees, coffee shop employee, student nurses,
technical students, mail room employees, all other technical employees, orderlies, stores clerk,
stockman, driver, darkroom aide, Registered Nurses and all other professional employees, guards
and supervisors as defined in the National Labor Relations Act of 1974, as amended.",167,41.489381,-81.667486,"Cleveland, OH 44101",1,"place","TIGER/Line® dataset from the US Census Bureau","Cleveland","Cuyahoga County","OH","44101","US",1,41.6518881214512,-81.8038817035355
"08-RD-313294","Northern Management & Leasing, Inc. d/b/a Statewide Express","Region 08, Cleveland, Ohio","Open","03/03/2023","","","Cleveland","OH","A","Single Labor Organization","Initial","04/11/2023",17,NA,"Teamsters Local 407 a/w International Brotherhood of Teamsters",7,"",NA,"",NA,6,15,"",2,"Y","","All truck drivers at the Employer's Engle Road, Ohio facility, or other Ohio dedicated operations or facilities at which truck driver employees report to work; excluding all clerical employees, office personnel, professional employees, dispatchers, guards, warehousemen, dock workers and supervisors as defined in the Act.","","","",16,"","","Included: All full-time and regular part-time drivers

Excluded: All professional employees, guards, managers, and supervisors as defined by the Act.",17,41.489381,-81.667486,"Cleveland, OH 44101",1,"place","TIGER/Line® dataset from the US Census Bureau","Cleveland","Cuyahoga County","OH","44101","US",1,41.7045769820185,-81.5156746521913
"08-RD-314163","GMP Friction Products","Region 08, Cleveland, Ohio","Open","03/14/2023","","","Akron","OH","","","","",NA,NA,"United Steelworkers Local 2L",NA,"",NA,"",NA,NA,NA,"",NA,"","","","","","",40,"","","Included:  All production and maintenance employees;
Excluded:  All supervisors, office and clerical employees, laboratory, experimental or development employees, guards and salaried inspection employees.",NA,41.04349,-81.524017,"Akron, OH 44301",1,"place","TIGER/Line® dataset from the US Census Bureau","Akron","Summit County","OH","44301","US",1,40.9978199404904,-81.7312286388008
"08-RD-320170","OmniSource LLC","Region 08, Cleveland, Ohio","Open","06/20/2023","","","Toledo","OH","","","","",NA,NA,"International Brotherhood of Teamsters Local 20",NA,"",NA,"",NA,NA,NA,"",NA,"","","","","","",8,"","","Drivers and full-time truck maintenance and box repair employees; excluding office, clerical, professional, research/development, engineering, seasonal, tech, guards, foremen, supervisors and dispatchers.",NA,41.720684,-83.569359,"Toledo, OH 43601",1,"place","TIGER/Line® dataset from the US Census Bureau","Toledo","Lucas County","OH","43601","US",1,42.1916285047192,-83.9256139417839
"08-RD-320352","Curaleaf Newark, LLC d/b/a Curaleaf","Region 08, Cleveland, Ohio","Open","06/20/2023","","","Newark","OH","","","","",NA,NA,"United Food and Commercial Workers International Union, Local 1059",NA,"",NA,"",NA,NA,NA,"",NA,"","","","","","",10,"","","Budtenders; excluding managers and supervisors.",NA,40.119897,-82.377784,"Newark, OH 43055",1,"place","TIGER/Line® dataset from the US Census Bureau","Newark","Licking County","OH","43055","US",1,40.4977148822249,-82.6063062753417
"09-RC-270027","Solstice Sleep Products, Inc.","Region 09, Cincinnati, Ohio","Open","12/09/2020","","","Columbus","OH","A","Single Labor Organization","Initial","03/03/2021",88,4,"United Food and Commercial Workers Union, Local No. 1059",4,"",NA,"",NA,36,40,"",10,"","","All full-time and regular part-time furniture manufacturing employees, including shipping department employees and lead employees employed by the Employer at its facility located at 3720 West Broad Street, Columbus, Ohio 43228, but excluding all seasonal employees, temporary employees, managerial employees, professional employees, office clerical employees, confidential employees, sales representative employees, purchaser employees, customer service employees, maintenance employees, guards and supervisors as defined in the Act.","","","",85,"","","Included:  All full-time and part-time furniture manufacturing employees employed by the Employer at the above location.  

Excluded:  All seasonal, temporary, managerial, clerical and confidential personnel, sales representatives, purchasers, customer service personnel, maintenance employees, guards and supervisors as defined in the Act.",88,40.100924,-83.013402,"Columbus, OH 43085",1,"place","TIGER/Line® dataset from the US Census Bureau","Columbus","Franklin County","OH","43085","US",1,40.5672695076516,-83.2200457073518
