"16-RC-298951","MAYTAG AIRCRAFT LLC","Region 16, Fort Worth, Texas","Open","07/07/2022","","","Fort Hood","TX","","","","",NA,NA,"International Association of Machinists and Aerospace Workers, AFL-CIO",NA,"",NA,"",NA,NA,NA,"",NA,"","","","","","",17,"","","INCLUDED: All full and regular part time hourly employees including, drivers system operator, accountant, dispatcher, fuel distribution operator, fuel distribution mechanic, part time driver system operator, working at Fort Hood TX.

EXCLUDED: Office clerical employees, professional employees, managerial employees, guards, supervisors, as defined in the Act.",NA,31.134891,-97.775614,"Fort Hood, TX 76544",0.8,"place","TIGER/Line® dataset from the US Census Bureau","Fort Hood","Bell County","TX","76544","US",1,30.7574777785979,-98.0089093973673
"16-RC-299517","Starbucks","Region 16, Fort Worth, Texas","Open","07/15/2022","","","San Antonio","TX","","","","",NA,NA,"Workers United",NA,"",NA,"",NA,NA,NA,"",NA,"","","","","","",21,"","","Included: All full-time & regular part-time Baristas and Shift Supervisors.

Excluded:
Assistant  Store Managers, Store Managers, Office Clericals, Guards, Professional Employees & Supervisors.",NA,29.468413,-98.528889,"San Antonio, TX 78201",1,"place","TIGER/Line® dataset from the US Census Bureau","San Antonio","Bexar County","TX","78201","US",1,29.4931007169702,-98.9745981614604
"16-RD-283976","EXXONMOBIL CORPORATION, BEAUMONT REFINERY","Region 16, Fort Worth, Texas","Open","10/05/2021","","","Beaumont","TX","A","Single Labor Organization","Initial","03/14/2022",581,3,"UNITED STEEL, PAPER, AND FORESTRY, RUBBER, MANUFACTURING, ENERGY, ALLIED-INDUSTRIAL AND SERVICE WORKERS INTERNATIONAL UNION AND ITS LOCAL NO. 13-243",258,"",NA,"",NA,229,487,"",9,"","UNITED STEEL, PAPER, AND FORESTRY, RUBBER, MANUFACTURING, ENERGY, ALLIED-INDUSTRIAll AND SERVICE WORKers and Service ERS INTERNATIONAL UNION AND ITS LOCAL NO. 13-243","INCLUDED: All full-time and regular part-time employees of the Employer in the Process
Division, Mechanical Division, Magpetco (including hourly paid subforemen, leadermen,
all clerks, typists, and messengers) at its Beaumont Refinery, Beaumont, Texas.

EXCLUDED: All other employees, including officials, supervisors, foremen with the right
to hire and discharge, all Subforemen A in the Machine Shop, plant protection employees,
civil, chemical, mechanical and electrical engineers, professional personnel, confidential
employees, employees in the IBEW of the AFL-CIO unit and casual temporary employees,
guards, and supervisors as defined by the National Labor Relations Act","","","",584,"","UNITED STEEL, PAPER, AND FORESTRY, RUBBER, MANUFACTURING, ENERGY, ALLIED-INDUSTRIAll AND SERVICE WORKers and Service ERS INTERNATIONAL UNION AND ITS LOCAL NO. 13-243","Included: Employees of the Company in the Process Division, Mechanical Division and Magpetco(including hourly paid subforemen, leaderman, all clerks, typists, and messengers)  atits Beaumont Refinery, Texas.

Excluded: officials, supervisors, foremen with the right to hire and discharge, all subforeman A in the Machine Shop, plant protection employees, civil, chemical, mechanical and electrical engineers professional personnel, confidential employees, employees in the I.B.E.W of the AFL-CIO unit and casual temporary employees,",581,30.073712,-94.109705,"Beaumont, TX 77701",1,"place","TIGER/Line® dataset from the US Census Bureau","Beaumont","Jefferson County","TX","77701","US",1,29.585446620668,-94.1673128095473
"16-RM-299446","MESTEK, INC.","Region 16, Fort Worth, Texas","Open","07/14/2022","","","Dallas","TX","","","","",NA,NA,"SHEET METAL WORKERS INTERNATIONAL ASSOCIATION, LOCAL UNION 68, AFL-CIO",NA,"",NA,"",NA,NA,NA,"",NA,"","","","","","",97,"","","Included: All hourly paid Production and maintenance employees at its 4830 Transport Drive.

Excluded: Other employees, guards and supervisors as defined by the Act",NA,32.781179,-96.790329,"Dallas, TX 75201",1,"place","TIGER/Line® dataset from the US Census Bureau","Dallas","Dallas County","TX","75201","US",1,33.1304826362343,-96.8942931667157
"18-RC-286388","Ecumen","Region 18, Minneapolis, Minnesota","Open","11/16/2021","","","Owatonna","MN","A","Revised Single Labor Org","Initial","05/03/2022",16,NA,"United Food and Commercial Workers Local 663",6,"",NA,"",NA,6,NA,"",1,"Y","","Included:  All full time and regular part time Resident Assistants, including Resident Leads, Dining Assistants, Cooks, and Housekeeping employees, including Housekeeping Leads, employed by the Employer in Owatonna, Minnesota. 

Excluded:  All Managers, and Guards and Supervisors as defined by the Act, as amended, and all other employees. 
","","","",NA,"","","",NA,44.047613,-93.223724,"Owatonna, MN 55060",1,"place","TIGER/Line® dataset from the US Census Bureau","Owatonna","Steele County","MN","55060","US",1,43.7939257698284,-93.6917906008499
"18-RC-291082","Starbucks Corporation","Region 18, Minneapolis, Minnesota","Open","02/22/2022","","","Plover","WI","A","Single Labor Organization","Initial","05/04/2022",34,NA,"Chicago and Midwest Regional Joint Board, Workers United/SEIU",7,"",NA,"",NA,5,12,"",2,"Y","Chicago and Midwest Regional Joint Board, Workers United affiliated with Service Employees International Union","All full-time and regular part-time baristas and shift supervisors employed by the Employer at its facility currently located at 120 Crossroads Drive, Plover, Wisconsin, but excluding all office clerical employees, guards, professional employees, and supervisors as defined in the Act.

Others permitted to vote: The parties have agreed that assistant store managers may vote in the election, but their ballots will be challenged since their eligibility has not been resolved. No decision has been made regarding whether the individuals in this classification or group are included in, or excluded from, the bargaining unit. The eligibility or inclusion of these individuals will be resolved, if necessary, following the election.
","","","",27,"","Chicago and Midwest Regional Joint Board, Workers United affiliated with Service Employees International Union","Included:
All full-time and regular part-time Baristas and Shift Supervisors

Excluded:
Store managers, Office Clericals, Guards, Professional Employees, and Supervisors",34,44.413942,-89.565507,"Plover, WI 54467",1,"place","TIGER/Line® dataset from the US Census Bureau","Plover","Portage County","WI","54467","US",1,44.8769457869792,-89.2561128476306
"18-RC-293227","Starbucks Corporation","Region 18, Minneapolis, Minnesota","Open","03/30/2022","","","Minneapolis","MN","A","Single Labor Organization","Initial","06/14/2022",19,NA,"Chicago and Midwest Regional Joint Board, Workers United/SEIU",5,"",NA,"",NA,6,11,"",NA,"","","Included: All full-time and regular part-time Baristas and Shift Supervisors employed by the Employer at 5351 Lyndale Ave S, Minneapolis, Minnesota 55419 (Store 822); 

Excluded: Store managers, Office Clericals, Professional Employees, and Guards and Supervisors as defined by the Act. 
","","","",17,"","","Included: All full-time and regular part-time Baristas and Shift Supervisors.

Excluded:  Store managers, Office Clericals, Guards, Professional Employees, and Supervisors.",19,44.984577,-93.269097,"Minneapolis, MN 55401",1,"place","TIGER/Line® dataset from the US Census Bureau","Minneapolis","Hennepin County","MN","55401","US",1,44.5383604556308,-93.3728531506964
"18-RC-293286","Starbucks Corporation","Region 18, Minneapolis, Minnesota","Open","03/30/2022","","","Madison","WI","A","Single Labor Organization","Initial","06/30/2022",22,NA,"Chicago and Midwest Regional Joint Board, Workers United/ SEIU",15,"",NA,"",NA,1,16,"",1,"","Chicago and Midwest Regional Joint Board, Workers United/SEIU","Included: All full-time and regular part-time baristas and shift supervisors employed by the Employer at its facility located at 1 E. Main Street, Madison, Wisconsin, also known as Store 2425.

Excluded: Store Managers, office clerical employees, guards, professional employees, and supervisors as defined in the Act.

Others Permitted to Vote: At this time, no decision has been made regarding whether any employees classified as Assistant Store Managers are included in, or excluded from, the bargaining unit. Individuals in this classification may vote in the election but their ballots shall be challenged since their eligibility has not been determined. The eligibility or inclusion of these individuals will be resolved, if necessary, following the election.
","","","",23,"","Chicago and Midwest Regional Joint Board, Workers United/SEIU","Included:  All full-time and regular part-time Baristas and Shift Supervisors.

Excluded:  Store managers, Office Clericals, Guards, Professional Employees and Supervisors.",22,43.060926,-88.230636,"Madison, WI 53702",1,"place","TIGER/Line® dataset from the US Census Bureau","Madison","Waukesha County","WI","53702","US",1,43.4247996223802,-88.2706992794481
"18-RC-293330","Wayzata Bay Senior Housing, Inc. d/b/a Folkestone","Region 18, Minneapolis, Minnesota","Open","03/31/2022","","","Wayzata","MN","A","Single Labor Organization","Initial","06/28/2022",56,NA,"SEIU HC MN and IA",10,"",NA,"",NA,36,46,"",2,"","","Included: All full time and regular part time Resident Assistants, non-certified Resident Assistants, Lead Resident Assistants, Licensed Practical Nurses (LPNs), and Trained Medication Assistants (TMAs).
 
Excluded:  All office clerical employees, professional employees, managers, guards and supervisors as defined by the Act, as amended, and all other employees.

","","","",69,"","","Included:  All Residential Assistants (RAs), Nursing Aide Registered (NARs) Certified Nursing Assistants (CNAs), Trained Medication Aide (TMAs), Licensed Practical Nurses (LPNs), and Activities Aides employed by Folkestone at 100 Promenade Ave, Wayzata, MN  55391.

Excluded:  All manager employees and guards as defied by The Act, and all other employees.",56,44.984663,-93.542233,"Wayzata, MN 55391",1,"place","TIGER/Line® dataset from the US Census Bureau","Wayzata","Hennepin County","MN","55391","US",1,45.29008211209,-93.5771728385733
"18-RC-294643","Starbucks Corporation","Region 18, Minneapolis, Minnesota","Open","04/22/2022","","","Eden Prairie","MN","A","Single Labor Organization","Initial","07/01/2022",26,NA,"Chicago and Midwest Regional Joint Board, Workers United/SEIU",8,"",NA,"",NA,9,17,"",NA,"","","Included: All full-time and regular part-time Baristas and Shift Supervisors employed by the Employer at 9250 Hennepin Town Road, Eden Prairie, Minnesota 55344 (Store 2366); 
Excluded: Store managers, Office Clericals, Professional Employees, and Guards and Supervisors as defined by the Act. 
","","","",27,"","","All full-time and regular part-time Baristas and Shift Supervisors; excluding Store managers, Office Clericals, Guards, Professional Employees, and Supervisors.",26,44.850563,-93.440429,"Eden Prairie, MN 55344",1,"place","TIGER/Line® dataset from the US Census Bureau","Eden Prairie","Hennepin County","MN","55344","US",1,45.1153961832606,-93.6799326648959
"18-RC-296191","Wright-Hennepin Cooperative Electric Association","Region 18, Minneapolis, Minnesota","Open","05/19/2022","","","Rockford","MN","A","Single Labor Organization","Initial","07/19/2022",6,NA,"International Brotherhood of Electrical Workers Local Union 160",4,"",NA,"",NA,2,6,"",NA,"","International Brotherhood of Electrical Workers Local Union 160","Included: All full-time and regular part-time Engineering Department Office Staff to include: Work Order Specialists, Work Order Accountants, GIS Coordinators, GIS Technicians, and Engineering Technicians.

Excluded: Field Engineers, Senior Field Engineers, Non-Engineering Department Clerical Workers, and Guards and Supervisors as defined by the Act.","","","",6,"","","Included: All regular full-time and all regular part-time Engineering Department Office Staff to include: Work Order Specialists, Work Order Accountants, GIS Coordinators, GIS Technicians, and Engineering Technicians.

Excluded: Field Engineers, Senior Field Engineers, Non-Engineering Department Clerical Workers, Guards, Supervisors, and others as defined by the Act.",NA,45.0875,-93.74167,"Rockford, MN 55373",1,"place","TIGER/Line® dataset from the US Census Bureau","Rockford","Wright County","MN","55373","US",1,45.0665488090366,-93.7375186366086
"18-RC-296575","Planned Parenthood North Central States","Region 18, Minneapolis, Minnesota","Open","05/26/2022","","","Saint Paul","MN","","","","",NA,NA,"SEIU Healthcare Minnesota & Iowa",NA,"",NA,"",NA,NA,NA,"",NA,"","","","","","",420,"","","Included:  All Regular Full-time and Part-time Accounting Associates, Administrative Assistants, Advocacy Fellows, Advocacy Strategists, Associate General Counselors, Associate Medical Directors, Associate Research Managers, Bilingual Patient Services Associates, Bilingual Registered Nurses, Care Coordinators, Central Services Supervisors, Centralized Services Associates, Claims Collections Analysts, Clinical Audit & Implementation Support Specialists, Clinical Research Assistants, Clinical Research Coordinators, Clinical Social Workers, Clinicians, Coding Specialists, Community Health Educators, Communications Associates, Communications Managers, Community Organizing Associates, Compliance Associates, Credentialing Associates, Development Coordinators, Development Operations Associates, Development Operations Specialists, Digital Organizers, Eligibility Associates, Employee Development Specialists, Evaluation Coordinators, Events Coordinators, Events Managers, Executive Assistants, Facilities Tech Leads, Facilities Associates, Financial Analysts, Financial Counselors, Float APNs, Float Clinicians, Float Health Center Associates, Float Licensed Practical Nurses, Float Medical Assistants, Float Registered Nurses, Grants & Data Coordinators, Grants Accountants, Grants Coordinators, Grants Managers, Health Center Associates, Health Center Associate Leads, Health Center Auditors, Health Educators, Health Services Support Specialists, Healthy Communities Organizing Associates, Internal Communications Managers, Leadership Annual Gift Officers, Learning & Development Program Managers, Learning & Development Specialists, Licensed Practical Nurses, Major Gifts Officers, Annual Fund Managers, Marketing Coordinators, Marketing Specialists, Medical Assistants, Medical QRM Managers, Medical Records Assistants, Nurse Practitioners, Patient Collections Analysts, Patient Services Associates, Patient Services Associate Leads, Patient Services Quality Specialists, Patient Services Training Specialists, Pharmacists, Physicians, Programs Managers for Physicians and Clinicians, Health Services Project Coordinators, Project Managers, Prospect Development Specialists, Purchasing Associates, Refill Center Associates, Refill Center Leads, Refill Center Specialists, Registered Nurses, Research Assistants, Research Coordinators, Scheduling Coordinators, Senior Community Organizing Associates, Senior Design Managers, Senior Research Coordinators, Senior Staff Accountants, Senior Training & Development Specialist Registered Nurses, Senior Compliance Specialists, Senior Equity Training Specialists, Training & Development Specialists, Ultrasound Technicians, Virtual Care Associates, and Virtual Clinic Associates. 

Excluded:  All other employees, managerial employees, and supervisors as defined in the Act.
",NA,44.951483,-93.090649,"Saint Paul, MN 55101",1,"place","TIGER/Line® dataset from the US Census Bureau","Saint Paul","Ramsey County","MN","55101","US",1,45.100698844227,-93.4344564076548
"18-RC-297107","WCCO-TV, CBS Broadcasting Inc.","Region 18, Minneapolis, Minnesota","Open","06/03/2022","","","Minneapolis","MN","","","","",NA,NA,"Screen Actors Guild - American Federation of Television and Radio Artists (SAG-AFTRA)",NA,"",NA,"",NA,NA,NA,"",NA,"","","","","","",15,"","","Petition seeks a self-determination election for the following described unit to be added to a recognized unit of announcers, performers, writers, reporters, correspondents, commentators , producers, editorialists, researchers, and talent at the station, WCCO-TV, owned and operated by CBS Broadcasting, Inc. Included: All full-time and regular part-time web producers, assignment editors, digital line producers, and digital content producers employed by the Employer.
Excluded: All other employees, managers, confidential employees, guards, and supervisors as defined by the Act.",NA,44.984577,-93.269097,"Minneapolis, MN 55401",1,"place","TIGER/Line® dataset from the US Census Bureau","Minneapolis","Hennepin County","MN","55401","US",1,45.1430233471081,-93.3737563126375
"18-RC-297461","Allina Health System","Region 18, Minneapolis, Minnesota","Open","06/10/2022","","","Fridley","MN","","","","",NA,NA,"SEIU Healthcare Minnesota and Iowa",NA,"",NA,"",NA,NA,NA,"",NA,"","","","","","",86,"","","Included:  All Medical Lab Scientists, Medical Lab Technicians, and Lab Assistants at the Mercy Hospital Mercy Campus, and the Mercy Hospital Unity Campus.

Excluded:  All other employees, guards and supervisors as defined by the Act.",NA,46.316134,-94.19948,"Minnesota",1,"state","TIGER/Line® dataset from the US Census Bureau",NA,NA,"MN",NA,"US",1,46.1224716378268,-94.4049446597244
"18-RC-297566","Starbucks Corporation","Region 18, Minneapolis, Minnesota","Open","06/14/2022","","","Edina","MN","","","","",NA,NA,"Chicago and Midwest Regional Joint Board, Workers United/SEIU",NA,"",NA,"",NA,NA,NA,"",NA,"","","","","","",23,"","","Included: All full-time and regular part-time Baristas and Shift Supervisors
Excluded: Store managers, Office Clericals, Guards, Professional Employees, and Supervisors",NA,44.889687,-93.349949,"Edina, MN 55424",0.9,"place","TIGER/Line® dataset from the US Census Bureau","Edina","Hennepin County","MN","55424","US",1,44.6365205058074,-93.0026378457593
"18-RC-297612","Starbucks Corporation","Region 18, Minneapolis, Minnesota","Open","06/14/2022","","","West Allis","WI","","","","",NA,NA,"Chicago and Midwest Regional Joint Board, Workers United/SEIU",NA,"",NA,"",NA,NA,NA,"",NA,"","","","","","",21,"","","Included: All full-time and regular part-time Baristas and Shift Supervisors
Excluded: Store managers, Office Clericals, Guards, Professional Employees, and Supervisors",NA,43.016681,-88.007032,"West Allis, WI 53214",0.9,"place","TIGER/Line® dataset from the US Census Bureau","West Allis","Milwaukee County","WI","53214","US",1,42.5552965943852,-87.7132713811066
"18-RC-297821","The American Bottling Company","Region 18, Minneapolis, Minnesota","Open","06/17/2022","","","Spencer","IA","","","","",NA,NA,"Teamsters Local 238",NA,"",NA,"",NA,NA,NA,"",NA,"","","","","","",3,"","","Included: Armor/Globe Election  All regular full time and part time Merchandise employees 
Excluded: supervisors, clerical, office employees and security guards",NA,43.13291,-95.177909,"Spencer, IA 51301",1,"place","TIGER/Line® dataset from the US Census Bureau","Spencer","Clay County","IA","51301","US",1,43.0940619544851,-95.5787132938076
"18-RC-297886","Des Moines Marble & Mantel Co.","Region 18, Minneapolis, Minnesota","Open","06/17/2022","","","Des Moines","IA","","","","",NA,NA,"Bricklayers and Allied Craftworkers, Local 3 Iowa",NA,"",NA,"",NA,NA,NA,"",NA,"","","","","","",26,"","","Included:  Employees working as Tile Layer, Marble Mason, Terrazo Worker, or Finisher.

Excluded:  Managerial, Clerical, and Security Personnel.",NA,41.672687,-93.572173,"Des Moines, IA 50301",1,"place","TIGER/Line® dataset from the US Census Bureau","Des Moines","Polk County","IA","50301","US",1,42.0227002143963,-93.3455276295203
"18-RC-297913","Abbott Northwestern Hospital","Region 18, Minneapolis, Minnesota","Open","06/21/2022","","","Minneapolis","MN","","","","",NA,NA,"SEIU HEALTH MINNESOTA",NA,"",NA,"",NA,NA,NA,"",NA,"","","","","","",1,"","","Included:  All full-time and regular part-time Rehabilitation Aides in the inpatient and acute care units to be added to the existing service and maintenance employees' unit via Armour-Globe.

Excluded:  All other professional employees, service and maintenance employees, technical employees, business office clerical employees, registered nurses, skilled maintenance employees, physicians, managers, supervisors, and guards.",NA,44.984577,-93.269097,"Minneapolis, MN 55401",1,"place","TIGER/Line® dataset from the US Census Bureau","Minneapolis","Hennepin County","MN","55401","US",1,45.2596876182113,-92.9906381176439
"18-RC-297917","Starbucks Corporation","Region 18, Minneapolis, Minnesota","Open","06/21/2022","","","Roseville","MN","","","","",NA,NA,"Chicago & Midwest Regional Joint Board, Workers United/SEIU",NA,"",NA,"",NA,NA,NA,"",NA,"","","","","","",25,"","","Included:  All full-time and regular part-time Baristas and Shift Supervisors.

Excluded: Store Managers, Office Clericals, Guards, Professional Employees, and Supervisors.",NA,45.006077,-93.156611,"Roseville, MN 55113",0.9,"place","TIGER/Line® dataset from the US Census Bureau","Roseville","Ramsey County","MN","55113","US",1,45.1899446778134,-93.4447962032151
"18-RC-297942","Starbucks Corporation","Region 18, Minneapolis, Minnesota","Open","06/21/2022","","","Rochester","MN","","","","",NA,NA,"Chicago & Midwest Regional Joint Board, Workers United/SEIU",NA,"",NA,"",NA,NA,NA,"",NA,"","","","","","",33,"","","Included:  All full-time and regular part-time Baristas and Shift Supervisors.

Excluded:  Store managers, Office Clericals, Guards, Professional Employees, and Supervisors.",NA,44.075285,-92.516916,"Rochester, MN 55901",1,"place","TIGER/Line® dataset from the US Census Bureau","Rochester","Olmsted County","MN","55901","US",1,43.9456430934089,-92.8855973928653
"18-RC-298414","Trader Joe's Minneapolis 725","Region 18, Minneapolis, Minnesota","Open","06/28/2022","","","Minneapolis","MN","","","","",NA,NA,"Trader Joe's United",NA,"",NA,"",NA,NA,NA,"",NA,"","","","","","",80,"","","Included: Crew Member, Merchant 
Excluded: Mate, Captain",NA,44.984577,-93.269097,"Minneapolis, MN 55401",1,"place","TIGER/Line® dataset from the US Census Bureau","Minneapolis","Hennepin County","MN","55401","US",1,44.7923314018161,-93.5320521263526
"18-RC-298879","Lyons Trading DBA Proozy","Region 18, Minneapolis, Minnesota","Open","07/06/2022","","","Eagan","MN","","","","",NA,NA,"International Brotherhood of Teamsters Local 120",NA,"",NA,"",NA,NA,NA,"",NA,"","","","","","",47,"","","Included:  All regular full-time & regular part-time warehouse employees employed by the employer at 980 Discovery Dr., Eagan, MN 55121

Excluded:  All clerical employees, professional employees, managers, supervisors & guards as defined.",NA,44.802791,-93.167768,"Eagan, MN 55122",1,"place","TIGER/Line® dataset from the US Census Bureau","Eagan","Dakota County","MN","55122","US",1,44.6727398060083,-92.8019867079135
"18-RC-299407","Minnesota United Football Club d/b/a Minnesota United FC","Region 18, Minneapolis, Minnesota","Open","07/14/2022","","","Golden Valley","MN","","","","",NA,NA,"International Alliance of Theatrical Stage Employees",NA,"",NA,"",NA,NA,NA,"",NA,"","","","","","",27,"","","Included:  All regular part-time freelance technicians, including Directors, Technical Directors, Audio Technicians, Audio Assistants, Video Technicians, Videotape Operators, Digital Recording Device Operators, Replay Technicians, Camera Operators (including stationary, mobile, and remotely operated), Graphics Operators, Font Operators, Show Control Operators, Utility Technicians and others in similar technical positions performing pre-production, production, and post-production work in connection with closed circuit telecasts displayed on the in-house video system within Allianz Field, including such telecasts of Minnesota United Football Club games, other Allianz Field events, pre-game shows and post-game shows.

Excluded:  All other employees, office clerical employees and guards, professional employees and supervisors as defined in the Act.",NA,45.005499,-93.379151,"Golden Valley, MN 55427",0.9,"place","TIGER/Line® dataset from the US Census Bureau","Golden Valley","Hennepin County","MN","55427","US",1,45.2758824408894,-93.8251221590316
"18-RD-295977","Mayo Clinic Health System - St. James","Region 18, Minneapolis, Minnesota","Open","05/16/2022","","","St. James","MN","","","","",NA,NA,"AFSCME, COUNCIL 65",NA,"",NA,"",NA,NA,NA,"",NA,"","","","","","",21,"","","Included:  All full-time and regular part-time registered nurses at Employer's facility in St. James, Minnesota.

Excluded:  Licensed practical nurses, technicians, technologists, nurses aides, office clerical employees, medical records employees, dietary employees, laundry employees, maintenance employees, housekeeping employees, casual employees, guards and supervisors.",NA,43.982851,-94.604116,"Saint James, MN 56081",1,"place","TIGER/Line® dataset from the US Census Bureau","Saint James","Watonwan County","MN","56081","US",1,44.395415555183,-94.303701203547
"18-RD-297254","Cheetah Precision, LLC d/b/a Minneapolis Washer & Stamping","Region 18, Minneapolis, Minnesota","Open","06/07/2022","","","Minneapolis","MN","","","","",NA,NA,"IUE-CWA LOCAL 1140",NA,"",NA,"",NA,NA,NA,"",NA,"","","","","","",17,"","","Included: All full-time production and skilled-trades employees, operators, and tool room/engine lathe employees.

Excluded: All other employees including: office employees, managerial employees, confidential employees.",NA,44.984577,-93.269097,"Minneapolis, MN 55401",1,"place","TIGER/Line® dataset from the US Census Bureau","Minneapolis","Hennepin County","MN","55401","US",1,44.5104119648211,-93.3250388920893
