"07-RD-282049","Maple-Drake Real Estate, LLC d/b/a Notting Hill of West Bloomfield","Region 07, Detroit, Michigan","Open","08/26/2021","","","West Bloomfield","MI","A","Single Labor Organization","Initial","11/29/2021",46,4,"SEIU Healthcare Michigan",12,"",NA,"",NA,9,21,"",3,"Y","SEIU Healthcare of Michigan","All full-time and regular part-time CNA employees, housekeeping employees, laundry employees, 
dietary aide employees, restorative aide employees, culinary aide employees, dietary cook employees,
activities aide employees, medical records employees, guest services employees and ward clerk
employees employed by the Employer at its facility located at 6535 Drake Road, West Bloomfield
Township, Michigan; but excluding all business officers, managers, dining room manages, managerial
employees, confidential employees, technical employees, professional employees, office personnel
employees, LPNs, RNs, executive chefs, registered dieticians, receptionists, casual employees, drivers,
social service employees, payroll employees, account management staff employees, central supply
employees, scheduler employees, maintenance employees, and guards and supervisors as defined in the
Act.
","","","",49,"","SEIU Healthcare of Michigan","Included: CNA, Kitchen, Laundry department, activities.  Excluded:  All other Employee's.",46,42.542715,-83.379535,"West Bloomfield, MI 48322",1,"place","TIGER/Line® dataset from the US Census Bureau","West Bloomfield","Oakland County","MI","48322","US",1,42.8037034529375,-83.269324477922
"07-RD-290351","VHS Sinai-Grace Hospital, Inc.","Region 07, Detroit, Michigan","Open","02/08/2022","","","Detroit","MI","","","","",NA,NA,"SEIU Healthcare Michigan",NA,"",NA,"",NA,NA,NA,"",NA,"","","","","","",320,"","","Included: All Full-Time, Regular Part-Time and Contingent (Per Diem) Service and Maintenance and Technical Employees

Excluded: Confidential Employees, Physicians, Residents, Central Business Office Employees",NA,42.347021,-83.060184,"Detroit, MI 48201",1,"place","TIGER/Line® dataset from the US Census Bureau","Detroit","Wayne County","MI","48201","US",1,42.4254878098204,-83.0668638171029
"07-RD-293425","Indiana Michigan Power Company","Region 07, Detroit, Michigan","Open","03/31/2022","","","Bridgman","MI","A","Single Labor Organization","Initial","07/18/2022",67,NA,"Local 1392, International Brotherhood of Electrical Workers, AFL-CIO",43,"",NA,"",NA,13,56,"",NA,"","Local 1392, International Brotherhood of Electrical Workers, AFL-CIO","Including:  All full-time and regular part-time auxiliary equipment operator seniors, auxiliary equipment operators, utility operators and make-up plant/identification specialists employed by the Employer at its facility located at Bridgman, Michigan, who were employed by the Employer during the biweekly payroll period ending Sunday, May 1, 2022. 

Excluding:  All electrical employees, managerial employees, guards, professional employees, and supervisors as defined in the Act.  



","","","",71,"","","INCLUDED: All full-time and regular part-time auxiliary equipment operator seniors, auxiliary equipment operators, utility operators and make-up plant/identification specialists employed at
its facility located in Bridgman, Michigan;


EXCLUDED: All clerical employees, managerial employees, guards, professional employees
and supervisors as defined in the Act",NA,41.942151,-86.544561,"Bridgman, MI 49106",1,"place","TIGER/Line® dataset from the US Census Bureau","Bridgman","Berrien County","MI","49106","US",1,41.6117318321238,-86.8612734625761
"07-RD-295477","VHS Sinai-Grace Hospital, Inc.","Region 07, Detroit, Michigan","Open","05/09/2022","","","Detroit","MI","","","","",NA,NA,"SEIU Healthcare Michigan",NA,"",NA,"",NA,NA,NA,"",NA,"","","","","","",320,"","","Included: All Full-Time, Regular Part-Time and Contingent (per diem) Service, Maintenance and Technical Employees

Excluded: Confidential Employees, Physicians, Residents, Central Business Office Employees",NA,42.347021,-83.060184,"Detroit, MI 48201",1,"place","TIGER/Line® dataset from the US Census Bureau","Detroit","Wayne County","MI","48201","US",1,42.079603001714,-82.9335298726201
"07-RD-296062","Fremont Healthcare, LLC d/b/a Transitional Health Services of Fremont","Region 07, Detroit, Michigan","Open","05/18/2022","","","Detroit","MI","","","","",NA,NA,"Service Employees Internaitonal Union",NA,"",NA,"",NA,NA,NA,"",NA,"","","","","","",55,"","","Included:  CNA, Housekeeping, Laundry, Maintenance and Kitchen",NA,42.347021,-83.060184,"Detroit, MI 48201",1,"place","TIGER/Line® dataset from the US Census Bureau","Detroit","Wayne County","MI","48201","US",1,42.061841986148,-83.4253362670407
"07-RD-299200","GFL Environment/Arbor Hills Land Fill","Region 07, Detroit, Michigan","Open","07/11/2022","","","Northville","MI","","","","",NA,NA,"Local 324, International Union of Operating Engineers (IUOE), AFL-CIO",NA,"",NA,"",NA,NA,NA,"",NA,"","","","","","",17,"","","Included: Equipment Operators and Mechanics

Excluded: Clerical Employees, Professional Employees, Supervisors, Laborers",NA,42.43115,-83.48327,"Northville, MI 48167",1,"place","TIGER/Line® dataset from the US Census Bureau","Northville","Wayne County","MI","48167","US",1,42.7891017500475,-83.2452813510639
"08-RC-284759","Kenyon College","Region 08, Cleveland, Ohio","Open","10/18/2021","","","Gambier","OH","","","","",NA,NA,"United Electrical, Radio and Machine Workers of America (UE)",NA,"",NA,"",NA,NA,NA,"",NA,"","","","","","",600,"","","Included: All hourly paid student employees of Kenyon College Excluded: All managerial employees, guards, professional employees and supervisors as defined by the Act, and all other employees",NA,40.338527,-82.348673,"Gambier, OH 43022",1,"place","TIGER/Line® dataset from the US Census Bureau","Gambier","Knox County","OH","43022","US",1,39.9877621558991,-82.3563909719228
"08-RC-287674","Tyler Trucking, Inc.","Region 08, Cleveland, Ohio","Open","12/14/2021","","","Bethesda","OH","A","Single Labor Organization","Initial","02/11/2022",7,NA,"Teamsters, Chauffeurs, Warehousemen & Helpers Local 697",3,"",NA,"",NA,1,4,"",3,"Y","Teamsters, Chauffeurs, Warehousemen & Helpers Local 697","All full-time and regular part-time truck drivers employed by the Employer at its 64660 North 26 Road, Bethesda, Ohio facility, but excluding all office clerical employees, professional employees, guards, managers, and supervisors as defined by the Act.","","","",5,"","Teamsters, Chauffeurs, Warehousemen & Helpers Local 697","All full time and regular part-time truck drivers employed at the Employer's Bethesda, Ohio facility, but excluding all professional employees and supervisors as defined in the Act.",7,39.996312,-81.065991,"Bethesda, OH 43719",1,"place","TIGER/Line® dataset from the US Census Bureau","Bethesda","Belmont County","OH","43719","US",1,40.3075113435305,-81.4410488558538
"08-RC-288488","Midwest Terminals of Toledo International, Inc.","Region 08, Cleveland, Ohio","Open","01/05/2022","","","Toledo","OH","A","Single Labor Organization","Initial","07/13/2022",44,NA,"International Longshoremen's Association",8,"",NA,"",NA,14,39,"",17,"Y","","Included: All full-time, regular part-time, on call (fn. 1) maintenance employees and dockworkers performing longshoring, stevedoring and warehousing duties employed by the Employer its Facility 1 location in Toledo, Ohio; excluding all other employees, office clerical employees, confidential employees, managers, guards, and supervisors as defined in the Act. 
(fn. 1) Any employee who has worked an average of four (4) hours or more per week during the 13 weeks immediately preceding the eligibility date is eligible to vote in the election.  
Excluded: All other employees, office clerical employees, confidential employees, managers, guards, and supervisors as defined in the Act.  
OTHERS PERMITTED TO VOTE:  The parties agree that Samuel A. Dumas, Scott D. Fisher, Ryan Richardson, Jordan C. Salhoff and David H. Whetsel may vote in the election, but their ballots will be challenged since their eligibility has not been resolved.  No decision has been made regarding whether the individuals are included in, or excluded from, the bargaining unit.  The eligibility or inclusion of these individuals will be resolved, if necessary, following the election.  
","","","",25,"","","lncluded: All regular full-time and part-time longshoremen, checkers, port laborers, loader operators, front end loaders, warehousemen, crane 
operators, power operators, tow motor operators, material handler operators, mechanics, maintenance employees, welders, signalmen, winchmen, linesmen, dispatchers, dock stewards, expeditors, hatch leaders, warehouse leaders and deck leaders
Excluded: All other employees, including executive, managerial, supervisory and confidential employees and guards, as defined by the Act.
",44,41.720684,-83.569359,"Toledo, OH 43601",1,"place","TIGER/Line® dataset from the US Census Bureau","Toledo","Lucas County","OH","43601","US",1,41.7159433939379,-83.1615403636087
"08-RC-289585","HHC Ohio, Inc. d/b/a Windsor Laurelwood Behavior Health Center","Region 08, Cleveland, Ohio","Open","01/27/2022","","","Willoughby","OH","","","","",NA,NA,"Ohio Nurses and Healthcare Employees Association, Ohio Nurses Association",NA,"",NA,"",NA,NA,NA,"",NA,"","","","","","",75,"","","Included: All Registered Nurses who are not managers. All Licensed Practical Nurses who are not managers. Excluded: All managers. All employees not a registered nurse or licensed practical nurse",NA,41.637997,-81.377383,"Willoughby, OH 44094",1,"place","TIGER/Line® dataset from the US Census Bureau","Willoughby","Lake County","OH","44094","US",1,41.6614827203905,-81.3807418046208
"08-RC-291055","Starbucks Corporation","Region 08, Cleveland, Ohio","Open","02/22/2022","","","Cleveland Heights","OH","","","","",NA,NA,"Chicago and Midwest Regional Joint Board, Workers Limited/Service Employees International Union",NA,"",NA,"",NA,NA,NA,"",NA,"","","","","","",19,"","","Included:  All full-time and regular part-time Baristas and Shift Supervisors 
Excluded:  Store Managers, Office Clericals, Guards, Professional Employees, and Supervisors.
",NA,41.489381,-81.667486,"Cleveland, OH 44101",0.95,"place","TIGER/Line® dataset from the US Census Bureau","Cleveland","Cuyahoga County","OH","44101","US",1,41.2732853794666,-81.9442937056389
"08-RC-291066","Starbucks Corporation","Region 08, Cleveland, Ohio","Open","02/22/2022","","","Cleveland","OH","","","","",NA,NA,"Chicago and Midwest Regional Joint Board, Workers United/Service Employees International Union",NA,"",NA,"",NA,NA,NA,"",NA,"","","","","","",35,"","","Included:  All full-time and regular part-time Baristas and Shift Supervisors 
Excluded:  Store Managers, Office Clericals, Guards, Professional Employees, and Supervisors.
",NA,41.489381,-81.667486,"Cleveland, OH 44101",1,"place","TIGER/Line® dataset from the US Census Bureau","Cleveland","Cuyahoga County","OH","44101","US",1,41.4979168426441,-82.0019626460359
"08-RC-291604","Marietta Area Health Care","Region 08, Cleveland, Ohio","Open","03/03/2022","","","Marietta","OH","","","","",NA,NA,"International Brotherhood of Teamsters Local Union 637",NA,"",NA,"",NA,NA,NA,"",NA,"","","","","","",220,"","","Included: 
 All registered nurses employed at Memorial Health System in Marietta, Ohio.
Excluded: all Non-Direct Patient Care Nurses (e.g. Clerical Nurses, Office Nurses, Safety Nurses, Education Nurses) Traveling Nurses, Contracted International Nurses, Shift Coordinators, Supervisors and Managerial Employees, Skilled Maintenance Employees, Technical Employees, Office Clerical Employees, Guards and all others specifically excluded by the National Labor Relations Act.

",NA,39.413446,-81.351051,"Marietta, OH 45750",1,"place","TIGER/Line® dataset from the US Census Bureau","Marietta","Washington County","OH","45750","US",1,39.1280943573597,-80.9280919901161
"08-RC-292577","Starbucks Corporation","Region 08, Cleveland, Ohio","Open","03/16/2022","","","Cleveland","OH","","","","",NA,NA,"Chicago & Midwest Regional Joint Board, Workers United, an affiliate of SEIU",NA,"",NA,"",NA,NA,NA,"",NA,"","","","","","",32,"","","Included: All full-time and regular part-time Baristas and Shift Supervisors. Excluded: Store Managers, Office Clericals, Guards, Professional Employees, and Supervisors.",NA,41.489381,-81.667486,"Cleveland, OH 44101",1,"place","TIGER/Line® dataset from the US Census Bureau","Cleveland","Cuyahoga County","OH","44101","US",1,41.3630198313118,-82.0677068057791
"08-RC-295218","Paragon Systems, Inc.","Region 08, Cleveland, Ohio","Open","05/04/2022","","","Cleveland","OH","A","Single Labor Organization","Initial","07/08/2022",79,NA,"International Union Security, Police and Fire Professionals of America (SPFPA)",33,"",NA,"",NA,NA,34,"",NA,"","International Union, Security, Police and Fire Professionals of America (SPFPA)","All full-time and  regular part-time Security Officers, Guards, and Security Police Officers employed by the Employer and assigned to the following locations:  Anthony J. Celebrezze Federal Building; Social Security Offices in Cleveland, Ohio, Euclid, Ohio, Beachwood, Ohio, Lorain, Ohio, Ashtabula, Ohio, Middleburg Heights, Ohio, Warrensville, Ohio, Lakewood, Ohio, and Painesville, Ohio; the F.B.I. Building in Cleveland, Ohio; the Social Security Hearings and Appeals Court in Cleveland, Ohio; the Stokes Federal Building in Cleveland, Ohio; the United States Attorney’s Office in Cleveland, Ohio; the Military Entrance Processing Station in Broadview Heights, Ohio; Environmental Protection Agency in Westlake, Ohio; United States Department of Justice in Cleveland, Ohio; and the Federal Building in Euclid, Ohio; excluding all security clerks and all office clerical employees and supervisors as defined in the Act.","","","",84,"","International Union, Security, Police and Fire Professionals of America (SPFPA)","All full-time and part-time armed and unarmed PROTECTIVE SECURITY OFFICERS PERFORMING GUARD DUTIES AS DEFINED IN SECTION 9(b)(3) OF THE NATIONAL LABOR RELATIONS ACT EMPOYED BY PARAGON SYSTEMS, INC. AT FEDERAL FACILITIES INN AND AROUND CLEVELAND, OHIO (SEE ATTACHED) BUT EXLUDING OFFICE CLERICAL EMPLOYEES, PROFESSIONAL EMPLOYEES AND SUPERVISORS AS DEFINED BY THE ACT.
Unit description: 
Federal facilities in and around Cleveland, OH including: Warrenville Heights, OH 
Lorain, OH 
Ashtabula, OH 
Middleburg Heights, OH 
Euclid, OH 
Lakewood, OH 
Beachwood, OH 
Painsville, OH",79,41.489381,-81.667486,"Cleveland, OH 44101",1,"place","TIGER/Line® dataset from the US Census Bureau","Cleveland","Cuyahoga County","OH","44101","US",1,41.86209099467,-81.7130379540701
"08-RC-295583","Trane Technologies Company LLC","Region 08, Cleveland, Ohio","Open","05/11/2022","","","Valley View","OH","","","","",NA,NA,"Pipefitters Local 120",NA,"",NA,"",NA,NA,NA,"",NA,"","","","","","",39,"","","All full-time and regular part-time journeyperson and apprentice contracting install technicians, field service technicians, service technician team leaders, contracting control technicians, and service control technicians employed by the Employer at its Valley View, Ohio facility; excluding all other employees, office clerical employees, professional employees, guards and supervisors as defined by the Act.",NA,39.965619,-83.072408,"Valleyview, OH 43204",0.8,"place","TIGER/Line® dataset from the US Census Bureau","Valleyview","Franklin County","OH","43204","US",1,40.4632301007854,-83.1277828542443
"08-RC-295748","HCL Software Products Limited","Region 08, Cleveland, Ohio","Open","05/13/2022","","","Cleveland","OH","A","Single Labor Organization","Initial","07/08/2022",15,NA,"United Steel, Paper and Forestry, Rubber, Manufacturing, Energy, Allied Industrial and Service Workers International Union, AFL-CIO/CLC",8,"",NA,"",NA,4,12,"",NA,"","United Steel, Paper and Forestry, Rubber, Manufacturing, Allied Industrial and Service Workers International Union, AFL-CIO/CLC","All full-time and regular part-time Software Engineers, Architects and Designers assigned to the Employer’s office located at 50 Public Square, Suite 1800, Cleveland, Ohio, including Senior Software Engineer I, Senior Technical Software Engineer I, Software Engineer II, Lead Software Engineer I, Senior Software Architect I, Senior Software Engineer II, Lead Designer II and Senior Designer II, excluding all temporary employees, guards and supervisors as defined the Act and all other employees.
","","","",13,"","United Steel, Paper and Forestry, Rubber, Manufacturing, Allied Industrial and Service Workers International Union, AFL-CIO/CLC","All software engineers and architects assigned to the Employer's office in Cleveland, Ohio; excluding all temporary employees, guards, and supervisors as defined in the Act, and all other employees.",15,41.489381,-81.667486,"Cleveland, OH 44101",1,"place","TIGER/Line® dataset from the US Census Bureau","Cleveland","Cuyahoga County","OH","44101","US",1,41.8040434520887,-81.2272097213515
"08-RC-296473","Sun Chemical Corporation","Region 08, Cleveland, Ohio","Open","05/25/2022","","","Maumee","OH","","","","",NA,NA,"United Steel Paper and Forestry Rubber Manufacturing Allied Industrial and Service Workers International Union AFL CIO CLC",NA,"",NA,"",NA,NA,NA,"",NA,"","","","","","",40,"","","Included: Production, Maintenance, and Shipping. Excluded: All other employees including office, clerical, supervisors, and guards as defined by the Act.",NA,41.571251,-83.685036,"Maumee, OH 43537",1,"place","TIGER/Line® dataset from the US Census Bureau","Maumee","Lucas County","OH","43537","US",1,41.9124056472926,-83.5863518625457
"08-RC-298271","Golden SVCS, LLC","Region 08, Cleveland, Ohio","Open","06/24/2022","","","Cleveland","OH","","","","",NA,NA,"Ohio Patrolmen's Benevolent Association",NA,"",NA,"",NA,NA,NA,"",NA,"","","","","","",4,"","","Included: All full time Security Lieutenants employed by the Employer at the NASA Glenn Research Center/Lewis Field Excluded: All others excluded under the Act",NA,41.489381,-81.667486,"Cleveland, OH 44101",1,"place","TIGER/Line® dataset from the US Census Bureau","Cleveland","Cuyahoga County","OH","44101","US",1,41.1392818052051,-81.4599687919342
"08-RC-299054","Horvath Electric, Inc.","Region 08, Cleveland, Ohio","Open","07/08/2022","","","Toledo","OH","","","","",NA,NA,"International Brotherhood of Electrical Workers, Local Union No. 8",NA,"",NA,"",NA,NA,NA,"",NA,"","","","","","",11,"","","Included - all full-time and part-time electricians employed by Horvath Electric, Inc. in the Ohio counties of Lucas, Wood, Sandusky, Defiance, Fulton, Ottawa, Seneca, Hancock, Paulding, Williams, Henry, and Putnam; and the Michigan counties of Hillsdale, Lenawee, and Monroe. Excluded - office clerks, confidential employees, professional employees, guards and supervisors as described in the Act.",NA,41.720684,-83.569359,"Toledo, OH 43601",1,"place","TIGER/Line® dataset from the US Census Bureau","Toledo","Lucas County","OH","43601","US",1,41.4281538833749,-83.928646025407
"08-RD-288251","Auto-Tronic Control","Region 08, Cleveland, Ohio","Open","12/29/2021","","","Northwood","OH","","","","",NA,NA,"International Brotherhood of Electrical Workers Local 8",NA,"",NA,"",NA,NA,NA,"",NA,"","","","","","",1,"","","All production and maintenance employees.",NA,41.603711,-83.47049,"Northwood, OH 43619",1,"place","TIGER/Line® dataset from the US Census Bureau","Northwood","Wood County","OH","43619","US",1,41.4814781852149,-83.1713543343579
"08-RD-294767","OmniSource LLC","Region 08, Cleveland, Ohio","Open","04/26/2022","","","Toledo","OH","A","Single Labor Organization","Initial","07/14/2022",9,NA,"International Brotherhood of Teamsters Local 20",5,"",NA,"",NA,4,9,"",NA,"","International Brotherhood of Teamsters Local 20","All of the Company's drivers and full-time truck maintenance and box repair employees employed at the Company's facility at 5159 N. Detroit Ave., Toledo, Ohio, but excluding office and clerical employees, professional employees, research and development employees, engineering employees, seasonal employees, technical employees, guards, foremen, dispatchers and supervisory employees, as defined in the National Labor Relations Act, as amended.","","","",8,"","International Brotherhood of Teamsters Local 20","Included:  Drivers, full-time truck maintenance and box repair employees
Excluded: 
office, supervisors, professional, research/development, engineers, seasonal, temps, guards, foreman, dispatchers",9,41.720684,-83.569359,"Toledo, OH 43601",1,"place","TIGER/Line® dataset from the US Census Bureau","Toledo","Lucas County","OH","43601","US",1,41.373793774692,-83.2830076677919
"08-RD-295582","Werk-Brau Co., Inc","Region 08, Cleveland, Ohio","Open","05/11/2022","","","Findlay","OH","","","","",NA,NA,"Iron Workers Regional Shop Local Union No. 851",NA,"",NA,"",NA,NA,NA,"",NA,"","","","","","",162,"","","Included: All full-time and regular part-time production and maintenance employees as set forth in Article XII, Classifications in the current collective-bargaining agreement between the Employer (Werk-Brau Company Inc.) and the Union (Iron Workers Regional Shop Local Union No. 851 of the International Association of Bridge, Structural Ornamental and Reinforcing Iron Workers, A.F.L.­-C.I.O., effective from August 1, 2019 to July 31, 2022, and located at the Employer's 2800 Fostoria Avenue, Findlay, Ohio facility. Excluded: All clerical employees, foremen, managers, component expediters (not to exceed 3 ), engineers, shipping clerks, quality assurance employees, summer seasonal employees, high school co­op students, temporary employees ( defined as employment agency employees, not more than three (3) at one time and not more than six (6) weeks' duration per employee) and guards and supervisors as defined and interpreted under the National Labor Relations Act, as amended.",NA,41.015219,-83.664786,"Findlay, OH 45840",1,"place","TIGER/Line® dataset from the US Census Bureau","Findlay","Hancock County","OH","45840","US",1,40.8260606046016,-84.1117349040785
"08-RD-297538","Penske Truck Leasing Co., L.P.","Region 08, Cleveland, Ohio","Open","06/13/2022","","","Perrysburg","OH","","","","",NA,NA,"International Brotherhood of Teamsters, Local Union No. 20",NA,"",NA,"",NA,NA,NA,"",NA,"","","","","","",11,"","","Included:  All Hiker employees employed by the Employer at its facilities located at 12222 Williams St, Perrysburg, Ohio, and 2821 Innovative Drive, Northwood, Ohio. 
Excluded:  All other employees employed by the Employer at its facilities at 12222 Williams St, Perrysburg, Ohio, and 2821 Innovative Drive, Northwood, Ohio including but not limited to office clerical employees, all professional employees, guards and supervisors as defined in the National Labor Relations Act. 
 
",NA,41.535057,-83.577701,"Perrysburg, OH 43551",1,"place","TIGER/Line® dataset from the US Census Bureau","Perrysburg","Wood County","OH","43551","US",1,41.7743418483287,-83.1077760562456
"08-RM-294845","Concord Steel Division of LB Metal, LLC","Region 08, Cleveland, Ohio","Open","04/28/2022","","","Warren","OH","A","Single Labor Organization","Initial","07/14/2022",14,NA,"United Steel, Paper & Forestry, Rubber, Manufacturing, Energy, Allied-Industrial and Service Workers Union, AFL-CIO/CLC",6,"",NA,"",NA,2,8,"",NA,"","United Steel, Paper and Forestry, Rubber, Manufacturing, Energy, Allied-Industrial and Service Workers International Union, AFL-CIO/CLC","All full-time and regular part-time production and maintenance employees engaged in the fabrication of iron, steel, metal, and other products, or in maintenance work in or about the Company's plant or plants located at 1451 Buena Vista NE, Warren, Ohio and vicinity but excluding office and clerical employees, draftsmen, engineering employees, watchmen, guards, and supervisors.","","","",16,"","United Steel, Paper and Forestry, Rubber, Manufacturing, Energy, Allied-Industrial and Service Workers International Union, AFL-CIO/CLC","All welders, burners, fitter/welders, fitter/inventory, and maintenance employees employed by the Employer at its Warren, Ohio facility; excluding Plant Manager, accounting, and administration.",14,41.176641,-80.902344,"Warren, OH 44481",1,"place","TIGER/Line® dataset from the US Census Bureau","Warren","Trumbull County","OH","44481","US",1,41.0182680632297,-80.8137965357727
"09-RC-270027","Solstice Sleep Products, Inc.","Region 09, Cincinnati, Ohio","Open","12/09/2020","","","Columbus","OH","A","Single Labor Organization","Initial","03/03/2021",88,4,"United Food and Commercial Workers Union, Local No. 1059",4,"",NA,"",NA,36,40,"",10,"","","All full-time and regular part-time furniture manufacturing employees, including shipping department employees and lead employees employed by the Employer at its facility located at 3720 West Broad Street, Columbus, Ohio 43228, but excluding all seasonal employees, temporary employees, managerial employees, professional employees, office clerical employees, confidential employees, sales representative employees, purchaser employees, customer service employees, maintenance employees, guards and supervisors as defined in the Act.","","","",85,"","","Included:  All full-time and part-time furniture manufacturing employees employed by the Employer at the above location.  

Excluded:  All seasonal, temporary, managerial, clerical and confidential personnel, sales representatives, purchasers, customer service personnel, maintenance employees, guards and supervisors as defined in the Act.",88,40.100924,-83.013402,"Columbus, OH 43085",1,"place","TIGER/Line® dataset from the US Census Bureau","Columbus","Franklin County","OH","43085","US",1,40.5672695076516,-83.2200457073518
