"Case","Case Name","Region","Status","Date Filed","Date Closed","Reason Closed","City","State","Unit ID","Ballot Type","Tally Type","Tally Date","No of Eligible Voters","Void Ballots","Labor Union1","Votes for Labor Union1","Labor Union2","Votes for Labor Union2","Labor Union3","Votes for Labor Union3","Votes Against","Total Ballots Counted","Runoff Required","Challenged Ballots","Challenges are Determinative","Union to Certify","Voting Unit (Unit A)","Voting Unit (Unit B)","Voting Unit (Unit C)","Voting Unit (Unit D)","Employees on charge/petition","Allegations","Union","Unit Sought","Voters","lat","long","formatted_address","accuracy","accuracy_type","source","address_components.city","address_components.county","address_components.state","address_components.zip","address_components.country","seached","lat_jit","long_jit"
"01-RC-288998","I.N.S.A., Inc.","Region 01, Boston, Massachusetts","Open","01/18/2022","","","Salem","MA","","","","",NA,NA,"UNITED FOOD AND COMMERCIAL WORKERS UNION LOCAL 1445",NA,"",NA,"",NA,NA,NA,"",NA,"","","","","","",28,"","","Included: All full-time and part-time retail associates, retail leads, inventory associates, and inventory leads employed by the employer at its 462 Highland Ave, Salem, MA facility.
Excluded: All other employees, asset protection employees, managerial employees, professional employees, guards and supervisors as defined by the Act.",NA,42.512946,-70.904237,"Salem, MA 01970",1,"place","TIGER/Line® dataset from the US Census Bureau","Salem","Essex County","MA","1970","US",1,42.8344077574122,-70.5004968659098
"01-RC-304016","Champion Specialty Services as Joint Employer with Holtec Decommissioning International (HDI)","Region 01, Boston, Massachusetts","Open","09/23/2022","","","Plymouth","MA","","","","",NA,NA,"LABORERS INTERNATIONAL UNION OF NORTH AMERICA",NA,"",NA,"",NA,NA,NA,"",NA,"","","","","","",16,"","","lncluded: All employees working as Laborers to perform the work associated with and required to decommission, decontaminate, demolish, and restore the Pilgrim Nuclear Power Generation site. Excluded: All other employees, employees working as Electricians, employees working as operating Engineers, office and clerical employees, professional
employees, watchmen, guards, and supervisors as defined in the Act.",NA,41.886207,-70.638717,"Plymouth, MA 02360",1,"place","TIGER/Line® dataset from the US Census Bureau","Plymouth","Plymouth County","MA","2360","US",1,42.1671050399277,-70.6577390265649
"01-RC-304042","Massachusetts Institute of Technology","Region 01, Boston, Massachusetts","Open","09/26/2022","","","Cambridge","MA","","","","",NA,NA,"UNITED ELECTRICAL RADIO & MACHINE WORKERS OF AMERICA (UE)",NA,"",NA,"",NA,NA,NA,"",NA,"","","","","","",1000,"","","Included:	All graduate fellows enrolled in Massachusetts Institute of Technology (MIT) degree programs who are employed to provide instructional or research services.

Excluded:  All other employees; undergraduate students; graduate student resident advisors; hourly graders who are not also graduate fellows; graduate students not seeking MIT degrees, including visiting students; office clericals; managers; guards and supervisors as defined in the Act.
 
",NA,42.380442,-71.132947,"Cambridge, MA 02138",1,"place","TIGER/Line® dataset from the US Census Bureau","Cambridge","Middlesex County","MA","2138","US",1,42.0421822168922,-70.6784121694745
"01-RC-305104","Brown University","Region 01, Boston, Massachusetts","Open","10/13/2022","","","Providence","RI","","","","",NA,NA,"GRADUATE LABOR ORGANIZATION, RIFT-AFT LOCAL 6516",NA,"",NA,"",NA,NA,NA,"",NA,"","","","","","",34,"","","Included: Masters of Fine Arts Graduate Students employed as actors and directors.
Excluded: Supervisory faculty, Managers, Guards.",NA,41.81835,-71.424851,"Providence, RI 02902",1,"place","TIGER/Line® dataset from the US Census Bureau","Providence","Providence County","RI","2902","US",1,42.1495082668684,-70.9312709557528
"01-RC-306528","Electric Boat Corporation","Region 01, Boston, Massachusetts","Open","11/03/2022","","","Groton","CT","","","","",NA,NA,"Southeastern CT Fire Professionals Union",NA,"",NA,"",NA,NA,NA,"",NA,"","","","","","",22,"","","Included: Firefighters Excluded: non-firefighters / management",NA,41.355405,-72.038268,"Groton, CT 06340",1,"place","TIGER/Line® dataset from the US Census Bureau","Groton",NA,"CT","6340","US",1,41.3461057466536,-72.0180616321702
"01-RC-309281","Paragon Systems Inc.","Region 01, Boston, Massachusetts","Open","12/21/2022","","","Boston","MA","A","Three Labor Organizations","Initial","06/05/2023",140,2,"United Federation LEOS-PBA Law Enforcement Officers Security & Police Benevolent Association",36,"International Union, Security, Police, and Fire Professionals of America (SPFPA)",18,"UNITED GOVERNMENT SECURITY OFFICERS OF AMERICA AND ITS LOCAL 273",14,NA,68,"",NA,"","United Federation LEOS-PBA Law Enforcement Officers Security & Police Benevolent Association","All full-time and regular part-time armed and unarmed Protective Security Officers employed by Paragon Systems, Inc. performing guard duties as defined by Section 9(b)(3) of the National Labor Relations Act, assigned to federal buildings in the Commonwealth of Massachusetts under Employer’s Contract 70RFP118DE1000001 with the Department of Homeland Security, Federal Protective Service.

Excluded: All office clerical employees, professional employees and supervisors
as defined by the Act.
","","","",150,"","United Federation LEOS-PBA Law Enforcement Officers Security & Police Benevolent Association","Included: All full-time and regular part-time armed and unarmed Protective Security Officers (“PSO”) employed by Paragon Systems performing guard duties as defined by Section 9 (b)(3) of the National Labor Relations Act, assigned to federal buildings in the State of Massachusetts under Employer's Contract No. 70RFP118DE1000001 with the Department of Homeland Security, Federal Protective Service Excluded: All office clerical employees, professional employees and supervisors as defined by the Act.",140,42.354318,-71.073449,"Boston, MA 02106",1,"place","TIGER/Line® dataset from the US Census Bureau","Boston","Suffolk County","MA","2106","US",1,42.7867340311371,-70.7783478281749
"01-RC-309535","Paragon Systems Inc.","Region 01, Boston, Massachusetts","Open","12/27/2022","","","Boston","MA","","","","",NA,NA,"UNITED GOVERNMENT SECURITY OFFICERS OF AMERICA AND ITS LOCAL 273",NA,"",NA,"",NA,NA,NA,"",NA,"","","","","","",140,"","","All full-time and regular part-time armed and unarmed Protective Security Officers (PSO) employed by Paragon Systems performing guard duties as defined by Section 9(b)(3) of the NLRA, assigned to federal buildings in the state of Massachusetts under Employer's Contract No 70RFP118DE1000001 with the Department of Homeland Security, Federal Protective Service; but excluding, 
 all office clerical employees, professional employees, and supervisors as defined in the Act.",NA,42.354318,-71.073449,"Boston, MA 02106",1,"place","TIGER/Line® dataset from the US Census Bureau","Boston","Suffolk County","MA","2106","US",1,42.6302573942542,-70.6789433504278
"01-RC-310539","Verano Four Daughters Holdings, LLC","Region 01, Boston, Massachusetts","Open","01/18/2023","","","Sharon","MA","A","Single Labor Organization","Initial","02/22/2023",24,NA,"United Food and Commercial Workers Local 1445 AFL-CIO, CLC",6,"",NA,"",NA,9,15,"",5,"Y","","Included:	All full-time and regular part-time edibles leads, sanitation specialists, packaging specialists, distribution specialists, maintenance technicians, extraction specialists, harvest specialists, production specialists, extraction leads, and post-harvest employees.
Excluded:	All agricultural employees, confidential employees, office clerical employees, managers, and guards, professional employees and supervisors as defined by the Act.
","","","",27,"","","Included:  All full-time and regular part-time lab/extraction employees, kitchen employees, post-harvest employees, packaging employees, driver/transport employees, and custodian/sanitation employees.
Excluded:  Cultivation employees, supervisors, managers, guards.",24,42.105288,-71.184785,"Sharon, MA 02067",1,"place","TIGER/Line® dataset from the US Census Bureau","Sharon","Norfolk County","MA","2067","US",1,41.9279333159004,-71.360763951389
"01-RC-311566","Northeastern University","Region 01, Boston, Massachusetts","Open","02/06/2023","","","Boston","MA","","","","",NA,NA,"GRADUATE EMPLOYEES OF NORTHEASTERN UNIVERSITY - UAW",NA,"",NA,"",NA,NA,NA,"",NA,"","","","","","",1700,"","","Included: All graduate student employees enrolled at Northeastern University who provide instructional services or research services. These include, but is not limited to, all Student Graduate Assistants (SGA), Teaching Assistants (instructors of record, teaching assistants, readers, graders, and graduate workers at the Writing Center), all Graduate Assistants and all graduate Research Assistants (regardless of funding source) employed by the Employer at the Boston, Nahant and Burlington campuses. Excluded: All undergraduate students employed by the employer, and all other employees, guards, and supervisors as defined in the Act.",NA,42.354318,-71.073449,"Boston, MA 02106",1,"place","TIGER/Line® dataset from the US Census Bureau","Boston","Suffolk County","MA","2106","US",1,42.6426797167827,-71.2534318954972
"01-RC-312846","Starbucks Corporation","Region 01, Boston, Massachusetts","Open","02/24/2023","","","Somerville","MA","","","","",NA,NA,"Workers United",NA,"",NA,"",NA,NA,NA,"",NA,"","","","","","",13,"","","Included: All full-time and regular part-time baristas and shift managers. Excluded: Store Managers.",NA,42.38092,-71.098896,"Somerville, MA 02143",1,"place","TIGER/Line® dataset from the US Census Bureau","Somerville","Middlesex County","MA","2143","US",1,42.6609024061804,-71.3405512042123
"01-RC-313008","Starbucks Corporation","Region 01, Boston, Massachusetts","Open","02/27/2023","","","Newton","MA","","","","",NA,NA,"Workers United, a/w SEIU",NA,"",NA,"",NA,NA,NA,"",NA,"","","","","","",15,"","","Included:  All full-time and regular part-time baristas and shift managers.  Excluded:  Store Managers",NA,42.446396,-71.459405,"Newton, MA 02160",1,"place","TIGER/Line® dataset from the US Census Bureau","Newton","Middlesex County","MA","2160","US",1,42.7788990361302,-71.3107007887724
"01-RC-313126","Northeastern University","Region 01, Boston, Massachusetts","Open","03/01/2023","","","Boston","MA","","","","",NA,NA,"American Coalition of Public Safety",NA,"",NA,"",NA,NA,NA,"",NA,"","","","","","",14,"","","Included: All full-time and regular part-time sergeants, detectives, and detective sergeants employed by the University at its Boston campus. Excluded: All other employees",NA,42.354318,-71.073449,"Boston, MA 02106",1,"place","TIGER/Line® dataset from the US Census Bureau","Boston","Suffolk County","MA","2106","US",1,41.8901427815166,-71.066616800596
"01-RC-314723","Reviewed, a division of Gannett Satellite Information Network, LLC","Region 01, Boston, Massachusetts","Open","03/23/2023","","","Cambridge","MA","","","","",NA,NA,"The NewsGuild - CWA",NA,"",NA,"",NA,NA,NA,"",NA,"","","","","","",25,"","","All full time and regular part time Lab Technician/Product Test Technician employees, Senior Manager of Lab Operations, the Logistics Coordinator and the Operations Coordinator, of the Employer.

All other employees, including managers, guards, and supervisors as defined by the Act
",NA,42.380442,-71.132947,"Cambridge, MA 02138",1,"place","TIGER/Line® dataset from the US Census Bureau","Cambridge","Middlesex County","MA","2138","US",1,42.8185805114975,-71.1622322807324
"01-RC-314724","Reviewed, a division of Gannett Satellite Information Network, LLC","Region 01, Boston, Massachusetts","Open","03/23/2023","","","Cambridge","MA","","","","",NA,NA,"The NewsGuild - CWA",NA,"",NA,"",NA,NA,NA,"",NA,"","","","","","",38,"","","Description of Present Unit: 
Included: All full-time and regular part-time content analysts, staff writers, editors, digital producers, graphic designers, photo editors, photographer/videographers, senior multimedia producers, and data entry employees

Excluded: All other employees, including newsletter editor & strategists, newsletter writers, lab technician/product test technicians, operations coordinators, logistics coordinators, managers, confidential employees, office clerical employees and guards, and supervisors as defined in the Act.

Description of Proposed Unit:
Included: All full-time and regular part-time content analysts, staff writers, editors, digital producers, graphic designers, photo editors, photographer/videographers, senior multimedia producers, newsletter writers, and data entry employees

Excluded: All other employees, including newsletter editor & strategists, lab technician/product test technicians, operations coordinators, logistics coordinators, managers, confidential employees, office clerical employees and guards, and supervisors as defined in the Act. 
",NA,42.380442,-71.132947,"Cambridge, MA 02138",1,"place","TIGER/Line® dataset from the US Census Bureau","Cambridge","Middlesex County","MA","2138","US",1,42.5170024032762,-71.0918677242243
"01-RC-314865","Public Service of New Hampshire d/b/a Eversource Energy","Region 01, Boston, Massachusetts","Open","03/27/2023","","","Manchester","NH","","","","",NA,NA,"INTERNATIONAL BROTHERHOOD OF ELECTRICAL WORKERS LOCAL 103",NA,"",NA,"",NA,NA,NA,"",NA,"","","","","","",24,"","","Included:
All ESCC System Operators including Control Room Operator, Systems Operator, Shift 
Operation Supervisor, Shift Operation Supervisor Level 1 & Shift Operation Supervisor Level 2
Excluded:
All other employees, guards, professional employees, and supervisors as defined in the
Act.",NA,42.988483,-71.462111,"Manchester, NH 03101",1,"place","TIGER/Line® dataset from the US Census Bureau","Manchester","Hillsborough County","NH","3101","US",1,43.4379527663467,-71.6469355230503
"01-RC-316049","Wes Wings and Red & Black Cafe (joint employer)","Region 01, Boston, Massachusetts","Open","04/13/2023","","","Middletown","CT","","","","",NA,NA,"UNITE HERE Local 217",NA,"",NA,"",NA,NA,NA,"",NA,"","","","","","",90,"","","INCLUDED: All full-time & regular part-time employees at the Employer's facilities in Middletown, Connecticut.

EXCLUDED: Office clerical employees, managerial employees, confidential employees, guards and supervisors as defined by the Act.
",NA,41.550139,-72.655357,"Middletown, CT 06457",1,"place","TIGER/Line® dataset from the US Census Bureau","Middletown","Lower Connecticut River Valley Planning Region","CT","6457","US",1,41.9675825301684,-73.1109443109493
"01-RC-316562","University of New Haven","Region 01, Boston, Massachusetts","Open","04/21/2023","","","West Haven","CT","","","","",NA,NA,"Local 217 UNITE HERE",NA,"",NA,"",NA,NA,NA,"",NA,"","","","","","",35,"","","Included: All full-time and regular part-time maintenance employees employed by the Employer.
Excluded: All office clerical, guards and supervisors as defined in the Act.",NA,41.272452,-72.940335,"West Haven, CT 06516",1,"place","TIGER/Line® dataset from the US Census Bureau","West Haven","South Central Connecticut Planning Region","CT","6516","US",1,41.1733161049732,-73.1824789145692
"01-RC-316644","Whitney Manor Operating Company, LLC","Region 01, Boston, Massachusetts","Open","04/21/2023","","","Hamden","CT","","","","",NA,NA,"United Food and Commercial Workers Union Local 371",NA,"",NA,"",NA,NA,NA,"",NA,"","","","","","",5,"","","Included: All full time and regular part time Therapists

Excluded: All per diem therapists, office clerical, and security as defined in the Act.",NA,41.372723,-72.938747,"Hamden, CT 06514",1,"place","TIGER/Line® dataset from the US Census Bureau","Hamden","South Central Connecticut Planning Region","CT","6514","US",1,41.2854048482764,-72.6743496757043
"01-RC-317281","President and Fellows of Harvard College (Harvard University)","Region 01, Boston, Massachusetts","Open","05/03/2023","","","Cambridge","MA","","","","",NA,NA,"Harvard Undergraduate Workers Union- UAW Local 5118",NA,"",NA,"",NA,NA,NA,"",NA,"","","","","","",500,"","","

All full-time and regular part-time undergraduate and graduate students enrolled in degree programs at Harvard University and who are employed by Harvard University as non-academic service employees in (1) the Harvard Library System;1 (2) Dining Services cafes;2 (3) Cambridge Queen’s Head Pub; and (4) in the Office of BGLTQ+ Life; the Harvard Foundation for Intercultural and Race Relations; and the Harvard College Women's Center.

Excluded
Managerial employees, guards, and professional employees as defined by the Act, and all other 
employees; and excluding any student employees working at the Arnold Arbo etum
Horticultural Library, Biblioteca Berenson, Dumbarton Oaks Research Library.


1 The known worksite locations are: 625 Massachusetts Avenue, Baker Library and Special 
Collections, Botany Libraries, Cabot Science Library, Countway Library, Ernst Mayr Library, Fine Arts Library, Frances Loeb Library, Fung Library, Gutman Library, Harvard Divinity School Library, Harvard Film Archive, Harvard Law School Library, Harvard Map Collection, Harvard University Archives, Harvard-Yenching Library, HKS Library and Research Services, Houghton Library, Lamont Library, Loeb Music Library, Robbins Library of Philosophy, Schlesinger Library on the History of Women in America, Science and Engineering Complex Library, Tozzer Library, Widener Library, Wolbach Library and Woodberry Poetry Room.

2 The known worksite locations are: Barker, Cafe Gato Rojo, GSAS Commons, HDS Commons, HKS, HLS Harkness Dining Room, Pub Grill, Harkbox & Catering, HLS Pub, LISE, Lamont, Northwest, and SEC.


",NA,42.380442,-71.132947,"Cambridge, MA 02138",1,"place","TIGER/Line® dataset from the US Census Bureau","Cambridge","Middlesex County","MA","2138","US",1,42.5314751439786,-71.1544407494602
"01-RC-317412","John Bapst Memorial High School","Region 01, Boston, Massachusetts","Open","05/04/2023","","","Bangor","ME","A","Single Labor Organization","Initial","06/05/2023",43,NA,"Maine Education Association",20,"",NA,"",NA,20,40,"",NA,"","","Included: All full-time and regular part-time professional faculty including teachers, guidance counselors, librarians and school nurses.
Excluded: Administrators, hourly support staff, guards, and supervisors as defined in the Act.","","","",45,"","","Included: All professional faculty, including teachers, guidance counselors, and librarians. Excluded: All supervisors, hourly support staff, and school nurses.",43,44.848517,-68.850405,"Bangor, ME 04401",1,"place","TIGER/Line® dataset from the US Census Bureau","Bangor","Penobscot County","ME","4401","US",1,45.2620227374369,-69.3354597581445
"01-RC-318449","North Shore Mechanical Contractors, LLC","Region 01, Boston, Massachusetts","Open","05/19/2023","","","Wilmington","MA","","","","",NA,NA,"United Association of Journeymen and Apprentices of the Plumbing and Pipefitting Industry of the United States and Canada, Local 12, AFL-CIO",NA,"",NA,"",NA,NA,NA,"",NA,"","","","","","",60,"","","Included: All full time and regular part-time plumbers, apprentices and laborers employed by North Shore Mechanical Contractors. Excluded: All other employees, office clerical employees, supervisors, managers and guards as defined by the National Labor Relations Act.",NA,42.561782,-71.173888,"Wilmington, MA 01887",1,"place","TIGER/Line® dataset from the US Census Bureau","Wilmington","Middlesex County","MA","1887","US",1,42.993198509673,-71.6346834279054
"01-RC-318931","Public Service of New Hampshire d/b/a Eversource Energy","Region 01, Boston, Massachusetts","Open","05/26/2023","","","Manchester","NH","","","","",NA,NA,"INTERNATIONAL BROTHERHOOD OF ELECTRICAL WORKERS LOCAL 1837",NA,"",NA,"",NA,NA,NA,"",NA,"","","","","","",24,"","","Included:  All Distribution System Operators and Associate Distribution System Operators. Excluded:  All others as defined in the Act.",NA,42.988483,-71.462111,"Manchester, NH 03101",1,"place","TIGER/Line® dataset from the US Census Bureau","Manchester","Hillsborough County","NH","3101","US",1,42.7583265136117,-71.4357753922515
"01-RC-318939","United Natural Foods, Inc.","Region 01, Boston, Massachusetts","Open","05/30/2023","","","Dayville","CT","A","Single Labor Organization","Initial","07/20/2023",182,NA,"INTERNATIONAL BROTHERHOOD OF TEAMSTERS JOINT COUNCIL 10 ON BEHALF OF IBT LU 493",83,"",NA,"",NA,44,127,"",12,"","INTERNATIONAL BROTHERHOOD OF TEAMSTERS JOINT COUNCIL 10 ON BEHALF OF IBT LU 493","All warehouse employees employed by the Employer at its Dayville, Connecticut facility, including Selectors, Flex Selectors, Lift Operators, Loaders, Receivers, Warehouse Sanitation employees, Warehouse Coordinators, and Warehouse Maintenance employees; but excluding Repack Selectors, Repack employees, Inventory Control employees, office clerical employees, confidential employees, professional employees, managers, guards, and supervisors as defined in the Act.","","","",188,"","","Included: All non supervisory warehouse employees including selector, lift operators, lift operators, Ioa.
Excluded: All other employees including managers, supervisors, guards, and non regular employees.",NA,41.854975,-71.858826,"Dayville, CT 06241",1,"place","TIGER/Line® dataset from the US Census Bureau","Dayville","Northeastern Connecticut Planning Region","CT","6241","US",1,41.7240924259875,-71.7146163305627
"01-RC-319255","Public Service Co. of New Hampshire d/b/a Eversource Energy","Region 01, Boston, Massachusetts","Open","06/02/2023","","","Manchester","NH","","","","",NA,NA,"INTERNATIONAL BROTHERHOOD OF ELECTRICAL WORKERS LOCAL 1837",NA,"",NA,"",NA,NA,NA,"",NA,"","","","","","",89,"","","Included: All full-time and regular part-time Working Foremen, Line in the New Hampshire
Line Department, including Working Foremen, Line, Transmission
To be included in existing Utility Group Contract bargaining unit.
Excluded: Supervisors, managers, confidential employees, and guards as defined by the Act.",NA,42.988483,-71.462111,"Manchester, NH 03101",1,"place","TIGER/Line® dataset from the US Census Bureau","Manchester","Hillsborough County","NH","3101","US",1,42.4988183855666,-71.9484739979081
"01-RC-319552","NSTAR Electric Company d/b/a Eversource Energy","Region 01, Boston, Massachusetts","Open","06/08/2023","","","Hadley","MA","A","Single Labor Organization","Initial","07/14/2023",10,NA,"INTERNATIONAL BROTHERHOOD OF ELECTRICAL WORKERS LOCAL 455",9,"",NA,"",NA,NA,9,"",NA,"","INTERNATIONAL BROTHERHOOD OF ELECTRICAL WORKERS LOCAL 455","All full time and regular part-time construction representatives, associate construction representatives and senior construction representatives employed by the Employer at its Hadley, Massachusetts facility; but excluding all confidential employees, managers, and guards, watchmen and supervisors as defined by the Act.","","","",10,"","INTERNATIONAL BROTHERHOOD OF ELECTRICAL WORKERS LOCAL 455","Included: All Construction Representatives and Associate & Senior Construction Representatives.
Excluded: Excluded: All confidential employees, managers, guards and watchmen, and supervisors as defined by the Act.",10,42.356804,-72.576613,"Hadley, MA 01035",1,"place","TIGER/Line® dataset from the US Census Bureau","Hadley","Hampshire County","MA","1035","US",1,42.8121338787214,-72.3852341539339
"01-RC-319761","Connecticut Light & Power Company d/b/a Eversource Energy","Region 01, Boston, Massachusetts","Open","06/12/2023","","","Berlin","CT","A","Single Labor Organization","Initial","07/14/2023",20,NA,"INTERNATIONAL BROTHERHOOD OF ELECTRICAL WORKERS, LOCAL 457, AFL-CIO",12,"",NA,"",NA,5,17,"",NA,"","INTERNATIONAL BROTHERHOOD OF ELECTRICAL WORKERS, LOCAL 457, AFL-CIO","All full-time and regular part-time Senior Construction Representatives, Construction Representatives, and Associate Construction Representatives employed by the Employer at its Hartford, Connecticut facility, but excluding all guards, professional employees and supervisors as defined in the Act.

","","","",21,"","INTERNATIONAL BROTHERHOOD OF ELECTRICAL WORKERS, LOCAL 457, AFL-CIO","Included: Senior Construction Rep, Construction Rep, and Associate Construction Rep.",20,41.579778,-72.746667,"Connecticut",1,"state","TIGER/Line® dataset from the US Census Bureau",NA,NA,"CT",NA,"US",1,41.3000012724521,-72.6074397049384
"01-RC-320914","Morrison Healthcare, a Division of Compass Group, USA","Region 01, Boston, Massachusetts","Open","06/29/2023","","","Norwalk","CT","","","","",NA,NA,"Connecticut Health Care Associates, National Union of Hospital and Health Care Employees, AFSCME, AFL-CIO",NA,"",NA,"",NA,NA,NA,"",NA,"","","","","","",64,"","","All full-time and regular part-time food service workers. cashiers, utility, cooks, and lead cooks but excluding all other employees, including office clerical/clerks, dieticians, managers, confidential employee, guards and supervisors as defined in the Act.",NA,41.126146,-73.442423,"Norwalk, CT 06850",1,"place","TIGER/Line® dataset from the US Census Bureau","Norwalk","Western Connecticut Planning Region","CT","6850","US",1,41.6130958766493,-73.083532820921
