"22-RD-290559","M. Chasen & Son, Inc.","Region 22, Newark, New Jersey","Open","02/14/2022","","","Irvington","NJ","A","Single Labor Organization","Initial","09/22/2022",19,7,"United Electrical, Radio and Machine Workers of America (UE), Local 155",7,"",NA,"",NA,4,11,"",1,"","United Electrical, Radio and Machine Workers of America (UE), Local 155","INCLUDED: All full-time and regular part-time Production and Maintenance employees of the Company as provided for under the National Labor Relations Board order of January 17, 1963, including truck drivers, employed by the Employer at its Irvington, New Jersey facility.

EXCLUDED: All bookkeepers, office clericals, guards and supervisors as defined in the Act, and all other employees.

OTHERS
PERMITTED
TO VOTE: At this time, no decision has been made regarding whether employees classified as Mechanic are included in, or excluded from, the bargaining unit, and individuals in this classification may vote in the election but their ballots shall be challenged since their eligibility has not been determined. The eligibility or inclusion of these individuals will be resolved, if necessary, following the election.","","","",NA,"","","",NA,40.726231,-74.23294,"Irvington, NJ 07111",1,"place","TIGER/Line® dataset from the US Census Bureau","Irvington","Essex County","NJ","7111","US",1,40.8850980595083,-74.3784042945901
"22-RD-304996","JSK Parsippany, LLC d/b/a Fairfield Inn & Suites","Region 22, Newark, New Jersey","Open","10/11/2022","","","Paterson","NJ","","","","",NA,NA,"New York Hotel & Motel Trades Council",NA,"",NA,"",NA,NA,NA,"",NA,"","","","","","",19,"","","INCLUDED:  All F/T & P/T  Maintenance Techs, Breakfast Host, Houseman and Housekeepers

EXCLUDED:  All other as defined in the Act",NA,40.911999,-74.170965,"Paterson, NJ 07501",1,"place","TIGER/Line® dataset from the US Census Bureau","Paterson","Passaic County","NJ","7501","US",1,41.1085895602556,-73.7525100083464
"22-UD-000401","New York Fast Ferry","Region 22, Newark, New Jersey","Open","10/12/2001","","","Highlands","NJ","","","","",NA,NA,"LOCAL 333, UNITED MARINE DIVISION, ILA",NA,"",NA,"",NA,NA,NA,"",NA,"","","","","","",15,"",""," Inc. Full-Time and regular part-time employees, including, but not limited, to Port Captain, Galley, Engine, Mechanic and Deck(Captain, Mate and Deckland)

Exc. All office , clerical, mangerial employees and supervisors as defined by the act.",NA,40.40372,-73.99153,"Highlands, NJ 07732",1,"place","TIGER/Line® dataset from the US Census Bureau","Highlands","Monmouth County","NJ","7732","US",1,40.5399715764777,-73.9557265716146
"25-RC-243735","Needham Excavating, Inc.","Region 25, Indianapolis, Indiana","Open","06/21/2019","","","Walcott","IA","A","Single Labor Organization","Initial","07/12/2019",17,NA,"International Union of Operating Engineers, Local 150, AFL-CIO",3,"",NA,"",NA,5,8,"",9,"","","Included:  All full-time and regular part-time heavy equipment operators employed by the Employer at its facility located at 137 North Main Street, Walcott, Iowa, 52773:
Excluded:  All other employees, and office clerical employees, managers, and guards and supervisors as defined in the Act.","","","",9,"","","Included: all full-time heavy equipment operators; Excluded: Other classifications, supervisors, managers, office clerical, and guards.",17,41.61358,-90.753478,"Walcott, IA 52773",1,"place","TIGER/Line® dataset from the US Census Bureau","Walcott","Scott County","IA","52773","US",1,41.3109281753375,-91.0102933738976
"25-RC-279310","Hall Aluminum Products, Inc.","Region 25, Indianapolis, Indiana","Open","06/30/2021","","","Fort Wayne","IN","A","Single Labor Organization","Initial","08/24/2021",63,2,"International Union of Painters and Allied Trades, District Council 91",17,"",NA,"",NA,25,42,"",6,"","","INCLUDED: All full-time and regular part-time glaziers, architectural metal workers, and architectural glass workers employed by the Employer at its Fort Wayne, Indiana facility,  
EXCLUDED: All janitorial employees, office clerical employees, professional employees, managers, temporary employees, and guards and supervisors as defined in the Act.","","","",43,"","","Included:  All full and part-time glaziers, architectural metal and glass workers

Excluded:  All statutory exemptions and shop employees",63,41.093763,-85.070713,"Fort Wayne, IN 46801",1,"place","TIGER/Line® dataset from the US Census Bureau","Fort Wayne","Allen County","IN","46801","US",1,40.7997344533389,-85.4703968789899
"25-RC-295115","Starbucks Corporation","Region 25, Indianapolis, Indiana","Open","05/03/2022","","","Peoria","IL","A","Single Labor Organization","Initial","07/12/2022",8,NA,"Chicago and Midwest Regional Joint Board, Workers United/SEIU",2,"",NA,"",NA,2,4,"",NA,"","","Included:  All full-time and regular part-time baristas and shift supervisors employed by the Employer at its store located at 707 W Pioneer Parkway, Peoria, IL.  
Excluded:  All store managers, assistant store managers, office clerical employees, confidential employees, managerial employees, professional employees, guards and supervisors as defined in the Act, and all other employees.","","","",21,"","","Included: All full-time and regular part-time Baristas and Shift Supervisors

Excluded: Store Managers, Office Clericals, Guards, Professional Employees, and Supervisors",8,40.693137,-89.589847,"Peoria, IL 61601",1,"place","TIGER/Line® dataset from the US Census Bureau","Peoria","Peoria County","IL","61601","US",1,40.4142691911309,-89.5868707582456
"25-RC-296418","Oak Street Health MSO, LLC","Region 25, Indianapolis, Indiana","Open","05/25/2022","","","Indianapolis","IN","A","Revised Single Labor Org","Initial","08/19/2022",25,1,"SEIU Healthcare Illinois & Indiana",8,"",NA,"",NA,9,17,"",NA,"Y","SEIU Healthcare Illinois & Indiana","INCLUDED: All full-time and regular part-time medical assistants, clinical testing medical assistants, medical assistant/phlebotomists, community health workers, welcome coordinators, outreach executives I, outreach executives II, medical social workers, patient representatives/patient relations managers, clinical informatics specialists, and lead clinical informatics specialists employed by the Employer at its clinic located at 4200 S. East St., Indianapolis, Indiana 46227;  
EXCLUDED: All office clerical employees, professional employees, temporary employees, managerial employees, guards and supervisors as defined in the Act, and all other employees.","","","",24,"","SEIU Healthcare Illinois & Indiana","medical assitant/welcome cord/outreach exec./social workers/patient rep/clinincal spec.",25,39.775092,-86.13216,"Indianapolis, IN 46201",1,"place","TIGER/Line® dataset from the US Census Bureau","Indianapolis","Marion County","IN","46201","US",1,39.8945212085711,-86.4313558665662
"25-RC-297000","SOLV Energy and Aerotek, Joint-Employers","Region 25, Indianapolis, Indiana","Open","06/03/2022","","","Bass Lake","IN","","","","",NA,NA,"International Union of Operating Engineers Local 150, AFL-CIO",NA,"",NA,"",NA,NA,NA,"",NA,"","","","","","",25,"","","Included: All regular full- and part-time heavy equipment operators and mechanics.  Excluded:  All supervisors, guards, and clericals, as defined by the Act.",NA,NA,NA,NA,NA,NA,NA,NA,NA,NA,NA,NA,1,NA,NA
"25-RC-301215","Lyons Fire and Safety, Inc.","Region 25, Indianapolis, Indiana","Open","08/11/2022","","","Danville","IN","A","Single Labor Organization","Initial","10/05/2022",6,1,"Road Sprinkler Fitters Local Union 669, United Association of Journeymen and Apprentices of the Plumbing Industry US and Canada, AFL-CIO",3,"",NA,"",NA,1,4,"",1,"","Road Sprinkler Fitters, Local 669 of the United Association of Journeyman and Apprentices of the Plumbing and Pipe Fitting Industry of the United States and Canada","Included: All full-time and regular part-time employees engaged in the installation of fire sprinkler systems who are employed by the Employer out of its Danville, Indiana, facility.

Excluded: All fire alarm technicians, managerial employees, office clerical employees, professional employees, confidential employees, temporary employees, employee relatives of the owner, and guards and supervisors as defined in the National Labor Relations Act.","","","",5,"","Road Sprinkler Fitters, Local 669 of the United Association of Journeyman and Apprentices of the Plumbing and Pipe Fitting Industry of the United States and Canada","Included: All full-time and regular part-time employees engaged in the installation of fire sprinkler systems employed by the Employer

Excluded: All other employed, fire alarm technicians, office clerical, guards, managers, and supervisors, as defined by the Act",6,39.766794,-86.530319,"Danville, IN 46122",1,"place","TIGER/Line® dataset from the US Census Bureau","Danville","Hendricks County","IN","46122","US",1,40.0806901866498,-86.6160698839108
"25-RC-303281","Jasper County REMC","Region 25, Indianapolis, Indiana","Open","09/13/2022","","","Rensselaer","IN","","","","",NA,NA,"Local 1393, International Brotherhood of Electrical Workers",NA,"",NA,"",NA,NA,NA,"",NA,"","","","","","",17,"","","Included: Foreman Linemen, Journeyman Linemen, Apprentice Linemen, Metering Technicians, Tree Trimmers, and Store Room Employees Excluded: All other employees",NA,40.994793,-87.10368,"Rensselaer, IN 47978",1,"place","TIGER/Line® dataset from the US Census Bureau","Rensselaer","Jasper County","IN","47978","US",1,41.3674520485312,-86.8712900875251
"25-RC-304698","10 Roads Express, LLC","Region 25, Indianapolis, Indiana","Open","10/05/2022","","","Peoria","IL","","","","",NA,NA,"American Postal Workers Union, AFL-CIO",NA,"",NA,"",NA,NA,NA,"",NA,"","","","","","",70,"","","Included: All drivers on the seniority bid list maintained at the Peoria, IL, terminal. Excluded: All other employees, managers, guards and supervisors",NA,40.693137,-89.589847,"Peoria, IL 61601",1,"place","TIGER/Line® dataset from the US Census Bureau","Peoria","Peoria County","IL","61601","US",1,41.0739301612246,-89.9727615261552
"25-RC-306134","Cellco Partnership d/b/a Verizon Wireless","Region 25, Indianapolis, Indiana","Open","10/28/2022","","","Oswego","IL","","","","",NA,NA,"Communications Workers of America, AFL-CIO",NA,"",NA,"",NA,NA,NA,"",NA,"","","","","","",6,"","","Included: All Full-Time and Regular Part-Time spec-retail (specialist) employees working at or out of the Employer's Facilities located at 2730 US 34 Oswego, IL 60543.

Excluded: All Guards and Supervisors as defined by the Act, and all other employees.",NA,41.68281,-88.35146,"Oswego, IL 60543",1,"place","TIGER/Line® dataset from the US Census Bureau","Oswego","Kendall County","IL","60543","US",1,41.7758314531254,-87.9698391670483
"25-RC-306563","Inteva Products","Region 25, Indianapolis, Indiana","Open","11/04/2022","","","Bluffton","IN","","","","",NA,NA,"International Union, United Automobile, Aerospace and Agricultural Implement Workers of America, UAW",NA,"",NA,"",NA,NA,NA,"",NA,"","","","","","",200,"","","Included: All full time and regular part time production and maintenance employees.
Excluded: All other employees including contract temporary employees, office employees, clerical employees, professional and managerial employees, guards and supervisors as defined by the act.",NA,40.71327,-85.2023,"Bluffton, IN 46714",1,"place","TIGER/Line® dataset from the US Census Bureau","Bluffton","Wells County","IN","46714","US",1,41.2128806484905,-84.987131686411
"25-RD-301657","Regional Ready Mix, LLC","Region 25, Indianapolis, Indiana","Open","08/18/2022","","","Rochelle","IL","A","Single Labor Organization","Initial","10/19/2022",27,NA,"IUOE, Local 150",7,"",NA,"",NA,1,8,"",13,"Y","","Included: All full-time and regular part-time plant operators, mechanics, concrete belt-placers, conveyor operators, loader operators, concrete pumping operators, maintenance workers, electricians, truck-drivers and oilers employed by the Employer at its facility located at 15051 E. Lind Road, Rochelle, IL 61068.

Excluded: all office clerical employees, management employees, guards and supervisors as defined in the Act, and all other employees.
","","","",13,"","","Included: FT/PT plant operators, mechanics, operators, maintenance, truck drivers

Excluded: All other employees of the company",27,42.007405,-89.100359,"Rochelle, IL 61068",1,"place","TIGER/Line® dataset from the US Census Bureau","Rochelle","Ogle County","IL","61068","US",1,41.6147956067759,-89.411759413746
"25-RD-303108","WM Transport of Indiana, LLC","Region 25, Indianapolis, Indiana","Open","09/09/2022","","","Muncie","IN","A","Single Labor Organization","Initial","10/25/2022",17,NA,"Teamsters Local 135",6,"",NA,"",NA,10,16,"",NA,"","","Included:  All full-time and regular part-time truck drivers, helpers and mechanics employed by the Employer at its Muncie, Indiana, facility.

Excluded:  All professional employees, managerial employees, office clerical employees, guards and supervisors as defined in the Act, and all other employees.
","","","",16,"","","Included: 16 Excluded: 0",17,40.142124,-85.389874,"Muncie, IN 47302",1,"place","TIGER/Line® dataset from the US Census Bureau","Muncie","Delaware County","IN","47302","US",1,39.8888302580399,-85.5180774025062
"25-RD-303156","Smithfield Direct, LLC","Region 25, Indianapolis, Indiana","Open","09/12/2022","","","Pendleton","IN","A","Single Labor Organization","Initial","11/02/2022",3,NA,"United Food and Commercial Workers, Local 700",NA,"",NA,"",NA,3,3,"",NA,"","","Included: All general workers and mechanics engaged on jobs in the Employer's Brazil, Evansville, Anderson, and South Bend, Indiana branches.

Excluded: All Route and Relief Salespersons, Branch Managers, Route Supervisors, Salaried Sales Personnel, office clerical employees, professional employees, employees specially selected by the Company who are undergoing training and instruction, and guards and supervisors as defined in the National Labor Relations Act.","","","",1,"","","Included: Direct Store Delivery-Sorting & Loading of Delivery Trucks on a daily basis

Excluded:",3,39.99754,-85.74664,"Pendleton, IN 46064",1,"place","TIGER/Line® dataset from the US Census Bureau","Pendleton","Madison County","IN","46064","US",1,40.2184551580464,-86.124140226954
"25-RD-306549","Tri-State Asphalt, LLC","Region 25, Indianapolis, Indiana","Open","11/03/2022","","","Morris","IL","","","","",NA,NA,"Teamsters Local 179",NA,"",NA,"",NA,NA,NA,"",NA,"","","","","","",14,"","","Included: Truck Drivers
Excluded: Managers and Supervisors",NA,41.337433,-88.430183,"Morris, IL 60450",1,"place","TIGER/Line® dataset from the US Census Bureau","Morris","Grundy County","IL","60450","US",1,41.087520050721,-88.9103515984712
"27-RC-279265","Hall Aluminum Products, Inc.","Region 27, Denver, Colorado","Open","06/30/2021","","","Kiowa","CO","A","Single Labor Organization","Initial","08/19/2021",37,3,"IUPAT District Council 81 - Glaziers, Architectural Metal & Glass Workers Union, Local Union No. 930, AFL-CIO",5,"",NA,"",NA,10,22,"",8,"Y","","Include: All full-time and regular part-time glaziers, architectural metal and glass workers, and industrial workers employed by the Employer on projects located in the State of Colorado. Exclude: All other employees, office clerical employees, guards, and supervisors, as defined in the Act.","","","",22,"","","Included: All Glaziers, Architectural Metal and Glass Workers, Industrial Workers within the State of Colorado.
Excluded: All other employees, guards and supervisors",37,39.370254,-104.421214,"Kiowa, CO 80117",1,"place","TIGER/Line® dataset from the US Census Bureau","Kiowa","Elbert County","CO","80117","US",1,39.3859921424215,-104.758814786239
"27-RC-283492","Staker & Parson Companies d/b/a Jack B. Parson Ready Mix Concrete","Region 27, Denver, Colorado","Open","09/24/2021","","","Draper","UT","A","Single Labor Organization","Initial","12/10/2021",266,5,"Independent Union of Concrete Handlers, Drivers and Operators",139,"",NA,"",NA,69,208,"",8,"","Independent Union of Concrete Handlers, Drivers and Operators","Include: All full-time and regular part-time Ready Mix Drivers employed by the Employer in (1) the following counties in Utah: Utah, Wasatch, Summit, Salt Lake, Tooele, Davis, Weber, Box Elder, and Cache, and (2) the following counties in Idaho: Bear Lake and Caribou. Exclude: All non-ready mix drivers, office clerical employees, managerial employees, professional employees guards, and Supervisors, as defined by the Act.","","","",220,"","Independent Union of Concrete Handlers, Drivers and Operators","Include: Ready Mix employees in Northern Utah and Southern Idaho. Exclude: office/clerical, guards, supervisors, and professional employees",266,40.506148,-111.869671,"Draper, UT 84020",1,"place","TIGER/Line® dataset from the US Census Bureau","Draper","Salt Lake County","UT","84020","US",1,40.5527674241308,-111.998672351539
"27-RC-289608","Starbucks Corporation","Region 27, Denver, Colorado","Open","01/27/2022","","","Denver","CO","A","Single Labor Organization","Initial","05/10/2022",23,NA,"Chicago and Midwest Regional Joint Board, Workers United/SEIU",13,"",NA,"",NA,NA,13,"",NA,"","Chicago and Midwest Regional Joint Board, Workers United/SEIU","Include: All full-time and regular part-time Baristas and Shift Supervisors employed by the Employer at its store No. 2946 located at 2975 E Colfax Ave., Denver, CO 80206. Exclude: Store managers, office clerical employees, guards, professional employees, and supervisors as defined in the Act.","","","",26,"","Chicago and Midwest Regional Joint Board, Workers United/SEIU","All full-time and regular part-time Baristas and Shift Supervisors.  Excluded:  Store managers, Office Clericals, Guards, Professional Employees, and Supervisors",23,39.760189,-104.996553,"Denver, CO 80202",1,"place","TIGER/Line® dataset from the US Census Bureau","Denver","Denver County","CO","80202","US",1,39.6284457204814,-104.858883680015
"27-RC-292261","Starbucks Corporation","Region 27, Denver, Colorado","Open","03/15/2022","","","Colorado Springs","CO","A","Single Labor Organization","Initial","05/19/2022",29,NA,"Chicago and Midwest Regional Joint Board, Workers United/SEIU",10,"",NA,"",NA,10,22,"",2,"Y","","Include: All full-time and regular part-time baristas and shift supervisors employed by the Employer at its Store #10897 located in Colorado Springs, CO. Exclude: All Store Managers, office clerical employees, confidential employees, managerial employees, professional employees, guards, and supervisors, as defined in the Act.","","","",27,"","","Include: All full-time and regular part-time Baristas and Shift Supervisors. Exclude: Store managers, Office Clericals, Guards, Professional Employees, and Supervisors",29,38.828893,-104.809929,"Colorado Springs, CO 80903",1,"place","TIGER/Line® dataset from the US Census Bureau","Colorado Springs","El Paso County","CO","80903","US",1,39.2108520122439,-105.220015328164
"27-RC-294161","Opus Inspection, Inc. d/b/a Air Care Colorado","Region 27, Denver, Colorado","Open","04/15/2022","","","Denver","CO","A","Single Labor Organization","Initial","08/25/2022",18,NA,"United Food and Commercial Workers International Union, AFL-CIO, Local 7",9,"",NA,"",NA,6,18,"",3,"Y","","Include:All full-time and regular part-time lane inspectors, First Assistant Managers, and 2nd Assistant Managers employed by the Employer at its facility located at 10190 East Warren Avenue, Denver, Colorado.

Exlclude: All office clerical employees, Station Administrators, Station Managers, confidential employees, professional employees, guards, and supervisors, as defined in the Act.","","","",12,"","","Included: All full-time and regular part time employees at the facility Excluded: Temporary Employees, Supervisors, Guards and Watchmen as defined by the Act.",18,39.760189,-104.996553,"Denver, CO 80202",1,"place","TIGER/Line® dataset from the US Census Bureau","Denver","Denver County","CO","80202","US",1,40.0996642170425,-104.640745439038
"27-RC-298711","Excalibur Associates, Inc.","Region 27, Denver, Colorado","Open","07/05/2022","","","Boulder","CO","","","","",NA,NA,"International Union, Security, Police and Fire Professionals of America (SPFPA)",NA,"",NA,"",NA,NA,NA,"",NA,"","","","","","",21,"","","Include: All full-time and part-time Armed Contract Security Officers (ACSO), Sergeants, Dispatchers and Shift Supervisors/Dispatch Supervisor preforming guard duties as defined in Section 9(b)(3) of the National Labor Relations Act, employed by Excalibur at 325 Broadway, Boulder, CO 80305. Exclude: All office clerical employees, managerial employees, Project Manager (PM) as defined by the Act.",NA,40.049468,-105.201421,"Boulder, CO 80301",1,"place","TIGER/Line® dataset from the US Census Bureau","Boulder","Boulder County","CO","80301","US",1,39.9079859927759,-105.558620605322
"27-RC-298866","Excalibur Associates, Inc.","Region 27, Denver, Colorado","Open","07/06/2022","","","Boulder","CO","","","","",NA,NA,"Security Officers Association of America",NA,"",NA,"",NA,NA,NA,"",NA,"","","","","","",21,"","","Include: All full-time and part-time armed and unarmed protective service officers at the Boulder, CO NIST Facility. Exclude: All other employees.",NA,40.049468,-105.201421,"Boulder, CO 80301",1,"place","TIGER/Line® dataset from the US Census Bureau","Boulder","Boulder County","CO","80301","US",1,39.8458175280128,-105.214412710799
"27-RC-299468","Clever Octopus","Region 27, Denver, Colorado","Open","07/14/2022","","","South Salt Lake","UT","","","","",NA,NA,"Salt Lake Industrial Workers of the World",NA,"",NA,"",NA,NA,NA,"",NA,"","","","","","",10,"","","Include: Admin assistants, store staff, sewing machine operators, shift leads, teachers, specialists. Exclude: Americorp volunteers.",NA,40.718835,-111.888269,"South Salt Lake, UT 84115",0.9,"place","TIGER/Line® dataset from the US Census Bureau","South Salt Lake","Salt Lake County","UT","84115","US",1,40.4575361614628,-111.583009878418
"27-RC-300485","VTCU, Corp.","Region 27, Denver, Colorado","Open","08/01/2022","","","Pocatello","ID","A","Single Labor Organization","Initial","09/28/2022",182,7,"International Union of Operating Engineers, Local 302",66,"",NA,"",NA,45,111,"",5,"","International Union of Operating Engineers, Local 302","INCLUDED: All full-time and regular part-time production and maintenance employees, including high voltage assemblers, core stackers, high voltage assembly set up employees, high voltage winders, high voltage winding set up employees, insulation cutters, welders, machine operators, final assemblers, painters, steam cleaners, sandblasters, low voltage core cutters, low voltage assemblers, low voltage core winders, maintenance helpers, maintenance mechanics, maintenance technicians, shipping clerks, receiving clerks, materials clerk, inventory control coordinator, utility workers, materials expediter, tanking techs, and continuous improvement techs, employed by the Employer at its Pocatello, Idaho facility. 

EXCLUDED: All temporary employees, clerical employees, professional employees, test technicians, quality control technicians, HVA techs, guards and supervisors as defined in the Act.","","","",192,"","International Union of Operating Engineers, Local 302","Include:  All full-time and regular part-time production and maintenance employees, including high voltage assemblers, core stackers, high voltage assembly set up employees, high voltage winders, high voltage
winding set up employees, insulation cutters, welders, machine operators, final assemblers, painters,steam cleaners, sandblasters, low voltage core cutters, low voltage assemblers, low voltage core winders, maintenance helpers, maintenance mechanics, maintenance technicians, shipping clerks, receiving clerks, materials clerk, the inventory control coordinator, utility workers, the materials expediter and all Continuous improvement techs and Quality Controls Tech, employed by the employer at its Pocatello Idaho facility.
Exclude:All temporary employees, clerical employees, test techs and guards,professional employees and supervisors as defined in the Act.

",182,42.904933,-112.380079,"Pocatello, ID 83201",1,"place","TIGER/Line® dataset from the US Census Bureau","Pocatello","Bannock County","ID","83201","US",1,42.6318362630138,-112.489855830068
"27-RC-303795","Proximo Distillers, LLC d/b/a Stranahan's Colorado Whiskey","Region 27, Denver, Colorado","Open","09/21/2022","","","Denver","CO","A","Single Labor Organization","Initial","11/01/2022",16,NA,"United Food and Commercial Workers International Union, Local 7, AFL-CIO",12,"",NA,"",NA,1,14,"",1,"","United Food and Commercial Workers International Union, Local 7, AFL-CIO","Include; All full-time and regular part-time Distillers I,II, and III; Bottling Operators I, II, and III; and the Production Lead employed by the Employer at its Denver, CO facility. Exclude: All tour guides, bartenders, warehouse supervisors, production administrators, maintenance technicians, bottling managers, production supervisors, office clerical employees, professional employees, guards, and supervisors, as defined in the Act, and other employees.","","","",14,"","United Food and Commercial Workers International Union, Local 7, AFL-CIO","Included: All full-time and part-time Distillers I, II, III and Bottling Operators I, II, III employed at the 200 S. Kalamath facility. Excluded: All Tour Guides, Bartenders, Warehouse Supervisors, Production Leads, Production Administrators, Maintenance Technicians, Bottling Managers, Production Supervisors, office and clerical employees, watchmen, guards and professional employees and supervisors as defined in the National Labor Relations Act, as amended, and all other employees.",16,39.760189,-104.996553,"Denver, CO 80202",1,"place","TIGER/Line® dataset from the US Census Bureau","Denver","Denver County","CO","80202","US",1,40.033340349742,-104.601661547723
