"08-RC-306216","Ultium Cells LLC","Region 08, Cleveland, Ohio","Open","10/31/2022","","","Warren","OH","","","","",NA,NA,"International Union, United Automobile, Aerospace and Agricultural Implement Workers of  America, UAW",NA,"",NA,"",NA,NA,NA,"",NA,"","","","","","",900,"","","Included:
All full-time and regular part-time and maintenance employees, including, but not limited to, the following department/teams: Mixing, Coating, Roll Press, Notch & Dry, Lamination and Stack, Packaging, Jig, Gas/Degas, Charge/Discharge, End of Line, Material Handlers, Quality Inspectors, Production Maintenance, HVAC, Boilers, Electricians, Industrial Maintenance Tech, Machinist, Production Technician Leaders/Crew Leaders employed by Ultium Cells at its facility in Warren, Ohio

Excluded:
Office clerical, professionals, guards, and supervisors as defined by the Act. 
",NA,41.176641,-80.902344,"Warren, OH 44481",1,"place","TIGER/Line® dataset from the US Census Bureau","Warren","Trumbull County","OH","44481","US",1,41.0595072228771,-80.9092624647873
"08-RC-306613","Mercy Health-Lorain Hospital","Region 08, Cleveland, Ohio","Open","11/03/2022","","","Lorain","OH","","","","",NA,NA,"Ohio Patrolmen's Benevolent Association",NA,"",NA,"",NA,NA,NA,"",NA,"","","","","","",13,"","","Included: Police Officers and Security Officers Excluded: All others",NA,41.450991,-82.166534,"Lorain, OH 44052",1,"place","TIGER/Line® dataset from the US Census Bureau","Lorain","Lorain County","OH","44052","US",1,41.1983813878126,-81.891455513116
"08-RD-300406","South Shore Cable Construction, Inc.","Region 08, Cleveland, Ohio","Open","07/28/2022","","","Cleveland","OH","A","Single Labor Organization","Initial","10/06/2022",NA,NA,"Communications Workers of America, Local 4340",NA,"",NA,"",NA,NA,NA,"",NA,"","","All employees in the following classifications employed by the Employer at its facilities located at 6400 Kolthoff Drive, Brook Park, Ohio and 8879 Basil Western Rd. Canal Winshester, Ohio, Crew Foreman, Underground Drop Bury Foreman, Equipment Operator, Cable Splicer/Maintenance Technician, Lineman/Wirepuller, Installer/Service Technician, Labor/Groundsman, Warehouse/Delivery, and Clerk; excluding all office clerical employees, professional employees, and supervisors as defined in the Act. 
","","","",60,"","","Included: Field work force. Excluded: Management, supervisor and office staff.",NA,41.489381,-81.667486,"Cleveland, OH 44101",1,"place","TIGER/Line® dataset from the US Census Bureau","Cleveland","Cuyahoga County","OH","44101","US",1,41.6839035836243,-82.0950023200218
"08-RD-301382","Oakwood Management Group, LLC d/b/a Lost Creek Healthcare and Rehabilitation","Region 08, Cleveland, Ohio","Open","08/15/2022","","","Lima","OH","","","","",NA,NA,"Service Employees International Union District 1199",NA,"",NA,"",NA,NA,NA,"",NA,"","","","","","",27,"","","All full time and regular part-time service and maintenance employees including licensed practical nurses, state-tested nursing assistants, cooks, dietary aids, housekeeping aids, laundry aids, maintenance aids, activity aids employed at the Employer’s Lima, Ohio facility.  
Excluded: 
All registered nurses, department heads, office clerical employees, professional employees, guards and supervisors as defined by the Act.",NA,40.772147,-84.0471,"Lima, OH 45801",1,"place","TIGER/Line® dataset from the US Census Bureau","Lima","Allen County","OH","45801","US",1,40.5416788253245,-83.8078854739763
"08-UD-300966","OmniSource LLC","Region 08, Cleveland, Ohio","Open","08/08/2022","","","Toledo","OH","A","UD","Initial","10/20/2022",9,NA,"Teamsters Local 20",4,"",NA,"",NA,2,6,"",NA,"","","All of the Company's drivers and full-time truck maintenance and box repair employees employed at the Company's facility at 5159 N. Detroit Ave., Toledo, Ohio, but excluding office and clerical employees, professional employees, research and development employees, engineering employees, seasonal employees, technical employees, guards, foremen, dispatchers and supervisory employees, as defined in the National Labor Relations Act, as amended.
","","","",9,"","","Included:  All drivers, full time truck maintenance and box repair
Excluded:  Office, supervisors, managers.",9,41.720684,-83.569359,"Toledo, OH 43601",1,"place","TIGER/Line® dataset from the US Census Bureau","Toledo","Lucas County","OH","43601","US",1,41.5831897104509,-83.6437383577422
"09-RC-270027","Solstice Sleep Products, Inc.","Region 09, Cincinnati, Ohio","Open","12/09/2020","","","Columbus","OH","A","Single Labor Organization","Initial","03/03/2021",88,4,"United Food and Commercial Workers Union, Local No. 1059",4,"",NA,"",NA,36,40,"",10,"","","All full-time and regular part-time furniture manufacturing employees, including shipping department employees and lead employees employed by the Employer at its facility located at 3720 West Broad Street, Columbus, Ohio 43228, but excluding all seasonal employees, temporary employees, managerial employees, professional employees, office clerical employees, confidential employees, sales representative employees, purchaser employees, customer service employees, maintenance employees, guards and supervisors as defined in the Act.","","","",85,"","","Included:  All full-time and part-time furniture manufacturing employees employed by the Employer at the above location.  

Excluded:  All seasonal, temporary, managerial, clerical and confidential personnel, sales representatives, purchasers, customer service personnel, maintenance employees, guards and supervisors as defined in the Act.",88,40.100924,-83.013402,"Columbus, OH 43085",1,"place","TIGER/Line® dataset from the US Census Bureau","Columbus","Franklin County","OH","43085","US",1,40.5672695076516,-83.2200457073518
"09-RC-297839","HERCULES INTERNATIONAL, INC.","Region 09, Cincinnati, Ohio","Open","06/17/2022","","","Huntington","WV","A","Single Labor Organization","Initial","07/21/2022",24,NA,"United Steel, Paper and Forestry, Rubber, Manufacturing, Energy, Allied Industrial & Service Workers International Union, AFL-CIO, CLC",12,"",NA,"",NA,10,22,"",2,"Y","","All full-time and regular part-time production, maintenance and shipping employees employed by the Employer at its facility located at 6060 Kyle Lane, Route 2 North, Huntington, West Virginia; excluding all temporary employees, managerial employees, office clerical employees, professional employees, guards and supervisors as defined in the Act.","","","",27,"","","Included:  All full-time and regular part-time production and maintenance employees at the Employer's facility in Huntington, WV.

Excluded:  All temporary employees, office clericals, managerial and professional employees, guards and supervisors as defined in the Act.
",24,38.371727,-82.412866,"Huntington, WV 25701",1,"place","TIGER/Line® dataset from the US Census Bureau","Huntington","Cabell County","WV","25701","US",1,38.4112616004516,-81.9464528739057
"09-RC-301758","BLUE RIBBON PLUMBING, INC., D/B/A WORKMAN & SONS PLUMBING","Region 09, Cincinnati, Ohio","Open","08/19/2022","","","Ashland","KY","A","Single Labor Organization","Initial","09/16/2022",12,NA,"United Association of Journeymen and Apprentices of the Plumbing and Pipefitting Industry of the United States and Canada, AFL-CIO, Plumbers and Steamfitters Local 248",NA,"",NA,"",NA,12,12,"",NA,"","","All full-time and regular part-time plumbers and helpers employed by the Employer at its facility located at 35555 Workman Road, Ashland, Kentucky; excluding shop employees, estimators, managers, office clerical employees, professional employees, guards and supervisors as defined in the Act and all other employees.","","","",12,"","","Included:  All full time and regular part-time plumbers and helpers employed by the Employer.

Excluded:  All other employees, including shop employees, estimators, office clerical employees, supervisors,
guards and managers as defined by the Act.",12,38.473824,-82.647933,"Ashland, KY 41101",1,"place","TIGER/Line® dataset from the US Census Bureau","Ashland","Boyd County","KY","41101","US",1,38.7474046817655,-82.7290530025491
"09-RC-302335","THE COURIER-JOURNAL, INC.","Region 09, Cincinnati, Ohio","Open","08/30/2022","","","Louisville","KY","","","","",NA,NA,"Indianapolis NewsGuild, TNG-CWA Local 34070",NA,"",NA,"",NA,NA,NA,"",NA,"","","","","","",35,"","","Included:  All full-time and regular part-time newsroom employees of the Employer.

Excluded:  All other employees, including managers, guards, and supervisors as defined by the Act.",NA,38.25247,-85.753812,"Louisville, KY 40202",1,"place","TIGER/Line® dataset from the US Census Bureau","Louisville","Jefferson County","KY","40202","US",1,38.4171085798231,-86.0099098524853
"09-RC-303303","DHL EXPRESS","Region 09, Cincinnati, Ohio","Open","09/13/2022","","","Erlanger","KY","","","","",NA,NA,"Teamsters Local Union No. 100",NA,"",NA,"",NA,NA,NA,"",NA,"","","","","","",900,"","","Included: All full-time and regular part-time employees at the Company's CVG Global Hub in the job positions of ramp agents and of tug operators working under the tug dispatch department. 

Excluded: All drivers, sort employees, clerical workers, employees covered by the Railway Labor Act, guards and supervisors as defined by the Act, and all other employees.",NA,39.019684,-84.591389,"Erlanger, KY 41018",1,"place","TIGER/Line® dataset from the US Census Bureau","Erlanger","Kenton County","KY","41018","US",1,39.2461510701697,-85.0459273870136
"09-RC-303946","SUNERGOS COFFEE","Region 09, Cincinnati, Ohio","Open","09/23/2022","","","Louisville","KY","","","","",NA,NA,"National Conference of Firemen & Oilers, 32BJ SEIU",NA,"",NA,"",NA,NA,NA,"",NA,"","","","","","",35,"","","Included: All hourly baristas and shift leads employed at 2122 S. Preston St; 306 West Woodlawn; 232 S. 5th St; 1647 Norris Place.  

Excluded: All managers, bakery staff, wholesale distribution staff, office and clerical staff.",NA,38.25247,-85.753812,"Louisville, KY 40202",1,"place","TIGER/Line® dataset from the US Census Bureau","Louisville","Jefferson County","KY","40202","US",1,37.7675136835829,-85.3921644483535
"09-RC-304309","TP MECHANICAL CONTRACTORS, LLC","Region 09, Cincinnati, Ohio","Open","09/29/2022","","","Dayton","OH","","","","",NA,NA,"Road Sprinkler Fitters Local 669",NA,"",NA,"",NA,NA,NA,"",NA,"","","","","","",4,"","","Included:  All full time and regular part time Sprinkler Fitters and Sprinkler Fitter Helpers employed by TP Mechanical
at its Dayton, Ohio location.

Excluded:  All other employees, clericals, professionals, guards, managers and supervisors as defined by the Act.",NA,39.750471,-84.268593,"Dayton, OH 45401",1,"place","TIGER/Line® dataset from the US Census Bureau","Dayton","Montgomery County","OH","45401","US",1,39.4992101172908,-84.3706716494482
"09-RC-305269","BROWN-FORMAN CORPORATION D/B/A WOODFORD RESERVE DISTILLERY","Region 09, Cincinnati, Ohio","Open","10/14/2022","","","Versailles","KY","","","","",NA,NA,"International Brotherhood of Teamsters (IBT), Local 651",NA,"",NA,"",NA,NA,NA,"",NA,"","","","","","",63,"","","Included:  All hourly employees to include:  bottling, distillery, processing/regauge/wh, logistics.

Excluded:  All maintenance, clerical, adm and salaried employees as defined by the Act.",NA,37.998762,-84.737666,"Versailles, KY 40383",1,"place","TIGER/Line® dataset from the US Census Bureau","Versailles","Woodford County","KY","40383","US",1,37.6638789478428,-84.8744701126989
"09-RC-305322","VALIANT GOVERNMENT SERVICES, LLC","Region 09, Cincinnati, Ohio","Open","10/17/2022","","","Wright-Patterson AFB","OH","","","","",NA,NA,"International Association of Machinists and Aerospace Workers, AFL-CIO (IAM) District 34",NA,"",NA,"",NA,NA,NA,"",NA,"","","","","","",27,"","","Included:  All full-time and part-time hourly employees - HVAC techs, electricians, leads, adn.

Excluded:  Professional, management and security guard.",NA,39.815581,-84.040333,"Wright Ave, Dayton, OH 45433",0.9,"street_center","TIGER/Line® dataset from the US Census Bureau","Dayton","Greene County","OH","45433","US",1,39.3259615412073,-83.8061884639202
"09-RC-305538","GANNETT MEDIA CORP.","Region 09, Cincinnati, Ohio","Open","10/20/2022","","","Louisville","KY","","","","",NA,NA,"Indianapolis NewsGuild, Communication Workers of America Local 34070(TNG-CWA), AFL-CIO",NA,"",NA,"",NA,NA,NA,"",NA,"","","","","","",14,"","","Included:  All full-time and regular part-time employees of the Employer.

Excluded:  All other employees, including managers, guards, supervisors, and confidential employees as defined by the Act.",NA,38.25247,-85.753812,"Louisville, KY 40202",1,"place","TIGER/Line® dataset from the US Census Bureau","Louisville","Jefferson County","KY","40202","US",1,38.7267496530481,-86.2125302125542
"09-RC-306658","STARBUCKS CORPORATION","Region 09, Cincinnati, Ohio","Open","11/07/2022","","","Columbus","OH","","","","",NA,NA,"Chicago & Midwest Regional Joint Board, an Affiliate of Workers United SEIU",NA,"",NA,"",NA,NA,NA,"",NA,"","","","","","",43,"","","Included:  All full-time and regular part-time Baristas and Shift Supervisors.

Excluded:  Store Managers, Office Clericals, Guards, Professional Employees and Supervisors.",NA,40.100924,-83.013402,"Columbus, OH 43085",1,"place","TIGER/Line® dataset from the US Census Bureau","Columbus","Franklin County","OH","43085","US",1,40.2846636714836,-83.1802981239047
"09-RD-200329","LEGGETT & PLATT, INC.","Region 09, Cincinnati, Ohio","Open","06/09/2017","","","Winchester","KY","","","","",NA,NA,"International Association of Machinists and Aerospace Workers, AFL-CIO (IAM), Local 619",NA,"",NA,"",NA,NA,NA,"",NA,"","","","","","",50,"","","Included:  Production & Maintenance employees at the New St. and Ecton Rd., Winchester, KY facility including inspectors and shipping and receiving employees.

Excluded:  Over the road drivers, office clerical emplooyees, quality auditors, inventory control employees, parts attendants, guards, professional employees, and supervisors.",NA,37.964922,-84.160724,"Winchester, KY 40391",1,"place","TIGER/Line® dataset from the US Census Bureau","Winchester","Clark County","KY","40391","US",1,38.1134548846611,-84.5467232746729
"10-RC-269250","AMAZON.COM SERVICES LLC","Region 10, Atlanta, Georgia","Open","11/20/2020","","","Bessemer","AL","A","Single Labor Organization","Rerun","03/31/2022",6153,59,"Retail, Wholesale, and Department Store, Local 932",875,"",NA,"",NA,993,1868,"",416,"Y","","","","","",1500,"","","Included: All hourly full-time and regular part-time fulfillment center employees including leads and
learning ambassadors.

Excluded: All truck drivers, seasonal employees, temporary employees, clerical employees, professional
employees, managerial employees, engineering employees, maintenance employees, robotics
employees, information technology employees and all supervisors as defined by the Act.",5867,33.402429,-86.951784,"Bessemer, AL 35020",1,"place","TIGER/Line® dataset from the US Census Bureau","Bessemer","Jefferson County","AL","35020","US",1,32.9847777918824,-86.8631234517917
"10-RC-273024","Nissan North America, Inc.","Region 10, Atlanta, Georgia","Open","02/19/2021","","","Smyrna","TN","","","","",NA,NA,"International Association of Machinists and Aerospace Workers, (IAM) District Lodge 1888",NA,"",NA,"",NA,NA,NA,"",NA,"","","","","","",87,"","","",NA,35.959541,-86.53159,"Smyrna, TN 37167",1,"place","TIGER/Line® dataset from the US Census Bureau","Smyrna","Rutherford County","TN","37167","US",1,36.2790223767914,-86.6893270278537
"10-RC-276292","The Atlanta Opera, Inc.","Region 10, Atlanta, Georgia","Open","04/28/2021","","","Atlanta","GA","","","","",NA,NA,"Make-Up Artists and Hair Stylists Union, Local 798, IATSE",NA,"",NA,"",NA,NA,NA,"",NA,"","","","","","",16,"","","Included: All Make-Up Artists and Hair Stylists employed by the Employer. Excluded: All other employees, including all clerical workers, managers, guards, and supervisors as defined by the Act.",NA,33.844371,-84.47405,"Atlanta, GA 30301",1,"place","TIGER/Line® dataset from the US Census Bureau","Atlanta","Fulton County","GA","30301","US",1,33.7612915757789,-84.1298079801884
"10-RC-279259","Garten Trucking Lc","Region 10, Atlanta, Georgia","Open","06/30/2021","","","Covington","VA","A","Single Labor Organization","Initial","08/06/2021",110,1,"Association of Western Pulp and Paper Workers",30,"",NA,"",NA,65,95,"",2,"","","All regular full-time and part-time truck drivers, maintenance, truck wash, and dispatch employees employed by the Employer at its facilities in Alleghany County, Virginia; but excluding all temporary employees, guards, managers, and supervisors as defined by the Act.","","","",104,"","","Included: All full time and part time truck drivers, Maintenance, truck wash and Dispatch employees. 

Excluded: All temporary employees, guards, and supervisors as defined by the Act.",110,37.780216,-79.986963,"Covington, VA 24426",1,"place","TIGER/Line® dataset from the US Census Bureau","Covington","Covington City","VA","24426","US",1,38.079168153651,-79.7417271722485
"10-RC-294270","Engert, LLC","Region 10, Atlanta, Georgia","Open","04/19/2022","","","Knoxville","TN","A","Single Labor Organization","Initial","07/25/2022",63,1,"Plumbers and Pipefitters UA Local 102",16,"",NA,"",NA,33,49,"",5,"","","All full-time and regular part-time pipefitters, welders, plumbers, HVAC service technicians, plumber service technicians, and plumber and pipefitter apprentices employed by the Employer out of its Knoxville, Tennessee facility.","","","",35,"","","Included:  All full-time and regular part-time pipefitters, welders, plumbers, HVAC service technicians, plumber service technicians and plumber and pipefitter apprentices employed by the Employer out of its Knoxville, Tennessee facility.  

Excluded:  All other employees, office clerical employees, professional employees, guards, and supervisors as defined by the National Labor Relations Act.",63,36.032334,-83.884804,"Knoxville, TN 37901",1,"place","TIGER/Line® dataset from the US Census Bureau","Knoxville","Knox County","TN","37901","US",1,35.5550384119965,-84.2942787479539
"10-RC-296248","US Foods Inc.","Region 10, Atlanta, Georgia","Open","05/23/2022","","","Charlotte","NC","A","Single Labor Organization","Initial","10/13/2022",61,NA,"International Brotherhood of Teamsters (Locals 71, 171, and 509)",28,"",NA,"",NA,24,52,"",2,"","Teamsters Local Union Numbers 71, 171, And 509, Affiliated with International Brotherhood of Teamsters","Included:  All full-time and regular part-time drivers, who receive loads from the Employer’s Charlotte, North Carolina distribution center located at 7801 Statesville Road, employed by the Employer at its locations in Norcross, Georgia; Statesville, North Carolina; Columbia/Lexington, South Carolina; Florence, South Carolina; Greenville, South Carolina; Hardeeville, South Carolina/Savannah, Georgia; Myrtle Beach, South Carolina; Walterboro, South Carolina; Dandridge, Tennessee; Charlottesville, Virginia; and Petersburg, Virginia; who were employed by the Employer during the payroll period ending August 27, 2022.

Excluded:  All other employees, including managerial employees, office clerical employees, temporary employees, and guards and supervisors as defined by the Act.
","","","",22,"","Teamsters Local Union Numbers 71, 171, And 509, Affiliated with International Brotherhood of Teamsters","Included:  All Drivers with work dispatched out of Charlotte facility at the following locations:  Statesville, NC, Charlottesville, VA, Columbia/Lexington, SC, Florence, SC, Myrtle Beach, SC, Hardeeville, SC, and Savannah, GA.

Excluded:  Supervisors, Managers, Maintenance, warehouse, Clerical/Office, and all non-drivers.",61,35.26002,-80.804151,"Charlotte, NC 28201",1,"place","TIGER/Line® dataset from the US Census Bureau","Charlotte","Mecklenburg County","NC","28201","US",1,35.1546095328652,-80.9609929102114
"10-RC-297006","Starbucks Corporation","Region 10, Atlanta, Georgia","Open","06/06/2022","","","Scottsboro","AL","A","Revised Single Labor Org","Initial","10/31/2022",NA,NA,"Workers United, Southern Regional Joint Board a/w Service Employees International Union",9,"",NA,"",NA,8,17,"",3,"Y","Workers United, Southern Regional Joint Board","Included:  All full-time and regular part-time baristas and shift supervisors employed by the Employer at its Store 66182, located at 23029 John T. Reid Pkwy, Scottsboro, Alabama.

Excluded:  Office clerical employees, professional employees, guards, and supervisors as defined in the Act.","","","",29,"","","Included:  All full-time and regular part-time Baristas, Shift Supervisors, Asst Store Managers.

Excluded:  Store Managers, office clericals, guards and supervisors as defined by the Act.",23,34.750724,-86.142151,"Scottsboro, AL 35768",1,"place","TIGER/Line® dataset from the US Census Bureau","Scottsboro","Jackson County","AL","35768","US",1,34.9376388730766,-85.6682487095459
"10-RC-297834","Siebel OCP Shakeout Test Employer","Region 10, Atlanta, Georgia","Open","06/19/2022","","","Atlanta","GA","A","Single Labor Organization","Initial","06/14/2022",102,1,"",52,"",NA,"",NA,49,101,"",NA,"","Siebel OCP Shakeout Test Employer","","","","",NA,"","","",NA,33.844371,-84.47405,"Atlanta, GA 30301",1,"place","TIGER/Line® dataset from the US Census Bureau","Atlanta","Cobb County","GA","30301","US",1,34.2754458393182,-84.372896429307
"10-RC-301757","Environmental Air Systems LLC","Region 10, Atlanta, Georgia","Open","08/19/2022","","","High Point","NC","","","","",NA,NA,"Plumbers and Pipefitters Local 421",NA,"",NA,"",NA,NA,NA,"",NA,"","","","","","",37,"","","Included:  All full time and regular part time employees in the Sub-Assembly Pipe Department employed by the Employer at its facility located at 250 Swathmore Ave, High Point, NC 27263;

Excluded: All other employees, managers, office clericals, guards and supervisors as defined
in the Act.",NA,35.954467,-79.987882,"High Point, NC 27260",1,"place","TIGER/Line® dataset from the US Census Bureau","High Point","Guilford County","NC","27260","US",1,36.3901843754834,-80.3303479424927
"10-RC-303082","McKay Books, Incorporated","Region 10, Atlanta, Georgia","Open","09/12/2022","","","Knoxville","TN","","","","",NA,NA,"Communications Workers of America",NA,"",NA,"",NA,NA,NA,"",NA,"","","","","","",61,"","","Included: All employees of the 230 Papermill Place Way, Knoxville, TN Store 

Excluded: General Mgrs., Managers, Assistant Mgrs., Office Mgrs., Guards and Supervisors",NA,36.032334,-83.884804,"Knoxville, TN 37901",1,"place","TIGER/Line® dataset from the US Census Bureau","Knoxville","Knox County","TN","37901","US",1,36.1422307250437,-84.0654903190141
"10-RC-303601","North Alabama Electric Cooperative","Region 10, Atlanta, Georgia","Open","09/16/2022","","","Stevenson","AL","","","","",NA,NA,"Grant Rains IBEW Local 175",NA,"",NA,"",NA,NA,NA,"",NA,"","","","","","",8,"","","Included: This petition seeks a self-determination election for the presently unrepresented all full-time and regular part-time Fiber Lineman Technicians, Fiber Technicians, and Fiber Installers and Repair at the North Alabama Electric Cooperative, Stevenson, AL. facilities, and to be included in the current unit and collective bargaining agreement dated the 1st day of October 2021 between the North Alabama Electric Cooperative and Local Union No. 175 of the International Brotherhood of Electrical Workers. 

Excluded: All other employees, clerical, confidential employees, guards, and supervisors as defined by the act.",NA,34.856233,-85.871317,"Stevenson, AL 35772",1,"place","TIGER/Line® dataset from the US Census Bureau","Stevenson","Jackson County","AL","35772","US",1,34.7931986299241,-86.044204848923
"10-RC-304076","Chenega Global Protection, LLC","Region 10, Atlanta, Georgia","Open","09/27/2022","","","Atlanta","GA","","","","",NA,NA,"United Federation LEOS-PBA Law Enforcement Officers Security & Police Benevolent Association",NA,"",NA,"",NA,NA,NA,"",NA,"","","","","","",19,"","","Included: All full-time and regular part-time Lead Officers, performing guard duties as defined in section 9(b)(3) of the National Labor Relations Act, employed by Chenega Global Protection, LLC @ various locations in Georgia as noted in 11D Excluded: All office clerical employees, professional employees, and 2/11 supervisors as defined by the Act.",NA,33.844371,-84.47405,"Atlanta, GA 30301",1,"place","TIGER/Line® dataset from the US Census Bureau","Atlanta","Cobb County","GA","30301","US",1,34.0545735875356,-84.1811254354354
"10-RC-304155","JetStream Ground Services, Inc.","Region 10, Atlanta, Georgia","Open","09/27/2022","","","Charlotte","NC","","","","",NA,NA,"International Association of Machinists and Aerospace Workers, AFL-CIO",NA,"",NA,"",NA,NA,NA,"",NA,"","","","","","",475,"","","Included:  All full time and regular part time employees performing aircraft cleaning, cargo, mail handling, and ramp handling services including, without limitation, employees classified as Cabin Cleaner, Cargo Agent, and Ramp Operations Agent.

Excluded:  Professional, office clerical, and managerial employees, guards, supervisors as defined in the Act.",NA,35.26002,-80.804151,"Charlotte, NC 28201",1,"place","TIGER/Line® dataset from the US Census Bureau","Charlotte","Mecklenburg County","NC","28201","US",1,35.0286550001022,-80.853617494238
