"07-RC-324672","Region 07, Detroit, Michigan","Edustaff, LLC","Open","08/25/2023","","","Mattawan","MI",40,"","","Included: Paraprofessionals Excluded: Substitute Paraprofessionals",NA,NA,NA,NA,NA,NA,NA,NA,NA,NA,NA,NA,NA,NA,NA,NA,NA,NA,NA,NA,NA,NA,"Michigan Education Association (MEA)"
"07-RD-282049","Region 07, Detroit, Michigan","Maple-Drake Real Estate, LLC d/b/a Notting Hill of West Bloomfield","Open","08/26/2021","","","West Bloomfield","MI",49,"","SEIU Healthcare of Michigan","Included: CNA, Kitchen, Laundry department, activities.  Excluded:  All other Employee's.",46,"A","Single Labor Organization","Initial","11/29/2021",46,4,12,"",NA,"",NA,9,21,"",3,"Y","SEIU Healthcare of Michigan","All full-time and regular part-time CNA employees, housekeeping employees, laundry employees, 
dietary aide employees, restorative aide employees, culinary aide employees, dietary cook employees,
activities aide employees, medical records employees, guest services employees and ward clerk
employees employed by the Employer at its facility located at 6535 Drake Road, West Bloomfield
Township, Michigan; but excluding all business officers, managers, dining room manages, managerial
employees, confidential employees, technical employees, professional employees, office personnel
employees, LPNs, RNs, executive chefs, registered dieticians, receptionists, casual employees, drivers,
social service employees, payroll employees, account management staff employees, central supply
employees, scheduler employees, maintenance employees, and guards and supervisors as defined in the
Act.
","","","","SEIU Healthcare Michigan"
"07-RD-282049","Region 07, Detroit, Michigan","Maple-Drake Real Estate, LLC d/b/a Notting Hill of West Bloomfield","Open","08/26/2021",NA,NA,"West Bloomfield","MI",49,NA,"SEIU Healthcare of Michigan","Included: CNA, Kitchen, Laundry department, activities.  Excluded:  All other Employee's.",46,NA,NA,NA,NA,NA,NA,NA,NA,NA,NA,NA,NA,NA,NA,NA,NA,NA,NA,NA,NA,NA,"SEIU Healthcare Michigan"
"07-RD-323100","Region 07, Detroit, Michigan","Trinity Health Grand Haven Hospital","Open","08/01/2023","","","Grand Haven","MI",181,"","","Included: All Employees assumed to be represented by SEIU Healthcare Michigan

Excluded: Managers, Salaried Employees and Nursing Staff",NA,NA,NA,NA,NA,NA,NA,NA,NA,NA,NA,NA,NA,NA,NA,NA,NA,NA,NA,NA,NA,NA,"SEIU Healthcare Michigan"
"08-RC-284759","Region 08, Cleveland, Ohio","Kenyon College","Open","10/18/2021","","","Gambier","OH",600,"","","Included: All student employees of Kenyon College
Excluded: All managerial employees, guards, professional employees and supervisors as defined by the Act, and all other employees",NA,NA,NA,NA,NA,NA,NA,NA,NA,NA,NA,NA,NA,NA,NA,NA,NA,NA,NA,NA,NA,NA,"United Electrical, Radio and Machine Workers of America (UE)"
"08-RC-295583","Region 08, Cleveland, Ohio","Trane Technologies Company LLC","Open","05/11/2022","","","Valley View","OH",39,"","","All full-time and regular part-time journeyperson and apprentice contracting install technicians, field service technicians, service technician team leaders, contracting control technicians, and service control technicians employed by the Employer at its Valley View, Ohio facility; excluding all other employees, office clerical employees, professional employees, guards and supervisors as defined by the Act.",34,"A","Single Labor Organization","Initial","07/12/2022",34,NA,11,"",NA,"",NA,19,30,"",3,"","","All full-time and regular part-time journeyperson and apprentice Contracting Install Technicians, HVAC Service Technicians, and HVAC Service Technician Leads employed by the Employer at its 9555 Rockside Road, Valley View, Ohio 44125 location; excluding all other employees, office clerical employees, professional employees, guards, and supervisors as defined in the Act.
Others Permitted to Vote:
The parties have agreed that the Contracting Install Technician Lead and the Contracting Install Project Specialist may vote in the election, but their ballots will be challenged since their eligibility has not been resolved.  No decision has been made regarding whether the individuals in the Contracting Install Technician Lead and the Contracting Install Project Specialist classifications are included in, or excluded from, the bargaining unit.  The eligibility or inclusion of these individuals will be resolved, if necessary, following the election. 
","","","","Pipefitters Local 120"
"08-RC-295583","Region 08, Cleveland, Ohio","Trane Technologies Company LLC","Open","05/11/2022",NA,NA,"Valley View","OH",39,NA,"","All full-time and regular part-time journeyperson and apprentice contracting install technicians, field service technicians, service technician team leaders, contracting control technicians, and service control technicians employed by the Employer at its Valley View, Ohio facility; excluding all other employees, office clerical employees, professional employees, guards and supervisors as defined by the Act.",34,NA,NA,NA,NA,NA,NA,NA,NA,NA,NA,NA,NA,NA,NA,NA,NA,NA,NA,NA,NA,NA,"Pipefitters Local 120"
"08-RC-310348","Region 08, Cleveland, Ohio","Total Line Refrigeration, Inc.","Open","01/13/2023","","","Avon Lake","OH",16,"","","Included: All full-time and regular part-time HVAC refrigeration installation employees employed by the Employer at its 33530 Pin Oak Parkway, Avon Lake, Ohio facility. Excluded: All other employees, office clerical employees, managerial employees, guards and supervisors as defined by the Act.",NA,NA,NA,NA,NA,NA,NA,NA,NA,NA,NA,NA,NA,NA,NA,NA,NA,NA,NA,NA,NA,NA,"Plumbers and Steamfitters Local 42"
"08-RC-320022","Region 08, Cleveland, Ohio","Easter's Plumbing, LLC","Open","06/14/2023","","","Martin","OH",4,"","","All full-time and regular part-time plumbers and their helpers employed by Easter’s 
Plumbing, LLC out of its 5418 N Elliston-Trowbridge Road, Martin, OH facility; all other employees, managers, office clericals, professionals, guards, and 
supervisors as defined in the Act.",4,"A","Single Labor Organization","Initial","07/31/2023",4,NA,1,"",NA,"",NA,3,4,"",NA,"","","All full-time and regular part-time plumbers and helpers employed by the Employer out of
its 5418 N. Elliston-Trowbridge Road, Martin, Ohio facility; excluding all other employees,
managers, office clerical employees, professional employees, guards, and supervisors as
defined in the Act.","","","","Plumbers, Steamfitters, and Service Mechanics Local Union 50"
"08-RC-320022","Region 08, Cleveland, Ohio","Easter's Plumbing, LLC","Open","06/14/2023",NA,NA,"Martin","OH",4,NA,"","All full-time and regular part-time plumbers and their helpers employed by Easter’s 
Plumbing, LLC out of its 5418 N Elliston-Trowbridge Road, Martin, OH facility; all other employees, managers, office clericals, professionals, guards, and 
supervisors as defined in the Act.",NA,NA,NA,NA,NA,NA,NA,NA,NA,NA,NA,NA,NA,NA,NA,NA,NA,NA,NA,NA,NA,NA,"Plumbers, Steamfitters, and Service Mechanics Local Union 50"
"08-RC-320753","Region 08, Cleveland, Ohio","Momentive Performance Materials Quartz, Inc. d/b/a Momentive Technologies","Open","06/27/2023","","","Strongsville","OH",115,"","","All regular full-time and regular part-time production and maintenance employees; all office clerical employees, managerial employees, confidential employees, guards, and supervisors as defined under the National Labor Relations Act.",112,"A","Single Labor Organization","Initial","08/18/2023",112,NA,47,"",NA,"",NA,48,95,"",15,"Y","","All full-time and regular part-time production and maintenance employees, including Material Handlers and CAD/PDM Systems Administrators, employed by the Employer at its Strongsville, Ohio facility, but excluding all other employees, R&D Technicians, temporary employees, office clerical employees, professional employees, managerial employees, guards, and supervisors as defined by the Act.","","","","IUE-CWA"
"08-RC-320753","Region 08, Cleveland, Ohio","Momentive Performance Materials Quartz, Inc. d/b/a Momentive Technologies","Open","06/27/2023","","","Strongsville","OH",115,NA,"","All regular full-time and regular part-time production and maintenance employees; all office clerical employees, managerial employees, confidential employees, guards, and supervisors as defined under the National Labor Relations Act.",NA,NA,NA,NA,NA,NA,NA,NA,NA,NA,NA,NA,NA,NA,NA,NA,NA,NA,NA,NA,NA,NA,"IUE-CWA"
"08-RC-322199","Region 08, Cleveland, Ohio","Ohio Machinery Co. d.b.a. Ohio CAT","Open","07/20/2023","","","Broadview Heights","OH",35,"","","Included: All full-time and regular part-time equipment delivery drivers working at all Ohio CAT locations in Ohio and Kentucky. Excluded: All other employees including all parts drivers, sales representatives, dispatchers, temporary employees, office clericals, guards, and supervisors as defined in the Act.",NA,NA,NA,NA,NA,NA,NA,NA,NA,NA,NA,NA,NA,NA,NA,NA,NA,NA,NA,NA,NA,NA,"International Union of Operating Engineers, Local 18"
"08-RC-323921","Region 08, Cleveland, Ohio","Half Price Books, Records, Magazine, Incorporated","Open","08/16/2023","","","Reynoldsburg","OH",14,"","","All full-time and regular part-time booksellers and shift leads; excluding all office clerical employees, gurads, managers, and supervisors as defined by the Act.",NA,NA,NA,NA,NA,NA,NA,NA,NA,NA,NA,NA,NA,NA,NA,NA,NA,NA,NA,NA,NA,NA,"United Food and Commercial Workers, Union Local 1059"
"08-RC-324382","Region 08, Cleveland, Ohio","Republic Services Vienna Junction Landfill","Open","08/22/2023","","","Toledo","OH",8,"","","Included: All full-time and regular part-time Heavy Equipment Operators, Scale Operators and Mechanics employed by the Employer at 6196 Hagman Rd., Toledo, OH 43612.  Excluded: All office clerical employees, professional employees, supervisors and guards as defined in the Act.",NA,NA,NA,NA,NA,NA,NA,NA,NA,NA,NA,NA,NA,NA,NA,NA,NA,NA,NA,NA,NA,NA,"Teamsters, Chauffeurs, Warehousemen and Helpers Local Union No. 20"
"08-RD-310824","Region 08, Cleveland, Ohio","Lutheran Hospital","Open","01/24/2023","","","Cleveland","OH",191,"","Service Employees International Union, District 1199 WV/KY/OH The Health Care and Social Service Union, CTW, CLC","Included:
All dietary employees, laundry employees, housekeeping employees, maintenance employees,
central supply employees including the technician, physical therapy assistants and aides, and
nursing service employees, including Licensed Practical Nurses, nursing department assistants
(transporters), nursing department assistant IIs, nursing department assistant IIIs, behavioral health
technicians, and division clerks.
Excluded:
All office clerical employees, dietary clerical employees, coffee shop employee, student nurses,
technical students, mail room employees, all other technical employees, orderlies, stores clerk,
stockman, driver, darkroom aide, Registered Nurses and all other professional employees, guards
and supervisors as defined in the National Labor Relations Act of 1974, as amended.",167,"A","Single Labor Organization","Initial","02/22/2023",167,1,70,"",NA,"",NA,61,131,"",1,"","Service Employees International Union, District 1199 WV/KY/OH The Health Care and Social Service Union, CTW, CLC","All dietary employees, laundry employees, housekeeping employees, maintenance employees, central supply employees including the technician, physical therapy assistants and aides, and nursing service employees, including Licensed Practical Nurses, nursing department assistants (transporters), nursing department assistant IIs, nursing department assistant IIIs, behavioral health technicians, and division clerks, but excluding all office clerical employees, dietary clerical employees, coffee shop employee, student nurses, technical students, mail room employees, all other technical employees, orderlies, stores clerk, stockman, driver, darkroom aide, Registered Nurses and all other professional employees, guards and supervisors as defined in the National Labor Relations Act of 1974, and as amended.","","","","Service Employees International Union, District 1199 WV/KY/OH, The Healthcare and Social Service Union"
"08-RD-310824","Region 08, Cleveland, Ohio","Lutheran Hospital","Open","01/24/2023",NA,NA,"Cleveland","OH",191,NA,"Service Employees International Union, District 1199 WV/KY/OH The Health Care and Social Service Union, CTW, CLC","Included:
All dietary employees, laundry employees, housekeeping employees, maintenance employees,
central supply employees including the technician, physical therapy assistants and aides, and
nursing service employees, including Licensed Practical Nurses, nursing department assistants
(transporters), nursing department assistant IIs, nursing department assistant IIIs, behavioral health
technicians, and division clerks.
Excluded:
All office clerical employees, dietary clerical employees, coffee shop employee, student nurses,
technical students, mail room employees, all other technical employees, orderlies, stores clerk,
stockman, driver, darkroom aide, Registered Nurses and all other professional employees, guards
and supervisors as defined in the National Labor Relations Act of 1974, as amended.",167,NA,NA,NA,NA,NA,NA,NA,NA,NA,NA,NA,NA,NA,NA,NA,NA,NA,NA,NA,NA,NA,"Service Employees International Union, District 1199 WV/KY/OH, The Healthcare and Social Service Union"
"08-RD-313294","Region 08, Cleveland, Ohio","Northern Management & Leasing, Inc. d/b/a Statewide Express","Open","03/03/2023","","","Cleveland","OH",16,"","","Included: All full-time and regular part-time drivers

Excluded: All professional employees, guards, managers, and supervisors as defined by the Act.",17,"A","Single Labor Organization","Initial","04/11/2023",17,NA,7,"",NA,"",NA,6,15,"",2,"Y","","All truck drivers at the Employer's Engle Road, Ohio facility, or other Ohio dedicated operations or facilities at which truck driver employees report to work; excluding all clerical employees, office personnel, professional employees, dispatchers, guards, warehousemen, dock workers and supervisors as defined in the Act.","","","","Teamsters Local 407 a/w International Brotherhood of Teamsters"
"08-RD-313294","Region 08, Cleveland, Ohio","Northern Management & Leasing, Inc. d/b/a Statewide Express","Open","03/03/2023",NA,NA,"Cleveland","OH",16,NA,"","Included: All full-time and regular part-time drivers

Excluded: All professional employees, guards, managers, and supervisors as defined by the Act.",NA,NA,NA,NA,NA,NA,NA,NA,NA,NA,NA,NA,NA,NA,NA,NA,NA,NA,NA,NA,NA,NA,"Teamsters Local 407 a/w International Brotherhood of Teamsters"
"08-RD-314163","Region 08, Cleveland, Ohio","GMP Friction Products","Open","03/14/2023",NA,NA,"Akron","OH",40,NA,"","Included:  All production and maintenance employees;
Excluded:  All supervisors, office and clerical employees, laboratory, experimental or development employees, guards and salaried inspection employees.",NA,NA,NA,NA,NA,NA,NA,NA,NA,NA,NA,NA,NA,NA,NA,NA,NA,NA,NA,NA,NA,NA,"United Steelworkers Local 2L"
"08-RD-323957","Region 08, Cleveland, Ohio","Starbucks Corporation","Open","08/17/2023","","","Cleveland","OH",17,"","","Included: All full-time and regular part-time Baristas and Shift Supervisors employed by the Employer at its Store 
I0208 located at 11302 Euclid Avenue, Cleveland, Ohio. Excluded: All Store Managers, Assistant Store Managers, office clerical employees and guards, and professional employees and supervisors, as defined in the Act.",NA,NA,NA,NA,NA,NA,NA,NA,NA,NA,NA,NA,NA,NA,NA,NA,NA,NA,NA,NA,NA,NA,"Chicago and Midwest Regional Joint Board, Workers United/Service Employees International Union"
"08-UD-324381","Region 08, Cleveland, Ohio","OmniSource, LLC","Open","08/23/2023","","","Toledo","OH",87,"","","Included: All employees listed in Appendix A of the collective bargaining agreement.

Excluded: All other employees, managers and supervisors.",NA,NA,NA,NA,NA,NA,NA,NA,NA,NA,NA,NA,NA,NA,NA,NA,NA,NA,NA,NA,NA,NA,"Teamsters, Chauffeurs, Warehouse workers Local No. 20, affiliated with the International Brotherhood of Teamsters, Chauffeurs, Warehousemen and Helpers"
"09-RC-270027","Region 09, Cincinnati, Ohio","Solstice Sleep Products, Inc.","Open","12/09/2020","","","Columbus","OH",85,"","","Included:  All full-time and part-time furniture manufacturing employees employed by the Employer at the above location.  

Excluded:  All seasonal, temporary, managerial, clerical and confidential personnel, sales representatives, purchasers, customer service personnel, maintenance employees, guards and supervisors as defined in the Act.",88,"A","Single Labor Organization","Initial","03/03/2021",88,4,4,"",NA,"",NA,36,40,"",10,"","","All full-time and regular part-time furniture manufacturing employees, including shipping department employees and lead employees employed by the Employer at its facility located at 3720 West Broad Street, Columbus, Ohio 43228, but excluding all seasonal employees, temporary employees, managerial employees, professional employees, office clerical employees, confidential employees, sales representative employees, purchaser employees, customer service employees, maintenance employees, guards and supervisors as defined in the Act.","","","","United Food and Commercial Workers Union, Local No. 1059"
"09-RC-270027","Region 09, Cincinnati, Ohio","Solstice Sleep Products, Inc.","Open","12/09/2020",NA,NA,"Columbus","OH",85,NA,"","Included:  All full-time and part-time furniture manufacturing employees employed by the Employer at the above location.  

Excluded:  All seasonal, temporary, managerial, clerical and confidential personnel, sales representatives, purchasers, customer service personnel, maintenance employees, guards and supervisors as defined in the Act.",88,NA,NA,NA,NA,NA,NA,NA,NA,NA,NA,NA,NA,NA,NA,NA,NA,NA,NA,NA,NA,NA,"United Food and Commercial Workers Union, Local No. 1059"
"09-RC-301758","Region 09, Cincinnati, Ohio","BLUE RIBBON PLUMBING, INC., D/B/A WORKMAN & SONS PLUMBING","Open","08/19/2022","","","Ashland","KY",12,"","","Included:  All full time and regular part-time plumbers and helpers employed by the Employer.

Excluded:  All other employees, including shop employees, estimators, office clerical employees, supervisors,
guards and managers as defined by the Act.",12,"A","Single Labor Organization","Initial","09/16/2022",12,NA,NA,"",NA,"",NA,12,12,"",NA,"","","All full-time and regular part-time plumbers and helpers employed by the Employer at its facility located at 35555 Workman Road, Ashland, Kentucky; excluding shop employees, estimators, managers, office clerical employees, professional employees, guards and supervisors as defined in the Act and all other employees.","","","","United Association of Journeymen and Apprentices of the Plumbing and Pipefitting Industry of the United States and Canada, AFL-CIO, Plumbers and Steamfitters Local 248"
"09-RC-301758","Region 09, Cincinnati, Ohio","BLUE RIBBON PLUMBING, INC., D/B/A WORKMAN & SONS PLUMBING","Open","08/19/2022",NA,NA,"Ashland","KY",12,NA,"","Included:  All full time and regular part-time plumbers and helpers employed by the Employer.

Excluded:  All other employees, including shop employees, estimators, office clerical employees, supervisors,
guards and managers as defined by the Act.",NA,NA,NA,NA,NA,NA,NA,NA,NA,NA,NA,NA,NA,NA,NA,NA,NA,NA,NA,NA,NA,NA,"United Association of Journeymen and Apprentices of the Plumbing and Pipefitting Industry of the United States and Canada, AFL-CIO, Plumbers and Steamfitters Local 248"
"09-RC-304309","Region 09, Cincinnati, Ohio","TP MECHANICAL CONTRACTORS, LLC","Open","09/29/2022","","","Dayton","OH",4,"","","Included:  All full time and regular part time Sprinkler Fitters and Sprinkler Fitter Helpers employed by TP Mechanical
at its Dayton, Ohio location.

Excluded:  All other employees, clericals, professionals, guards, managers and supervisors as defined by the Act.",7,"A","Single Labor Organization","Initial","01/19/2023",7,NA,3,"",NA,"",NA,1,4,"",6,"Y","","All full-time and regular part-time sprinkler fitters, including journeymen and apprentices, employed by the Employer at its 7496 Webster Street Dayton, Ohio facility, but excluding all office clerical employees, and all professional employees, guards, and supervisors as defined by the Act, and all other employees.","","","","Road Sprinkler Fitters Local 669"
"09-RC-304309","Region 09, Cincinnati, Ohio","TP MECHANICAL CONTRACTORS, LLC","Open","09/29/2022",NA,NA,"Dayton","OH",4,NA,"","Included:  All full time and regular part time Sprinkler Fitters and Sprinkler Fitter Helpers employed by TP Mechanical
at its Dayton, Ohio location.

Excluded:  All other employees, clericals, professionals, guards, managers and supervisors as defined by the Act.",7,NA,NA,NA,NA,NA,NA,NA,NA,NA,NA,NA,NA,NA,NA,NA,NA,NA,NA,NA,NA,NA,"Road Sprinkler Fitters Local 669"
"09-RC-305269","Region 09, Cincinnati, Ohio","BROWN-FORMAN CORPORATION D/B/A WOODFORD RESERVE DISTILLERY","Open","10/14/2022","","","Versailles","KY",63,"","","Included:  All hourly employees to include:  bottling, distillery, processing/regauge/wh, logistics.

Excluded:  All maintenance, clerical, adm and salaried employees as defined by the Act.",60,"A","Single Labor Organization","Initial","11/17/2022",60,NA,14,"",NA,"",NA,45,59,"",7,"","","All full-time and regular part-time regauge and processing, distillery, warehousing and bottling employees employed by the Employer at its 7855 McCracken Pike, Versailles, Kentucky facility; excluding all professional employees, office clerical employees, guards and supervisors as defined in the Act.","","","","International Brotherhood of Teamsters (IBT), Local 651"
"09-RC-305269","Region 09, Cincinnati, Ohio","BROWN-FORMAN CORPORATION D/B/A WOODFORD RESERVE DISTILLERY","Open","10/14/2022",NA,NA,"Versailles","KY",63,NA,"","Included:  All hourly employees to include:  bottling, distillery, processing/regauge/wh, logistics.

Excluded:  All maintenance, clerical, adm and salaried employees as defined by the Act.",60,NA,NA,NA,NA,NA,NA,NA,NA,NA,NA,NA,NA,NA,NA,NA,NA,NA,NA,NA,NA,NA,"International Brotherhood of Teamsters (IBT), Local 651"
"09-RC-307464","Region 09, Cincinnati, Ohio","HERITAGE FIRE PROTECTION, INC.","Open","11/18/2022","","","Ashland","KY",3,"","","Included:  All full-time and regular-part time employees engaged in the fabrication and installation of fire sprinkler systems.

Excluded:  All other employees, including inspectors, fire extinguisher technicians, office clericals, supervisors and guards as defined in the Act.",8,"A","Single Labor Organization","Initial","12/15/2022",8,NA,1,"",NA,"",NA,1,2,"",7,"Y","","All full-time and regular part-time employees engaged in the fabrication and installation of fire sprinkler systems employed by the Employer at its 400 S. Big Run Road, Ashland, Kentucky facility; excluding inspectors, fire extinguisher technicians, office clerical employees, and all professional employees, guards and supervisors as defined in the Act, and all other employees.","","","","UA Local Union 669 Road Sprinkler Fitters"
"09-RC-307464","Region 09, Cincinnati, Ohio","HERITAGE FIRE PROTECTION, INC.","Open","11/18/2022",NA,NA,"Ashland","KY",3,NA,"","Included:  All full-time and regular-part time employees engaged in the fabrication and installation of fire sprinkler systems.

Excluded:  All other employees, including inspectors, fire extinguisher technicians, office clericals, supervisors and guards as defined in the Act.",8,NA,NA,NA,NA,NA,NA,NA,NA,NA,NA,NA,NA,NA,NA,NA,NA,NA,NA,NA,NA,NA,"UA Local Union 669 Road Sprinkler Fitters"
"09-RC-309216","Region 09, Cincinnati, Ohio","TRADER JOE'S EAST, INC.","Open","12/20/2022","","","Louisville","KY",100,"","Trader Joe's United","Included: All full-time and regular part-time crew and merchants of Trader Joe’s located at Store 628, 4600 Shelbyville Road, Suite 111, Louisville, KY 40207, excluding all mates, captains and supervisors as defined by the National Labor Relations Act. 

Excluded: All full-time and regular part-time crew and merchants of Trader Joe’s located at Store 628, 4600 Shelbyville Road, Suite 111, Louisville, KY 40207, excluding all mates, captains and supervisors as defined by the National Labor Relations Act.",106,"A","Single Labor Organization","Initial","01/26/2023",106,NA,48,"",NA,"",NA,36,84,"",7,"","Trader Joe's United","All full-time and regular part-time crew and merchants employed by the Employer at its 4600 Shelbyville Road, Suite 111, Louisville, Kentucky facility (Store No. 628); excluding all mates, captains, office clerical employees, and all professional employees, guards and supervisors as defined in the Act.","","","","Trader Joe's United"
"09-RC-309216","Region 09, Cincinnati, Ohio","TRADER JOE'S EAST, INC.","Open","12/20/2022",NA,NA,"Louisville","KY",100,NA,"","Included: All full-time and regular part-time crew and merchants of Trader Joe’s located at Store 628, 4600 Shelbyville Road, Suite 111, Louisville, KY 40207, excluding all mates, captains and supervisors as defined by the National Labor Relations Act. 

Excluded: All full-time and regular part-time crew and merchants of Trader Joe’s located at Store 628, 4600 Shelbyville Road, Suite 111, Louisville, KY 40207, excluding all mates, captains and supervisors as defined by the National Labor Relations Act.",NA,NA,NA,NA,NA,NA,NA,NA,NA,NA,NA,NA,NA,NA,NA,NA,NA,NA,NA,NA,NA,NA,"Trader Joe's United"
