"27-RC-271418","Region 27, Denver, Colorado","Hussmann Services Corporation","Open","01/15/2021","","","Denver","CO",19,"","United Association of Journeymen and Apprentices of the Plumbing and Pipe Fitting Industry of the United States and Canada, Pipefitters Local 208, AFL-CIO","Included: All full-time and regular part-time Commercial Refrigeration Service Technicians employed by the Employer at its Colorado facilities in Colorado Springs, Denver and Grand Junction. Excluded: All other employees, managerial employees, guards and supervisors within the meaning of the Act.",19,"A","Single Labor Organization","Initial","06/28/2021",19,NA,4,"",NA,"",NA,10,14,"",2,"","United Association of Journeymen and Apprentices of the Plumbing and Pipe Fitting Industry of the United States and Canada, Pipefitters Local 208, AFL-CIO","Include: All full-time and regular part-time service technicians employed by the Employer from its Denver, Colorado location. Exclude: All installation technicians, office clerical employees, professional employees, guards, and supervisors as defined by section 2(11) of the Act.","","","","United Association of Journeymen and Apprentices of the Plumbing and Pipe Fitting Industry of the United States and Canada, Pipefitters Local 208, AFL-CIO"
"27-RC-275868","Region 27, Denver, Colorado","Longmont United Hospital","Open","04/20/2021","","","Longmont","CO",219,"","","All full-time, regular part-time and per diem registered nurses employed by the Employer at its facility located at 1950 Mountain View Ave., Longmont, CO 80501; excluding all other employees, including RN's employed by other entities, registries or agencies providing outside labor to the Employer,  office clerical employees, nurse administrators, mangerial employees, confidential employees, guards and supervisors within the meaning of the Act.",229,"A","Revised Single Labor Org","Initial","08/13/2021",NA,4,93,"",NA,"",NA,88,188,"",7,"Y","","Include: All full-time, regular part-time, and per diem registered nurses employed by the Employer at its facility located in Longmont, CO 80501; Exclude: All other employees, including RNs employed by other entities, registries or agencies providing outside labor to the Employer, office clerical employees, nurse administrators, managerial employees, confidential employees, guards, and supervisors as defined by the National Labor Relations Act.","","","","National Nurses Organizing Committee/National Nurses United, AFL-CIO (NNOC/NNU)"
"27-RC-275868","Region 27, Denver, Colorado","Longmont United Hospital","Open","04/20/2021","","","Longmont","CO",219,"","","All full-time, regular part-time and per diem registered nurses employed by the Employer at its facility located at 1950 Mountain View Ave., Longmont, CO 80501; excluding all other employees, including RN's employed by other entities, registries or agencies providing outside labor to the Employer,  office clerical employees, nurse administrators, mangerial employees, confidential employees, guards and supervisors within the meaning of the Act.",229,"A","Single Labor Organization","Initial","07/07/2021",229,4,93,"",NA,"",NA,84,192,"",15,"Y","","Include: All full-time, regular part-time, and per diem registered nurses employed by the Employer at its facility located in Longmont, CO 80501; Exclude: All other employees, including RNs employed by other entities, registries or agencies providing outside labor to the Employer, office clerical employees, nurse administrators, managerial employees, confidential employees, guards, and supervisors as defined by the National Labor Relations Act.","","","","National Nurses Organizing Committee/National Nurses United, AFL-CIO (NNOC/NNU)"
"27-RC-279265","Region 27, Denver, Colorado","Hall Aluminum Products, Inc.","Open","06/30/2021","","","Kiowa","CO",22,"","","Included: All Glaziers, Architectural Metal and Glass Workers, Industrial Workers within the State of Colorado.
Excluded: All other employees, guards and supervisors",37,NA,NA,NA,NA,NA,NA,NA,NA,NA,NA,NA,NA,NA,NA,NA,NA,NA,NA,NA,NA,NA,"IUPAT District Council 81 - Glaziers, Architectural Metal & Glass Workers Union, Local Union No. 930, AFL-CIO"
"27-RC-280668","Region 27, Denver, Colorado","Big Green","Open","07/30/2021","","","Boulder","CO",14,"","","Include: Program Coordinators and Project Managers Exclude: All others",NA,NA,NA,NA,NA,NA,NA,NA,NA,NA,NA,NA,NA,NA,NA,NA,NA,NA,NA,NA,NA,NA,"Denver Newspaper Guild - CWA Local 37074, AFL-CIO"
"27-RC-280832","Region 27, Denver, Colorado","Dillon Companies, Inc. d/b/a City Market","Open","08/03/2021","","","Fruita","CO",2,"","United Food and Commercial Workers, Local 7","Included: Deli Manager and Meat Manager at the Fruita, Colorado store in self-determination election to determine whether they will be represented by Petitioner and join the existing Grand Junction, Fruita, and Clifton Meat Bargaining Unit represented by Petitioner (Armour-Globe election) Excluded: Store Director, Assistant Store Director, all other employees, supervisors, security, confidential, and all temporary employees as defined in the Act.",3,"A","Single Labor Organization","Initial","12/10/2021",3,NA,2,"",NA,"",NA,1,3,"",NA,"","United Food and Commercial Workers, Local 7","Include: All full-time and regular part-time meat and deli department managers employed by the Employer at Store 413, located in Fruita, Colorado. Exclude: All other employees, Store Managers, Assistant Store Managers, management trainees, production bakers and finishers, hostesses, demonstrators, pharmacists, courtesy clerks, office and clerical employees, janitors, parking lot attendants, food clerks, warehouse employees, watchmen, guards and professional employees and supervisors as defined in the Act.","","","","United Food and Commercial Workers, Local 7"
"27-RC-282916","Region 27, Denver, Colorado","Grocery Delivery E-Services USA, Inc. d/b/a Hello Fresh/Green Chef","Open","09/14/2021","","","Aurora","CO",386,"","","Include: All regular part-time and full-time employees of the Employer in the classifications Bundle workers, Line workers, Pack or packing workers, Cleaners, Leads, Prep workers, Trainers, Runners, Quality assurance workers, Inventory, Sanitation workers, Powered industrial truck operators, Machine operators, Assembly, Warehouse, Shipping, Maintenance, Safety, Sauce, and Sticker at its operations at 16304 E. 32nd St., Aurora CO 80011.
Exclude: guards, office clericals, managers and statutory supervisors",363,"A","Single Labor Organization","Initial","11/22/2021",363,2,91,"",NA,"",NA,166,264,"",7,"","","Include: All full-time and regular part-time production, maintenance, and warehouse employees employed by the Employer at its Aurora, Colorado location, including prep, kitting, assembly workers, Team Leads, runners, trainers, Quality Assurance Workers, inventory clerks, receiving clerks, sanitation workers, forklift drivers, machine operators, shipping, maintenance, production, safety coordinators, and sticker at its Aurora, Colorado facility. Exclude: All Chefs and Chef Assistants, office clerical employees, temporary employees, professional employees, confidential employees, guards, managers, and supervisors, as defined in the Act.","","","","UNITE HERE Local 23, AFL-CIO"
"27-RC-283492","Region 27, Denver, Colorado","Staker & Parson Companies d/b/a Jack B. Parson Ready Mix Concrete","Open","09/24/2021","","","Draper","UT",220,"","Independent Union of Concrete Handlers, Drivers and Operators","Include: Ready Mix employees in Northern Utah and Southern Idaho. Exclude: office/clerical, guards, supervisors, and professional employees",266,"A","Single Labor Organization","Initial","12/10/2021",266,5,139,"",NA,"",NA,69,208,"",8,"","Independent Union of Concrete Handlers, Drivers and Operators","Include: All full-time and regular part-time Ready Mix Drivers employed by the Employer in (1) the following counties in Utah: Utah, Wasatch, Summit, Salt Lake, Tooele, Davis, Weber, Box Elder, and Cache, and (2) the following counties in Idaho: Bear Lake and Caribou. Exclude: All non-ready mix drivers, office clerical employees, managerial employees, professional employees guards, and Supervisors, as defined by the Act.","","","","Independent Union of Concrete Handlers, Drivers and Operators"
"27-RC-287610","Region 27, Denver, Colorado","Albertson's LLC","Open","12/13/2021","","","Rock Springs","WY",8,"","","Included: All full-time and regular part-time employees in the meat department and butcher block. (Self-Determination election on whether to join existing Service Deli bargaining unit) Excluded: office clerical, confidential and professional employees, guards, watchmen, one Meat Manager, the Store Director, two Assistant Store Directors, other supervisors as defined in the Act, and all other employees",7,"A","Single Labor Organization","Initial","02/03/2022",7,NA,NA,"",NA,"",NA,4,4,"",NA,"","","Included: All full-time and regular part-time employees in the meat department and butcher block employed in Store No. 3342 located at 1323 Dewar Dr., Rock Springs, WY.

Excluded: Office clerical employees, confidential employees, professional employees, guards, watchmen, Meat Manager, Butcher Block Supervisor, Store Director, Assistant Store Director, supervisors as defined in the Act, and all other employees.","","","","United Food and Commercial Workers International Union, AFL-CIO, Local 7"
"27-RC-288318","Region 27, Denver, Colorado","Starbucks Corporation","Open","12/30/2021","","","Louisville","CO",24,"","","Include: All full-time and part-time Baristas and Shift Supervisors. Exclude: Store Mangers, office clericals, guards, professional employees, and supervisors.",NA,NA,NA,NA,NA,NA,NA,NA,NA,NA,NA,NA,NA,NA,NA,NA,NA,NA,NA,NA,NA,NA,"Chicago and Midwest Regional Joint Board, Workers United/ SEIU"
"27-RC-289451","Region 27, Denver, Colorado","The GEO Group, Inc.","Open","01/24/2022","","","Aurora","CO",211,"","","INCLUDED:  All full-time and regular part-time Private Security Officers (PSOs).

EXCLUDED:  Supervisors, Managerial, Confidential employees.",NA,NA,NA,NA,NA,NA,NA,NA,NA,NA,NA,NA,NA,NA,NA,NA,NA,NA,NA,NA,NA,NA,"United Professional Security Officers of America"
"27-RC-289608","Region 27, Denver, Colorado","Starbucks Corporation","Open","01/27/2022","","","Denver","CO",26,"","","All full-time and regular part-time Baristas and Shift Supervisors.  Excluded:  Store managers, Office Clericals, Guards, Professional Employees, and Supervisors",NA,NA,NA,NA,NA,NA,NA,NA,NA,NA,NA,NA,NA,NA,NA,NA,NA,NA,NA,NA,NA,NA,"Chicago and Midwest Regional Joint Board, Workers United/SEIU"
"27-RC-290287","Region 27, Denver, Colorado","Southern Glazer's Wine & Spirits","Open","02/08/2022","","","Aurora","CO",47,"","","Include: All regular full-time and part-time order selectors, unsalable employees, hostlers, inventory employees, replenishment employees, loaders, receivers/put away employees, floaters, and speed line replenishment employees. Exclude: Drivers, driver check in employees, sales representatives, Janitorial/Maintenance employees, clerical employees, supervisors as defined in the Act.",NA,NA,NA,NA,NA,NA,NA,NA,NA,NA,NA,NA,NA,NA,NA,NA,NA,NA,NA,NA,NA,NA,"International Brotherhood of Teamsters Local 455"
"27-RD-278799","Region 27, Denver, Colorado","Summit Fire & Security LLC","Open","06/21/2021","","","Salt Lake City","UT",12,"","","Include: Sprinkler Pipe Fitters Exclude: Extinguisher",12,"A","Revised Single Labor Org","Initial","02/04/2022",12,NA,2,"",NA,"",NA,3,5,"",NA,"","","Included: All full-time and regular part-time Sprinkler Fitters of the Employer’s branch location at 3676 West California Avenue, Suite D100, Salt Lake City, Utah 84104 engaged primarily or exclusively in the installation, maintenance, and repair of fire sprinkler systems, including the unloading, handling by hand or with power equipment, and installation of all piping or tubing, appurtenances, and equipment pertaining thereto, including both overhead and underground water mains, fire hydrants, and hydrant mains, standpipes, and hose connections to sprinkler systems, sprinkler tank heaters, and air lines used in connection with fire sprinkler systems, but excluding steam fire protection systems and excluding the inspection or testing of fire protection systems. 

Excluded: All other employees, including all field technicians not primarily engaged in the scope of work described above (for example, technicians handling inspections, alarm systems, surveillance systems, air sampling smoke detection systems, dry chemical systems, CO2 systems, clean agent systems, and pre-engineered systems), all office employees, Confidential employees, Managers, Supervisors, and Guards, as defined by the National Labor Relations Act.
","","","","Road Sprinkler Fitters Local Union No. 669, Columbia Maryland, of the United Association of Journeymen and Apprentices of the Plumbing and Pipefitting Industry of the United States and Canada"
"27-RD-278799","Region 27, Denver, Colorado","Summit Fire & Security LLC","Open","06/21/2021","","","Salt Lake City","UT",12,"","","Include: Sprinkler Pipe Fitters Exclude: Extinguisher",12,"A","Single Labor Organization","Initial","09/14/2021",12,NA,2,"",NA,"",NA,2,5,"",1,"Y","","Included: All full-time and regular part-time Sprinkler Fitters of the Employer’s branch location at 3676 West California Avenue, Suite D100, Salt Lake City, Utah 84104 engaged primarily or exclusively in the installation, maintenance, and repair of fire sprinkler systems, including the unloading, handling by hand or with power equipment, and installation of all piping or tubing, appurtenances, and equipment pertaining thereto, including both overhead and underground water mains, fire hydrants, and hydrant mains, standpipes, and hose connections to sprinkler systems, sprinkler tank heaters, and air lines used in connection with fire sprinkler systems, but excluding steam fire protection systems and excluding the inspection or testing of fire protection systems. 

Excluded: All other employees, including all field technicians not primarily engaged in the scope of work described above (for example, technicians handling inspections, alarm systems, surveillance systems, air sampling smoke detection systems, dry chemical systems, CO2 systems, clean agent systems, and pre-engineered systems), all office employees, Confidential employees, Managers, Supervisors, and Guards, as defined by the National Labor Relations Act.
","","","","Road Sprinkler Fitters Local Union No. 669, Columbia Maryland, of the United Association of Journeymen and Apprentices of the Plumbing and Pipefitting Industry of the United States and Canada"
"28-RC-161891","Region 28, Phoenix, Arizona","Stern Produce Company, Inc.","Open","10/14/2015","","","Phoenix","AZ",45,"","","Included:  All full-time and regular part-time warehouse workers and drivers employed by the Employer at its facility at 3200 S. 7th St. Phoenix, Arizona.

Exclued:  All sales, accounting, office clerical, and maintenance employees, and all managers, supervisors, and guards as defined by the National Labor Relations Act.",64,"A","Single Labor Organization","Initial","06/12/2020",64,7,NA,"",NA,"",NA,8,36,"",28,"Y","","Included:  All full-time and regular part-time warehouse employees and drivers employed by the Employer at its distribution facility in Phoenix, Arizona.

Excluded:  All sales employees, accounting employees, office clerical employees, maintenance employees, managers, guards, and supervisors as defined by the National Labor Relations Act.","","","","United Food and Commercial Workers Union, Local 99"
"28-RC-232059","Region 28, Phoenix, Arizona","CEMEX Construction Materials Pacific, LLC","Open","12/03/2018","","","Las Vegas","NV",385,"","International Brotherhood of Teamsters","INCLUDED:  All full-time and regular part-time drivers of ready mix trucks.

EXCLUDED:  All yardmen, batchmen, mechanics, building mechanics, testers/inspectors, safety champions, guards, clericals and supervisors as defined by the Act.",369,"A","Single Labor Organization","Initial","03/13/2019",369,NA,166,"",NA,"",NA,179,361,"",16,"Y","International Brotherhood of Teamsters","Included:  All full-time and regular part-time ready-mix drivers, plant operators II who regularly operate ready-mix trucks, and driver trainers employed by the Employer at its ready-mix facilities in Southern Nevada and Southern California, including its plants in Las Vegas, North Las Vegas, and Sloan, Nevada, and Compton, Corona, Escondido, Fontana, Highland, Hollywood, Irvine, Los Angeles, Moorpark, Oceanside, Orange, Oxnard, Perris, Rialto, San Diego, San Juan Capistrano, Santa Barbara, Santa Paula, Simi Valley, Temecula, and Walnut, California.

Excluded:  All other employees, batch men, yardmen, yardmen/laborers, plant maintenance employees, plant maintenance employees II, plant maintenance foremen, fleet mechanics, fleet mechanic foremen, mechanic foremen, senior driver trainers/safety champions, plant foremen, dispatchers, quality control representatives, office clerical employees, professional employees, guards and supervisors as defined in the Act. 

Plant operators II who regularly operate ready-mix trucks during 25 percent or more of their working time are eligible to vote. 
","","","","International Brotherhood of Teamsters"
"28-RC-252280","Region 28, Phoenix, Arizona","NP Red Rock LLC d/b/a Red Rock  Casino Resort Spa","Open","11/21/2019","","","Las Vegas","NV",1350,"","Local Joint Executive Board of Las Vegas a/w UNITE HERE International Union","INCLUDED: All full-time and regular part-time Assistant Food Servers, Bakers, Bakers 2,
Bakers 3, Banquets Back Aisle, Banquet Bar Backs, Banquet Bartenders, Banquet Porters,
Banquets Setup, Barbacks, Bar porters. Bar host, Bartenders, Bell Persons, Bell Starters,
Beverage Porters, Beverage Servers, Beverage (Race/Sports), Banquet Servers, Bus
Persons/Bussers, Cake Decorators, Cake Decorators 2, Captains, Coffee Breakers, Concession
Workers, Cooks, Cook’s Helpers, Counter Attendants, Entertainment Bartenders, Food Servers,
Gourmet Hostperson/Cashiers, Host/Cashiers, Flousekeeping Utility Porters, Ice Cream
Concession Workers, Kitchen Runners, Kitchen Workers, Lead Banquet Porters, Lead Counter
Attendants, Lead Servers, Mini Bar Attendants, Mixologists, Pantry, Porters, Resort Guest Room
Attendants, Resort Housepersons, Resort Suite Guest Room Attendants, Resort Steakhouse
Cooks, Restaurant Attendants, Room Runners, Room Service Captains, Runners, Service
Bartenders, Specialty Cooks, Servers, Sprinters, Status Board, Stove Persons, TDR Attendants,
Turndown Guest Room Attendants, Utility Porters, VIP Attendants, VIP Bartenders, and VIP
Lounge Attendants employed by the employer at its facility at 11011 W Charleston Blvd, Las
Vegas, NV.
EXCLUDED: All other employees, front desk employees, valet parkers, gaming employees
(dealers, slot attendants, cage cashiers), inspectresses, engineering and maintenance employees,
office clerical employees, guards, managers, and supervisors as defined by the Act.
",1337,"A","Single Labor Organization","Initial","12/20/2019",1337,7,534,"",NA,"",NA,627,1161,"",NA,"","Local Joint Executive Board of Las Vegas","INCLUDED: All full-time and regular part-time assistant food servers, bakers (I, II, III), banquet bartenders, banquet porters, banquets setup, bar porters, bartenders, bell persons, bell starters, beverage porters, beverage servers, beverage (Race/Sports), banquet servers, bus persons/bussers, cake decorators (I, II), captains, coffee breakers, concession workers, cooks, cook’s helpers, counter attendants, food servers, gourmet hostperson/cashiers, host/cashiers, housekeeping utility porters, ice cream concession workers, kitchen runners, kitchen workers, lead banquet porters, lead counter attendants, lead servers, mini bar attendants, pantry, porters, resort guest room attendants, resort housepersons, resort suite guest room attendants, resort steakhouse cooks, room runners,  room service captains, runners, service bartenders, specialty cooks, servers, sprinters, status board, stove persons, team member dining room (TDR) attendants, turndown guest room attendants, utility porters, VIP attendants, VIP bartenders, and VIP lounge attendants employed by the Employer at its facility located at 11011 West Charleston Boulevard, Las Vegas, Nevada.

EXCLUDED: All other employees, front desk employees, valet parkers, retail cashier/clerks, gaming employees (dealers, slot attendants, cage cashiers), inspectresses, engineering and maintenance employees, office clerical employees, guards, managers, and supervisors as defined by the Act.
","","","","Local Joint Executive Board of Las Vegas"
"28-RC-254977","Region 28, Phoenix, Arizona","ERP International","Open","01/22/2020","","","Las Vegas","NV",4,"","","Included: All full time and regular part time Pharmacy Technicians employed by the employer in the Nellis AFB Satellite Pharmacy Bldg # 340 located at Nellis Air Force Base Las Vegas NV. 
Excluded: All managers, Pharmacists, Dietitians and all other professional employees, guards and supervisors as defined by the Act. 
",4,"A","Single Labor Organization","Initial","06/05/2020",4,1,1,"",NA,"",NA,NA,2,"",1,"Y","","INCLUDED: All full time and regular part time Pharmacy Technicians employed by the employer in the Nellis AFB Satellite Pharmacy Bldg #340 located at Nellis Air Force Base, Las Vegas NV.

EXCLUDED: All managers, other Pharmacists, Dietitians and all other professional employees, guards and supervisors as defined by the Act.
","","","","International Association of Machinists and Aerospace Workers, Local Lodge SC711, AFL-CIO"
"28-RC-263057","Region 28, Phoenix, Arizona","Westside Plumbing LLC","Open","07/15/2020","","","Bernalillo","NM",30,"","","Included:
All  full-time  and  regular  part-time  journeymen  plumbers,  apprentice  plumbers,  and plumber  helpers/laborers  employed  by  the  Employer  out  of  its  facility  located  at  423 Calle Industrial, Bernalillo, NM 87004.

Excluded:
All   other   employees,   office   clerical   employees,   guards,   managerial   employees, supervisors as defined by the Act.

",40,"A","Single Labor Organization","Initial","10/15/2020",40,2,1,"",NA,"",NA,4,7,"",2,"","","Included:  All full-time and regular part-time journeymen plumbers, apprentice plumbers, and plumber helpers/laborers employed by the Employer at its facility in Bernalillo, New Mexico.

Excluded:  All other employees, office clerical employees, managerial employees, guards, and supervisors as defined in the Act.
","","","","United Association of Plumbers and Pipefitters Local 412"
"28-RC-280235","Region 28, Phoenix, Arizona","Prep & Pastry Restaurant LLC","Open","07/20/2021","","","Tucson","AZ",60,"","United Food & Commercial Workers International Union, Local 99, AFL-CIO, CLC","INCLUDED:  All full-time and part-time kitchen employees, line cooks, prep cooks, dishwashers, bussers, servers, hostess, bakers and bartenders

EXCLUDED:  All other employees, office clerical employees, guards and supervisors as defined by the Act.",41,"A","Single Labor Organization","Initial","09/20/2021",41,2,7,"",NA,"",NA,12,23,"",4,"","United Food & Commercial Workers International Union, Local 99, AFL-CIO, CLC","INCLUDED: All full-time and regular part-time kitchen employees, line cooks, prep cooks, dishwashers, bussers, servers, hostess, bakers and bartenders employed by the Employer at its Tucson, Arizona facility.

EXCLUDED: All other employees, office clerical employees, professional employees,
managerial employees, guards and supervisors as defined in the Act.

Others permitted to vote: The parties have agreed that cleaners may vote in the election but their ballots will be challenged since their eligibility has not been resolved. No decision has been made regarding whether the individuals in this classification or group are included in, or excluded from, the bargaining unit. The eligibility or inclusion of these individuals will be resolved, if necessary, following the election.","","","","United Food & Commercial Workers International Union, Local 99, AFL-CIO"
"28-RC-283964","Region 28, Phoenix, Arizona","Comprehensive Health Services, LLC (Trail House)","Open","10/04/2021","","","El Paso","TX",22,"","","Included: All hourly full-time Chaperone employees Excluded: All supervisors and leads as defined by the Act.",NA,NA,NA,NA,NA,NA,NA,NA,NA,NA,NA,NA,NA,NA,NA,NA,NA,NA,NA,NA,NA,NA,"International Union of Operating Engineers Local 351"
"28-RC-285574","Region 28, Phoenix, Arizona","Akima Global Services, Inc.","Open","10/26/2021","","","Florence","AZ",250,"","","INCLUDED:  all full and part time Detention, Armed Detention and Armed Transportation Officers employed by the Company at the ICE Florence Detention Center

EXCLUDED:  other employees, including clerical and professional employees as defined in the National Labor Relations Act",NA,"A","Two Labor Organizations","Initial","02/08/2022",235,6,72,"International Union, Security, Police & Fire Professionals of America (SPFPA)",14,"",NA,1,87,"",NA,"","United Government Security Officers of America International Union, & Its Local 823 (UGSOA)","Included: All full-time and regular part-time detention officers, armed detention officers, and armed transportation officers performing guard duties as defined in Section 9(b)(3) of the National Labor Relations Act, employed by the Employer at the ICE Detention Center in Florence, Arizona, under contract to the United States Immigration and Customs Enforcement, Contract # 70CDCR20D00000004.
. 
Excluded: All other employees, office clerical employees, professional employees, managers and supervisors as defined in the Act.
","","","","United Government Security Officers of America, International Union (UGSOA) and its Local 381"
