"13-RC-281748","Symphony Buffalo Grove LLC","Buffalo Grove","08/23/2021","IL","Included: All full-time and regular part-time Certified Nursing Assistants, Dietary Employees, Housekeeping Employees, Laundry Employees, Activity Aides, Restorative/Rehab Aides, and Maintenance workers Excluded: Licensed Practical and Registered Nurses, confidential employees, causal employees, guards, managers, and supervisors as defined by the NLRA",90,"SEIU Healthcare Illinois & Indiana","Open"
"13-RC-281758","Verilife Cannabis Dispensary","Arlington Heights","08/23/2021","IL","Included: All full-time and regular part-time Cannabis Sales Consultants (CSC), Asset Protection Associates (APA)
and Dispensing Inventory Specialists (DIS).
Excluded: All salaried managers, temporary employees, other contracted employees, office clerical employees,
confidential employees, and professional employees, guards and supervisors as defined in the Act.",19,"Teamsters Local 777","Open"
"13-RC-281871","Warren Barr North Shore LLC","Highland Park","08/25/2021","IL","Included: All full-time and regular part-time Certified Nursing Assistants, Activity Aides, and Restorative/Rehab Aides Excluded: Licensed Practical and Registered Nurses, confidential employees, causal employees, guards, managers, and supervisors as defined by the NLRA",55,"SEIU Healthcare Illinois & Indiana","Open"
"13-RC-281939","Streamwood Skilled Nursing Facility, LLC","Streamwood","08/25/2021","IL","Included: All full-time and regular part-time Certified Nursing Assistants, Housekeeping Employees, Laundry Employees, Activity Aides, and Restorative/Rehab Aides Excluded: Licensed Practical and Registered Nurses, confidential employees, causal employees, guards, managers, and supervisors as defined by the NLRA",70,"SEIU Healthcare Illinois & Indiana","Open"
"13-RC-282070","Verilife Cannabis Dispensary","Chicago","08/27/2021","IL","Included:
All full-time and regular part-time Cannabis Sales Consultants (CSC), Asset Protection Associates (APA)
and Dispensing Inventory Specialists (DIS).
Excluded:
All salaried managers, temporary employees, other contracted employees, office clerical employees,
confidential employees, and professional employees, guards and supervisors as defined in the Act.",27,"Teamsters Local 777","Open"
"13-RD-281948","Alta Equipment company","South Elgin","08/26/2021","IL","Included: Shop mechanics 

Excluded: Parts employees, sales employees and management",13,"Automobile Workers Local 701","Open"
"13-RD-282010","Rieke Office Interiors","Elgin","08/26/2021","IL","Included: All full time and regular part time production employees, installers, programming employees, and shipping/receiving employees employed by the employer at its facility currently located at 2000 Fox Lane, Elgin, IL
 Excluded: Executive management employees, Human Resources Employees, Accounting Employees, General Administration Employees, Order Entry Employees, Scheduling Employees, Purchasing Employees, Interior Design Employees, Furniture Design Employees, Project Managers, Sales Employees, Office Clerical Employees, Managerial Employees, Professional Employees, Guards, and Supervisors as defined in the act",11,"INTERNATIONAL ASSOCIATION OF MACHINISTS AND AEROSPACE WORKERS, DISTRICT LODGE 8","Open"
"14-RC-278595","Union Electric Company d/b/a Ameren Missouri","Steedman","06/16/2021","MO","Included:  Employees of the Callaway Work Management department with the job title of planner.  Excluded:  Managers, Professional Employees and Guards as defined by the Act.",12,"International Union of Operating Engineers, Local 148","Open"
"14-RC-278912","Roxana Landfill, LLC","Edwardsville","06/23/2021","IL","Included: All full-time and regular part-time heavy equipment operators employed by the Employer at its 4601 Cahokia Rd., Edwardsville, Illinois facility Excluded: All other employees, office clerical employees, professional employees, guards and supervisors as defined by the Act",12,"Teamsters, Automotive, Petroleum and Allied Workers, Local No. 50","Open"
"14-RC-279611","Brenntag Mid-South, Inc.","Saint Louis","07/07/2021","MO","Included:  truck drivers, warehouse workers, forklift drivers, etc.  Excluded:  management/corporate employees or any other non-bargaining unit employees.",21,"Teamsters Local 618","Open"
"14-RC-280156","N & R of Poplar Bluff, Inc. dba Mark Twain Caring Center","Poplar Bluff","07/20/2021","MO","Included: All nursing aides, housekeepers, laundry aides, dietary aides, transportation aides, med techs, and LPNs Excluded: All Registered Nurses, clerical and secretarial workers, bookkeepers, payroll, and all administrators",62,"United Food and Commercial Workers Union Local 655","Open"
"14-RC-280288","Apple Bus Company","Wood River","07/22/2021","IL","Included:  All regular and part-time bus drivers and monitors.  Excluded:  Office clericals, guards and supervisors as defined by the Act.",22,"International Brotherhood of Teamsters Local 525","Open"
"14-RC-280405","Brent Electric Co., Inc.","Tulsa","07/26/2021","OK","Included:  All electrical work, maintenance, and repair work done by Brent Electric.  Excluded:  Supervisors who actually perform statutory supervisor duties.",14,"International Brotherhood of Electrical Workers Local 584","Open"
"14-RC-280407","UniFirst Corporation","Kansas City","07/26/2021","MO","Included: All Full Time and Part Time Route Sales Professionals, route helpers, vacation relief drivers and other employees employed at the employers Kansas City Missouri Location. Excluded: supervisors as defined in the Act",13,"International Brotherhood of Teamsters Local Union No. 955","Open"
"14-RC-280992","Lattimore Materials Corp.","Stringtown","08/06/2021","OK","Included:  Production & Maintenance Employees.  Excluded:  Guards, Clerical Employees & Supervisors",32,"International Union of Operating Engineers Local 627","Open"
"14-RC-280992","Lattimore Materials Corp.","Stringtown","08/06/2021","OK","Included:  Production & Maintenance Employees.  Excluded:  Guards, Clerical Employees & Supervisors",32,"International Union of Operating Engineers Local 627","Open"
"14-RC-281302","KMS Commercial Painting, L.L.C.","Omaha","08/13/2021","NE","Included:  All full-time and regular part-time painters, decorators, wall coverers, drywall finishers, floor coverers, glaziers and apprentice employees.  Excluded:  Supervisors, office clerical and other employees than those set out above.",12,"International Union of Painters and Allied Trades, Local Union N0. 109, District Council No. 81","Open"
"14-RD-280570","Opco, LLC d/b/a Georgian Gardens Center for Rehab and Healthcare","Potosi","07/28/2021","MO","Included:  All full-time and regular part-time service employees employed at the Employer's Potosi, Missouri.  Excluded:  office clerical employees and professional employees, registered nurses, licensed practical nurses, maintenance employees and supervisors as defined in the Act.",54,"Service Employees International Union Healthcare Missouri/Kansas, a Division of Service Employees International Union Healthcare, Illinois and Indiana","Open"
"14-RD-281808","Clean Harbors Environmental Services, Inc.","Granite City","08/24/2021","IL","Included:  Driver/Operator Technician Laborer",2,"International Union  of Painters and Allied Trades District Council #58","Open"
"15-RC-008841","Outokumpu Stainless USA f/k/a ThyssenKrup Stainless USA, LLC","Calvert","05/17/2010","AL","Included:  All full-time and part-rime production and maintenance employees.

Excluded:  All supervisors, managers and guards as defined in the Act, as amended.",80,"USW","Open"
"15-RC-275949","Huntington Ingalls Incorporated, Ingalls Shipbuilding Division","Pascagoula","04/21/2021","MS","Included:  All full-time and regularly scheduled employees classified as firefighters including firefighter 4 (lead worker), firefighter 3, firefighter 2 (all firefighters are qualified as emergency medical technicians and paramedics) at the employers facility located at 1000 Jerry St. Pe Hwy, Pascagoula, MS

Excluded:  Fire Chief, fire inspectors, fire prevention auditors, safety employees, maintenance employees, apprentices (production and maintenance dept), all material men, material support employees (material expediters and material supply clerks), tool room employees and plant and office clerical employees, (drawing clerks, key machine operators, mail carriers,office clerks, reproduction clerks, senior office clerks and senior reproduction clerks),  office janitors, technical employees (mt-pt inspectors, optical detailers, radiographic employees, in plant production dept, including security officers, all pattern makers (and apprentices), all time keepers, apprentices, technical aids, junior designers, designers, senior designers and supervisors, as defined in the act.",14,"International Association of Firefighters, Local 100-97","Open"
"15-RC-279794","Centerra Group, LLC","Pensacola","07/13/2021","FL","Included:  All full-time and shared position Court Security Officers (CSOs) and Lead Court Security
Officers (LCSOs) employed by the employer at the U.S. Courthouse, 100 N. Palafox St.,
Pensacola, FL and the U.S. Courthouse, 30 W. Government St., Panama City, FL

Excluded:  
All office clerical employees, professional employees, confidential employees and supervisors as
defined in the Act.",38,"United States Court Security Officers","Open"
"15-RC-280545","CenTrio Energy South LLC","New Orleans","07/28/2021","LA","Included: All full-time and regular part-time operators/stationary engineers and maintenance employees employed by the Employer out of its location at 1661 Gravier St., New Orleans, LA 70112

Excluded: All other employees, managers, office clericals, guards and supervisors as defined in the Act.",11,"UA Plumbers and Steamfitters Local Union 60","Open"
"15-RC-281727","FlightSafety International Defense Corporation","Milton","08/20/2021","FL","Included:

All FULL AND REGULAR TIME AND PART TIME FLIGHT TRAINING INSTRUCTORS. 

Excluded:

Office clerical employees, professional employees, managerial employees, guards, supervisors and defined by the act.",2,"IAMAW, AFL-CIO","Open"
"15-RC-281801","VISKASE","Parkin","08/23/2021","AR","All full and regular part time production maintenance employees and lab workers.",162,"IAMAW, AFL-CIO","Open"
"15-RD-279796","Magnitude 7 Metals, LLC","Marston","07/13/2021","MO","Included: All hourly-paid Production, Technical, and Maintenance Employees (including Quality Assurance employees)

Excluded: All office and plant Clerical and Professional Employees, salaried employees, Guards, and Supervisors as defined in the Act.",405,"United Steelworkers of America, Local 7686","Open"
"15-RD-281851","Oswalt Sewer Rooter and Plumbing Repair","Bossier City","08/24/2021","LA","Included:  current unionized jobs

Excluded:  supervisors",3,"Plumbers & Steamfitters Local 141","Open"
"16-RC-280633","HERZOG TRANSIT SERVICES, INC.","Irving","07/29/2021","TX","Included: All full-time and regular part-time employees that perform train, engine and yard services

Excluded: all other employees, supervisors, managers, guards, and confidential employees as defined by the Act",39,"AMERICAN TRAIN DISPATCHERS ASSOCIATION","Open"
"16-RC-280825","Universal Protection Services, LP d/b/a Allied Universal Security Services","Palestine","08/02/2021","TX","Included: All full-time and part-time armed and unarmed Transportation Officers performing guard duties as defined in Section 9(b)(3) of the National Labor Relations Act, employed by Allied Universal at 320 Sanderson Farms Pkwy., Palestine, TX  75803.

Excluded: All office clerical employees, professional employees ad supervisors as defined by the Act.",19,"International Union, Security, Police and Fire Professionals of America (SPFPA)","Open"
"16-RC-280839","SUNRISE BEACH CORPORATION D/B/A M2 SERVICES CORPORATION","Fort Hood","08/02/2021","TX","INCLUDED: ALL FULL AND REGULAR PART-TIME AIRCRAFT MECHANIC II, AIRCRAFT MECHANIC III, AND PRODUCTION CONTROL CLERKS WORKING AT FORT HOOD, TX LOCATIONS.

EXCLUDED: OFFICE CLERICAL EMPLOYEES, PROFESSIONAL EMPLOYEES, MANAGERIAL EMPLOYEES, GUARDS, SUPERVISORS, AS DEFINED IN THE ACT.",93,"International Association of Machinists and Aerospace Workers, AFL-CIO","Open"
"16-RC-281833","STRATEGIC SECURITY CORP","Austin","08/24/2021","TX","Included: All full time and part-time  and unarmed security officers and protective security officers performing  guards duties as defined in section 9(b)(3) of the National Labor Relation Board Act, employed by Stategic Security Corp @ 1100 North 1-35, Austin, TX  78753.

Excluded: All office clerical employees, professional employees and supervisors as defined by the Ac.",15,"International Union, Security, Police and Fire Professionals of America (SPFPA)","Open"
"16-RC-281918","UNIVAR SOLUTIONS","Garland","08/25/2021","TX","Included: All full time and part time Truck Drivers, Material Handlers and Waste employees.

Excluded: All other full-time and part-time employees, managers, professional employees, lab, clerical, guards and supervisors as defined in the Act.",17,"INTERNATIONAL UNION OF OPERATING ENGINEERS, LOCAL 564","Open"
"18-RC-281063","Allina Health System d/b/a United Hospital","Saint Paul","08/09/2021","MN","Included:  Pharm Techs to be added to existing service & maintenance BU based on armour-globe.

Excluded:  All other employees.",30,"SEIU Healthcare Minnesota","Open"
"18-RC-281063","Allina Health System d/b/a United Hospital","Saint Paul","08/09/2021","MN","Included:  Pharm Techs to be added to existing service & maintenance BU based on armour-globe.

Excluded:  All other employees.",30,"SEIU Healthcare Minnesota","Open"
"18-RC-281066","Allina Health System d/b/a Mercy Hospital – Mercy Campus","Coon Rapids","08/09/2021","MN","Included:  Pharm Techs to be added to existing service & maintenance BU based on armour-globe.
Excluded:  All other employees.",30,"SEIU Healthcare Minnesota","Open"
"18-RC-281728","Midwest Air Traffic Control Services, Inc.","Overland Park","08/20/2021","KS","Included: Air Traffic Control Specialist (Full & Part Time)
Excluded: Guards, Supervisors & Air Traffic Manager",4,"PROFESSIONAL AIR TRAFFIC CONTROLLERS ORGANIZATION, INC.","Open"
"18-RD-274308","Cheetah Precision, LLC d/b/a Minneapolis Washer & Stamping","Minneapolis","03/16/2021","MN","Included:  Operators, tooling machinists, shipping, receiving, packing, setupmen; Excluded:  N/A",14,"IUE-CWA LOCAL 1140","Open"
"18-RD-280454","W.S. DARLEY & CO.","Chippewa Falls","07/26/2021","WI","Included: all union shop employees @ chippewa falls wi production facilities Excluded: all non union shop employees @ chippewa falls wi production facilities",79,"TEAMSTERS LOCAL 662","Open"
"18-RD-280610","Bishop Noa Home for Senior Citizens","Escanaba","07/29/2021","MI","All full-time and regular part-time certified nursing assistants employed by the Employer; excluding All activity aides, maintenance employees, housekeeping employees, registered nurses (RN), licensed practical nurses (LPN), personal care attendants (PCA), non-certified aides, dietary employees, ward clerks, certified senior advisors (CSA), and guards and supervisors as defined by the Act, as amended.",30,"United Steel Workers Local 2-21","Open"
"19-RC-276616","Cornish College of the Arts","Seattle","05/04/2021","WA","",52,"Office and Professional Employees International Union, Local #8","Open"
"19-RC-277637","Pacific Northwest Regional Council of Carpenters","Kent","05/25/2021","WA","Included:  Representatives, Leads, Market Recovery Rep., Regional Manager, Contract Reps.

Excluded:  All other employees, probationary employees, supervisors, and confidential employees.",24,"United Food and Commercial Workers Union Local 367","Open"
"19-RC-278433","WestRock Services LLC, Tacoma, WA","Tacoma","06/11/2021","WA","Included:  All Millwrights, Machinists and other employees currently represented by IAM.

Excluded:  All other employees, supervisors, guards and confidential employees.",18,"Pacific Northwest Regional Council of Carpenters","Open"
"19-RC-279392","Providence Health & Services - Oregon d/b/a Providence Willamette Falls Medical Center","Oregon City","07/02/2021","OR","Included: All per diem nurses to be included in existing RN unit at Willamette Falls. Excluded: Supervisors, guards.",36,"Oregon Nurses Association","Open"
"19-RC-279443","Ponder LLC","Seattle","07/02/2021","WA","Included: 

All Budtenders and Floor Managers. 

Excluded: 

General Managers, Inventory Managers, Operational Managers and Security Guards.",8,"United Food and Commercial Workers Union Local 21","Open"
"19-RC-279446","Gonselves & Santucci, Inc. d/b/a The Conco Companies","Kent","07/02/2021","WA","Included: All full-time and part-time flatbed and delivery drivers employed by the employer at facility's located in Kent and Rochester, WA. Excluded: All other employees, including warehouse, office clerical, guards and supervisors as defined by the Act.",11,"General Teamsters Local Union #174","Open"
"19-RC-279480","Tri Med Ambulance  LLC","Kent","07/06/2021","WA","Included:  All full time and regular part-time EMTs, Field Supervisors and CCT Nurses.

Excluded:  All other employees of Tri Med Ambulance LLC.",200,"IAFF Local I-98","Open"
"19-RC-279875","Safeway, Inc.","Portland","07/14/2021","OR","Included: All production Bakers, Utility Bakers, and Cake Decorators. Excluded: All other employees.",4,"Bakery, Confectionery, Tobacco Workers and Grain Millers Union,  Local 114, AFL-CIO, CLC","Open"
"19-RC-280018","Lourdes Hospital LLC d/b/a Lourdes Counseling Center","Richland","07/16/2021","WA","Employees Included: The Petitioner seeks to add through a self-determination election all Perdiems in the Adult Psychiatric and Transitions inpatient units, including the following job titles: Care Coordinators, Case Managers,Court Coordinators, Health Unit Coordinators, Mental Health Aides, Mental Health Counselors, Mental Health Professionals, Registered Nurses, Secretaries, and Therapist employed by the employer at 1175 Carondelet Dr, Richland, WA 99354, to the existing bargaining unit. Employees Excluded: Excluding all guards, supervisors, managers and confidential employees as defined by the Act",31,"United Food and Commercial Workers Local 21","Open"
"19-RC-280423","Mid-Columbia Medical Center","The Dalles","07/23/2021","OR","Included: All full time, regular part-time, and per diem technical employees employed by the employer in The Dalles, Oregon and Hood River, Oregon including all: radiology technologists, respiratory therapists, radiation therapists, certified surgical technologists, EKG technologists, echo technologists, and mammography technologists. Excluded: All other non-professional employees, professional employees, physicians, registered nurses, business office clerical employees, skilled maintenance employees, managers, guards, and supervisors as defined by the Act.",43,"Oregon Federation of Nurses and Health Professionals, Local 5017, AFT, AFL-CIO","Open"
"19-RC-280752","Safeway, Inc.","Corvallis","07/30/2021","OR","Included: All production Bakers, Utility Bakers, and Cake Decorators. Excluded: All other employees.",3,"Bakery, Confectionery, Tobacco Workers and Grain Millers Union, Local 114, AFL-CIO, CLC","Open"
"19-RC-280859","Tuality Healthcare","Forest Grove","08/04/2021","OR","Included:  All service and technical employees.
Excluded:  All other employees, including managers, supervisors and guards.",16,"American Federation of State County Municipal Employees Council 75","Open"
"19-RC-280859","Tuality Healthcare","Forest Grove","08/04/2021","OR","Included:  All service and technical employees.
Excluded:  All other employees, including managers, supervisors and guards.",16,"American Federation of State County Municipal Employees Council 75","Open"
"19-RC-281382","Legacy Auto Group Inc. d/b/a Marysville Toyota","Marysville","08/13/2021","WA","Employees Included: All full-time and regular part-time flat rate, hourly, master and lead technicians working out of the Marysville, WA facility. Employees Excluded: All office clerical, managers, guards and other employees as defined in the Act.",14,"Aerospace Machinists District Lodge 751","Open"
"19-RC-281426","MultiCare Health System","Tacoma","08/13/2021","WA","Included: All full-time, part-time, float and per diem physicians, physician assistants, and advanced registered nurse practitioners employed at the locations listed in Attachment A. Excluded: All other employees, non-professional employees, guards & supervisors as defined by the Act.",21,"Weinberg, Roger & Rosenfeld","Open"
"19-RC-281493","Hospital Central Services Association","Auburn","08/16/2021","WA","Included: 

Any and all full time and part time drivers at HCSA.

Excluded: 

Guards, supervisors, and all other employees as defined in the Act.",18,"Teamsters Local Union 117","Open"
"19-RC-281641","Stoneway Concrete","Seattle","08/19/2021","WA","Included: 

All full-time and part-time Quality Control Technicians.

Excluded: 

All other employees, including warehouse, office clerical, guards and supervisors as defined by the Act.",5,"Teamsters Local Union #174","Open"
"19-RC-281898","Central Washington Hospital","Wenatchee","08/24/2021","WA","Self-Determination Petition

This self-determination petition seeks to add a group of twenty-eight (28) Oncology Infusion Registered Nurses and Registered Nurse Navigators employed by the Employer in its facilities in Omak, Moses Lake and Wenatchee, Washington to an existing unit of approximately 580 registered nurses. 

The Washington State Nurses Association is the recognized exclusive collective bargaining representative of a unit consisting of approximately 580 registered nurses.",28,"Washington State Nurses Association","Open"
"19-RC-282003","Swedish Medical Center","Seattle","08/26/2021","WA","To be Included in the Existing Unit: All full-time, part-time and per diem Pharmacists, Lead Pharmacists, Dietitians, Lead Dieticians employed by the Employer at Swedish Medical Center.

To be Excluded: All other employees, guards, and supervisors as defined in the Act.
",175,"SEIU Healthcare 1199NW","Open"
"19-RC-282004","Swedish Medical Center","Seattle","08/26/2021","WA","To be Included in the Existing Unit: All full-time, part-time and per diem Pharmacy Buyers and Lead Buyers employed by the Employer at Swedish Medical Center.

To be Excluded: All other employees, guards, and supervisors as defined in the Act.
",10,"SEIU Healthcare 1199NW","Open"
"19-RD-204660","United Food and Commercial Workers Union, Local Union No. 21, AFL-CIO, CLC","Seattle","08/18/2017","WA","Included:  All union representatives, lead union representatives, grievance representatives, organizers, community organizers, political organizers, and researchers.

Excluded:  All office/clerical employees, confidential employees, guards, department heads, supervisors, student interns under the supervision of a Local 21 staff person and full time negotiators.",38,"Federation of Agents and International Representatives","Open"
"19-RD-223516","CP Anchorage Hotel 2, LLC, d/b/a Hilton Anchorage","Anchorage","07/11/2018","AK","Included:  Unit involved: Banquet Bartender; Banquet Captain; Banquet Server; Banquet Houseman; Barista; Bellman; Bell Captain; Bruins Bartender; Bus Person; Cashier; Coat Check/Room Check Attendant; Cocktail Server; Concierge; Cook; Dishwasher/Steward; Doorman; Front Desk/PBX; Host/Hostess; Housekeeping Clerk; Housekeeper/Room Attendant; Houseman; Housekeeping inspector; Laundry-Presser/Chute; Laundry-Washer; Maintenance; Maintenance Supervisor; Night Auditor; Purchasing; Restaurant Server; Room Service.

Exclude:  Security, Managers, Confidential employee; Clerical employee, Supervisor as defined in the Act.",153,"UNITE HERE! LOCAL 878","Open"
"19-RD-280464","EAN Holdings, LLC, Oregon Division d/b/a National Car Rental and Alamo Rent-A-Car","Portland","07/27/2021","OR","Included: Rental agent, emerald specialist, return, service, exit agents, bus drivers, mechanics. Excluded: All other employees, office clerical, guards, managers + supervisors.",42,"International Brotherhood of Teamsters, Local 305","Open"
"19-RM-281461","The Columbian Publishing Company","Vancouver","08/17/2021","WA","Included: All full-time and regular part-time employees in the News Department, including reporters, sports reporters, photojournalists, copy editors, news clerks, and FYI coordinators employed by the Employer at its Vancouver, WA facility. Excluded: All other employees, office clerical employees, confidential employees, all other editors, guards and supervisors.",14,"Pacific Northwest Newspaper Guild, Local 37082","Open"
"20-RC-277446","Bio-Medical Applications of California, Inc. and Liberty Dialysis-Hawaii LLC; and Liberty Dialysis-North Hawaii LLC, Single Employer","Waimea","05/20/2021","HI","INCLUDED: Registered Nurses employed by the Employer at the Liberty Dialysis North
Hawaii dialysis center (Armour-Globe)

EXCLUDED: Confidential employees, managers, guards, and supervisors as defined by the Act",2,"Hawaii Nurses' Association, OPEIU Local 50","Open"
"20-RC-280026","Hearst Communications, Inc. d/b/a The San Francisco Chronicle","San Francisco","07/16/2021","CA","Included:  Developers, including the newsroom developers and the data visualization developer, employed by the San Francisco Chronicle.

Excluded:  All other employees, managers, guards, and supervisors as defined in the Act.",6,"Pacific Media Workers Guild, TNG-CWA, Local 39521","Open"
"20-RC-281474","Valdivia Trucking","Santa Rosa","08/16/2021","CA","Included:  Drivers, truck washers, mechanics

Excluded:  Dispatchers, clerical employees, and guards and supervisors excluded under the Act",27,"Teamsters Local 665","Open"
