"Case","Case Name","City","Date Filed","State","Voting Unit (Unit A)","No of Eligible Voters","Labor Union1","Status"
"01-RC-284055","HNS Management Company d/b/a CT Transit","Hartford","10/06/2021","CT","Included
All full-time and regular part-time employees in the Planning & Scheduling Departments employed by
the Employer at its Hartford, CT facility. 
Excluded:
All fare inspectors, all other employees, guards, managers, and supervisors as defined in the Act.",14,"AMALGAMATED TRANSIT UNION LOCAL 425, AFL-CIO/CLC","Open"
"01-RC-284132","Durham School Services, LP","Trumbull","10/06/2021","CT","Included:
All full-time and regular part-time dispatchers and mechanics/technicians employed by the
Employer at its facility currently located at 81 Spring Hill Road in Trumbull, Connecticut. 
Excluded:
All other employees, guards, managers, and supervisors as defined by the Act.",5,"Amalgamated Transit Union Local 1336","Open"
"01-RC-284132","Durham School Services, LP","Trumbull","10/06/2021","CT","Included:
All full-time and regular part-time dispatchers and mechanics/technicians employed by the
Employer at its facility currently located at 81 Spring Hill Road in Trumbull, Connecticut. 
Excluded:
All other employees, guards, managers, and supervisors as defined by the Act.",5,"Amalgamated Transit Union Local 1336","Open"
"01-RC-284178","Berkshire VNA","Pittsfield","10/07/2021","MA","Included: All full time, part time, and Per Diem Berkshire VNA RNs & Health Care Professionals
Excluded: Guards and supervisors, all other employees as defined by the Act.",66,"MASSACHUSETTS NURSES ASSOCIATION","Open"
"01-RC-284384","President and Trustees of Bates College","Lewiston","10/08/2021","ME","Included:
All non-tenure and non-tenure track faculty and all staff not excluded below.
Excluded:
All managers, tenured and tenure track faculty, confidential employees, guards and sup",652,"Maine Service Employee Association – SEIU Local 1989","Open"
"01-RC-284750","Connecticut Natural Gas Company","East Hartford","10/18/2021","CT","All full-time and regular part-time, Construction and Maintenance Supervisors, Operations Administrative Assistants, QA/QC Inspectors, Associate Analysts and Technical Support Specialists; but excluding all Managers, Supervisors as defined by the Act, all other employees of the Employer.",8,"Utility Workers Union of America, AFL-CIO","Open"
"01-RC-284756","Southern Connecticut Gas Company","Orange","10/18/2021","CT","All full-time and regular part-time, Construction and Maintenance Supervisors, QA/QC Inspectors, Associate Analysts and Technicians; but excluding all Managers, Supervisors as defined by the Act, all other employees of the Employer",6,"Utility Workers Union of America, AFL-CIO","Open"
"01-RC-285043","The United Illuminating Company","Orange","10/25/2021","CT","Included: All Full Time and Regular Part Time Construction Managers and Vegetations Managers.
Excluded: Supervisors as defined by the act and all other employees of the Employers.",5,"Utility Workers Union of America, AFL-CIO","Open"
"01-RC-285099","Eversource Energy","Berlin","10/25/2021","CT","Included: SCADA Engineers and SCADA Associate Engineers.
Excluded: Guards, Professionals and Supervisors as defined by the Act.",9,"INTERNATIONAL BROTHERHOOD OF ELECTRICAL WORKERS, LOCAL 457, AFL-CIO","Open"
"01-RC-285150","Precision Human Resource Solutions, Inc.","Hartford","10/26/2021","CT","Included: All employees of the Employer at the facility currently located at 317 West Service Road in Hartford, Connecticut.
Excluded: All other employees, supervisors and managers, and guards as defined in the Act.",149,"Amalgamated Transit Union, AFL-CIO/CLC","Open"
"01-RC-286199","Pace Ambulance/Western Maine Health","Norway","11/12/2021","ME","Included:  Full-time and Per-diem EMT's/AEMT's/MEDIC's
Excluded: All other positions covered at Pace Ambulance",38,"INTERNATIONAL BROTHERHOOD OF TEAMSTERS LOCAL 340","Open"
"01-RC-286302","DATTCO (Andover)","Andover","11/16/2021","CT","Included: All full-time and regular part-time bus drivers.
Excluded: All office clerical employees, professional employees, guards, and supervisors defined under the Act.",4,"INTERNATIONAL BROTHERHOOD OF TEAMSTERS, LOCAL 671","Open"
"01-RC-286493","First Transit, Inc.","Exeter","11/18/2021","RI","Included: All employees of the Employer at the facility currently located at 100 Exeter Road.
Ecluded: Supervisors, managers, and guards.",14,"Amalgamated Transit Union Division 618","Open"
"01-RD-286356","Bob's Discount Furniture","Manchester","11/16/2021","NH","Included:  All hourly and commissioned associates. Excluded: All others as defined in the Act.",24,"United Food and Commercial Workers Local 1445 AFL-CIO","Open"
"02-RC-109420","Commercial Building Maintenance Corp.","SYOSSET","07/18/2013","NY","",11,"INTERNATIONAL BROTHERHOOD OF TRADE UNIONS LOCAL 713","Open"
"02-RC-278139","Blue School","New York","06/07/2021","NY","Included:
All full-time and regular part-time professional and non-professional employees of the Employer.

Excluded:
All supervisors, managers, confidential employees and guards as defined by the Act.
",81,"LOCAL 2110, TECHNICAL, OFFICE & PROFESSIONAL UNION, UAW, AFL-CIO","Open"
"02-RC-278139","Blue School","New York","06/07/2021","NY","Included:
All full-time and regular part-time professional and non-professional employees of the Employer.

Excluded:
All supervisors, managers, confidential employees and guards as defined by the Act.
",81,"LOCAL 2110, TECHNICAL, OFFICE & PROFESSIONAL UNION, UAW, AFL-CIO","Open"
"02-RC-278451","Pier 55, Inc. d/b/a Little Island","Manhattan","06/14/2021","NY","Included:
All full-time, part-time, overtime and seasonal stage technicians and stage hands employed by the Employer

Excluded:
All other employees, including all clerical workers, managers, guards, and supervisors as defined by the Act.",19,"Theatrical Protective Union, Local No. One, IATSE, AFL-CIO, CLC","Open"
"02-RC-280769","The New York Times Company","New York","08/02/2021","NY","Included: All full-time and regular part-time engineers, analysts, designers, project managers, product managers, and assistants who perform work for the New York Times’ websites and mobile applications, wherever located in the United States Excluded: managers, supervisors and guards as defined by the Act",600,"The NewsGuild of New York, Local 31003, TNG/CWA","Open"
"02-RC-281723","Professional Referee Organization, Inc. (""""PRO"""")","Manhattan","08/20/2021","NY","Included: Soccer Officials designated by the employer. PRO, as Tiers A, B, and C Officials. 

Excluded: Soccer Officials designated y the employer, PRO, as Tier D",88,"Professional Soccer Referees Association (PSRA)","Open"
"02-RC-283400","sp0n, Inc., dba Citizen","New York","09/22/2021","NY","Included: All full time and regular part time employees of the employer in the Central Ops Department Excluded: All other employees including those in the Central Ops Protect subdepartment, Protect Agents, Shift Managers, Project Managers, supervisors and guards as defined by the Act.",69,"Communications Workers of America","Open"
"02-RC-283400","sp0n, Inc., dba Citizen","New York","09/22/2021","NY","Included: All full time and regular part time employees of the employer in the Central Ops Department Excluded: All other employees including those in the Central Ops Protect subdepartment, Protect Agents, Shift Managers, Project Managers, supervisors and guards as defined by the Act.",69,"Communications Workers of America","Open"
"02-RC-283879","Intrepid Museum Foundation, Inc.","Manhattan","10/04/2021","NY","Included:
All full time and regular part time security officers, gateman and evacuation office

Excluded:
Per diem security officers, locksmith and all other employees and supervisors

",28,"Special Superior Officers Benevolent Association","Open"
"02-RC-284372","Resources for Children with Special Needs, Inc. d/b/a INCLUDEnyc","New York","10/12/2021","NY","Included:
All full time and regular part time employed by the Employer

Excluded:
All confidential employees, managers, guards and supervisors as defined by the Act.
",25,"Office and Professional Employees International Union (OPEIU), Local 153, AFL-CIO","Open"
"02-RC-285419","Start Elevator","Bronx","11/01/2021","NY","Included:
full time field employees

Excluded:
full time office personal, engineers and managers",110,"INTERNATIONAL UNION OF ELEVATOR CONSTRUCTORS, LOCAL NO. 1, OF NEW YORK AND NEW JERSEY, AFL-CIO","Open"
"02-RC-285569","Legoland New York, LLC","Goshen","11/02/2021","NY","Included:
All full time and part time engineers and tech workers

Excluded:  Do a substantial number (30% or more)
All office and professional employees.guards and supervisors under the act.",5,"International Union of Operating Engineers Local 30 AFL-CIO","Open"
"02-RC-285911","Children's Village","Dobbs Ferry","11/08/2021","NY","Included: All security guards and special security counselors

Excluded:
All other employees
",26,"Special Patrolman Benevolent Association","Open"
"02-RC-286035","The Wavecrest Management Team LTD/2340 Beaumont Owner LLC","Bronx","11/10/2021","NY","Included: All full time & regular part time superintendents & porters Excluded: all other employees including office clerical employees, guards & supervisors as defined in the Act.",2,"UWA Local 660","Open"
"02-RC-286040","The Wavecrest Management Team LTD/Brook Ave Owner LLC","Bronx","11/10/2021","NY","Included: All full time & regular part time superintendents and porters Excluded: All other employees including office clerical employees, guards & supervisors as defined in the Act",2,"UWA Local 660","Open"
"02-RC-286045","The Wave Crest Management Team LTD/West 144 Owner LLC","New York","11/10/2021","NY","Included: all full time and regular part time superintendents and porters Excluded: All other employees including office clerical employees, guards & supervisors as defined in the Act",2,"UWA Local 660","Open"
"02-RC-286046","The Wavecrest Management Team LTD/Cranford Owner LLC","Bronx","11/10/2021","NY","Included: All full time & regular part time superintendents & porters Excluded: All other employees including office clerical employees, guards & supervisors as defined in the Act",2,"UWA Local 660","Open"
"02-RC-286187","Taft Garage Corp.","Manhattan","11/12/2021","NY","Included:
All full time  and regular part time employees.

Excluded: All supervisors, professional employees, and guards as defined by the Act.",4,"GARAGE EMPLOYEES LOCAL UNION NO. 272, INTERNATIONAL BROTHERHOOD OF TEAMSTERS","Open"
"02-RC-286205","St. Joseph's Medical Center","Yonkers","11/15/2021","NY","Included: All full time and regular part time, including per diem, Professional employees
employed by the Employer.
Excluded: All other employees, guards, and supervisors as defined in the Act.",50,"1199 SEIU UNITED HEALTH CARE WORKER EAST","Open"
"02-RC-286461","Care for the Homeless and Tolentine-Zeiser CLC","Bronx","11/18/2021","NY","Included: All full-time, part-time, and per diem employees employed by the employer
in the following job classifications:
Housing Specialist, Activities Coordinator, Program Aide, Senior Housing
Specialist, Office Manager, Porter, Community Housing Liaison, Shift
Supervisor, Food Service Worker, Receptionist, Case Aide, Case Manager,
Client Escort, RC — Recreation Coordinator, Intake Worker, Driver,
Administrative Assistant, Superintendent
Excluded: All confidential employees, supervisors and guards as defined by the
National Labor Relations Act.",76,"DISTRICT COUNCIL 37, AFSCME","Open"
"02-RC-286622","Start Elevator","Bronx","11/22/2021","NY","Included:
full time field employees

Excluded:
full time office personnel, engineers and managers
",110,"Local One Elevators Constructors","Open"
"02-RD-152184","Sparks Steak House","New York","05/13/2015","NY","Included:  Waiters and Bartenders

Excluded:  Managers, kitchen staff (including chefs, cooks, dishwashers, kitchen head).",34,"United Food and Commercial Workers Union, Local 342, AFL-CIO","Open"
"02-RD-285700","305 West End Assisted Living","New York","11/04/2021","NY","Included: 
KITCHEN , DINING , FRONT OFFICE AND HOUSEKEEPING 

Excluded: 
REFLECTIONS & WELLNESS",45,"United Food and Commercial Workers Union Local 2013","Open"
"02-RD-285700","305 West End Assisted Living","New York","11/04/2021","NY","Included: 
KITCHEN , DINING , FRONT OFFICE AND HOUSEKEEPING 

Excluded: 
REFLECTIONS & WELLNESS",45,"United Food and Commercial Workers Union Local 2013","Open"
"02-RD-286337","Bayberry Care Center","New Rochelle","11/16/2021","NY","Included:
CNA's, dietary, housekeeping, maintenance, porters, laundry employees

Excluded: guards, supervisors, RN's, LPN's technical employees, confidential employees.",18,"UFCW Local 2013","Open"
"02-UD-098508","Donato Marangi, Inc., Cottage Carting, Inc., and Advanced Waste d/b/a Marangi Disposal","Valley Cottage","02/15/2013","NY","Included:  All full time and regular part time employees employed bythe Employer in and out of the facilities listed above.

Excluded:  All security-supervisors and clerical as defined by the Act.",92,"WASTE MATERIAL, RECYCLING & GENERAL INDUSTRIAL, LOCAL 108","Open"
"03-RC-281879","Pathway Vet Alliance, LLC, Veterinary Specialists & Emergency Services","Rochester","08/25/2021","NY","Included:  All full-time and regular part-time employees.

Excluded:  Managers, supervisors, veterinarians, and guards.",146,"International Association of Machinists and Aerospace Workers","Open"
"03-RC-282115","Starbucks Corporation","Buffalo","08/30/2021","NY","All full-time and regular part-time Baristas, Shift Supervisors, Asst. Store Managers.  Excluded:  Store Managers; office clericals, guards, and supervisors as defined by the Act.",21,"Workers United Upstate","Open"
"03-RC-282115","Starbucks Corporation","Buffalo","08/30/2021","NY","All full-time and regular part-time Baristas, Shift Supervisors, Asst. Store Managers.  Excluded:  Store Managers; office clericals, guards, and supervisors as defined by the Act.",21,"Workers United Upstate","Open"
"03-RC-282127","Starbucks Corporation","Hamburg","08/30/2021","NY","All full-time and regular part-time Baristas, Shift Supervisors, Asst. Store Managers.  Excluded:  Store Managers, office clericals, guards, and supervisors as defined by the Act.",30,"Workers United Upstate","Open"
"03-RC-282139","Starbucks Corporation","Hamburg (Town)","08/30/2021","NY","All full-time and regular part-time Baristas, Shift Supervisors, Asst. Store Managers.  Excluded:  Store Managers, office clericals, guards, and supervisors as defined by the Act.",30,"Workers United Upstate","Open"
"03-RC-282139","Starbucks Corporation","Hamburg (Town)","08/30/2021","NY","All full-time and regular part-time Baristas, Shift Supervisors, Asst. Store Managers.  Excluded:  Store Managers, office clericals, guards, and supervisors as defined by the Act.",30,"Workers United Upstate","Open"
"03-RC-284515","National Audubon Society, Inc.","Troy","10/14/2021","NY","Included:

All full time and regular part-time employees employed by the Employer in the New
York/Connecticut regional office, including employees at nature centers, sanctuaries, and preserves.

Excluded:

All other employees, including employees who report to the National Office, directors, seasonal employees, fellows, interns, confidential employees, guards and supervisors as defined by the Act.",27,"Communications Workers of America","Open"
"03-RC-284515","National Audubon Society, Inc.","Troy","10/14/2021","NY","Included:

All full time and regular part-time employees employed by the Employer in the New
York/Connecticut regional office, including employees at nature centers, sanctuaries, and preserves.

Excluded:

All other employees, including employees who report to the National Office, directors, seasonal employees, fellows, interns, confidential employees, guards and supervisors as defined by the Act.",27,"Communications Workers of America","Open"
"03-RC-284518","National Audubon Society, Inc.","Huntington","10/14/2021","VT","Included:

All full time and regular part-time employees employed by the Employer in the Vermont state office, including employees at nature centers, sanctuaries, and preserves.

Excluded:

All other employees, including employees who report to the National Office, directors, seasonal employees, fellows, interns, confidential employees, guards and supervisors as defined by the Act.",6,"Communications Workers of America","Open"
"03-RC-284518","National Audubon Society, Inc.","Huntington","10/14/2021","VT","Included:

All full time and regular part-time employees employed by the Employer in the Vermont state office, including employees at nature centers, sanctuaries, and preserves.

Excluded:

All other employees, including employees who report to the National Office, directors, seasonal employees, fellows, interns, confidential employees, guards and supervisors as defined by the Act.",6,"Communications Workers of America","Open"
"03-RC-285087","Springfield Hospital Inc.","Springfield","10/26/2021","VT","Employees included:  All full-time, part-time and per diem RNs employed by Springfield Hospital, including RNs at the Windham Center.

Employees Excluded:  Guards and supervisors, and all other employees as defined by the Act.",76,"United Allies and Healthcare Professionals","Open"
"03-RC-285087","Springfield Hospital Inc.","Springfield","10/26/2021","VT","Employees included:  All full-time, part-time and per diem RNs employed by Springfield Hospital, including RNs at the Windham Center.

Employees Excluded:  Guards and supervisors, and all other employees as defined by the Act.",76,"United Allies and Healthcare Professionals","Open"
"03-RC-285929","Starbucks Corporation","Cheektowaga","11/09/2021","NY","All full-time and regular part-time Baristas, Shift Supervisors, Asst Store Managers.  Excluded:  Store Managers; office clericals, guards, and supervisors as defined by the Act.",31,"Workers United","Open"
"03-RC-285986","Starbucks Corporation","Amherst","11/10/2021","NY","All full-time and regular part-time Baristas, Shift Supervisors, Asst. Store Managers.  Excluded:  Store Managers; office clericals, guards, and supervisors.",41,"Workers United","Open"
"03-RC-285989","Starbucks Corporation","Depew","11/10/2021","NY","All full-time and regular part-time Baristas, Shift Supervisors, Asst. Store Managers.  Excluded:  Store Manager; office clericals, guards, and supervisors as defined by the Act.",31,"Workers United","Open"
"03-RC-286024","Hamilton College","Clinton","11/10/2021","NY","All DMC Student Ambassadors.  Excluded:  All other employees, guards, supervisors, confidential employees as defined by the Act.",16,"United Food & Commercial Workers Union Local One","Open"
"03-RC-286034","Hamilton College","Clinton","11/10/2021","NY","All Residential Advisors.  Excluded:  All other employees, guards, supervisors, confidential employees as defined by the Act.",69,"United Food & Commercial Workers Union Local One","Open"
"03-RC-286087","Thompson Sanitation Corporation","Rock Hill","11/12/2021","NY","Included: CDL Drivers, non-CDL drivers, helpers, mechanics, welders Excluded: Supervisors and those in management roles",25,"Waste Material Recycling, and General Industrial Laborers' Local 108","Open"
"03-RD-283004","WNY Bus Company","Blasdell","09/16/2021","NY","Included:  All regular full time and regular part time drivers and aides who are employed at Employers location that work for the Lackawanna School District.

Excluded: All other employees, including maintenance employees, clerical employees, mechanics, dispatchers, professional employees, on-call employees, guards and supervisors as defined in the National Labor Relations Act, as amended.",42,"United Food and Commercial Workers District Union Local One","Open"
"03-RD-284434","STA of New York, Inc.","Newfane","10/13/2021","NY","Included:  As described in certification.  Excluded:  As described in certification.",52,"Truck Drivers Local Union 449 (aka Teamsters Local 449)","Open"
"03-RD-284434","STA of New York, Inc.","Newfane","10/13/2021","NY","Included:  As described in certification.  Excluded:  As described in certification.",52,"Truck Drivers Local Union 449 (aka Teamsters Local 449)","Open"
"04-RC-271327","Airway LLC","Philadelphia","01/13/2021","PA","Included: All full-time and regular part-time employees employed by the Employer at the Philadelphia International Airport performing airport related services.

Excluded: All other employees not described above, employees represented by another union, food service employees, engineers, retail employees, office employees, confidential employees, managers, security guards and supervisors as defined in the Act.",25,"United Construction Trades & Industrial Employees (U.C.T.I.E.) Local 621","Open"
"04-RC-281855","Crestwood Village 3","Manchester Township","08/24/2021","NJ","Included: All full and part time maintenance and custodial workers, and working Foreman/Head of Maintenance. Excluded: All other employees under the Act.",10,"Teamsters, Local 125","Open"
"04-RC-281855","Crestwood Village 3","Manchester Township","08/24/2021","NJ","Included: All full and part time maintenance and custodial workers, and working Foreman/Head of Maintenance. Excluded: All other employees under the Act.",10,"Teamsters, Local 125","Open"
"04-RC-284593","National Audubon Society, Inc.","Philadelphia","10/14/2021","PA","Included:  All full time and regular part-time employees employed by the Employer in the Mid-Atlantic regional office, including employees at nature centers, sanctuaries, and preserves.

Excluded:  All other employees, including employees at the Pickering Creek Center, employees who report to the National Office, directors, seasonal employees, fellows, interns, confidential employees, guards and supervisors as defined by the Act.",18,"Communications Workers of America, AFL-CIO, CLC","Open"
"04-RC-284955","STA of Pennsylvania, Inc.","Macungie","10/22/2021","PA","INCLUDED: Routing coordinators and dispatchers
CURRENTLY INCLUDED: All full-time and regular part-time bus drivers, bus
attendants, substitute drivers, mechanics, and washers employed by the Company at its
facility currently located at 3096 Route 100, Macungie, PA.
CURRENTLY EXCLUDED: Office clerical employees, maintenance manager, and
guards and supervisors as defined in the Act.",4,"Teamsters Local 773","Open"
"04-RC-284988","Hillyard, Inc. d/b/a Hillyard Mid-Atlantic","Warminster","10/22/2021","PA","Included: All full-time and regular part-time drivers employed by the Employer at its Warminster, Pennsylvania facility. 

Excluded: All other employees, office clerical employees, guards and supervisors as defined in the Act.",9,"Highway Truck Drivers and Helpers Local 107","Open"
"04-RC-285717","AES Compassionate Care, LLC d/b/a Curaleaf","Philadelphia","11/04/2021","PA","Included:  All full time and regular part time store associates at the employer's facility

Excluded:  managers, leads, supervisors, guards, professional employees as defined by the Act
",26,"United Food and Commercial Workers Union, Local 1776","Open"
"04-RC-285803","Crozer Chester Medical Center","Chester","11/05/2021","PA","Included: All full-time and regular part-time 
Telecommunications Operators employed by the Employer at its One Medical Center Blvd., Upland, PA facility.

Excluded: All other employees, executive employees, administrators, department heads, confidential employees, office clerical employees, physicians, Crozer students, RNs, technical employees, professional employees, guards, and supervisors as defined in the Act. 
",8,"Professional and Public Service Employees, Local Union 1310","Open"
"04-RC-285811","Amerinox Processing, Inc.","Camden","11/05/2021","NJ","Included:
All full-time and regular part-time shipping/receiving employees, production and maintenance employees

Excluded:
",35,"SMART, Sheet Metal Workers Local 19","Open"
"04-RC-285830","Custom Aire, Inc.","Bensalem","11/08/2021","PA","Included:
All employees employed by the employer at its 962 Bristol Pike, Bensalem, PA location

Excluded:
All managers, office/clerical employees, and guards as defined by the Act",17,"SMART, Sheet Metal Workers Local 19","Open"
"04-RC-286240","PepsiCo","Harrisburg","11/15/2021","PA","Included:  All general warehouse employees at 941 Dana Drive, Harrisburg, PA

Excluded:  All management, clerical staff, confidential employees and guards as defined in the Act",40,"Teamsters Local Union No. 776","Open"
"04-RC-286533","Temple Physicians, Inc.","Philadelphia","11/19/2021","PA","Included:  All full-time, part-time, and per diem Certified Registered Nurse Anesthetists (CRNAs) employed by TPI at Temple North (Fox Chase Cancer Center and Jeans Hospital)

Excluded:  All other employees, and skilled maintenance, guards, confidential employees, and supervisors as defined the Act.",27,"Pennsylvania Association of Staff Nurses and Allied Professionals","Open"
"04-RC-286591","GFP Mobile Mix Supply","Wilmington","11/19/2021","DE","Included:  driver operator

Excluded:  clerical, guards and supervisors as defined by the Act",10,"International Union of Operating  Engineers Local 542","Open"
"04-RC-286606","B. Braun Medical Inc.","Breinigsville","11/22/2021","PA","Included: All full-time and regular part-time, warehouse associates, shipping associates, and forklift operators.

Excluded: All other employees including but not limited to managers, building maintenance, custodians, supervisors, and guards as defined in the act.",53,"Teamster Local Union No. 773","Open"
"04-RD-285496","Jones Lang LaSalle Americas, Inc.","Townsend","11/01/2021","DE","Included:  Operating Engineers Local 542",20,"International Union of Operating Engineers Local 542","Open"
