"27-RC-321862","Region 27, Denver, Colorado","IGT Global Solutions Corporation","Open","07/17/2023","","","Pueblo","CO",7,"","Communications Workers of America, District 7","Included: Computer Operator. Excluded: Operations analyst, Operations supervisor, Operations manager and all others excluded under the Act.",6,"A","Single Labor Organization","Initial","08/28/2023",6,NA,5,"",NA,"",NA,1,6,"",NA,"","Communications Workers of America, District 7","Included: All full-time and regular part-time Computer Operators employed by the Employer at its facility located at 225 North Main Street, Suite 221, Pueblo, CO 81003. Excluded: All Operations Supervisors, Operations Managers, office clerical employees, confidential employees, managerial employees, guards and supervisors, as defined in the Act.","","","","Communications Workers of America, District 7"
"27-RC-321862","Region 27, Denver, Colorado","IGT Global Solutions Corporation","Open","07/17/2023","","","Pueblo","CO",7,NA,"","Included: Computer Operator. Excluded: Operations analyst, Operations supervisor, Operations manager and all others excluded under the Act.",NA,NA,NA,NA,NA,NA,NA,NA,NA,NA,NA,NA,NA,NA,NA,NA,NA,NA,NA,NA,NA,NA,"Communications Workers of America, District 7"
"27-RC-322267","Region 27, Denver, Colorado","CORE Electric Cooperative","Open","07/21/2023","","","Sedalia","CO",23,"","","Included: All full-time and regular part-time employees in the classifications of Member Service Representative 1. Member Service Representative 2, and Member Service Representative Training Specialist employed by the Employer. Excluded: All supervisors, guards, confidential employees, all other employees, and all employees excluded by the Act.",21,"A","Single Labor Organization","Initial","08/23/2023",21,NA,5,"",NA,"",NA,15,22,"",2,"","","Included: All full-time and regular part-time Member Service Representatives 1, Member Service Representatives 2, Member Service Representatives 3, and Training Specialists employed by the Employer at its Headquarters in Sedalia and its District Offices in Bennett, Conifer and Woodland Park. 

Excluded:  All other employees, temporary employees, professional employees, guards and supervisors as defined in the Act.

","","","","International Brotherhood of Electrical Workers, Local 111, AFL-CIO"
"27-RC-322267","Region 27, Denver, Colorado","CORE Electric Cooperative","Open","07/21/2023","","","Sedalia","CO",23,NA,"","Included: All full-time and regular part-time employees in the classifications of Member Service Representative 1. Member Service Representative 2, and Member Service Representative Training Specialist employed by the Employer. Excluded: All supervisors, guards, confidential employees, all other employees, and all employees excluded by the Act.",NA,NA,NA,NA,NA,NA,NA,NA,NA,NA,NA,NA,NA,NA,NA,NA,NA,NA,NA,NA,NA,NA,"International Brotherhood of Electrical Workers, Local 111, AFL-CIO"
"27-RC-322782","Region 27, Denver, Colorado","Colorado Music Festival and Center for Musical Arts","Open","07/31/2023","","","Boulder","CO",67,"","","Included: All tenured and probationary musicians. Excluded: Guest, extra, and substitute musicians.",NA,NA,NA,NA,NA,NA,NA,NA,NA,NA,NA,NA,NA,NA,NA,NA,NA,NA,NA,NA,NA,NA,"Denver Musicians Association, Local 20-623, affiliated with the American Federation of Musicians in the United States and Canada"
"27-RC-322996","Region 27, Denver, Colorado","Starbucks Corporation","Open","08/02/2023","","","Denver","CO",17,"","","Included:  All full-time and regular part-time Baristas and Shift Supervisors.

Excluded:  Store managers, assistant managers, office clericals, guards, professionals, supervisors.",NA,NA,NA,NA,NA,NA,NA,NA,NA,NA,NA,NA,NA,NA,NA,NA,NA,NA,NA,NA,NA,NA,"Chicago & Midwest Regional Joint Board of Workers United/SEIU"
"27-RC-323557","Region 27, Denver, Colorado","Swire Pacific Holdings Inc. d/b/a Swire Coca-Cola, USA","Open","08/10/2023","","","West Valley City","UT",100,"","","Included: Production, Warehouse, Sanitation, Laboratory and Shipping. Excluded: Statutory supervisors, management, office clerical employees and guards.",NA,NA,NA,NA,NA,NA,NA,NA,NA,NA,NA,NA,NA,NA,NA,NA,NA,NA,NA,NA,NA,NA,"International Brotherhood of Teamsters Local 222"
"27-RC-323806","Region 27, Denver, Colorado","Dyna Distribution, Inc. d/b/a Maybee's","Open","08/15/2023","","","Boulder","CO",8,"","","Included: All sales associates and key holders employed by the Employer at its Bouder CO store. Excluded: All office clerical employees, professional employees, guards and supervisors.",NA,NA,NA,NA,NA,NA,NA,NA,NA,NA,NA,NA,NA,NA,NA,NA,NA,NA,NA,NA,NA,NA,"Maybee Employee Committee"
"27-RC-324056","Region 27, Denver, Colorado","Dragonfly Wellness","Open","08/18/2023","","","Salt Lake City","UT",30,"","","Included: All wellness associates, team leads, drivers, delivery leads, inventory specialists, pharmacists and head trainers Excluded: All delivery operations managers, patient experience representatives, fulfillment managers, chief pharmacists, general managers, patient experience managers and delivery personelle managers",NA,NA,NA,NA,NA,NA,NA,NA,NA,NA,NA,NA,NA,NA,NA,NA,NA,NA,NA,NA,NA,NA,"United Food and Commercial Workers, Local 99"
"27-RC-324287","Region 27, Denver, Colorado","Denver Urban Gardens","Open","08/22/2023","","","Denver","CO",11,"","","Included: All regular full-time and part-time employees. Excluded: All supervisory, managerial, confidential, & guard ees under the Act.",NA,NA,NA,NA,NA,NA,NA,NA,NA,NA,NA,NA,NA,NA,NA,NA,NA,NA,NA,NA,NA,NA,"Denver Newspaper Guild-Communications Workers of America Local 37074, AFL-CIO"
"27-RC-324911","Region 27, Denver, Colorado","Intermountain Gas Company","Open","08/31/2023","","","Boise","ID",14,"","","Included: All full-time and regular part-time field operations coordinators employed by the Employer out of its locations at 1527 Hollipark Drive, Idaho Falls, ID 83401, 555S. Cole Road, Boise, ID 83709, 2921 Caldwell Boulevard, Nampa, ID 83561, 451 Alan Drive, Jerome, ID 83338, and 12584 W. Tyhee Road, Pocatello, ID 83202.
Excluded: All other employees, managers, office clericals, guards and supervisors as defined in the Act.",NA,NA,NA,NA,NA,NA,NA,NA,NA,NA,NA,NA,NA,NA,NA,NA,NA,NA,NA,NA,NA,NA,"Plumbers and Fitters Local Union No. 296 and Plumbers and Pipefitters Local Union No. 648 and Plumbers affiliated with United Association of Journeymen and Apprentices of the Plumbing and Pipefitting Industry of the United States and Canada, AFL-CIO"
"27-RD-311324","Region 27, Denver, Colorado","United Food and Commercial Workers, Local 7","Open","02/01/2023","","","Wheat Ridge","CO",24,"","","Included: Organizers, Representatives, Accounting, Secretaries, Information Tech. Excluded: E-board members, Directors, Supervisors.",NA,NA,NA,NA,NA,NA,NA,NA,NA,NA,NA,NA,NA,NA,NA,NA,NA,NA,NA,NA,NA,NA,"Federation of Agents & International Representatives"
"27-RD-321383","Region 27, Denver, Colorado","Starbucks Corporation","Open","07/07/2023","","","Denver","CO",25,"","","Included: Full-time and regular part-time baristas and shift supervisors employed by the Employer at its Store # 5640.

Excluded:  Store Managers, office clerical employees, confidential employees, managerial employees, professional emp",NA,NA,NA,NA,NA,NA,NA,NA,NA,NA,NA,NA,NA,NA,NA,NA,NA,NA,NA,NA,NA,NA,"Chicago & Midwest Regional Joint Board, Workers United/SEIU"
"27-RD-322381","Region 27, Denver, Colorado","Starbucks Corporation","Open","07/25/2023","","","Cottonwood Heights","UT",17,"","","Included: All full-time and regular part time baristas and shift supervisors at Store #50326. Excluded: All Store Managers, office clerical employees, confidential employees, managerial employees, professional employees, guards, and supervisors, as defined in the Act, and all other employees.",NA,NA,NA,NA,NA,NA,NA,NA,NA,NA,NA,NA,NA,NA,NA,NA,NA,NA,NA,NA,NA,NA,"Chicago and Midwest Regional Joint Board, Workers United/SEIU"
"27-RD-323371","Region 27, Denver, Colorado","Crown Cork and Seal USA, Inc.","Open","08/08/2023","","","Worland","WY",85,"","United Steel, Paper and Forestry, Rubber, Manufacturing, Energy, Allied Industrial and Service Workers, District 11, AFL-CIO","Included: All bargaining unit employees as defined in Appendix A of the collective bargaining agreement. Excluded: Managers and supervisors as defined in the Act.",83,"A","Single Labor Organization","Initial","08/31/2023",83,NA,59,"",NA,"",NA,19,78,"",NA,"","United Steel, Paper and Forestry, Rubber, Manufacturing, Energy, Allied Industrial and Service Workers, District 11, AFL-CIO","Included: All full-time and regular part-time electricians, machinists, front end overhaul mechanics, front end mechanics, center section mechanics, back end mechanics, millwrights, chemical process operators, quality control employees, mister press operators, shipping clerks, palletizer operators, forklift operators, cleaner/sorters, spray machine operators, ironer operators, printer operators, storeroom attendants, dunnage sorters, can sorters, and summer helpers employed by the Employer at its facility in Worland, Wyoming.
Excluded: All office clerical employees, professional employees, managers, guards, and supervisors, as defined in the Act.
","","","","United Steel, Paper And Forestry, Rubber, Manufacturing, Energy, Allied And Industrial Service Workers International Union, AFL-CIO, CLC"
"27-RD-323371","Region 27, Denver, Colorado","Crown Cork and Seal USA, Inc.","Open","08/08/2023","","","Worland","WY",85,NA,"","Included: All bargaining unit employees as defined in Appendix A of the collective bargaining agreement. Excluded: Managers and supervisors as defined in the Act.",NA,NA,NA,NA,NA,NA,NA,NA,NA,NA,NA,NA,NA,NA,NA,NA,NA,NA,NA,NA,NA,NA,"United Steel, Paper And Forestry, Rubber, Manufacturing, Energy, Allied And Industrial Service Workers International Union, AFL-CIO, CLC"
"27-RD-324417","Region 27, Denver, Colorado","Zimmerman Metals, Inc.","Open","08/24/2023","","","Denver","CO",40,"","","Included: All production employees engaged in the fabrication of iron, steel, metal products and substitutes in the plant. Excluded: Maintenance employees, supervisors and managers.",NA,NA,NA,NA,NA,NA,NA,NA,NA,NA,NA,NA,NA,NA,NA,NA,NA,NA,NA,NA,NA,NA,"International Association of Ironworkers, Local 853"
"28-RC-161891","Region 28, Phoenix, Arizona","Stern Produce Company, Inc.","Open","10/14/2015","","","Phoenix","AZ",45,"","","Included:  All full-time and regular part-time warehouse workers and drivers employed by the Employer at its facility at 3200 S. 7th St. Phoenix, Arizona.

Exclued:  All sales, accounting, office clerical, and maintenance employees, and all managers, supervisors, and guards as defined by the National Labor Relations Act.",64,"A","Single Labor Organization","Initial","06/12/2020",64,7,NA,"",NA,"",NA,8,36,"",28,"Y","","Included:  All full-time and regular part-time warehouse employees and drivers employed by the Employer at its distribution facility in Phoenix, Arizona.

Excluded:  All sales employees, accounting employees, office clerical employees, maintenance employees, managers, guards, and supervisors as defined by the National Labor Relations Act.","","","","United Food and Commercial Workers Union, Local 99"
"28-RC-161891","Region 28, Phoenix, Arizona","Stern Produce Company, Inc.","Open","10/14/2015",NA,NA,"Phoenix","AZ",45,NA,"","Included:  All full-time and regular part-time warehouse workers and drivers employed by the Employer at its facility at 3200 S. 7th St. Phoenix, Arizona.

Exclued:  All sales, accounting, office clerical, and maintenance employees, and all managers, supervisors, and guards as defined by the National Labor Relations Act.",64,NA,NA,NA,NA,NA,NA,NA,NA,NA,NA,NA,NA,NA,NA,NA,NA,NA,NA,NA,NA,NA,"United Food and Commercial Workers Union, Local 99"
"28-RC-232059","Region 28, Phoenix, Arizona","CEMEX Construction Materials Pacific, LLC","Open","12/03/2018","","","Las Vegas","NV",385,"","International Brotherhood of Teamsters","INCLUDED:  All full-time and regular part-time drivers of ready mix trucks.

EXCLUDED:  All yardmen, batchmen, mechanics, building mechanics, testers/inspectors, safety champions, guards, clericals and supervisors as defined by the Act.",369,"A","Single Labor Organization","Initial","03/13/2019",369,NA,166,"",NA,"",NA,179,361,"",16,"Y","International Brotherhood of Teamsters","Included:  All full-time and regular part-time ready-mix drivers, plant operators II who regularly operate ready-mix trucks, and driver trainers employed by the Employer at its ready-mix facilities in Southern Nevada and Southern California, including its plants in Las Vegas, North Las Vegas, and Sloan, Nevada, and Compton, Corona, Escondido, Fontana, Highland, Hollywood, Irvine, Los Angeles, Moorpark, Oceanside, Orange, Oxnard, Perris, Rialto, San Diego, San Juan Capistrano, Santa Barbara, Santa Paula, Simi Valley, Temecula, and Walnut, California.

Excluded:  All other employees, batch men, yardmen, yardmen/laborers, plant maintenance employees, plant maintenance employees II, plant maintenance foremen, fleet mechanics, fleet mechanic foremen, mechanic foremen, senior driver trainers/safety champions, plant foremen, dispatchers, quality control representatives, office clerical employees, professional employees, guards and supervisors as defined in the Act. 

Plant operators II who regularly operate ready-mix trucks during 25 percent or more of their working time are eligible to vote. 
","","","","International Brotherhood of Teamsters"
"28-RC-232059","Region 28, Phoenix, Arizona","CEMEX Construction Materials Pacific, LLC","Open","12/03/2018",NA,NA,"Las Vegas","NV",385,NA,"International Brotherhood of Teamsters","INCLUDED:  All full-time and regular part-time drivers of ready mix trucks.

EXCLUDED:  All yardmen, batchmen, mechanics, building mechanics, testers/inspectors, safety champions, guards, clericals and supervisors as defined by the Act.",369,NA,NA,NA,NA,NA,NA,NA,NA,NA,NA,NA,NA,NA,NA,NA,NA,NA,NA,NA,NA,NA,"International Brotherhood of Teamsters"
"28-RC-252280","Region 28, Phoenix, Arizona","NP Red Rock LLC d/b/a Red Rock  Casino Resort Spa","Open","11/21/2019","","","Las Vegas","NV",1350,"","Local Joint Executive Board of Las Vegas a/w UNITE HERE International Union","INCLUDED: All full-time and regular part-time Assistant Food Servers, Bakers, Bakers 2,
Bakers 3, Banquets Back Aisle, Banquet Bar Backs, Banquet Bartenders, Banquet Porters,
Banquets Setup, Barbacks, Bar porters. Bar host, Bartenders, Bell Persons, Bell Starters,
Beverage Porters, Beverage Servers, Beverage (Race/Sports), Banquet Servers, Bus
Persons/Bussers, Cake Decorators, Cake Decorators 2, Captains, Coffee Breakers, Concession
Workers, Cooks, Cook’s Helpers, Counter Attendants, Entertainment Bartenders, Food Servers,
Gourmet Hostperson/Cashiers, Host/Cashiers, Flousekeeping Utility Porters, Ice Cream
Concession Workers, Kitchen Runners, Kitchen Workers, Lead Banquet Porters, Lead Counter
Attendants, Lead Servers, Mini Bar Attendants, Mixologists, Pantry, Porters, Resort Guest Room
Attendants, Resort Housepersons, Resort Suite Guest Room Attendants, Resort Steakhouse
Cooks, Restaurant Attendants, Room Runners, Room Service Captains, Runners, Service
Bartenders, Specialty Cooks, Servers, Sprinters, Status Board, Stove Persons, TDR Attendants,
Turndown Guest Room Attendants, Utility Porters, VIP Attendants, VIP Bartenders, and VIP
Lounge Attendants employed by the employer at its facility at 11011 W Charleston Blvd, Las
Vegas, NV.
EXCLUDED: All other employees, front desk employees, valet parkers, gaming employees
(dealers, slot attendants, cage cashiers), inspectresses, engineering and maintenance employees,
office clerical employees, guards, managers, and supervisors as defined by the Act.
",1337,"A","Single Labor Organization","Initial","12/20/2019",1337,7,534,"",NA,"",NA,627,1161,"",NA,"","Local Joint Executive Board of Las Vegas a/w UNITE HERE International Union","INCLUDED: All full-time and regular part-time assistant food servers, bakers (I, II, III), banquet bartenders, banquet porters, banquets setup, bar porters, bartenders, bell persons, bell starters, beverage porters, beverage servers, beverage (Race/Sports), banquet servers, bus persons/bussers, cake decorators (I, II), captains, coffee breakers, concession workers, cooks, cook’s helpers, counter attendants, food servers, gourmet hostperson/cashiers, host/cashiers, housekeeping utility porters, ice cream concession workers, kitchen runners, kitchen workers, lead banquet porters, lead counter attendants, lead servers, mini bar attendants, pantry, porters, resort guest room attendants, resort housepersons, resort suite guest room attendants, resort steakhouse cooks, room runners,  room service captains, runners, service bartenders, specialty cooks, servers, sprinters, status board, stove persons, team member dining room (TDR) attendants, turndown guest room attendants, utility porters, VIP attendants, VIP bartenders, and VIP lounge attendants employed by the Employer at its facility located at 11011 West Charleston Boulevard, Las Vegas, Nevada.

EXCLUDED: All other employees, front desk employees, valet parkers, retail cashier/clerks, gaming employees (dealers, slot attendants, cage cashiers), inspectresses, engineering and maintenance employees, office clerical employees, guards, managers, and supervisors as defined by the Act.
","","","","Local Joint Executive Board of Las Vegas"
"28-RC-252280","Region 28, Phoenix, Arizona","NP Red Rock LLC d/b/a Red Rock  Casino Resort Spa","Open","11/21/2019",NA,NA,"Las Vegas","NV",1350,NA,"Local Joint Executive Board of Las Vegas a/w UNITE HERE International Union","INCLUDED: All full-time and regular part-time Assistant Food Servers, Bakers, Bakers 2,
Bakers 3, Banquets Back Aisle, Banquet Bar Backs, Banquet Bartenders, Banquet Porters,
Banquets Setup, Barbacks, Bar porters. Bar host, Bartenders, Bell Persons, Bell Starters,
Beverage Porters, Beverage Servers, Beverage (Race/Sports), Banquet Servers, Bus
Persons/Bussers, Cake Decorators, Cake Decorators 2, Captains, Coffee Breakers, Concession
Workers, Cooks, Cook’s Helpers, Counter Attendants, Entertainment Bartenders, Food Servers,
Gourmet Hostperson/Cashiers, Host/Cashiers, Flousekeeping Utility Porters, Ice Cream
Concession Workers, Kitchen Runners, Kitchen Workers, Lead Banquet Porters, Lead Counter
Attendants, Lead Servers, Mini Bar Attendants, Mixologists, Pantry, Porters, Resort Guest Room
Attendants, Resort Housepersons, Resort Suite Guest Room Attendants, Resort Steakhouse
Cooks, Restaurant Attendants, Room Runners, Room Service Captains, Runners, Service
Bartenders, Specialty Cooks, Servers, Sprinters, Status Board, Stove Persons, TDR Attendants,
Turndown Guest Room Attendants, Utility Porters, VIP Attendants, VIP Bartenders, and VIP
Lounge Attendants employed by the employer at its facility at 11011 W Charleston Blvd, Las
Vegas, NV.
EXCLUDED: All other employees, front desk employees, valet parkers, gaming employees
(dealers, slot attendants, cage cashiers), inspectresses, engineering and maintenance employees,
office clerical employees, guards, managers, and supervisors as defined by the Act.
",1337,NA,NA,NA,NA,NA,NA,NA,NA,NA,NA,NA,NA,NA,NA,NA,NA,NA,NA,NA,NA,NA,"Local Joint Executive Board of Las Vegas"
"28-RC-263057","Region 28, Phoenix, Arizona","Westside Plumbing LLC","Open","07/15/2020","","","Bernalillo","NM",30,"","","Included:
All  full-time  and  regular  part-time  journeymen  plumbers,  apprentice  plumbers,  and plumber  helpers/laborers  employed  by  the  Employer  out  of  its  facility  located  at  423 Calle Industrial, Bernalillo, NM 87004.

Excluded:
All   other   employees,   office   clerical   employees,   guards,   managerial   employees, supervisors as defined by the Act.

",40,"A","Single Labor Organization","Initial","10/15/2020",40,2,1,"",NA,"",NA,4,7,"",2,"","","Included:  All full-time and regular part-time journeymen plumbers, apprentice plumbers, and plumber helpers/laborers employed by the Employer at its facility in Bernalillo, New Mexico.

Excluded:  All other employees, office clerical employees, managerial employees, guards, and supervisors as defined in the Act.
","","","","United Association of Plumbers and Pipefitters Local 412"
"28-RC-263057","Region 28, Phoenix, Arizona","Westside Plumbing LLC","Open","07/15/2020",NA,NA,"Bernalillo","NM",30,NA,"","Included:
All  full-time  and  regular  part-time  journeymen  plumbers,  apprentice  plumbers,  and plumber  helpers/laborers  employed  by  the  Employer  out  of  its  facility  located  at  423 Calle Industrial, Bernalillo, NM 87004.

Excluded:
All   other   employees,   office   clerical   employees,   guards,   managerial   employees, supervisors as defined by the Act.

",40,NA,NA,NA,NA,NA,NA,NA,NA,NA,NA,NA,NA,NA,NA,NA,NA,NA,NA,NA,NA,NA,"United Association of Plumbers and Pipefitters Local 412"
"28-RC-280235","Region 28, Phoenix, Arizona","Prep & Pastry Restaurant LLC","Open","07/20/2021","","","Tucson","AZ",60,"","United Food & Commercial Workers International Union, Local 99, AFL-CIO, CLC","INCLUDED:  All full-time and part-time kitchen employees, line cooks, prep cooks, dishwashers, bussers, servers, hostess, bakers and bartenders

EXCLUDED:  All other employees, office clerical employees, guards and supervisors as defined by the Act.",41,"A","Single Labor Organization","Initial","09/20/2021",41,2,7,"",NA,"",NA,12,23,"",4,"","United Food & Commercial Workers International Union, Local 99, AFL-CIO, CLC","INCLUDED: All full-time and regular part-time kitchen employees, line cooks, prep cooks, dishwashers, bussers, servers, hostess, bakers and bartenders employed by the Employer at its Tucson, Arizona facility.

EXCLUDED: All other employees, office clerical employees, professional employees,
managerial employees, guards and supervisors as defined in the Act.

Others permitted to vote: The parties have agreed that cleaners may vote in the election but their ballots will be challenged since their eligibility has not been resolved. No decision has been made regarding whether the individuals in this classification or group are included in, or excluded from, the bargaining unit. The eligibility or inclusion of these individuals will be resolved, if necessary, following the election.","","","","United Food & Commercial Workers International Union, Local 99, AFL-CIO"
"28-RC-280235","Region 28, Phoenix, Arizona","Prep & Pastry Restaurant LLC","Open","07/20/2021",NA,NA,"Tucson","AZ",60,NA,"United Food & Commercial Workers International Union, Local 99, AFL-CIO, CLC","INCLUDED:  All full-time and part-time kitchen employees, line cooks, prep cooks, dishwashers, bussers, servers, hostess, bakers and bartenders

EXCLUDED:  All other employees, office clerical employees, guards and supervisors as defined by the Act.",41,NA,NA,NA,NA,NA,NA,NA,NA,NA,NA,NA,NA,NA,NA,NA,NA,NA,NA,NA,NA,NA,"United Food & Commercial Workers International Union, Local 99, AFL-CIO"
"28-RC-285574","Region 28, Phoenix, Arizona","Akima Global Services, Inc.","Open","10/26/2021","","","Florence","AZ",250,"","United Government Security Officers of America International Union, & Its Local 823 (UGSOA)","INCLUDED:  all full and part time Detention, Armed Detention and Armed Transportation Officers employed by the Company at the ICE Florence Detention Center

EXCLUDED:  other employees, including clerical and professional employees as defined in the National Labor Relations Act",235,"A","Two Labor Organizations","Rerun","05/05/2023",276,10,89,"International Union, Security, Police & Fire Professionals of America (SPFPA) & Its Local 830",6,"",NA,3,98,"",NA,"","United Government Security Officers of America International Union, & Its Local 823 (UGSOA)","Included: All full-time and regular part-time detention officers, armed detention officers, and armed transportation officers performing guard duties as defined in Section 9(b)(3) of the National Labor Relations Act, employed by the Employer at the ICE Detention Center in Florence, Arizona, under contract to the United States Immigration and Customs Enforcement, Contract # 70CDCR20D00000004.
. 
Excluded: All other employees, office clerical employees, professional employees, managers and supervisors as defined in the Act.
","","","","United Government Security Officers of America, International Union (UGSOA) and its Local 381"
"28-RC-285574","Region 28, Phoenix, Arizona","Akima Global Services, Inc.","Open","10/26/2021",NA,NA,"Florence","AZ",250,NA,"United Government Security Officers of America International Union, & Its Local 823 (UGSOA)","",235,NA,NA,NA,NA,NA,NA,NA,NA,NA,NA,NA,NA,NA,NA,NA,NA,NA,NA,NA,NA,NA,"United Government Security Officers of America, International Union (UGSOA) and its Local 381"
"28-RC-288928","Region 28, Phoenix, Arizona","Resorts World Las Vegas LLC","Open","01/12/2022","","","Las Vegas","NV",9,"","","Included: All regular full-time and regular part-time employees working at the Gaming Technician Department in the following classifications: Lead Gaming Tech and Gaming Tech. 
Excluded: All Secretarial, office Clerical, sales and all managers, supervisors and guards as defined in the National Labor Relations Act.",9,"A","Single Labor Organization","Initial","03/09/2022",9,NA,4,"",NA,"",NA,4,8,"",NA,"","","INCLUDED:  All full-time and regular part-time Gaming Technicians employed by the Employer in Las Vegas, Nevada.

EXCLUDED: All other employees, office clerical employees, sales employees, professional employees, guards, and supervisors as defined in the Act.","","","","International Union of Operating Engineers, Local 501 AFL-CIO"
