"Case","Region","Case Name","Status","Date Filed","Date Closed","Reason Closed","City","State","Employees on charge/petition","Allegations","Union","Unit Sought","Voters","Unit ID","Ballot Type","Tally Type","Tally Date","No of Eligible Voters","Void Ballots","Votes for Labor Union1","Labor Union2","Votes for Labor Union2","Labor Union3","Votes for Labor Union3","Votes Against","Total Ballots Counted","Runoff Required","Challenged Ballots","Challenges are Determinative","Union to Certify","Voting Unit (Unit A)","Voting Unit (Unit B)","Voting Unit (Unit C)","Voting Unit (Unit D)","Labor Union1"
"01-RC-288998","Region 01, Boston, Massachusetts","I.N.S.A., Inc.","Open","01/18/2022","","","Salem","MA",28,"","","Included: All full-time and part-time retail associates, retail leads, inventory associates, and inventory leads employed by the employer at its 462 Highland Ave, Salem, MA facility.
Excluded: All other employees, asset protection employees, managerial employees, professional employees, guards and supervisors as defined by the Act.",NA,NA,NA,NA,NA,NA,NA,NA,NA,NA,NA,NA,NA,NA,NA,NA,NA,NA,NA,NA,NA,NA,"UNITED FOOD AND COMMERCIAL WORKERS UNION LOCAL 1445"
"01-RC-304016","Region 01, Boston, Massachusetts","Champion Specialty Services as Joint Employer with Holtec Decommissioning International (HDI)","Open","09/23/2022",NA,NA,"Plymouth","MA",16,NA,"","lncluded: All employees working as Laborers to perform the work associated with and required to decommission, decontaminate, demolish, and restore the Pilgrim Nuclear Power Generation site. Excluded: All other employees, employees working as Electricians, employees working as operating Engineers, office and clerical employees, professional
employees, watchmen, guards, and supervisors as defined in the Act.",NA,NA,NA,NA,NA,NA,NA,NA,NA,NA,NA,NA,NA,NA,NA,NA,NA,NA,NA,NA,NA,NA,"LABORERS INTERNATIONAL UNION OF NORTH AMERICA"
"01-RC-304042","Region 01, Boston, Massachusetts","Massachusetts Institute of Technology","Open","09/26/2022","","","Cambridge","MA",1000,"","","Included:	All graduate fellows enrolled in Massachusetts Institute of Technology (MIT) degree programs who are employed to provide instructional or research services.

Excluded:  All other employees; undergraduate students; graduate student resident advisors; hourly graders who are not also graduate fellows; graduate students not seeking MIT degrees, including visiting students; office clericals; managers; guards and supervisors as defined in the Act.
 
",NA,NA,NA,NA,NA,NA,NA,NA,NA,NA,NA,NA,NA,NA,NA,NA,NA,NA,NA,NA,NA,NA,"UNITED ELECTRICAL RADIO & MACHINE WORKERS OF AMERICA (UE)"
"01-RC-305104","Region 01, Boston, Massachusetts","Brown University","Open","10/13/2022","","","Providence","RI",34,"","","Included: Masters of Fine Arts Graduate Students employed as actors and directors.
Excluded: Supervisory faculty, Managers, Guards.",NA,NA,NA,NA,NA,NA,NA,NA,NA,NA,NA,NA,NA,NA,NA,NA,NA,NA,NA,NA,NA,NA,"GRADUATE LABOR ORGANIZATION, RIFT-AFT LOCAL 6516"
"01-RC-306528","Region 01, Boston, Massachusetts","Electric Boat Corporation","Open","11/03/2022","","","Groton","CT",22,"","","Included: Firefighters Excluded: non-firefighters / management",NA,NA,NA,NA,NA,NA,NA,NA,NA,NA,NA,NA,NA,NA,NA,NA,NA,NA,NA,NA,NA,NA,"Southeastern CT Fire Professionals Union"
"01-RC-309281","Region 01, Boston, Massachusetts","Paragon Systems Inc.","Open","12/21/2022","","","Boston","MA",150,"","United Federation LEOS-PBA Law Enforcement Officers Security & Police Benevolent Association","Included: All full-time and regular part-time armed and unarmed Protective Security Officers (“PSO”) employed by Paragon Systems performing guard duties as defined by Section 9 (b)(3) of the National Labor Relations Act, assigned to federal buildings in the State of Massachusetts under Employer's Contract No. 70RFP118DE1000001 with the Department of Homeland Security, Federal Protective Service Excluded: All office clerical employees, professional employees and supervisors as defined by the Act.",140,"A","Three Labor Organizations","Initial","06/05/2023",140,2,36,"International Union, Security, Police, and Fire Professionals of America (SPFPA)",18,"UNITED GOVERNMENT SECURITY OFFICERS OF AMERICA AND ITS LOCAL 273",14,NA,68,"",NA,"","United Federation LEOS-PBA Law Enforcement Officers Security & Police Benevolent Association","All full-time and regular part-time armed and unarmed Protective Security Officers employed by Paragon Systems, Inc. performing guard duties as defined by Section 9(b)(3) of the National Labor Relations Act, assigned to federal buildings in the Commonwealth of Massachusetts under Employer’s Contract 70RFP118DE1000001 with the Department of Homeland Security, Federal Protective Service.

Excluded: All office clerical employees, professional employees and supervisors
as defined by the Act.
","","","","United Federation LEOS-PBA Law Enforcement Officers Security & Police Benevolent Association"
"01-RC-309535","Region 01, Boston, Massachusetts","Paragon Systems Inc.","Open","12/27/2022","","","Boston","MA",140,"","","All full-time and regular part-time armed and unarmed Protective Security Officers (PSO) employed by Paragon Systems performing guard duties as defined by Section 9(b)(3) of the NLRA, assigned to federal buildings in the state of Massachusetts under Employer's Contract No 70RFP118DE1000001 with the Department of Homeland Security, Federal Protective Service; but excluding, 
 all office clerical employees, professional employees, and supervisors as defined in the Act.",NA,NA,NA,NA,NA,NA,NA,NA,NA,NA,NA,NA,NA,NA,NA,NA,NA,NA,NA,NA,NA,NA,"UNITED GOVERNMENT SECURITY OFFICERS OF AMERICA AND ITS LOCAL 273"
"01-RC-310539","Region 01, Boston, Massachusetts","Verano Four Daughters Holdings, LLC","Open","01/18/2023","","","Sharon","MA",27,"","","Included:  All full-time and regular part-time lab/extraction employees, kitchen employees, post-harvest employees, packaging employees, driver/transport employees, and custodian/sanitation employees.
Excluded:  Cultivation employees, supervisors, managers, guards.",24,"A","Single Labor Organization","Initial","02/22/2023",24,NA,6,"",NA,"",NA,9,15,"",5,"Y","","Included:	All full-time and regular part-time edibles leads, sanitation specialists, packaging specialists, distribution specialists, maintenance technicians, extraction specialists, harvest specialists, production specialists, extraction leads, and post-harvest employees.
Excluded:	All agricultural employees, confidential employees, office clerical employees, managers, and guards, professional employees and supervisors as defined by the Act.
","","","","United Food and Commercial Workers Local 1445 AFL-CIO, CLC"
"01-RC-310539","Region 01, Boston, Massachusetts","Verano Four Daughters Holdings, LLC","Open","01/18/2023",NA,NA,"Sharon","MA",27,NA,"","Included:  All full-time and regular part-time lab/extraction employees, kitchen employees, post-harvest employees, packaging employees, driver/transport employees, and custodian/sanitation employees.
Excluded:  Cultivation employees, supervisors, managers, guards.",24,NA,NA,NA,NA,NA,NA,NA,NA,NA,NA,NA,NA,NA,NA,NA,NA,NA,NA,NA,NA,NA,"United Food and Commercial Workers Local 1445 AFL-CIO, CLC"
"01-RC-311566","Region 01, Boston, Massachusetts","Northeastern University","Open","02/06/2023","","","Boston","MA",1700,"","","Included: All graduate student employees enrolled at Northeastern University who provide instructional services or research services. These include, but is not limited to, all Student Graduate Assistants (SGA), Teaching Assistants (instructors of record, teaching assistants, readers, graders, and graduate workers at the Writing Center), all Graduate Assistants and all graduate Research Assistants (regardless of funding source) employed by the Employer at the Boston, Nahant and Burlington campuses. Excluded: All undergraduate students employed by the employer, and all other employees, guards, and supervisors as defined in the Act.",NA,NA,NA,NA,NA,NA,NA,NA,NA,NA,NA,NA,NA,NA,NA,NA,NA,NA,NA,NA,NA,NA,"GRADUATE EMPLOYEES OF NORTHEASTERN UNIVERSITY - UAW"
"01-RC-312846","Region 01, Boston, Massachusetts","Starbucks Corporation","Open","02/24/2023","","","Somerville","MA",13,"","Workers United a/w SEIU","Included: All full-time and regular part-time baristas and shift managers. Excluded: Store Managers.",10,"A","Single Labor Organization","Initial","08/17/2023",10,NA,8,"",NA,"",NA,NA,8,"",NA,"","Workers United a/w SEIU","All full-time and regular part-time baristas performing work at the Employer’s store located at 711 Somerville Ave., Somerville, MA, 02143 but excluding all store managers, shift managers, office clericals, guards, and supervisors as defined in the Act.


","","","","Workers United"
"01-RC-312846","Region 01, Boston, Massachusetts","Starbucks Corporation","Open","02/24/2023","","","Somerville","MA",13,NA,"","Included: All full-time and regular part-time baristas and shift managers. Excluded: Store Managers.",NA,NA,NA,NA,NA,NA,NA,NA,NA,NA,NA,NA,NA,NA,NA,NA,NA,NA,NA,NA,NA,NA,"Workers United"
"01-RC-313008","Region 01, Boston, Massachusetts","Starbucks Corporation","Open","02/27/2023","","","Newton","MA",15,"","Workers United, a/w SEIU","Included:  All full-time and regular part-time baristas and shift managers.  Excluded:  Store Managers",8,"A","Single Labor Organization","Initial","08/17/2023",8,NA,6,"",NA,"",NA,NA,6,"",NA,"","Workers United, a/w SEIU","All full-time and regular part-time baristas performing work at the Employer’s store located at 259 Centre St., Newton Centre, MA, 02458; but excluding all store managers, shift managers, office clericals, guards, and supervisors as defined in the Act.","","","","Workers United, a/w SEIU"
"01-RC-313008","Region 01, Boston, Massachusetts","Starbucks Corporation","Open","02/27/2023","","","Newton","MA",15,NA,"","Included:  All full-time and regular part-time baristas and shift managers.  Excluded:  Store Managers",NA,NA,NA,NA,NA,NA,NA,NA,NA,NA,NA,NA,NA,NA,NA,NA,NA,NA,NA,NA,NA,NA,"Workers United, a/w SEIU"
"01-RC-313126","Region 01, Boston, Massachusetts","Northeastern University","Open","03/01/2023","","","Boston","MA",14,"","","Included: All full-time and regular part-time sergeants, detectives, and detective sergeants employed by the University at its Boston campus. Excluded: All other employees",NA,NA,NA,NA,NA,NA,NA,NA,NA,NA,NA,NA,NA,NA,NA,NA,NA,NA,NA,NA,NA,NA,"American Coalition of Public Safety"
"01-RC-314723","Region 01, Boston, Massachusetts","Reviewed, a division of Gannett Satellite Information Network, LLC","Open","03/23/2023","","","Cambridge","MA",25,"","","All full time and regular part time Lab Technician/Product Test Technician employees, Senior Manager of Lab Operations, the Logistics Coordinator and the Operations Coordinator, of the Employer.

All other employees, including managers, guards, and supervisors as defined by the Act
",NA,NA,NA,NA,NA,NA,NA,NA,NA,NA,NA,NA,NA,NA,NA,NA,NA,NA,NA,NA,NA,NA,"The NewsGuild - CWA"
"01-RC-314724","Region 01, Boston, Massachusetts","Reviewed, a division of Gannett Satellite Information Network, LLC","Open","03/23/2023","","","Cambridge","MA",38,"","","Description of Present Unit: 
Included: All full-time and regular part-time content analysts, staff writers, editors, digital producers, graphic designers, photo editors, photographer/videographers, senior multimedia producers, and data entry employees

Excluded: All other employees, including newsletter editor & strategists, newsletter writers, lab technician/product test technicians, operations coordinators, logistics coordinators, managers, confidential employees, office clerical employees and guards, and supervisors as defined in the Act.

Description of Proposed Unit:
Included: All full-time and regular part-time content analysts, staff writers, editors, digital producers, graphic designers, photo editors, photographer/videographers, senior multimedia producers, newsletter writers, and data entry employees

Excluded: All other employees, including newsletter editor & strategists, lab technician/product test technicians, operations coordinators, logistics coordinators, managers, confidential employees, office clerical employees and guards, and supervisors as defined in the Act. 
",NA,NA,NA,NA,NA,NA,NA,NA,NA,NA,NA,NA,NA,NA,NA,NA,NA,NA,NA,NA,NA,NA,"The NewsGuild - CWA"
"01-RC-314865","Region 01, Boston, Massachusetts","Public Service of New Hampshire d/b/a Eversource Energy","Open","03/27/2023","","","Manchester","NH",24,"","","Included:
All ESCC System Operators including Control Room Operator, Systems Operator, Shift 
Operation Supervisor, Shift Operation Supervisor Level 1 & Shift Operation Supervisor Level 2
Excluded:
All other employees, guards, professional employees, and supervisors as defined in the
Act.",NA,NA,NA,NA,NA,NA,NA,NA,NA,NA,NA,NA,NA,NA,NA,NA,NA,NA,NA,NA,NA,NA,"INTERNATIONAL BROTHERHOOD OF ELECTRICAL WORKERS LOCAL 103"
"01-RC-317281","Region 01, Boston, Massachusetts","President and Fellows of Harvard College (Harvard University)","Open","05/03/2023","","","Cambridge","MA",500,"","","

All full-time and regular part-time undergraduate and graduate students enrolled in degree programs at Harvard University and who are employed by Harvard University as non-academic service employees in (1) the Harvard Library System;1 (2) Dining Services cafes;2 (3) Cambridge Queen’s Head Pub; and (4) in the Office of BGLTQ+ Life; the Harvard Foundation for Intercultural and Race Relations; and the Harvard College Women's Center.

Excluded
Managerial employees, guards, and professional employees as defined by the Act, and all other 
employees; and excluding any student employees working at the Arnold Arbo etum
Horticultural Library, Biblioteca Berenson, Dumbarton Oaks Research Library.


1 The known worksite locations are: 625 Massachusetts Avenue, Baker Library and Special 
Collections, Botany Libraries, Cabot Science Library, Countway Library, Ernst Mayr Library, Fine Arts Library, Frances Loeb Library, Fung Library, Gutman Library, Harvard Divinity School Library, Harvard Film Archive, Harvard Law School Library, Harvard Map Collection, Harvard University Archives, Harvard-Yenching Library, HKS Library and Research Services, Houghton Library, Lamont Library, Loeb Music Library, Robbins Library of Philosophy, Schlesinger Library on the History of Women in America, Science and Engineering Complex Library, Tozzer Library, Widener Library, Wolbach Library and Woodberry Poetry Room.

2 The known worksite locations are: Barker, Cafe Gato Rojo, GSAS Commons, HDS Commons, HKS, HLS Harkness Dining Room, Pub Grill, Harkbox & Catering, HLS Pub, LISE, Lamont, Northwest, and SEC.


",NA,NA,NA,NA,NA,NA,NA,NA,NA,NA,NA,NA,NA,NA,NA,NA,NA,NA,NA,NA,NA,NA,"Harvard Undergraduate Workers Union- UAW Local 5118"
"01-RC-318449","Region 01, Boston, Massachusetts","North Shore Mechanical Contractors, LLC","Open","05/19/2023","","","Wilmington","MA",60,"","","Included: All full time and regular part-time plumbers, apprentices and laborers employed by North Shore Mechanical Contractors. Excluded: All other employees, office clerical employees, supervisors, managers and guards as defined by the National Labor Relations Act.",70,"A","Single Labor Organization","Initial","06/30/2023",70,NA,30,"",NA,"",NA,34,64,"",6,"Y","","","","","","United Association of Journeymen and Apprentices of the Plumbing and Pipefitting Industry of the United States and Canada, Local 12, AFL-CIO"
"01-RC-318449","Region 01, Boston, Massachusetts","North Shore Mechanical Contractors, LLC","Open","05/19/2023","","","Wilmington","MA",60,NA,"","Included: All full time and regular part-time plumbers, apprentices and laborers employed by North Shore Mechanical Contractors. Excluded: All other employees, office clerical employees, supervisors, managers and guards as defined by the National Labor Relations Act.",NA,NA,NA,NA,NA,NA,NA,NA,NA,NA,NA,NA,NA,NA,NA,NA,NA,NA,NA,NA,NA,NA,"United Association of Journeymen and Apprentices of the Plumbing and Pipefitting Industry of the United States and Canada, Local 12, AFL-CIO"
"01-RC-318931","Region 01, Boston, Massachusetts","Public Service of New Hampshire d/b/a Eversource Energy","Open","05/26/2023","","","Manchester","NH",24,"","","Included:  All Distribution System Operators and Associate Distribution System Operators. Excluded:  All others as defined in the Act.",NA,NA,NA,NA,NA,NA,NA,NA,NA,NA,NA,NA,NA,NA,NA,NA,NA,NA,NA,NA,NA,NA,"INTERNATIONAL BROTHERHOOD OF ELECTRICAL WORKERS LOCAL 1837"
"01-RC-319255","Region 01, Boston, Massachusetts","Public Service Co. of New Hampshire d/b/a Eversource Energy","Open","06/02/2023","","","Manchester","NH",89,"","","Included: All full-time and regular part-time Working Foremen, Line in the New Hampshire
Line Department, including Working Foremen, Line, Transmission
To be included in existing Utility Group Contract bargaining unit.
Excluded: Supervisors, managers, confidential employees, and guards as defined by the Act.",NA,NA,NA,NA,NA,NA,NA,NA,NA,NA,NA,NA,NA,NA,NA,NA,NA,NA,NA,NA,NA,NA,"INTERNATIONAL BROTHERHOOD OF ELECTRICAL WORKERS LOCAL 1837"
"01-RC-321092","Region 01, Boston, Massachusetts","Commonwealth Flats Dev Corp d/b/a Seaport Hotel Boston","Open","07/03/2023","","","Boston","MA",48,"","","Included:  Banquet servers, Banquet Bartenders, Banquet Bar Backs, Convention Services Housepersons, Convention, Services Houseperson Supervisors.  Excluded:  All of other classifications, and all managers, supervisors, and guards as defined in the Act.",NA,NA,NA,NA,NA,NA,NA,NA,NA,NA,NA,NA,NA,NA,NA,NA,NA,NA,NA,NA,NA,NA,""
"01-RC-321901","Region 01, Boston, Massachusetts","Trustees of Boston University","Open","07/17/2023","","","Boston","MA",6,"","","Included: All Postdoctoral Associates teaching in the Boston University Kilachand Honors
College to be added to the Salaried Lecturers and Instructors unit. Excluded: All other employees.",NA,NA,NA,NA,NA,NA,NA,NA,NA,NA,NA,NA,NA,NA,NA,NA,NA,NA,NA,NA,NA,NA,"Service Employees International Union, Local 509"
"01-RC-321910","Region 01, Boston, Massachusetts","Fenway Community Health Center, Inc.","Open","07/17/2023","","","Boston","MA",430,"","","Included:  All eligible employees of Fenway Health, including those working at Boomrangs.  Excluded:  All supervisors, managers, confidential employees, and guards.",NA,NA,NA,NA,NA,NA,NA,NA,NA,NA,NA,NA,NA,NA,NA,NA,NA,NA,NA,NA,NA,NA,"1199SEIU United Healthcare Workers East"
"01-RC-322286","Region 01, Boston, Massachusetts","Jasper Hill Creamery, Inc. and Cellars at Jasper Hill LLC, a single employer d/b/a Jasper Hill Farm","Open","07/24/2023","","","Greensboro Bend","VT",45,"","","Included:  All full-time and regular part-time employees engaged in creamery/cheese production, cellar/affinage, quality assurance, maintenance, warehouse, and fullfillment operations at the Employer's facilities in Greensboro, VT and Hardwick, VT.  
Excluded:  Employees in the Sales department, office clerical employees, managerial employees, and guards, professional employees, and supervisors with the meaning of the Act.",NA,NA,NA,NA,NA,NA,NA,NA,NA,NA,NA,NA,NA,NA,NA,NA,NA,NA,NA,NA,NA,NA,"United Food and Commercial Workers Union Local 1459"
"01-RC-322483","Region 01, Boston, Massachusetts","Starbucks Corporation","Open","07/26/2023","","","Beverly","MA",24,"","","Included: All full-time and regular part-time baristas and shift managers. Excluded: Store managers.",NA,NA,NA,NA,NA,NA,NA,NA,NA,NA,NA,NA,NA,NA,NA,NA,NA,NA,NA,NA,NA,NA,"WORKERS UNITED A/W SERVICE EMPLOYEES INTERNATIONAL UNION"
"01-RC-322988","Region 01, Boston, Massachusetts","Holistic Industries, Inc.","Open","08/02/2023","","","Monson","MA",40,"","","Included: All full-time and regular part-time non-cultivation employees at the Employer’s
facility located in Monson, MA
Excluded: Cultivation employees, managerial employees, and guards, professional employees,
and supervisors within the meaning of the Act.",NA,NA,NA,NA,NA,NA,NA,NA,NA,NA,NA,NA,NA,NA,NA,NA,NA,NA,NA,NA,NA,NA,"United Food and Commercial Workers Union Local 1459"
"01-RC-323187","Region 01, Boston, Massachusetts","L3Harris Technologies, Inc.","Open","08/04/2023","","","Northampton","MA",21,"","","Included: All full time and part time Test Technicians.
Excluded: All usual exclusions including managers, supervisors, office clerical, and guards.
",NA,NA,NA,NA,NA,NA,NA,NA,NA,NA,NA,NA,NA,NA,NA,NA,NA,NA,NA,NA,NA,NA,"INTERNATIONAL ASSOCIATION OF MACHINISTS AND AEROSPACE WORKERS AFL-CIO, DISTRICT 15 1420"
"01-RC-323236","Region 01, Boston, Massachusetts","The Bridgespan Group, Inc.","Open","08/07/2023","","","Boston","MA",149,"","","Included:  All full-time and regular part-time employees employed by the Employer.
Excluded:  All confidential employees, managers, guards, and supervisors defined by the Act.",NA,NA,NA,NA,NA,NA,NA,NA,NA,NA,NA,NA,NA,NA,NA,NA,NA,NA,NA,NA,NA,NA,"Office and Professional Employees International Union Local 6"
"01-RC-323539","Region 01, Boston, Massachusetts","Michaels Stores, Inc.","Open","08/10/2023","","","Hadley","MA",24,"","","All full-time and regular part-time employees employed by the Employer at its 325 Russell St. Unit B, Hadley Massachusetts facility, including service team members, framers, customer experience managers, framing managers, operations managers and replenishment managers but excluding, general managers, and guards, professional employees, and supervisors within the meaning of the Act.",NA,NA,NA,NA,NA,NA,NA,NA,NA,NA,NA,NA,NA,NA,NA,NA,NA,NA,NA,NA,NA,NA,"United Food and Commercial Workers Union Local 1459"
"01-RC-323997","Region 01, Boston, Massachusetts","Staples","Open","08/17/2023","","","Brunswick","ME",7,"","","Included: Print and Marketing Technology Associates, Print and Marketing Supervisor, Technology Supervisor. 
Excluded: Office clerical, professional, managerial, guards and supervisors as defined in the Act.
",NA,NA,NA,NA,NA,NA,NA,NA,NA,NA,NA,NA,NA,NA,NA,NA,NA,NA,NA,NA,NA,NA,"INTERNATIONAL ASSOCIATION OF MACHINISTS & AEROSPACE WORKERS, AFL-CIO, DISTRICT LODGE 4"
"01-RC-324255","Region 01, Boston, Massachusetts","Kaycha MA LLC","Open","08/22/2023","","","Natick","MA",20,"","","Included: All full-time and regular part-time employees at the Employer’s facility located in Natick, MA
Excluded: Managerial employees, guards, professional employees, and supervisors within the meaning
of the Act.",NA,NA,NA,NA,NA,NA,NA,NA,NA,NA,NA,NA,NA,NA,NA,NA,NA,NA,NA,NA,NA,NA,"United Food and Commercial Workers Union, Local 1445"
"01-RC-324582","Region 01, Boston, Massachusetts","Country Gardens Health & Rehabilitation Center","Open","08/25/2023","","","Swansea","MA",13,"","","Included: All full-time, regularly scheduled part-time and per diem Physical Therapists.Physical Therapist Assistants, Speech-Language 
Pathologists,Occupational Therapists ,Certified Occupational Therapy Assistants and Restorative Coordinator. Excluded: All other employees including Registered Nurses, Certified Nursing Aides, all supervisors and managerial employees as defined by the Act.",NA,NA,NA,NA,NA,NA,NA,NA,NA,NA,NA,NA,NA,NA,NA,NA,NA,NA,NA,NA,NA,NA,"New England Healthcare Employees Union (SEIU 1199)"
"01-RC-324756","Region 01, Boston, Massachusetts","Through These Doors","Open","08/29/2023","","","Portland","ME",25,"","","Included:
Development Associate, All Educators: Including YAAPP, Community, CDVIP, All Advocates Including: Housing and Resource, Shelter, EPIC, Community Based, Core Services, Safe Reentry, Intercultural Engagement Liaison to DHHS and CPS Volunteer Coordinator.

Excluded:
All Supervisory, Managerial, Confidential Employees and Guards As defined by the Act.
",NA,NA,NA,NA,NA,NA,NA,NA,NA,NA,NA,NA,NA,NA,NA,NA,NA,NA,NA,NA,NA,NA,"Maine Service Employees Association, SEIU Local 1989"
"01-RC-324947","Region 01, Boston, Massachusetts","First Student, Inc.","Open","09/01/2023","","","New London","CT",67,"","","Included: All bus drivers and monitors. Excluded: All office staff",NA,NA,NA,NA,NA,NA,NA,NA,NA,NA,NA,NA,NA,NA,NA,NA,NA,NA,NA,NA,NA,NA,"International Brotherhood of Teamsters, Local 493"
"01-RD-293620","Region 01, Boston, Massachusetts","Securitas Security Services USA, Inc.","Open","04/07/2022","","","Boston","MA",20,"","","Security Guards",NA,NA,NA,NA,NA,NA,NA,NA,NA,NA,NA,NA,NA,NA,NA,NA,NA,NA,NA,NA,NA,NA,"SERVICE EMPLOYEES INTERNATIONAL UNION LOCAL 32BJ"
"01-RD-321193","Region 01, Boston, Massachusetts","All-Star Transportation, LLC","Open","07/06/2023","","","Brookfield","CT",40,"","","Included: All CDL Drivers.
Excluded: Clerical Employees, Professional Employees, Guards and Supervisors.",NA,NA,NA,NA,NA,NA,NA,NA,NA,NA,NA,NA,NA,NA,NA,NA,NA,NA,NA,NA,NA,NA,"INTERNATIONAL BROTHERHOOD OF TEAMSTERS LOCAL 671"
"02-RC-109420","Region 02, New York, New York","Commercial Building Maintenance Corp.","Open","07/18/2013","","","SYOSSET","NY",11,"","","",NA,NA,NA,NA,NA,NA,NA,NA,NA,NA,NA,NA,NA,NA,NA,NA,NA,NA,NA,NA,NA,NA,"INTERNATIONAL BROTHERHOOD OF TRADE UNIONS LOCAL 713"
"02-RC-293285","Region 02, New York, New York","Universal Television","Open","03/30/2022",NA,NA,"New York","NY",11,NA,"","INCLUDED:
All Post Production Supervisors and Post Production Coordinators, including Post Production Department Heads, Seconds, and Thirds, working on scripted content in the New York area, employed by the Employer and/or any of its subsidiaries or affiliates in the past six months, irrespective of how credited.


EXCLUDED:
All other employees, production assistants, post production editors including Film and Television editors, Assistant Editors, Associate Editors, Apprentice Editors, Edit Room Assistants, Music Editors, and Sound Editors, guards, and supervisors as defined by the Act.
",NA,NA,NA,NA,NA,NA,NA,NA,NA,NA,NA,NA,NA,NA,NA,NA,NA,NA,NA,NA,NA,NA,NA
