"18-RC-289885","Region 18, Minneapolis, Minnesota","Sabre Industries","Open","02/02/2022","","","Sioux City","IA",250,"","","Included: All full time and regular part time manufacturing workers at the Sabre Sioux City Iowa plant. Including Equipment Operator, Fork Lift Drivers, Maintenance Workers, All Seamers, All Long Seamers, STM Seamers, Plate Yard, Production 3DLP, Production Leads, Material Handlers, All STS, Shipping, Warehouse, Warehouse Auditor, Inventory, Inventory Specialist, Inventory Material Handler, All Paint, Paint Shop, NDT Tech A, All QC Visual Inspector, QC UT Tech II, QC, QC NDT Tech I, QC NDT Tech II, QC All Senior NDT Tech, QC Senior UT II, QC Senior Inspector, Quality Leads, All Welders, Weld Coach, Welder Trainee, Welders A, Welders B, Welders C, Welder Fitters, Welders Fitters A, Welders Fitters B and Welders Fitters C.

Excluded: All other employees, confidential employees, office, guards and supervisors as defined by act.
",NA,NA,NA,NA,NA,NA,NA,NA,NA,NA,NA,NA,NA,NA,NA,NA,NA,NA,NA,NA,NA,NA,"IBEW Local 231"
"18-RC-289961","Region 18, Minneapolis, Minnesota","Rainbow Health Minnesota","Open","02/02/2022","","","Saint Paul","MN",63,"","","Included:  All Community Health Advocates, Education and Prevention Specialists, COVID Community Coordinators, Aging Services Advocates, Benefits Counselors, MNSure Navigators, Housing Specialists, Housing Access Coordinators, Medical Case Managers, Outreach Case Managers, Care Linkage Specialists, 
Chemical Health Assessors, Peer Support Assistants, Psychotherapists, Intake Specialist, Mental 
Health Care Coordinators, HERR Day Out Coordinators, Clinical Supervisors, Legal Assistants, Transportation Coordinators, EPCEA Specialists, Every Penny Counts Program Assistants, EPCEA Coordinators, Communications & Marketing Assistants, Marketing Design Specialists, Administrative Assistant/Receptionists, Senior Staff Accountants employed by the employer.

Excluded:  All managerial employees and guards as defined by the Act, and all other employees.
",NA,NA,NA,NA,NA,NA,NA,NA,NA,NA,NA,NA,NA,NA,NA,NA,NA,NA,NA,NA,NA,NA,"Service Employees International Union - Healthcare MN"
"18-RC-290288","Region 18, Minneapolis, Minnesota","Koppers Recovery Resources","Open","02/08/2022","","","LAnse","MI",10,"","","Included:  All full-time and regular part-time heavy equipment operators and drivers.

Excluded:  Guards and supervisors as defined in the Act.
",NA,NA,NA,NA,NA,NA,NA,NA,NA,NA,NA,NA,NA,NA,NA,NA,NA,NA,NA,NA,NA,NA,"International Union of Operating Engineers, Local 324"
"18-RD-288362","Region 18, Minneapolis, Minnesota","Mayo Clinic Health System in Fairmont","Open","01/03/2022","","","Fairmont","MN",41,"","","Included: All full-time and part-time service and maintenance employees and
business officer clerical employees employed by the Mayo clinic Health System in
Fairmont.

Excluding: Licensed Practical Nurses, technical employees, professional employees,
managerial employees, confidential employees, temporary employees (those hired
under work agreements of ninety (90) days or less), guards and supervisors as
defined in the National Labor Relations Act, as amended.",NA,NA,NA,NA,NA,NA,NA,NA,NA,NA,NA,NA,NA,NA,NA,NA,NA,NA,NA,NA,NA,NA,"General Drivers Union, Local 120"
"18-RD-289262","Region 18, Minneapolis, Minnesota","CentraCare Health-Sauk Centre","Open","01/20/2022","","","Sauk Centre","MN",45,"","","Included: RN, LPN, RT, DMS, MLT, CST 
Excluded: none",NA,NA,NA,NA,NA,NA,NA,NA,NA,NA,NA,NA,NA,NA,NA,NA,NA,NA,NA,NA,NA,NA,"SEIU Healthcare Minnesota"
"18-UC-289408","Region 18, Minneapolis, Minnesota","North Memorial Health Hospital","Open","01/21/2022","","","Robbinsdale","MN",1100,"","","All full time, part time, and casual non-professional employees in the job classifications as set forth in the wage schedule of the CBA; excluding all other professional employees, technical employees, registered nurses, physicians, supervisors, and any other job classifications not included in the wage schedule of the CBA.

Clarification of 20 ees:  Employer recently consolidated office spades and moved employees in the classifications of Billing Specialists to work alongside Office Employee III bargaining unit members in the same office space.  The Employees in both classifications share an overwhelming community of interest.",NA,NA,NA,NA,NA,NA,NA,NA,NA,NA,NA,NA,NA,NA,NA,NA,NA,NA,NA,NA,NA,NA,NA
"19-RC-282395","Region 19, Seattle, Washington","United Rentals (North America), Inc.","Open","09/02/2021","","","Tukwila","WA",17,"","","Included:  

All full-time and part-time equipment delivery drivers employed by the employer at facility's located in Everett, Kirkland, Seattle, Tukwila, Tacoma and Bonney Lake, WA (Seattle Metro Hub).

Excluded: 

All other employees, including warehouse, office clerical, guards, and supervisors as defined by the Act.",17,"A","Single Labor Organization","Initial","11/23/2021",17,NA,6,"",NA,"",NA,9,15,"",2,"","","All full-time and regular part-time equipment delivery drivers employed by the Employer and working out of its Seattle Metro Hub locations in Everett, Kirkland, Seattle, Tukwila, Tacoma and Bonney Lake, Washington; excluding all other employees, warehouse employees, office clerical employees, managers and guards, and supervisors as defined by the Act.


","","","","Teamsters Local Union No. 174 affiliated with the International Brotherhood of Teamsters"
"19-RC-282922","Region 19, Seattle, Washington","Cannaseur's Choice, LLC","Open","09/14/2021","","","Renton","WA",29,"","","Included:  

Growers, Trimmers, Processors, and Fulfillment Associates

Excluded:

Sales Associates, Marketing, Inventory Extraction, Drivers, and all Supervisors.",23,"A","Single Labor Organization","Initial","01/27/2022",23,NA,6,"",NA,"",NA,8,14,"",2,"","","All Extraction Technicians, Machine Operators, Inventory Associates, Fulfillment Associates, and Senior Fulfillment Associates employed by the Employer at its Renton, Washington facility; excluding all other employees, Allocations Manager, Director of Cultivation, Director of Operations, Driver, Fulfillment Manager, Interim Growth Supervisor, Inventory Manager, Marketing, Marketing Director, Wholesale Inventory Manager, Cultivation Associates, Cultivation Lead, Trim Associates, Trim Department Supervisor, and guards and supervisors as defined in the Act. 
","","","","United Food and Commercial Workers Union, Local No. 21"
"19-RC-283239","Region 19, Seattle, Washington","Safeway, Inc.","Open","09/21/2021","","","Portland","OR",5,"","","Included: All pharmacy clerk and tech employees in armored globe election into grocery contract. Excluded: All pharmacists and supervisors as defined by the act.",NA,NA,NA,NA,NA,NA,NA,NA,NA,NA,NA,NA,NA,NA,NA,NA,NA,NA,NA,NA,NA,NA,"United Food and Commercial Workers, Local 555"
"19-RC-283727","Region 19, Seattle, Washington","Albertsons LLC","Open","09/30/2021","","","Portland","OR",1,"","","Included: All pharmacy clerk and tech employees in Armour-Globe election into grocery contract. Excluded: All pharmacists and supervisors as defined by the Act.",NA,NA,NA,NA,NA,NA,NA,NA,NA,NA,NA,NA,NA,NA,NA,NA,NA,NA,NA,NA,NA,NA,"United Food and Commercial Workers, Local 555"
"19-RC-283728","Region 19, Seattle, Washington","Safeway, Inc.","Open","09/30/2021","","","Portland","OR",4,"","","Included: All pharmacy clerk and tech employees in Armour-Globe election into grocery contract. Excluded: All pharmacists and supervisors as defined by the Act.",NA,NA,NA,NA,NA,NA,NA,NA,NA,NA,NA,NA,NA,NA,NA,NA,NA,NA,NA,NA,NA,NA,"United Food and Commercial Workers, Local 555"
"19-RC-283824","Region 19, Seattle, Washington","Safeway, Inc.","Open","10/01/2021","","","Wilsonville","OR",5,"","Bakery, Confectionery, Tobacco Workers and Grain Millers International Union Local 114, AFL-CIO, CLC","Included: All Production Bakers, Utility Bakers, Cake Decorators, and Assistant Bakery Manager. Excluded: All other employees.",4,"A","Single Labor Organization","Initial","11/18/2021",4,NA,1,"",NA,"",NA,NA,1,"",1,"","Bakery, Confectionery, Tobacco Workers and Grain Millers International Union Local 114, AFL-CIO, CLC","All full-time and regular part-time production bakers, utility bakers, and cake decorators employed by the Employer at its store located at 8255 SW Wilsonville Rd., Wilsonville, Oregon; but excluding all other employees, bakery clerks, employees represented by other labor organizations, managers, and guards and supervisors as defined by the Act.","","","","Bakery, Confectionery, Tobacco Workers and Grain Millers Union, Local 114, AFL-CIO, CLC"
"19-RC-284052","Region 19, Seattle, Washington","Safeway, Inc.","Open","10/05/2021","","","Portland","OR",3,"","","Included: All pharmacy clerk and tech employees in Armour-Globe election into grocery contract. Excluded: All pharmacists and supervisors as defined by the Act.",NA,NA,NA,NA,NA,NA,NA,NA,NA,NA,NA,NA,NA,NA,NA,NA,NA,NA,NA,NA,NA,NA,"United Food and Commercial Workers, Local 555"
"19-RC-284054","Region 19, Seattle, Washington","Safeway, Inc.","Open","10/05/2021","","","Boring","OR",3,"","","Included: All pharmacy clerk and tech employees in Armour-Globe election into grocery contract. Excluded: All pharmacists and supervisors as defined by the Act.",NA,NA,NA,NA,NA,NA,NA,NA,NA,NA,NA,NA,NA,NA,NA,NA,NA,NA,NA,NA,NA,NA,"United Food and Commercial Workers, Local 555"
"19-RC-285696","Region 19, Seattle, Washington","Lineage Logistics Services, LLC","Open","11/04/2021","","","Richland","WA",70,"","","Included:  

All full-time and part-time CDL Truck Drivers employed at Richland Facility.

Excluded:  

All other employees, guards and supervisors per the NLRA.",74,"A","Single Labor Organization","Initial","01/20/2022",74,1,25,"",NA,"",NA,39,64,"",NA,"","","All full-time CDL truck drivers employed by the Employer at its Richland, Washington facility; excluding  all other employees, managers, confidential employees, and guards and supervisors as defined by the Act.","","","","Teamsters Local 839, affiliated with the International Brotherhood oF Teamsters"
"19-RC-285965","Region 19, Seattle, Washington","Safeway, Inc.","Open","11/09/2021","","","King City","OR",3,"","","Included: All pharmacy clerk and tech employees in Armour-Globe election into grocery contract. Excluded: All pharmacists and supervisors as defined by the Act.",NA,NA,NA,NA,NA,NA,NA,NA,NA,NA,NA,NA,NA,NA,NA,NA,NA,NA,NA,NA,NA,NA,"United Food and Commercial Workers Local 555"
"19-RC-285966","Region 19, Seattle, Washington","Safeway, Inc.","Open","11/09/2021","","","Sherwood","OR",1,"","","Included: All pharmacy clerk and tech employees in Armour-Globe election into grocery contract. Excluded: All pharmacists and supervisors as defined by the Act.",NA,NA,NA,NA,NA,NA,NA,NA,NA,NA,NA,NA,NA,NA,NA,NA,NA,NA,NA,NA,NA,NA,"United Food and Commercial Workers Local 555"
"19-RC-285967","Region 19, Seattle, Washington","Albertsons LLC","Open","11/09/2021","","","Hillsboro","OR",2,"","","Included: All pharmacy clerk and tech employees in Armour-Globe election into grocery contract. Excluded: All pharmacists and supervisors as defined by the Act.",NA,NA,NA,NA,NA,NA,NA,NA,NA,NA,NA,NA,NA,NA,NA,NA,NA,NA,NA,NA,NA,NA,"United Food and Commercial Workers Local 555"
"19-RC-286014","Region 19, Seattle, Washington","The Harvest Center & Associates, LLC","Open","11/09/2021","","","Eugene","OR",20,"","","Included: All production trimmers. Excluded: All guards, and managers and supervisors as defined by the Act.",18,"A","Single Labor Organization","Initial","01/14/2022",18,1,NA,"",NA,"",NA,2,2,"",10,"Y","","All full-time and regular part-time Trimmer Specialists employed by the Employer at its Eugene, Oregon facility; but excluding all other employees, office clerical employees, confidential employees, and guards and supervisors as defined by the Act.","","","","United Food and Commercial Workers Union Local 555"
"19-RC-286902","Region 19, Seattle, Washington","North Pacific Paper Company, LLC","Open","11/29/2021","","","Longview","WA",154,"","","Included: All full time and regular part-time employees in the paper maker department,
including Machine Tender/Wet End Operator, Furnish Operator, Wet End Processor Assistant,
Back Tender/Dry End Operator, Third Hand/Winder Operator, Fourth Hand/Assistant Winder
Operator, Fifth Hand/Process Operator, Reel Guy/Dry End Support, Customer Service
Representatives, and Salvage Winder. Excluded: All other employees, office clericals, guards, managerial employees, confidential
employees, and supervisors as defined in the Act.",NA,NA,NA,NA,NA,NA,NA,NA,NA,NA,NA,NA,NA,NA,NA,NA,NA,NA,NA,NA,NA,NA,"International Longshore and Warehouse Union, Local 21"
"19-RC-287149","Region 19, Seattle, Washington","Safeway, Inc.","Open","12/02/2021","","","Longview","WA",5,"","","Included: All pharmacy clerk and tech employees. Excluded: All Pharmacists and supervisors as defined by the Act.",NA,NA,NA,NA,NA,NA,NA,NA,NA,NA,NA,NA,NA,NA,NA,NA,NA,NA,NA,NA,NA,NA,"United Food and Commercial Workers International Local 555, AFL-CIO"
"19-RC-287149","Region 19, Seattle, Washington","Safeway, Inc.","Open","12/02/2021","","","Longview","WA",5,"","","Included: All pharmacy clerk and tech employees. Excluded: All Pharmacists and supervisors as defined by the Act.",NA,NA,NA,NA,NA,NA,NA,NA,NA,NA,NA,NA,NA,NA,NA,NA,NA,NA,NA,NA,NA,NA,"United Food and Commercial Workers International Local 555, AFL-CIO"
"19-RC-287280","Region 19, Seattle, Washington","Fruit and Flower Child Development Center at PCC Rock Creek Campus","Open","12/07/2021","","","Portland","OR",17,"","","Included: All full-time and regular part-time employees, including the following classifications: Lead Teacher, Assistant Teacher, Float Teacher, Cook, and Dishwasher. Excluded: Volunteers, parents/guardians receiving reduced tuition, office clericals, guards, managerial employees, confidential employees, and supervisors as defined in the Act",NA,NA,NA,NA,NA,NA,NA,NA,NA,NA,NA,NA,NA,NA,NA,NA,NA,NA,NA,NA,NA,NA,"International Longshore and Warehouse Union, Local 5"
"19-RC-287293","Region 19, Seattle, Washington","Albertsons LLC","Open","12/06/2021","","","Klamath Falls","OR",5,"","","Included:  All pharmacy clerks and tech employees.  Excluded:  All pharmacists and supervisors as defined by the Act.",NA,NA,NA,NA,NA,NA,NA,NA,NA,NA,NA,NA,NA,NA,NA,NA,NA,NA,NA,NA,NA,NA,"United Food and Commercial Workers Union Local 555"
"19-RC-287294","Region 19, Seattle, Washington","Safeway, Inc.","Open","12/06/2021","","","Cottage Grove","OR",5,"","","Included:  All pharmacy clerk and tech employees.  Excluded:  All pharmacists and supervisors as defined by the Act.",NA,NA,NA,NA,NA,NA,NA,NA,NA,NA,NA,NA,NA,NA,NA,NA,NA,NA,NA,NA,NA,NA,"United Food and Commercial Workers Union Local 555"
"19-RC-287320","Region 19, Seattle, Washington","Providence Health and Services Washington d/b/a Providence Holy Family Hospital","Open","12/07/2021","","","Spokane","WA",23,"","","Included: The Petitioner seeks to add through an Armour-Globe self-determination election all full-time, part-time, and per-diem Patient Registration Registrars in Emergency and Admitting departments employed by the employer at 5633 N Lidgerwood, Spokane, WA  99208, to the existing Service bargaining unit. Excluded: Excluding all guards, supervisors, managers, and confidential employees as defined by the Act.",23,"A","Single Labor Organization","Initial","02/03/2022",23,1,8,"",NA,"",NA,9,17,"",NA,"","","All full-time, regular part-time, and per-diem Patient Registrar in the Emergency and Admitting departments employed by the Employer at its Spokane, WA facility; excluding all other employees, professional employees, managers, confidential employees, and guards and supervisors as defined by the Act. 
","","","","United Food and Commercial Workers Local 21"
"19-RC-287669","Region 19, Seattle, Washington","North Pacific Paper Company, LLC","Open","12/13/2021","","","Longview","WA",60,"","","Included: All full time and regular part-time employees in the fiberline department, including
Control Room Operator 1, Control Room Operator 2, Refiner Operator 1, Refiner Operator 2,
Deink Control Room Operator, Deink Field, Inside 3rd, Outside 3rd, Pulper Building 1, Pulper
Building 2, Pulper Building 3, Raw Material Coordinator, Inventory Specialist, and Quality
Control Person.

Excluded: All other employees, office clericals, guards, managerial employees, confidential
employees, and supervisors as defined in the Act.",NA,NA,NA,NA,NA,NA,NA,NA,NA,NA,NA,NA,NA,NA,NA,NA,NA,NA,NA,NA,NA,NA,"International Longshore and Warehouse Union, Local 21"
"19-RC-287672","Region 19, Seattle, Washington","North Pacific Paper Company, LLC","Open","12/13/2021","","","Longview","WA",34,"","","Included: 

All full time and regular part-time employees in the warehouse department, including Loader, Rail Loader, Line Driver/Loader, Line Driver, and Roll Mover.

Excluded: 

All other employees, office clericals, guards, managerial employees, confidential employees, and supervisors as defined in the Act.",NA,NA,NA,NA,NA,NA,NA,NA,NA,NA,NA,NA,NA,NA,NA,NA,NA,NA,NA,NA,NA,NA,"International Longshore and Warehouse Union, Local 21"
"19-RC-287799","Region 19, Seattle, Washington","Country Doctor Community Health Centers","Open","12/15/2021","","","Seattle","WA",135,"","","",NA,NA,NA,NA,NA,NA,NA,NA,NA,NA,NA,NA,NA,NA,NA,NA,NA,NA,NA,NA,NA,NA,"SEIU HealthCare 1199NW"
"19-RC-287844","Region 19, Seattle, Washington","Alliance for South Sound Health dba Wellfound Behavioral Health Hospital","Open","12/16/2021","","","Tacoma","WA",55,"","","Included: ARNP, Care Coordinator, Court Coordinator, Group Therapist, Group Therapy Team Lead, Licensed Mental Health Counselor, Medical NP, Mental Health Counselor, PAC, Recreational Therapist, Social Worker, Social Worker Certified, Tele Psych PMHNP, Therapy Team Lead. Excluded: All other employees, guards, and supervisors as defined by the Act.",NA,NA,NA,NA,NA,NA,NA,NA,NA,NA,NA,NA,NA,NA,NA,NA,NA,NA,NA,NA,NA,NA,"SEIU HealthCare 1199NW"
"19-RC-287954","Region 19, Seattle, Washington","Starbucks Corporation","Open","12/20/2021","","","Seattle","WA",15,"","","Included: All full-time and regular part-time Baristas, Shift Supervisors, Asst. Store Managers. Excluded: Store Managers; office clericals, guards, and supervisors as defined by the Act.",NA,NA,NA,NA,NA,NA,NA,NA,NA,NA,NA,NA,NA,NA,NA,NA,NA,NA,NA,NA,NA,NA,"Workers United"
"19-RC-288045","Region 19, Seattle, Washington","Lines for Life","Open","12/21/2021","","","Portland","OR",150,"","","Included: All non-supervisory employees including, but not limited to the following classifications or job titles:  Lead Content Writer, CCL Preceptor, Helpers Helping Helpers Facilitator, Youth Line Outreach Coordinator, Youth Line Volunteer Coordinator, Events Specialist, Events Coordinator, OPR Coordinator, CADC Case Manager, CIS, Youth Line Staff, Youth Line Supervisor, all non-supervisory Counselors, all Team Leads, Safe and Strong Counselor, QA Specialists, non-supervisory CADCs, Coordinators, Event Specialist, all non-supervisory admin staff, all other non-supervsory staff.  Excluded: Supervisory staff,  managers, and directors.",NA,NA,NA,NA,NA,NA,NA,NA,NA,NA,NA,NA,NA,NA,NA,NA,NA,NA,NA,NA,NA,NA,"Oregon AFSCME Council 75"
"19-RC-288202","Region 19, Seattle, Washington","Providence Health & Services - Western Washington, d/b/a Providence Regional Medical Center Everett","Open","12/28/2021","","","Everett","WA",4,"","","Included: The petitioner seeks to add through an Armour-Globe self-determination election all full time, part time, and per diem Dieticians employed by the employer at Providence Regional Medical Center-Everett Pacific Campus (916 Pacific Avenue Everett WA 98201), Providence Regional Medical Center Everett Pavilion for Women & Children (900 Pacific Avenue Everett WA 98201), and Providence Regional Cancer Partnership (1717 13th street Everett WA 98201) to the existing Professional bargaining unit. Excluded: Excluding all guards, supervisors, managers, and confidential employees as defined by the Act.",NA,NA,NA,NA,NA,NA,NA,NA,NA,NA,NA,NA,NA,NA,NA,NA,NA,NA,NA,NA,NA,NA,"United Food and Commercial Workers Local 21"
"19-RC-288289","Region 19, Seattle, Washington","Alliance for a Healthier Generation, Inc.","Open","12/29/2021","","","Portland","OR",44,"","","Included: All Associate Director, Associate Director/Cause Marketing and Communications, Family Engagement Manager, National Content Advisor, Rise Program Manager, Content Manager, Social and Emotional Health, Member Engagement and Support Manager, Social Emotional Health Content Manager, Data Manager, HSCP Manager, Network, Healthy Schools Program Manager, Senior Manager Digital Marketing, Business Systems Analyst, Member Engagement and Support Manager Communications, Regional Program Manager, Software and Data Engineer, Software Development Manager, Rise Virtual Program Manager, National Advisor, HSCP, Senior Managment Development, Digital Engagement Specialist, Senior National PE/PA Advisor, Digital Marketing Manager, UX/UI Designer, Technical Support Specialist, Virtual Content Manager/Social Emotional Health. Excluded: Guards and Supervisors as defined by the Act.",NA,NA,NA,NA,NA,NA,NA,NA,NA,NA,NA,NA,NA,NA,NA,NA,NA,NA,NA,NA,NA,NA,"Office & Professional Employees International Union, Local 11"
"19-RC-288296","Region 19, Seattle, Washington","Community Work Training Association","Open","12/29/2021","","","Bellingham","WA",14,"","","Included: All regular full time, part time, and cover staff. Excluded: Director and Assistant Director",NA,NA,NA,NA,NA,NA,NA,NA,NA,NA,NA,NA,NA,NA,NA,NA,NA,NA,NA,NA,NA,NA,"General Teamsters Union Local No. 231, affiliated with the International Brotherhood of Teamsters"
"19-RC-288422","Region 19, Seattle, Washington","Safeway, Inc.","Open","01/04/2022","","","Grants Pass","OR",3,"","","Included: All pharmacy clerk and tech employees. Excluded: All pharmacists and supervisors as defined by the Act.",NA,NA,NA,NA,NA,NA,NA,NA,NA,NA,NA,NA,NA,NA,NA,NA,NA,NA,NA,NA,NA,NA,"United Food and Commercial Workers Local 555"
"19-RC-288429","Region 19, Seattle, Washington","Eagle 5 Enterprises Inc. d/b/a Spacebuds The Dispensary","Open","01/04/2022","","","Eugene","OR",14,"","","Included: All budtenders, delivery drivers, and intake managers. Excluded: All guards, supervisors, and managers as defined by the Act.",NA,NA,NA,NA,NA,NA,NA,NA,NA,NA,NA,NA,NA,NA,NA,NA,NA,NA,NA,NA,NA,NA,"United Food and Commercial Workers Local 555"
"19-RC-288594","Region 19, Seattle, Washington","Starbucks Corporation","Open","01/07/2022","","","Eugene","OR",15,"","","Included: All full-time and regular part-time Baristas, Shift Supervisors, Asst. Store Managers. Excluded: Store managers, office clericals, guards, and supervisors as defined by the Act.",NA,NA,NA,NA,NA,NA,NA,NA,NA,NA,NA,NA,NA,NA,NA,NA,NA,NA,NA,NA,NA,NA,"Workers United"
"19-RC-288685","Region 19, Seattle, Washington","Pacific Architects & Engineers, Inc","Open","01/10/2022","","","Seattle","WA",10,"","","Included: 

All full-time and regular part-time general clerk, biometric fingerprinting technician and leads working at the USCIS Seattle, Yakima and Spokane locations.

Excluded: 

Guards, supervisors and all other employees as defined in the Act.",NA,NA,NA,NA,NA,NA,NA,NA,NA,NA,NA,NA,NA,NA,NA,NA,NA,NA,NA,NA,NA,NA,"Aerospace Machinists Industrial District Lodge 751"
"19-RC-288732","Region 19, Seattle, Washington","Credena Health LLC d/b/a Credena Health Pharmacy - Monroe","Open","01/10/2022","","","Everett","WA",8,"","","Included: The Petitioner seeks to add through an Armour-Globe self-determination election all full-time and part-time pharmacy technicians employed by the employer at the Credena Health Pharmacy Monroe (19200 N Kelsey St, Monroe, WA 98272) to the existing Technical bargaining unit. Excluded: Excluding all guards, supervisors, managers, and confidential employees as defined by the Act.",NA,NA,NA,NA,NA,NA,NA,NA,NA,NA,NA,NA,NA,NA,NA,NA,NA,NA,NA,NA,NA,NA,"United Food and Commercial Workers Local 21"
"19-RC-288906","Region 19, Seattle, Washington","Everett Holdings LLC d/b/a Budlandia","Open","01/13/2022","","","Portland","OR",8,"","","Included: All Budtenders and Intake Managers. Excluded: All Guards and Supervisors as defined by the Act.",NA,NA,NA,NA,NA,NA,NA,NA,NA,NA,NA,NA,NA,NA,NA,NA,NA,NA,NA,NA,NA,NA,"United Food and Commercial Workers Local 555"
"19-RC-288907","Region 19, Seattle, Washington","Flowr of Lyfe, LLC. d/b/a Flowr of Lyfe","Open","01/13/2022","","","Eugene","OR",6,"","","Included: All Budtenders and Leads. Excluded: All Guards and Supervisors as defined by the Act.",NA,NA,NA,NA,NA,NA,NA,NA,NA,NA,NA,NA,NA,NA,NA,NA,NA,NA,NA,NA,NA,NA,"United Food and Commercial Workers Local 555"
"19-RC-289040","Region 19, Seattle, Washington","Valaurum Inc.","Open","01/18/2022","","","Portland","OR",20,"","","Included: All employees. Excluded: All supervisors, confidential employees, guards and others expressly prohibited.",NA,NA,NA,NA,NA,NA,NA,NA,NA,NA,NA,NA,NA,NA,NA,NA,NA,NA,NA,NA,NA,NA,"IBEW Local 89"
"19-RC-289079","Region 19, Seattle, Washington","Providence Health & Services – Oregon  d/b/a Providence St. Vincent Medical Center","Open","01/18/2022","","","Portland","OR",26,"","","Included: Biomedical equipment technicians, including biomed tech 1, 2, senior biomed techs, and biomed tech leads. Excluded: All other employees, incl. but not limited to temp employees, guards, employees  whose duties are primarily supervisory in nature as defined by the Act, and employees other than Biomed Techs who work at Providence St. Vincent's Medical Center in Portland, OR.",NA,NA,NA,NA,NA,NA,NA,NA,NA,NA,NA,NA,NA,NA,NA,NA,NA,NA,NA,NA,NA,NA,"International Union of Operating Engineers, Local 701"
