"06-RC-325794","Region 06, Pittsburgh, Pennsylvania","Gold Star Foods, Inc.","Open","09/14/2023","","","Huntingdon","PA",18,"","","Included: All full-time and regular part-time truck drivers employed at the Employer's Huntingdon, PA facility;

Excluded: All office clerical employees, professional employees, guards, managers, and supervisors as defined in the Act, and all other employees.",NA,NA,NA,NA,NA,NA,NA,NA,NA,NA,NA,NA,NA,NA,NA,NA,NA,NA,NA,NA,NA,NA,"Teamsters, Chauffeurs, Warehousemen and Helpers, Local Union No. 110 a/w International Brotherhood of Teamsters"
"06-RC-326316","Region 06, Pittsburgh, Pennsylvania","ECM Transport, LLC","Open","09/22/2023","","","Erie","PA",13,"","","Included: All truck drivers employed at employer's Erie, PA location

Excluded: Managers, clerical employees, mechanics, guards and supervisors and all others",NA,NA,NA,NA,NA,NA,NA,NA,NA,NA,NA,NA,NA,NA,NA,NA,NA,NA,NA,NA,NA,NA,"General Teamsters Local 397 a/w International Brotherhood of Teamsters"
"06-RC-327340","Region 06, Pittsburgh, Pennsylvania","Point Park University","Open","10/05/2023","","","Pittsburgh","PA",2,"","","Included

All full-time and regular part-time skilled and unskilled maintenance employees employed by the Employer
including, but not limited to carpenters, electricians, plumbers and general maintenance employees.

Excluded

All other employees, supervisors, security personnel and student part-time employees.
",NA,NA,NA,NA,NA,NA,NA,NA,NA,NA,NA,NA,NA,NA,NA,NA,NA,NA,NA,NA,NA,NA,"International Union of Operating Engineers, Local 95, AFL-CIO"
"06-RC-327786","Region 06, Pittsburgh, Pennsylvania","Western Pennsylvania School for the Deaf","Open","10/12/2023","","","Pittsburgh","PA",95,"","","Included: All full time and regular part time professional student services employees, including but not limited to primary and secondary school teachers, early childhood program teachers, counselors, occupational, physical and art therapists, nurses, audiologists, speech and language pathologists, reading and behavior specialists, social workers, IEP Coordinator, Curriculum Coordinator, Coordinator of Children's Services, Transition Coordinator, Work Training Coordinator, Interpreter, Media Coordinator, Coordinator of Library services, and Coordinator of ASL Services employed by the Employer at its campuses in Pittsburgh, PA, Edinboro, PA, Hershey, PA, and Scranton, PA.

Excluded: All other employees, including directors, non-professional employees, teachers aides, substitute teachers, Library Aide, administrative assistants, business office employees, human resources employees, operations department employees except those expressly included, security, residential supervisors, managerial employees, confidential employees, and guards and supervisors as defined in the Act.",NA,NA,NA,NA,NA,NA,NA,NA,NA,NA,NA,NA,NA,NA,NA,NA,NA,NA,NA,NA,NA,NA,"Kiski Area Education Support Professionals No. 2/PSEA, NEA"
"06-RD-321620","Region 06, Pittsburgh, Pennsylvania","Starbucks Corporation","Open","07/12/2023","","","Pittsburgh","PA",3,"","","Included

All full time and regular part-time hourly Baristas and shift Supervisors

Excluded

All other employees",NA,NA,NA,NA,NA,NA,NA,NA,NA,NA,NA,NA,NA,NA,NA,NA,NA,NA,NA,NA,NA,NA,"Workers United"
"06-RD-324813","Region 06, Pittsburgh, Pennsylvania","Comcast Communications, LLC","Open","08/30/2023","","","Pittsburgh","PA",37,"","Communications Workers of America, Local 13000","Included: All regular full-time and regular part-time installers, service technicians 1, service technicians 2, line maintenance technicians, headend technicians, construction technicians. quality control
technicians and asset control clerk.

Excluded: All other employees.",38,"A","Single Labor Organization","Initial","10/12/2023",38,NA,22,"",NA,"",NA,16,NA,"",NA,"","Communications Workers of America, Local 13000","Included: All regular full-time and part-time Installers, Service Technicians I, Service Technicians II, Line Maintenance Technicians, Headend Technicians, Construction Technicians, Quality Control Technicians and Asset Control Clerks employed by the Employer at its facility located at 5211 Brownsville Rd, Pittsburgh, Pennsylvania 15236 in the South Hills bargaining unit. 

Excluded: All other employees.","","","","Communication Workers of America, Local 13000"
"06-RD-324813","Region 06, Pittsburgh, Pennsylvania","Comcast Communications, LLC","Open","08/30/2023","","","Pittsburgh","PA",37,NA,"","Included: All regular full-time and regular part-time installers, service technicians 1, service technicians 2, line maintenance technicians, headend technicians, construction technicians. quality control
technicians and asset control clerk.

Excluded: All other employees.",NA,NA,NA,NA,NA,NA,NA,NA,NA,NA,NA,NA,NA,NA,NA,NA,NA,NA,NA,NA,NA,NA,"Communication Workers of America, Local 13000"
"06-RD-327096","Region 06, Pittsburgh, Pennsylvania","National Imprint Corporation","Open","10/02/2023","","","Claysburg","PA",3,"","","Included-

All full-time and regular part-time production and maintenance employees employed at the Plant.

Excluded-

temporary employees, office clerical employees, quality control, salesmen, working foremen and guards.",NA,NA,NA,NA,NA,NA,NA,NA,NA,NA,NA,NA,NA,NA,NA,NA,NA,NA,NA,NA,NA,NA,"USW Local Union 6521-18"
"06-RD-327742","Region 06, Pittsburgh, Pennsylvania","Moundsville Healthcare Center","Open","10/10/2023","","","Moundsville","WV",34,"","","Included: Full + part time CNA, Housekeeping/laundry, Hospitality Aides, Cooks, dietary aides, maintenance helper, Activity Aides + Social Service Aide

Excluded: NR, LPN, office clerical, Social worker, med records employee students, guards, all professional employees + supervisors as defined by the HLR Act",NA,NA,NA,NA,NA,NA,NA,NA,NA,NA,NA,NA,NA,NA,NA,NA,NA,NA,NA,NA,NA,NA,"United Food and Commercial Workers International Union, Local 1776, CLC"
"07-RC-269162","Region 07, Detroit, Michigan","American Steel Construction","Open","11/18/2020","","","Livonia","MI",8,"","","Included: Full time and regular part time journeyman and apprentice field ironworkers

Excluded: All others including clerical, professional, guards and supervisors under the act",NA,NA,NA,NA,NA,NA,NA,NA,NA,NA,NA,NA,NA,NA,NA,NA,NA,NA,NA,NA,NA,NA,"Local 25, International  Association of Bridge, Structural, Ornamental and Reinforcing Iron Workers (Iron Workers), AFL-CIO"
"07-RC-314790","Region 07, Detroit, Michigan","Detroit Education and Research","Open","03/24/2023","","","Detroit","MI",1300,"","","Included:  All Resident Physicians, Interns, and Medical Fellows employed by the Employer

Excluded:  All other employees, supervisors, managers, and guards as defined by the Act.",NA,NA,NA,NA,NA,NA,NA,NA,NA,NA,NA,NA,NA,NA,NA,NA,NA,NA,NA,NA,NA,NA,"Alliance of Resident Physicians, AFT Michigan, AFT AFL- CIO"
"07-RC-316218","Region 07, Detroit, Michigan","Detroit Education & Research","Open","04/13/2023","","","Detroit","MI",1300,"","","Included:  All Resident Physicians, Interns, and Medical Fellows employed by the employer

Excluded:  All other employees, supervisors, managers, and guards as defined by the Act.",NA,NA,NA,NA,NA,NA,NA,NA,NA,NA,NA,NA,NA,NA,NA,NA,NA,NA,NA,NA,NA,NA,"Alliance of Resident Physicians, AFT Michigan, AFT AFL- CIO"
"07-RC-316456","Region 07, Detroit, Michigan","Models and Tools","Open","04/18/2023",NA,NA,"Shelby","MI",107,NA,"","Included: All employees employed by Models and Tools

Excluded:  all other employees, supervisors, managers, clerical, confidential",NA,NA,NA,NA,NA,NA,NA,NA,NA,NA,NA,NA,NA,NA,NA,NA,NA,NA,NA,NA,NA,NA,NA
"07-RC-318095","Region 07, Detroit, Michigan","New World Communications of Detroit, Inc., d/b/a Fox TelevisionION STATIONS, LLC. (WJBK-TV)WJBK-TV","Open","05/10/2023","","","Southfield","MI",20,"","","Included: Armour-Globe election to include Producers and Per Diem Writers in existing unit 

Excluded: web team, assignment desk, sports producers, and all other excluded employees",NA,NA,NA,NA,NA,NA,NA,NA,NA,NA,NA,NA,NA,NA,NA,NA,NA,NA,NA,NA,NA,NA,"National Association of Broadcast Employees and Technicians - Communications Workers of America (NABET-CWA) , AFL-CIO"
"07-RC-324626","Region 07, Detroit, Michigan","Sunbelt Rentals, Inc.","Open","08/25/2023","","","Oak Park","MI",4,"","Local 324, International Union Of Operating Engineers (IUOE), AFL-CIO","Included:  All full-time and regular part-time drivers, mechanics, shop foreman, and yard associates employed at the Employer's 12992 W. 8 Mile Rd., Oak Park, Ml 48237 
Excluded: branch managers, outside sales representatives, equipment rental specialists, dispatchers, service managers, office clerical employees, and guards and supervisors as defined in the Act.",4,"A","Single Labor Organization","Initial","10/04/2023",4,NA,4,"",NA,"",NA,NA,4,"",NA,"","Local 324, International Union Of Operating Engineers (IUOE), AFL-CIO","All full-time and regular part-time drivers, mechanics, shop foremen, and yard associates employed by the Employer at their facility currently located at  12992 W. 8 Mile Road, Oak Park, Michigan 48237; but excluding branch managers, outside sales representatives, equipment rental specialists, dispatchers, service managers, office clerical employees, and guards and supervisors as defined in the Act.","","","","Local 324, International Union of Operating Engineers (IUOE), AFL-CIO"
"07-RC-324626","Region 07, Detroit, Michigan","Sunbelt Rentals, Inc.","Open","08/25/2023","","","Oak Park","MI",4,NA,"","Included:  All full-time and regular part-time drivers, mechanics, shop foreman, and yard associates employed at the Employer's 12992 W. 8 Mile Rd., Oak Park, Ml 48237 
Excluded: branch managers, outside sales representatives, equipment rental specialists, dispatchers, service managers, office clerical employees, and guards and supervisors as defined in the Act.",NA,NA,NA,NA,NA,NA,NA,NA,NA,NA,NA,NA,NA,NA,NA,NA,NA,NA,NA,NA,NA,NA,"Local 324, International Union of Operating Engineers (IUOE), AFL-CIO"
"07-RC-324672","Region 07, Detroit, Michigan","EduStaff, LLC","Open","08/25/2023","","","Mattawan","MI",40,"","","Included: Paraprofessionals Excluded: Substitute Paraprofessionals",NA,NA,NA,NA,NA,NA,NA,NA,NA,NA,NA,NA,NA,NA,NA,NA,NA,NA,NA,NA,NA,NA,"Michigan Education Association (MEA)"
"07-RC-325153","Region 07, Detroit, Michigan","Triple Canopy, Inc.","Open","09/01/2023","","","Battle Creek","MI",1,"","","Included: All full-time armed lieutenants performing guard duties as defined in section 9(b)(3) of the national labor relations act, employed by Constellis at 3 Michigan locations- see attached

Excluded: All office clerical employees, professional employees and supervisors as defined by the act.
",NA,NA,NA,NA,NA,NA,NA,NA,NA,NA,NA,NA,NA,NA,NA,NA,NA,NA,NA,NA,NA,NA,"International Union, Security, Police, and Fire Professionals of America (SPFPA)"
"07-RC-325528","Region 07, Detroit, Michigan","Lewis Tree Service","Open","09/06/2023","","","Flint","MI",12,"","","Included:  All Foreman, Crew Leader, Groundman, Trimmers, Vegetation and Trainees

Excluded:  All Supervisors and Security Guards according to ACT",NA,NA,NA,NA,NA,NA,NA,NA,NA,NA,NA,NA,NA,NA,NA,NA,NA,NA,NA,NA,NA,NA,"Local 876, International Brotherhood of Electrical Workers (IBEW), AFL-CIO"
"07-RC-326194","Region 07, Detroit, Michigan","Alta Industrial Equipment Company, LLC d/b/a Alta Equipment Company","Open","09/19/2023","","","Sterling Heights","MI",36,"","","Included:  All full-time and regular part-time mechanics, road technicians, service technicians, and shop technicians
employed by the Employer in and out of its facility located at 7500 E 15 Mile Road, Sterling Heights, Ml

Excluded:  Office clerical employees, guards, and supervisors as defined in the Act.",NA,NA,NA,NA,NA,NA,NA,NA,NA,NA,NA,NA,NA,NA,NA,NA,NA,NA,NA,NA,NA,NA,"Local 324, International Union of Operating Engineers (IUOE), AFL-CIO"
"07-RC-326302","Region 07, Detroit, Michigan","Yona Solutions","Open","09/20/2023","","","Adrian","MI",7,"","","Included: 
All fulltime and parttime cooks and dishwashers

Excluded: 
Managers and Assistant Managers",NA,NA,NA,NA,NA,NA,NA,NA,NA,NA,NA,NA,NA,NA,NA,NA,NA,NA,NA,NA,NA,NA,"Local 876, United Food and Commercial Workers International Union (UFCW), AFL-CIO, CLC"
"07-RC-326458","Region 07, Detroit, Michigan","Alta Industrial Equipment Company, LLC d/b/a Alta Equipment Company","Open","09/21/2023","","","Muskegon","MI",14,"","","Included:  All full-time and regular part-time field technicians, service technicians, parts employees, mechanics and drivers employed by the Employer in and out of its facility located at 5920 Grand Haven Rd, Muskegon, Michigan

Excluded:  office clerical employees, guards, and supervisors as defined in the Act.",NA,NA,NA,NA,NA,NA,NA,NA,NA,NA,NA,NA,NA,NA,NA,NA,NA,NA,NA,NA,NA,NA,"Local 324, International Union of Operating Engineers (IUOE), AFL-CIO"
"07-RC-326580","Region 07, Detroit, Michigan","ProMedica Hickman Hospital","Open","09/22/2023","","","Adrian","MI",2,"","","Voting Group:  All full-time and regular part-time surgical clinical reviewers and core measures coordinators.

Existing Unit:  All full time and regular part-time Registered Nurses, including Staff Nurses, Utilization Management Nurses, Charge Nurses, and Pre-Surgical Testing Coordinators, BUT EXCLUDING Vice Presidents, Hospital Supervisors, Clinical Managers, Staff Instructors, Guards, and Supervisors as defined in the Act,
temporary and relief nurses, and all other nurses. 

Self Determination/Armour-Globe Election
If a majority of the valid ballots cast for the Michigan Nurses Association (Petitioner) by those employees
employed in the voting group, they will be taken to have indicated the employees' desire to tie included in the existing registered nurses unit described above, which is currently represented by the Michigan Nurses Association (Petitioner). If a majority of valid ballots are not cast for representation, they will be taken to have indicated the employees' desire to remain unrepresented.",NA,NA,NA,NA,NA,NA,NA,NA,NA,NA,NA,NA,NA,NA,NA,NA,NA,NA,NA,NA,NA,NA,"Michigan Nurses Association"
"07-RC-326739","Region 07, Detroit, Michigan","Antolin Shelby","Open","09/25/2023","","","Shelby","MI",300,"","","Included:  All full-time and regular part-time production at Antolin.

Excluded:  All office, managers, supervisors, temporary employees and salary exempt employees.",NA,NA,NA,NA,NA,NA,NA,NA,NA,NA,NA,NA,NA,NA,NA,NA,NA,NA,NA,NA,NA,NA,"International Union, United Automobile Aerospace and Agricultural Implement Workers of America (UAW), AFL-CIO"
"07-RC-326903","Region 07, Detroit, Michigan","AllSecurity/Total Armored Car","Open","09/27/2023","","","Detroit","MI",23,"","","Included: All Full-Time armed Drivers, Messengers and ATM Technicians, performing guard duties as defined in Section 9(b)(3) of the National Labor Relations Act, employed by AllSecurity/Total Armored Car at 2950 Rosa Parks Blvd., Detroit, MI 48216

Excluded: All Office Clerical Employees, Professional Employees and Supervisors as defined by the Act.",NA,NA,NA,NA,NA,NA,NA,NA,NA,NA,NA,NA,NA,NA,NA,NA,NA,NA,NA,NA,NA,NA,"International Union, Security, Police and Fire Professionals of America (SPFPA)"
"07-RC-327146","Region 07, Detroit, Michigan","West Pharmaceutical Services, Inc.","Open","09/29/2023","","","Walker","MI",368,"","","Included:  Assembly, Material Handler, Maintenance, Technician, Operator.

Excluded:  Supervisors and Guards as defined by the Act.
",NA,NA,NA,NA,NA,NA,NA,NA,NA,NA,NA,NA,NA,NA,NA,NA,NA,NA,NA,NA,NA,NA,"Local 406, International Brotherhood of Teamsters (IBT)"
"07-RC-327285","Region 07, Detroit, Michigan","Ajax Paving Industries, Inc.","Open","10/04/2023","","","Troy","MI",8,"","","Included: Scale House operators

Excluded: All other employees, guards, and supervisors as defined in the Act.",NA,NA,NA,NA,NA,NA,NA,NA,NA,NA,NA,NA,NA,NA,NA,NA,NA,NA,NA,NA,NA,NA,"Local 324, International Union of Operating Engineers (IUOE), AFL-CIO"
"07-RC-327555","Region 07, Detroit, Michigan","Alta Equipment Company","Open","10/05/2023","","","Livonia","MI",26,"","","Included:  All full-time and regular part-time mechanics, road technicians, service technicians, shop technicians, and parts employees employed by the Employer in and out of its facility located at 13211 Merriman Road, Livovnia, Ml

Excluded:  office clerical employees, guards, and supervisors as defined in the Act.",NA,NA,NA,NA,NA,NA,NA,NA,NA,NA,NA,NA,NA,NA,NA,NA,NA,NA,NA,NA,NA,NA,"Local 324, International Union of Operating Engineers (IUOE),  AFL-CIO"
"07-RC-327625","Region 07, Detroit, Michigan","Alta Equipment Company","Open","10/05/2023","","","Romulus","MI",29,"","","Included:  All full-time and regular part-time mechanics, road technicians, service technicians, and shop technicians, employed by the Employer in and out of its facility located at 28855 Smith Road, Romulus, Ml 

Excluded:   office clerical employees, guards, and supervisors as defined in the Act.",NA,NA,NA,NA,NA,NA,NA,NA,NA,NA,NA,NA,NA,NA,NA,NA,NA,NA,NA,NA,NA,NA,"Local 324, International Union of Operating Engineers (IUOE),  AFL-CIO"
"07-RD-282049","Region 07, Detroit, Michigan","Maple-Drake Real Estate, LLC d/b/a Notting Hill of West Bloomfield","Open","08/26/2021","","","West Bloomfield","MI",49,"","SEIU Healthcare of Michigan","Included: CNA, Kitchen, Laundry department, activities.  Excluded:  All other Employee's.",46,"A","Single Labor Organization","Initial","11/29/2021",46,4,12,"",NA,"",NA,9,21,"",3,"Y","SEIU Healthcare of Michigan","All full-time and regular part-time CNA employees, housekeeping employees, laundry employees, 
dietary aide employees, restorative aide employees, culinary aide employees, dietary cook employees,
activities aide employees, medical records employees, guest services employees and ward clerk
employees employed by the Employer at its facility located at 6535 Drake Road, West Bloomfield
Township, Michigan; but excluding all business officers, managers, dining room manages, managerial
employees, confidential employees, technical employees, professional employees, office personnel
employees, LPNs, RNs, executive chefs, registered dieticians, receptionists, casual employees, drivers,
social service employees, payroll employees, account management staff employees, central supply
employees, scheduler employees, maintenance employees, and guards and supervisors as defined in the
Act.
","","","","SEIU Healthcare Michigan"
"07-RD-282049","Region 07, Detroit, Michigan","Maple-Drake Real Estate, LLC d/b/a Notting Hill of West Bloomfield","Open","08/26/2021",NA,NA,"West Bloomfield","MI",49,NA,"SEIU Healthcare of Michigan","Included: CNA, Kitchen, Laundry department, activities.  Excluded:  All other Employee's.",46,NA,NA,NA,NA,NA,NA,NA,NA,NA,NA,NA,NA,NA,NA,NA,NA,NA,NA,NA,NA,NA,"SEIU Healthcare Michigan"
"07-RD-323100","Region 07, Detroit, Michigan","Trinity Health Grand Haven Hospital","Open","08/01/2023","","","Grand Haven","MI",181,"","SEIU Healthcare Michigan","Included: All Employees assumed to be represented by SEIU Healthcare Michigan

Excluded: Managers, Salaried Employees and Nursing Staff",182,"B","Single Labor Organization","Initial","09/29/2023",182,NA,89,"",NA,"",NA,66,155,"",7,"","SEIU Healthcare Michigan","VOTING GROUP - UNIT A (PROFESSIONAL UNIT):
All full-time and regular part-time Social Worker MSW, Medical Technologist ASCP II and Nuclear Medicine Technologist employed by the Employer; but excluding all guards and supervisors as defined in the Act.
VOTING GROUP - UNIT B (NON-PROFESSIONAL UNIT):
All full-time and regular part-time Ambassador, ARRT/CT Scan Technologist, HIM Analyst Coder, Biller, Cashier, Central Scheduler, PACS Administrator/Clinical Application Specialist, Certified Surgical Technologist, CT Scan Technologist, Clinical Documentation Specialist, Clinical Quality Assurance Liaison, Coder Assistant, Communications Specialist, Cook, CPD Lead Technician, CPD Technician, Custodian, Financial Counselor, Echocardiography Technician, EMT, Exercise Physiologist, Health Information Management Clerk, Histologist-Reg., Housekeeping Aide, Lab Assistant I-Phlebotomist, Lab Assistant II, Lead Housekeeper, Logging Clerk, LPNII, Mammography Technologist, Mammography Technologist II, M.I Technician Assistant, Materials Management Buyer, Materials Handler, Mechanic I, Mechanic II, Mechanic III-Electrician, Medical Imaging Pt. Reg. File Clerk, Medical Imaging Technical Assistant, Medical Technician ASCP I, Medical Assistant, Nurse Aide, Paramedic, Patient Accounts Specialist, Patient Registration Clerk, Patient Service Representative, Pharmacy Lead Technician, Pharmacy/Certified Technician, Pharmacy Assistants, Pre-Admission Review Specialist, Production Worker, RDMS/RVT, Registered Polysomnographer, Registered Respiratory Therapist,  Supply Aide/Courier, Surgical Technologist, Surgical Services Scheduler, Systems Support Specialist, Technologist Reg ARRT, Technician NReg ARRT Tissue Technician, Transcriptionist, Ultrasound Technologist, Unit Clerk, Unit Technician and Unit Technician/Clerk employed by the Employer at its Grand Haven facilities; but excluding guards and supervisors as defined in the Act.
","","","","SEIU Healthcare Michigan"
"07-RD-323100","Region 07, Detroit, Michigan","Trinity Health Grand Haven Hospital","Open","08/01/2023","","","Grand Haven","MI",181,NA,"","Included: All Employees assumed to be represented by SEIU Healthcare Michigan

Excluded: Managers, Salaried Employees and Nursing Staff",NA,NA,NA,NA,NA,NA,NA,NA,NA,NA,NA,NA,NA,NA,NA,NA,NA,NA,NA,NA,NA,NA,"SEIU Healthcare Michigan"
"07-RD-326252","Region 07, Detroit, Michigan","Attitude Wellness d/b/a Lume Cannibis Co.","Open","09/15/2023","","","Monroe","MI",22,"","","Included: All (22) Full- and Part-Time Luminary Bud Tenders, Hybrid Tenders, Hybrid Drivers, Inventory Lead and Lead Luminaries

Excluded; Managers, Assistant Managers, Office Clerical Employees, Guards and Supervisors as defined by the Act.

",NA,NA,NA,NA,NA,NA,NA,NA,NA,NA,NA,NA,NA,NA,NA,NA,NA,NA,NA,NA,NA,NA,"Local 876, United Food and Commercial Workers International Union (UFCW), AFL-CIO, CLC"
"08-RC-284759","Region 08, Cleveland, Ohio","Kenyon College","Open","10/18/2021","","","Gambier","OH",600,"","","Included: All student employees of Kenyon College
Excluded: All managerial employees, guards, professional employees and supervisors as defined by the Act, and all other employees",NA,NA,NA,NA,NA,NA,NA,NA,NA,NA,NA,NA,NA,NA,NA,NA,NA,NA,NA,NA,NA,NA,"United Electrical, Radio and Machine Workers of America (UE)"
"08-RC-295583","Region 08, Cleveland, Ohio","Trane Technologies Company LLC","Open","05/11/2022","","","Valley View","OH",39,"","","All full-time and regular part-time journeyperson and apprentice contracting install technicians, field service technicians, service technician team leaders, contracting control technicians, and service control technicians employed by the Employer at its Valley View, Ohio facility; excluding all other employees, office clerical employees, professional employees, guards and supervisors as defined by the Act.",34,"A","Single Labor Organization","Initial","07/12/2022",34,NA,11,"",NA,"",NA,19,30,"",3,"","","All full-time and regular part-time journeyperson and apprentice Contracting Install Technicians, HVAC Service Technicians, and HVAC Service Technician Leads employed by the Employer at its 9555 Rockside Road, Valley View, Ohio 44125 location; excluding all other employees, office clerical employees, professional employees, guards, and supervisors as defined in the Act.
Others Permitted to Vote:
The parties have agreed that the Contracting Install Technician Lead and the Contracting Install Project Specialist may vote in the election, but their ballots will be challenged since their eligibility has not been resolved.  No decision has been made regarding whether the individuals in the Contracting Install Technician Lead and the Contracting Install Project Specialist classifications are included in, or excluded from, the bargaining unit.  The eligibility or inclusion of these individuals will be resolved, if necessary, following the election. 
","","","","Pipefitters Local 120"
"08-RC-295583","Region 08, Cleveland, Ohio","Trane Technologies Company LLC","Open","05/11/2022",NA,NA,"Valley View","OH",39,NA,"","All full-time and regular part-time journeyperson and apprentice contracting install technicians, field service technicians, service technician team leaders, contracting control technicians, and service control technicians employed by the Employer at its Valley View, Ohio facility; excluding all other employees, office clerical employees, professional employees, guards and supervisors as defined by the Act.",34,NA,NA,NA,NA,NA,NA,NA,NA,NA,NA,NA,NA,NA,NA,NA,NA,NA,NA,NA,NA,NA,"Pipefitters Local 120"
"08-RC-310348","Region 08, Cleveland, Ohio","Total Line Refrigeration, Inc.","Open","01/13/2023","","","Avon Lake","OH",16,"","","Included: All full-time and regular part-time HVAC refrigeration installation employees employed by the Employer at its 33530 Pin Oak Parkway, Avon Lake, Ohio facility. Excluded: All other employees, office clerical employees, managerial employees, guards and supervisors as defined by the Act.",NA,NA,NA,NA,NA,NA,NA,NA,NA,NA,NA,NA,NA,NA,NA,NA,NA,NA,NA,NA,NA,NA,"Plumbers and Steamfitters Local 42"
