"05-RM-275681","Keolis Transit America","Leesburg","04/15/2021","VA","Included: Driver/Operators, Dispatchers, Road Supervisors, Maintenance Foreman, Mechanic, Utility Workers, and Parts Clerks.

Excluded: All other employees, Office clericals, Guards and Supervisors as defined in the Act.",94,"Amalgamated Transit Union, Local 689","Open"
"06-RC-280088","Paragon Systems Inc","Harrisburg","07/19/2021","PA","Included: All full-time and regular part-time Security Officers, Guards, Security Police Officers, performing guard duties as defined in section 9(b)(3) of the National Labor Relations Act, employed by Paragon Systems Inc @ various locations throughout Central Pennsylvania. Excluded: All office clerical employees, professional employees and supervisors as defined by the Act.",40,"Paragon Protective Service Officers National Union PSONU, United Federation LEOS-PBA","Open"
"06-RC-280280","Hudson Legal Group P.C.","Pittsburgh","07/22/2021","PA","Included: Hourly employees in the United States including: Legal Writing Specialists, Senior Writing Specialists, Team Leads and Senior Editors, Team Lead Assistants and Senior Editors, Floating Team Lead Assistants and Senior Editors, Revisions Specialists, Revisions Specialist Team Leads, Case Administration Specialists and Receptionists, Case Administration Specialist Paralegals, Case Administration Specialists, US Forms Team Leads, Legal Assistants, Senior Paralegals, Paralegal Team Leads 

Excluded: Supervisors, Managerial Employees, Attorneys, Security Guards, and Confidential Employees as defined in the Act",180,"United Electrical, Radio & Machine Workers of America","Open"
"06-RC-280312","Paragon Systems Inc","Pittsburgh","07/22/2021","PA","Included: All full-time and regular part-time Security Officers performing guard duties as defined in section 9(b)(3) of the National Labor Relations Act, employed by Paragon Systems Inc under Employer’s Contract No. 70RFP318DE3000001 with the Department of Homeland Security, Federal Protective Service. 

Excluded: All office clerical employees, professional employees and supervisors as defined by the Act.",70,"Paragon Protective Service Officers National Union PSONU, United Federation LEOS-PBA","Open"
"06-RC-281003","10 Roads Express, LLC","Warrendale","08/06/2021","PA","Included: All Full-Time/Part-Time time drivers that are dispatched from and report to the Employer’s Trafford, Pittsburgh, and Warrendale locations.  
Excluded: All office clericals, guards, managers, and professional employees and supervisors as defined by the Act.",70,"General Teamsters, Chauffeurs and Helpers Local 249","Open"
"06-RC-281239","HIPR Pacsoft Technologies","Pittsburgh","08/12/2021","PA","Included: Hourly employees in the United States including: Legal Writing Specialists, Senior Writing Specialists, Team Leads and Senior Editors, Team Lead Assistants and Senior Editors, Floating Team Lead Assistants and Senior Editors, Revisions Specialists, Revisions Specialist Team Leads, Case Administration Specialists and Receptionists, Case Administration Specialist Paralegals, Case Administration Specialists, US Forms Team Leads, Legal Assistants, Senior Paralegals, and Paralegal Team Leads
Excluded: Supervisors, Managerial Employees, Attorneys, Security Guards, and Confidential Employees as defined in the Act",180,"United Electrical, Radio, and Machine Workers of America","Open"
"06-RC-281254","Hudson Legal Group PC/HIPR Pacsoft Technologies, a Common Employer","Pittsburgh","08/12/2021","PA","Included: Hourly employees in the United States including: Legal Writing Specialists, 
Senior Writing Specialists 
Team Leads and Senior Editors 
Team Lead Assistants and Senior Editors 
Floating Team Lead Assistants and Senior Editors 
Revisions Specialists 
Revisions Specialist Team Leads 
Case Administration Specialists and Receptionists 
Case Administration Specialist Paralegals 
Case Administration Specialists 
US Forms Team Leads 
Legal Assistants 
Senior Paralegals 
Paralegal Team Leads
 
Excluded: Supervisors, Managerial Employees, Attorneys, Security Guards, and Confidential Employees as defined in the Act.",180,"United Electrical, Radio, and Machine Workers of America","Open"
"06-RC-281559","Compass Natural Gas Partners LP","Montoursville","08/18/2021","PA","Included: All Regular Full-Time and Part-Time CDL Truck Drivers Excluded: Terminal Attendants and any/all others not covered by this act",8,"Teamsters Local Union No. 764","Open"
"06-RD-273153","GBC Advanced Materials, LLC","Latrobe","02/22/2021","PA","Included: All production and maintenance employees, including plant clerical employees, of the Company at Latrobe, PA plant.

Excluded: Office clerical employees, draftsmen, salesmen, confidential employees, all other employees, all other employees and guards, professional employees and supervisors as defined in the Labor Management Act of 1947, as amended.",20,"IUE-CWA, The Industrial Division of the Communications Workers of America, AFL-CIO, CLC","Open"
"06-RD-279255","ST Engineering Hackney, Inc.","Montgomery","06/29/2021","PA","Included: All full-time and regular part-time production, maintenance, shipping and receiving and Quality Control employees
Excluded: All temporary employees, office clerical employees and guards, professional employees and supervisors as defined by the Act.",109,"United Steel, Paper and Forestry, Rubber, Manufacturing, Energy, Allied Industrial and Service Workers International Union, AFL-CIO/CLC","Open"
"06-RD-279339","Duritza's Enterprises, Inc. d/b/a Rostraver Shop' N Save","Belle Vernon","07/01/2021","PA","Included: Deli, Produce, Front End, Stockers, Meat, Dairy, Frozen, Floral Departments
Excluded:",60,"United Steel, Paper and Forestry, Rubber, Manufacturing, Energy, Allied Industrial and Service Workers International Union, Local 3403, AFL-CIO, CLC","Open"
"06-RD-280868","Catalus Corporation","Galeton","08/04/2021","PA","Included: All full-time and regular part-time production and maintenance employees

Excluded: Confidential, executive, guards, watchmen, professionals, supervisors, quality, technicians, and temporary.",34,"IUE-CWA Industrial Division Local 81134","Open"
"06-RD-281331","Monongahela Power Company","Haywood","08/13/2021","WV","Included: All full time and regular part time employees, including Op Tech/M, Op Tech/O, Op/C Techs, Store Room

Excluded: All office clerical employees, foreman, guards, professional employees and supervisors",166,"Utility Workers Union of America Local #304","Open"
"06-RD-281747","Platinum Ridge Center for Rehabilitation and Healing","Brackenridge","08/22/2021","PA","Included: CNA, LPN, dietary aides, cooks, therapy assistants, housekeeping
Excluded: RN, supervisors, managers",40,"AFSCME","Open"
"06-UD-279304","Kinzua Healthcare and Rehabilitation Center","Warren","06/30/2021","PA","Included:  CNAs, LPNs, van drivers/maintenance, housekeeping and laundry aide employees

Excluded:  Receptionists, Dietary employees, central supply employees, office clerical employees, and guards and supervisors",58,"SEIU","Open"
"07-RC-269162","American Steel Construction","Livonia","11/18/2020","MI","Included: Full time and regular part time journeyman and apprentice field ironworkers

Excluded: All others including clerical, professional, guards and supervisors under the act",8,"Local 25, International  Association of Bridge, Structural, Ornamental and Reinforcing Iron Workers (Iron Workers), AFL-CIO","Open"
"07-RC-279452","Power Home Solar LLC","Chesterfield","07/06/2021","MI","Included: All Licensed Masters, Journeymen and Apprentice Installers and Electricians employed

Excluded: Owner, Supervisor, Office Staff,
Guards",30,"Local 58, International Brotherhood of Electrical Workers  (IBEW), AFL-CIO","Open"
"07-RC-280298","Quaker Houghton PA, Inc.","Detroit","07/22/2021","MI","Included:  All full time, part time and supplemental production and maintenance employees.

Excluded:  All other employees; office, clerical, guards and supervisors as defined in the Act.",32,"International Union, United Automobile, Aerospace and Agricultural Implement Workers of America (UAW), AFL-CIO","Open"
"07-RC-281432","Traverse Anesthesia Associates, P.C.","Traverse City","08/16/2021","MI","Included: All full time, part time and contingent CRNAs and Anesthesia Assistants employed at
Traverse City and its satellite facilities including Manistee, Michigan 

Excluded: All other employees",26,"Northwest Michigan CRNA and Associates","Open"
"07-RD-264330","Rieth-Riley Construction Co., Inc.","Grand Rapids, Kalamazoo, Petoskey, Lansing","08/07/2020","MI","Included:  All full and regular part-time asphalt plant employees, paving and grading employees in Michigan

Excluded:  Guards and Supervisors",161,"Local 324, International Union of Operating Engineers (IUOE)","Open"
"07-RD-279735","Wellspring Lutheran Services","Frankenmuth","07/12/2021","MI","Included: Nursing and Social Work

Excluded: NA",17,"International Union, United Automobile, Aerospace and Agricultural Implement Workers of America (UAW), AFL-CIO","Open"
"07-RD-280684","OMNI Community Credit Union","Battle Creek","07/30/2021","MI","Included: Union Positions

Excluded: Non Union Positions",41,"Local 42, Office and Professional Employees International  Union, (OPEIU),AFL-CIO","Open"
"07-RD-282049","Notting Hill of West Bloomfield","West Bloomfield","08/26/2021","MI","Included: CNA, Kitchen, Laundry department, activities.  Excluded:  All other Employee's.",32,"SEIU Healthcare Michigan","Open"
"08-RC-275374","The American National Red Cross","Cleveland","04/09/2021","OH","All Volunteer Engagement Representatives I and II managed through Blood Services Northern Ohio Region of the American Red Cross to be included in the Petitioner's existing unit consisting of the Employer's regular full-time and regular  part-time Donor Recruitment Department Account Managers, as certified in NLRB Case Nos. 8-RC-153338, but excluding any Volunteer Engagement Representatives managed by other Regions of the American Red Cross.",7,"Teamsters Local Union No. 507","Open"
"08-RC-278766","INEOS Pigments USA, Inc.","Ashtabula","06/21/2021","OH","Included: All full and regular part-time production, maintenance, instrumenticians and electricians, shipping and receiving, and warehouse employees.

Excluded: All office clerical employees, professional employees, lab employees, guards and supervisors, as defined in the Act.",129,"International Chemical Workers Union Council of the UFCW, Local 1033C","Open"
"08-RC-279485","Copley Ohio Newspapers, Inc., dba Kent Record-Courier","Kent","07/06/2021","OH","All full and regular part time news department employees of the Record Courier.",7,"Northeast Ohio Newspaper Guild/TNG-CWA Local 34001","Open"
"08-RD-280149","Sunbelt Rentals, Inc.","Findlay","07/20/2021","OH","Included:

All full-time and part-time mechanics/
technicians, drivers and yard associates

Excluded: Secretaries, dispatchers, clerical and sales personnel, FCM, professional employees, guards, service managers and supervisors
",8,"International Union of Operating Engineers Local 18 District 2","Open"
"09-RC-280878","BROWN COUNTY RURAL WATER ASSOCIATION, INC.","Ripley","08/04/2021","OH","Included:  All full-time and part-time production and distribution workers.

Excluded:  All clerical and professional employees, guards, and supervisors.",17,"Laborers' International Union of North America (LIUNA), Local 265","Open"
"09-RC-280879","BROWN COUNTY RURAL WATER ASSOCIATION, INC.","Ripley","08/04/2021","OH","Included:  All full-time and part-time office clerical workers.

Excluded:  All production & distribution workers, professional employees, guards, and supervisors.",2,"Laborers' International Union of North America, Local 265","Open"
"09-RC-281643","CHEMOURS","Belle","08/19/2021","WV","Included:  All lab full-time and part-time (Laboratory Analyst and Laboratory Technician).
Excluded:  All supervisory, office, operators, clerical or security as defined by the Act.",4,"United Mine Workers of America, Region II","Open"
"09-RC-281922","ARBORMETRICS SOLUTIONS LLC","Hazard","08/25/2021","KY","Included: All full-time and regular part-time employees of the Employer performing work
planning or job planning on the property of Appalachian Power Co./Kentucky Power and its
subsidiaries in the Commonwealth of Kentucky, including all Work Planners/Permission persons.  
Excluding: Project leads, managers, office clerical employees, professional employees, guards
and supervisors as defined by the Act, and all other employees.",2,"International Brotherhood of Electrical Workers AFL-CIO (IBEW), Local Union 369","Open"
"09-RD-200329","LEGGETT & PLATT, INC.","Winchester","06/09/2017","KY","Included:  Production & Maintenance employees at the New St. and Ecton Rd., Winchester, KY facility including inspectors and shipping and receiving employees.

Excluded:  Over the road drivers, office clerical emplooyees, quality auditors, inventory control employees, parts attendants, guards, professional employees, and supervisors.",50,"International Association of Machinists and Aerospace Workers, AFL-CIO (IAM), Local 619","Open"
"09-RD-280999","ALRO STEEL CORPORATION","Dayton","08/06/2021","OH","Included:  All full-time crane operators, truck drivers, production employees and warehouse employees employed by the Company at the Dayton OH facility:
Excluded:  All office employees, clerical employees, all professional employees, guards and supervisors as defined in the Act.",150,"General Truck Drivers, Warehousemen, Helpers, Sales and Service, and Casino Employees, Teamsters Local Union No. 957","Open"
"10-RC-273024","Nissan North America, Inc.","Smyrna","02/19/2021","TN","Included: Tool and Die Maintenance Technicians

Excluded: Maintenance, Production, all other employees, & usual exclusions under the Act",87,"International Association of Machinists and Aerospace Workers, (IAM) District Lodge 1888","Open"
"10-RC-276292","The Atlanta Opera, Inc.","Atlanta","04/28/2021","GA","Included: All Make-Up Artists and Hair Stylists employed by the Employer. Excluded: All other employees, including all clerical workers, managers, guards, and supervisors as defined by the Act.",16,"Make-Up Artists and Hair Stylists Union, Local 798, IATSE","Open"
"10-RC-276475","Duke University","Durham","05/03/2021","NC","Included:  All full-time and regular part-time employees.

Excluded:  Supervisors, managerial employees, and confidential employees as defined in the Act.
",77,"Washington-Baltimore News Guild, Local 32035","Open"
"10-RC-279386","Vulcan Mechanical Services, Inc., d/b/a Vulcan Heating and Air Conditioning Service, Inc.","Madison","07/02/2021","AL","Included: All full-time and regular part-time HVAC service technicians employed by the Employer at its 7243 Greenbriar Road, Madison, Alabama facility. Excluded: All other employees, office clerical employees, guards and supervisors as defined by the Act.",11,"Plumbers and Pipefitters Local 760, United Association of Journeymen and Apprentices of the Plumbing and Pipe Fitting Industry of the United States and Canada, AFL-CIO","Open"
"10-RC-279628","ADC LTD NM","Hapeville","07/08/2021","GA","Included:  All full-time and part-time armed and unarmed security officers employed by the Employer.

Excluded:  Clerical, managerial, salaried, and supervisory personnel as defined by the Act.",8,"United Government Security Officers of America and its Local 291","Open"
"10-RC-280204","Culpepper & Associates Security Services, Inc.","College Park","07/20/2021","GA","Included: All Full-Time and Part-Time Armed and Unarmed Security Officers Performing Guard Duties As Defined In Section 9(b)(3) of The National Labor Relations Act, Employed by Culpepper Associates Security Services @ 1701 Columbia Ave, College Park, GA 30337

Excluded: All Office Clerical Employees, Professional Employees and Supervisors as Defined by the Act.
",14,"International Union, Security, Police and Fire Professional of America (SPFPA)","Open"
"10-RC-281040","US Foods","Charlotte","08/09/2021","NC","Included: All Driver 
Excluded: Supervisors, managers, maintenance, warehouse, clerical/office, all non- driver.",5,"Teamster Local 509","Open"
"10-RC-281060","Vertex Aerospace, LLC","Jacksonville","08/10/2021","NC","ALL FULL AND REGULAR PART TIME AIRFRAME MECHANICS, AVIONICS MECHANICS, SHEETMETAL MECHANICS, CDQAR INSPECTORS, MAINTENANCE ADMIN CLERKS, PRODUCTION CONTROL CLERKS AND HAZMAT/SUPPLY/TOOL AND PARTS ATTENDANTS AND CLERKS, PERFORMING WORK ON THE EMPLOYERS H-53 RESET PROGRAM AT MARINE CORPS AIR STATION NEW RIVER. EXCLUDED: OFFICE CLERICAL EMPLOYEES, PROFESSIONAL EMPLOYEES, MANAGERIAL EMPLOYEES, GUARDS, SUPERVISORS, AS DEFINED IN THE ACT.",74,"International Association of Machinists and Aerospace Workers, AFL-CIO","Open"
"10-RC-281157","Pepsi Beverages Company, an operating unit of Pepsico, Inc.","Macon","08/11/2021","GA","Included: All Full-time Regular Part-time loaders, checkers, drivers, (including relief drivers, full services drivers, bulk drivers, and D bay drivers), (merchandisers and fleet mechanics. 
Excluded: All other employees.",47,"United Food & Commercial Workers Union Local 1996","Open"
"10-RC-281238","Celestik Inc.","Fletcher","08/12/2021","NC","Included:  All warehouse workers, baler lead, balers, shipping/receiving, production, machine operators, floor lead, forklift drivers, core cutters, material handlers, maintenance

Excluded:  Supervisors
",15,"International Brotherhood of Teamsters, Local 61","Open"
"10-RC-281586","Architectural Glass & Waterproofing Inc.","Canton","08/18/2021","GA","Included: All full-time and part-time glaziers, apprentices
Excluded: Excluding all other employees, guards and supervisors",7,"International Union of Painters & Allied Trades District Council No. 77, Local Union No. 1940","Open"
"10-RC-281650","Amentum","Nashville","08/19/2021","TN","Included: All full-time and regular part-time Aircraft Mechanics

Excluded: Managers, Supervisors, Clerical Workers, and all other employees including professional employees, managerial employees, guards, supervisors, and other employees as defined by the Act.",3,"International Association of Machinists and Aerospace Workers, AFL-CIO","Open"
"10-RC-281673","Invictus Technical Solutions","Nashville","08/20/2021","TN","Included: All Full-time and regular part-time aircraft mechanics. Excluded: All mangers, supervisors, clerical workers, and all other employees including professional employees, managerial employees, guards, supervisors, and other employees as defined by the act.",3,"International Association of Machinists and Aerospace Workers","Open"
"10-RC-281971","Cumberland Electric Membership Corporation","Clarksville","08/26/2021","TN","Included: This petition seeks a self-determination (Armour Globe) election for the presently unrepresented all full-time and regular part-time Fiber Technicians I and Fiber Technicians II at the Cumberland Electric Membership Corporation, Clarksville, TN. facilities, and to be included in current unit in collective bargaining agreement dated the 26th day of August 2018 between the Cumberland Electric Membership Corporation and Local Union No. 175 of the International Brotherhood of Electrical Workers.

Excluded: All other employees, confidential employees, and guards and supervisors as defined by the act.",10,"IBEW Local 175","Open"
"12-RC-279367","Earle M. Jorgensen Company","Orlando","07/01/2021","FL","NCLUDED:  All full-time and regular part-time warehouse employees, machine operators and drivers employed by the Employer at its facility located at 8501 Florida Rock Road, Orlando, Florida.

EXCLUDED:  All inside sales employees, customer service employees, customer service employees, temporary employees, office clerical, guards and supervisors as defined in the Act.",9,"Earle M. Jorgenson Co. / EMJ Metals","Open"
"12-RC-279895","Wellpath, LLC","Florida City","07/12/2021","FL","Included: All Full-Time and Part-Time Armed and Unarmed Custody Officers and Correctional Officers Performing Guard Duties as Defined in Section 9(b)(3) of the National Labor Relations Act, employed by Wellpath @ 18680 SW 376 St, Florida City, FL 33034.

Excluded: All Office Clerical Employees, Professional Employees and Supervisors as Defined by the Act.
",50,"International Union of Security, Police and Fire Professionals of America","Open"
"12-RC-279939","Agregados Piedra Blanca, Inc.","Arecibo","07/15/2021","PR","Included:  All the Full Time and Regular Part Time Heavy Equipment Operators employed by the Employer at its Facilities.  Excluded:  All other employees, Office Clerical Employees, Professional Employees, Confidential Employees, Guards and Supervisors as defined by the Act.",10,"LIUNA District Council of Puerto Rico","Open"
"12-RC-281816","Liga Puertorriqueña Contra el Cancer","San Juan","08/24/2021","PR","Included: All Physical Therapies assistant that work for the employer in the above name location. 

Excluded: All supervisor, managerial, security guard and all other excluded employees under the act.",3,"Union General de Trabajadores, Service Employees International Union","Open"
"12-RC-281896","Liga Puertorriqueña Contra el Cáncer","San Juan","08/24/2021","PR","Included: All medical technologies and Physical Therapies that work for the employer in the above name location. 

Excluded: All Supervisor, managerial, security guard and all other excluded employees under the act.",5,"Union General de Trabajadores, Service Employees International Union","Open"
"12-RD-279313","Indian River Memorial Hospital, Inc. d/b/a Cleveland Clinic Indian River Hospital","Vero Beach","06/30/2021","FL","Included:  Nurses
Excluded: all other employees",468,"Teamsters Local Union No. 769","Open"
"12-RD-280349","Petro Taino Transport Corp.","Penuelas","07/23/2021","PR","Included: All full time and Regular Part time Truck Drivers, Mechanics, Assistant & Maintenance. 

Excluded: Other employees, guards, supervisors.",19,"","Open"
"13-RC-274653","Wide Open West Illinois, LLC","Warrenville","03/25/2021","IL","Included: Service Techs, Field Service Techs, Fiber Techs, Commertical Techs, Laborers & Warehouse

Excluded:
Payment Center Clerks, Network Assurance Center employees & all other employees",48,"IBEW Local 21","Open"
"13-RC-281169","Spike Enterprise, Inc.","Channahon (Township)","08/11/2021","IL","Included:
Full and regular part-time heavy equipment and vac truck operators, techs and laborers.

Excluded:
Supervisors, guards and clericals as defined by the Act.",17,"International Union of Operating Engineers, Local 150, AFL-CIO","Open"
"13-RC-281406","Northwestern Memorial Hospital","Chicago","08/16/2021","IL","Included: All regular, full-time, part-time Nutrition Operators to be represented in the existing
unit as defined in the collective bargaining agreement between the Petitioner and Employer.
Section 2.1 of the collective bargaining agreement between Petitioner and Employer provides the
Description of Unit. The Hospital recognizes the Union as the exclusive bargaining agent with
respect to wages, hours, and other terms and conditions of employment for all employees in the
job classifications set forth as: Housekeeping Assistant, Housekeeping Assistant II, Food Service
Attendant II, Wait Staff Associate, Server, Film File Clerk, Food Service Attendant III,
Housekeeping Assistant Specialist I, Third Cook, Catering Associate, Operating Room
Technician, Darkroom Technician, Diet Clerk, Materials Service Coordinator II, Housekeeping
Assistant Specialist II, Mail Clerk, Nursing Assistant, Operating Room Assistant, Physical
Therapy Aide, Second Cook, Food Service Attendant I, Patient Escort, Support Services
Specialist, Materials Service Coordinator III, Unit Secretary, Lead Patient Escort, Lead Mail
Clerk, Sterile Processing Technician I, Patient Care Technician, Emergency Department
Assistant, Groundskeeper, Pharmacy Technician II, First Cook, Sterile Processing Technician
II (11 professional experience subclasses), Pharmacy Technician III (11 professional experience
subclasses), Pharmacy Technician III (Hazardous Compounding) (11 professional experience
subclasses), and Operating Room Scrub Technician (16 professional experience subclasses).

Excluded: The unit specifically excludes all regularly scheduled employees working nineteen
(19) hours per week or less, all casual and part-time employees who work less than one thousand
(1,000) hours in a calendar year, guards, student nurses, students under Chicago Board of
Education supervision, supervisors (as defined in the Act) and all other Hospital employees.",6,"SEIU Healthcare Illinois, Indiana, Missouri, and Kansas","Open"
"13-RC-281469","Wheeling Skilled Nursing Facility, LLC a/k/a Bella Terra Wheeling","Wheeling","08/17/2021","IL","Included: All full-time and regular part-time certified Nursing Assistants (CNAs), Housekeeping employees, Laundry Employees, Activity Aides, and Restorative Nurse/Rehab Aides.

Excluded: Licensed practical and registered nurses, confidential employees, casual employees, guard, managers and supervisors as defined by the National Labor Relations Act.",100,"Service Employees International Union Local 4","Open"
"13-RC-281653","Earth Friendly Products","Addison","08/19/2021","IL","Employees Included:All regular full and part time production, maintenance, and warehouse employees
including, but not limited to, line operators, batch makers, shipping and receiving, and
recycling.
Employees.
Excluded:
All clerical employees and guards and supervisors as defined by the NLRA",45,"GCC/IBT Local 458M","Open"
