"12-RC-273572","JJR Construction Group LLC","Naguabo","03/02/2021","PR","Included: All the full time and regular part time crane operators employed by the employer at its Naguabo facilities Excluded: All other employees, office clerical employees, professional employees, confidential employees, guards and supervisors as defined by the Act",14,"Laborer's International Union of North America","Open"
"12-RC-277678","Industrial Sprinkler Corp.","Barceloneta","05/25/2021","PR","Included: All the full time and regular part time employees engged in the fabrication and installations of sprinkler systems employed by the employer at its facilities.

Excluded: All other employees, office clerical employees, professional employees, confidential employees, guards and supervisors as defined by the Act.
",36,"Laborers' International Union of North America (LIUNA), District Council of Puerto Rico, AFL-CIO","Open"
"12-RC-277875","GM&P Consulting and Glazing Contractors, Inc.","Miami","05/28/2021","FL","Included: Journeyman Finishers.  Excluded: Laborers",33,"International Association of Bridge, Structural, Ornamental, and Reinforcing Iron Workers Local 272, AFL-CIO","Open"
"12-RC-278038","Bio-Medical Applications of Arecibo, Inc.","San Juan","06/01/2021","PR","Included: All the nursing staff.

Excluded: None nursing staff.",2,"Union General de Trabajadores, Local 1199, Service Employees International Union (SEIU)","Open"
"12-RC-278339","Lifestyle Footwear, Inc.","Moca","06/09/2021","PR","Todos los operadores de equipo de producción, operadores de máquinas de coser, ‘set up”, control de calidad y trabajadores mecánicos, y otros trabajadores relacionados a producción.
 
Excluídos: todos los empleados gerenciales, empleados clericales de oficina, guardias y supervisores según se definen en la Ley.  
",426,"Laborers’ International Union of North America (LIUNA), District Council of Puerto Rico, AFL-CIO","Open"
"12-RC-278958","ADC LTD NM","Carolina","06/23/2021","PR","INCLUDED:  All security guards that work for the employer in the above name location.
EXCLUDED:  All non security guards and all other excluded employees under the Act.",10,"Union de Profesionales de la Seguridad Privada y Transporte de Valores","Open"
"12-RC-279295","Intermodal Mexico USA, LLC (IMEX)","Miami Springs","06/29/2021","FL","Included:  Mechanics employed by the employer in both Miami and Ft. Lauderdale.  Excluded:  All other employees of the Employer.",9,"Teamsters Local Union  No. 769","Open"
"12-RC-279367","Earle M. Jorgensen Company","Orlando","07/01/2021","FL","NCLUDED:  All full-time and regular part-time warehouse employees and drivers at the Employer's facility in Orlando, FL.
EXCLUDED:  All temporary employees, salesman, office clerical, guards and supervisors as defined in the Act.",9,"Earle M. Jorgenson Co. / EMJ Metals","Open"
"12-RC-279412","AmeriGas Propane, Inc.","Ocala","07/02/2021","FL","Included: ACE Drivers, Bulk Drivers, Service Technicians working in the Ocala, FL and Brooksville, FL facilities. Excluded: All others",17,"Teamsters Local 79","Open"
"12-RC-279895","Wellpath","Florida City","07/12/2021","FL","Included: All Full-Time and Part-Time Armed and Unarmed Custody Officers and Correctional Officers Performing Guard Duties as Defined in Section 9(b)(3) of the National Labor Relations Act, employed by Wellpath @ 18680 SW 376 St, Florida City, FL 33034.

Excluded: All Office Clerical Employees, Professional Employees and Supervisors as Defined by the Act.
",50,"International Union of Security, Police and Fire Professionals of America","Open"
"12-RC-279939","Agregados Piedra Blanca, Inc.","Arecibo","07/15/2021","PR","Included:  All the Full Time and Regular Part Time Heavy Equipment Operators employed by the Employer at its Facilities.  Excluded:  All other employees, Office Clerical Employees, Professional Employees, Confidential Employees, Guards and Supervisors as defined by the Act.",10,"LIUNA District Council of Puerto Rico","Open"
"12-RD-279313","Cleveland Clinic Indian River Hospital","Vero Beach","06/30/2021","FL","Included:  Nurses
Excluded: all other employees",468,"Teamsters Local Union No. 769","Open"
"12-RM-277090","Kazi Foods of the Virgin Islands, Inc. d/b/a Kentucky Fried Chicken","St Thomas","05/13/2021","VI","lncluded: Food & customer service team members employed only at Ft. Mylner & Subbase.

Excluded:
all managerial employees, office clerical employees, guards, & supervisors.",35,"Virgin Islands Workers Union","Open"
"13-RC-160240","JAM Productions, Ltd., Event Productions, Inc., Standing Room Only, Inc., and Victoria Operating Co., a single employer","Chicago","09/17/2015","IL","Included- All full-time and  regular part-time stage production employees employed by the Employer at the Riveria, Park West, and Vic Theatres, including employees who perform carpentry, electrical, properties, audio, rigging, fly rail work, load-in, and load-out.

Excluded- Office Clerical employees and guards, professional employees and supervisors as defined in the Act.",58,"International Alliance of Theatrical Stage Employees (IATSE) Local 2","Open"
"13-RC-274653","Wide Open West Illinois, LLC","Warrenville","03/25/2021","IL","Included: Service Techs, Field Service Techs, Fiber Techs, Commertical Techs, Laborers & Warehouse

Excluded:
Payment Center Clerks, Network Assurance Center employees & all other employees",48,"IBEW Local 21","Open"
"13-RC-278226","Hallowell List Industries","Munster","06/08/2021","IN","Included:  All Assembly, Warehouse and Production Employees.

Excluded:  Clerical, Supervisors and Guards as defined by the Act.",21,"Teamsters Local 142","Open"
"13-RC-278393","Northwest Community Healthcare","Arlington Heights","06/11/2021","IL","Included:  All full-time and regular part-time engineers, maintenance, mechanics, painters, electricians, groundkeepers, and coordinators working in the skilled maintenance department at Northwest Community Healthcare located at 800 West Central Road, Arlington Heights, IL   60005.
Excluded:
office clerical, professional employees, managers, guards, and supervisors as defined by the Act.",30,"International Union of Operating Engineers Local 399","Open"
"13-RC-278462","Asphalt Operating Services of Chicago, LLC","Chicago","06/14/2021","IL","Included: All full-time and regular part-time rail loaders, rail helpers, scale operators, operations technicians, and team leaders. Excluded: All managers, supervisors, clericals, and guards as defined under the Act.",18,"International Union of Operating Engineers, Local 150, AFL-CIO","Open"
"13-RC-279684","DFW Security Protective Force","Chicago","07/09/2021","IL","Included:  FAA Security Guards assigned to the federal buildings in the state of Illinois.

Excluded:  All other employees of the Employer covered by the Act.",38,"Illinois Council of Police (ICOPS)","Open"
"13-RD-277094","Groot Industries, Inc.","Elk Grove Village","05/13/2021","IL","Included: Helpers, sorters, utility employees - forklift, balers, conveyer feed loaders, on-site sweeper units, bobcats, equipment maintenance, truck spotters, truck washers, parts / pick up deliver, and inner company messenger service. 


Excluded: supervisors, managers, office clerical",60,"Teamsters Local Union No. 731","Open"
"13-RM-278885","Club Gene & Georgetti Limited Partnership","Chicago","06/22/2021","IL","Included: Head waiter, head hostess, full time captain hostess, waiter, waitress, bus person,
cashier, food checker, combination cashier checker, working chef supervising, pastry chef,
assistant chef, head second cook, night cook, head cold meat, head butcher, assistant pastry
check, assistant sugar decorator, head roast, head broiler, head fry, second cook, butcher, baker,
cold meat, pastry cook, roast, broiler, fry, carver, steamtable, oysterman, chicken butcher, fish
butcher, sandwich man, pastry man, vegetable cook, pastry man/vegetable cook combination,
pantry combination, dishwasher, runner (kitchen), potwasher, clean up man, utility, steady &
extra public bartender, steady & extra service bartender, barporter.
Excluded:
Part-time Captain/Hostess
",44,"Unite HERE, Local 1","Open"
"14-RC-265356","The Riverview Nursing Facility, LLC d/b/a The Riverview Care Center","Saint Louis","08/28/2020","MO","Included:  All full-time and regular part-time cooks, activity assistants, deitary aides, licensed practical nurses (LPNs), graduate practical nurses (GPNs), certified medication technicians (CMTs), restorative aides (RAs), certified nursing assistants (CNAs), housekeepers, laundry aides, and maintenance employees employed by the Employer. Excluded:  registered nurses (RNs), receptionists, medical records secretary/central supply clerk, office clericals and professional employees, and guards and supervisors as defined by the Act.",57,"SEIU Healthcare Missouri-Kansas, a division of SEIU Healthcare Illinois/Indiana","Open"
"14-RC-276315","Lieber Mechanical, LLC","Oklahoma City","04/28/2021","OK","Included:  All full-time and regular part-time pipefitters, plumbers, pipelayers, and pipe helpers and/or apprentices employed by the Employer at its jobsite currently located at First National Center, 120 N. Robinson Avenue, Oklahoma City, Oklahoma 73102.  Excluded:  All other employees, managers, office clericals, guards and supervisors as defined in the Act.",39,"Plumbers & Pipefitters Local 344","Open"
"14-RC-277556","Schenker, Inc.","Edwardsville","05/24/2021","IL","Included:  All full-time drivers working for DB Shenker based out of 3 Gateway Commerce Center Drive East, Edwardsville, IL 62025.  Excluded:  Office clerical, professional employees, managers, guards and supervisors as defined by the Act.",65,"International Union of Operating Engineers Local 399","Open"
"14-RC-278560","Hallcon Corporation","Wichita","06/15/2021","KS","Included:  All regular full-time and part-time drivers.  Excluded:  office clerical employees, professional employees, guards, supervisors as defined in the Act.",9,"International Brotherhood of Teamsters, Local 795","Open"
"14-RC-278595","Union Electric Company d/b/a Ameren MO","Steedman","06/16/2021","MO","Included:  Employees of the Callaway Work Management department with the job title of planner.  Excluded:  Managers, Professional Employees and Guards as defined by the Act.",12,"International Union of Operating Engineers, Local 148","Open"
"14-RC-278912","Republic Services","Edwardsville","06/23/2021","IL","Included: All full-time and regular part-time heavy equipment operators employed by the Employer at its 4601 Cahokia Rd., Edwardsville, Illinois facility Excluded: All other employees, office clerical employees, professional employees, guards and supervisors as defined by the Act",12,"Teamsters, Automotive, Petroleum and Allied Workers, Local No. 50","Open"
"14-RC-279611","Brenntag Chemical Company","Saint Louis","07/07/2021","MO","Included:  truck drivers, warehouse workers, forklift drivers, etc.  Excluded:  management/corporate employees or any other non-bargaining unit employees.",21,"Teamsters Local 618","Open"
"14-RD-275984","Air Capitol Fire, LLC","Wichita","04/22/2021","KS","Included:  Employees performing installation, inspection and repair of sprinkler and fire safety systems.  Excluded:  Management employees.",3,"UA Local Union No 669 Road Sprinkler Fitters, AFL-CIO","Open"
"15-RC-008841","Outokumpu Stainless USA f/k/a ThyssenKrup Stainless USA, LLC","Calvert","05/17/2010","AL","Included:  All full-time and part-rime production and maintenance employees.

Excluded:  All supervisors, managers and guards as defined in the Act, as amended.",80,"USW","Open"
"15-RC-275949","Huntington Ingalls Shipbuilding","Pascagoula","04/21/2021","MS","Included:  All full-time and regularly scheduled employees classified as firefighters including firefighter 4 (lead worker), firefighter 3, firefighter 2 (all firefighters are qualified as emergency medical technicians and paramedics) at the employers facility located at 1000 Jerry St. Pe Hwy, Pascagoula, MS

Excluded:  Fire Chief, fire inspectors, fire prevention auditors, safety employees, maintenance employees, apprentices (production and maintenance dept), all material men, material support employees (material expediters and material supply clerks), tool room employees and plant and office clerical employees, (drawing clerks, key machine operators, mail carriers,office clerks, reproduction clerks, senior office clerks and senior reproduction clerks),  office janitors, technical employees (mt-pt inspectors, optical detailers, radiographic employees, in plant production dept, including security officers, all pattern makers (and apprentices), all time keepers, apprentices, technical aids, junior designers, designers, senior designers and supervisors, as defined in the act.",14,"International Association of Firefighters, Local 100-97","Open"
"15-RC-276907","UPS Supply Chain Solutions, Inc.","Memphis","05/11/2021","TN","Included:  All full time and regular part time warehouse, receivers, packers and fork lift operator

Excluded:  All managers and office employees, and all guards and supervisors as defined by the ACT.",28,"International Brotherhood of Teamsters Local 667","Open"
"15-RC-277883","Gulf Coast Electric Cooperative Inc.","Wewahitchka","06/01/2021","FL","Included: All Outside Full-time and Part-time Apprentices, Line Technicians, Foreman, Utility Technicians, Apparatus Specialist, Mechanic, ROW Operator & Warehouseman. Excluded: All Other Regular full-time and part-time Employees, Professional Employees, Office Clerical, Managerial Employees, Engineers, Guards and Supervisors as defined by the Act.",32,"International Brotherhood of Electrical Workers, Local Union 1055","Open"
"15-RC-278204","Entergy Operations, Inc.","Port Gibson","06/08/2021","MS","Included:  All Full-Time and Part-Time Armed and Unarmed Security Officers performing guard duties as defined in Section 9(B)(3) of the National Labor Relations Act, employed by Entergy Operations, Inc @ 7003 Bald Hill Rd, Port Gibson, MS 39150

Excluded:  All Office Clerical Employees, Professional Employees and Supervisors as defined by the Act.
",64,"Nuclear Enforcement Officers National Unions, IUSPFPA-PBA","Open"
"15-RC-279355","Centerra Group, LLC","Pensacola","07/06/2021","FL","All full-time and shared position Court Security Officers (CSOs) and Lead Court Security
Officers (LCSOs) employed by the employer at the U.S. Courthouse, 100 N. Palafox St.,
Pensacola, FL and the U.S. Courthouse, 30 W. Government St., Panama City, FL, and excluding
all office clerical employees, professional employees, confidential employees and supervisors as
defined in the Act.",38,"United States Court Security Officers","Open"
"15-RC-279794","Centerra Group, LLC","Pensacola","07/13/2021","FL","Included:  All full-time and shared position Court Security Officers (CSOs) and Lead Court Security
Officers (LCSOs) employed by the employer at the U.S. Courthouse, 100 N. Palafox St.,
Pensacola, FL and the U.S. Courthouse, 30 W. Government St., Panama City, FL

Excluded:  
All office clerical employees, professional employees, confidential employees and supervisors as
defined in the Act.",38,"United States Court Security Officers","Open"
"15-RD-272833","Security Walls, LLC","New Orleans","02/17/2021","LA","Included:
All full-time and regular part-time unsecured officers employed by the employer at the Michoud Assembly Facility, New Orleans, Louisiana

Excluded:
All other employees including, office clerical employees, professional employees, managerial employees, and supervisors as defined in the Act.",41,"International Union, Security, Police and Security Professionals of America (SPFPA), and Its Local No. 129","Open"
"15-RD-279796","Magnitude 7 Metals","Marston","07/13/2021","MO","Included: 405

Excluded: 114",519,"United Steelworkers of America, Local 7686","Open"
"16-RC-277810","Praxair Distribution, Inc.","Austin","05/28/2021","TX","INCLUDED:  All cylinder fillers, material handlers & drivers.

EXCLUDED:  Supervisors, salesmen, clerical, watchmen, guards, home medical employees.",10,"TEAMSTERS LOCAL UNION NO. 657","Open"
"16-RC-279051","UNIVAR SOLUTIONS USA INC.","Houston","06/25/2021","TX","Included: Drivers Excluded: 0",19,"TEAMSTERS LOCAL UNION NO. 988","Open"
"16-RC-279750","Corpus Christi Regional Transportation","Corpus Christi","07/12/2021","TX","Included: Transportation & Maintenance Workers.


Excluded: Management.",104,"TRASPORT WORKERS UNION OF AMERICA, AFL-CIO","Open"
"16-RD-276481","GENERAL CABLE INDUSTRIES, INC. D/B/A PRYSMIAN GROUP","Scottsville","04/30/2021","TX","Included: 
Hourly employees

Excluded: Salary employees",400,"INTERNATIONAL UNION, UNITED AUTOMBILE, AEROSPACE AND AGRICULTURAL WORKERS OF AMERICA, UAW AND ITS LOCAL 3057","Open"
"18-RC-273053","FOX TELEVISION STATIONS, LLC","Brown Deer","02/22/2021","WI","Included: All full and part time Photojournalists including the Chief Photographer and Director of Photography, Multimedia Journalists, and Editors.

Excluded: Clericals, administrative staff, managers, and other statutorily excluded employees.
",32,"National Association of Broadcast Employees and Technicians - Communications Workers of America, AFL-CIO","Open"
"18-RC-278314","Sysco Western Minnesota, Inc.","Minneapolis","06/09/2021","MN","Included:  All regular full-time and regular part-time drivers and domicile drivers employed by the employer at the St. Cloud facility, 900 Highway 10 S, St. Cloud, MN 56304. Excluding:  All clerical employees, warehouse workers, professional employees, managers, supervisors and guards as defined in the act and all other employees.",40,"Teamsters Local 120","Open"
"18-RC-278851","Duluth Nursing Rehabilitation Center LLC d/b/a Bayshore Residence and Rehabilitation Center","Duluth","06/21/2021","MN","Included: Skilled Maintenance Bargaining Unit Excluded: All other represented and unrepresented bargaining units",3,"SEIU Healthcare Minnesota","Open"
"18-RC-279260","Dairyland Power Cooperative","La Crosse","06/30/2021","WI","Included: All full-time and regular part-time fleet mechanics, lead fleet mechanics, foreperson-fleet mechanics, and parts specialists employed by the Employer at its La Crosse and Elk Mound, Wisconsin facilities.

Excluded: All other employees, office clerical employees, and guards and supervisors as defined by the Act, as amended.",7,"International Brotherhood of Electrical Workers Local Union 953","Open"
"18-RC-279326","ALLETE, INC. D/B/A MINNESOTA POWER","Duluth","07/01/2021","MN","Included: Armour-Globe election - Add all employees in the Instrument/lab/environmental specialist classification to the existing bargaining unit Excluded: Professionals, managers, guards and supervisors as defined by the Act, as amended",4,"International Brotherhood of Electrical Workers Local 31","Open"
"18-RD-274308","Cheetah Precision, LLC d/b/a Minneapolis Washer & Stamping","Minneapolis","03/16/2021","MN","Included:  Operators, tooling machinists, shipping, receiving, packing, setupmen; Excluded:  N/A",14,"IUE-CWA LOCAL 1140","Open"
"18-RD-279598","Lakeside Foods, Inc.","Poynette","07/08/2021","WI","Included:  All year round employees, including distribution center employees and truck drivers.

Excluded:  seasonal employees, professional employees, managerial employees, officer clerical employees, ag employee.



",47,"TEAMSTERS LOCAL 695","Open"
"18-RD-279670","Carris Health","Benson","07/08/2021","MN","Included:  CNA, lab/x-ray/surg./pharm techs, reception, dietary, housekeeper, HIM, revenue cycle, IT, maintenance.
 
Excluded: Department Heads, Supervisors, Confidential Employees, Registered Nurses, Licensed Practical Nurses",41,"AFSCME LOCAL 2053 - COUNCIL 65","Open"
"18-RD-279674","Anderson Custom Processing Inc","Little Falls","07/08/2021","MN","Included: Bagging, Warehouse, Blender, Assistant Dryer, Dryer Operator, Maintenance
Excluded: Lab, Office/Management",28,"United Steelworkers Union","Open"
"19-RC-276605","Imperfect Foods, Inc.","Clackamas","05/04/2021","OR","Included: All delivery drivers and lead drivers at the Clackamas and Portland locations. Excluded: All other employees.",50,"TEAMSTERS LOCAL 252","Open"
"19-RC-276616","Cornish College of the Arts","Seattle","05/04/2021","WA","Included:  

All Full-Time and Regular Part-Time employees employed by the employer in classifications set forth in Attachment A who are residual to the existing units represented by IATSE, AMF and CFT.

Employees Excluded: 

All other employees of the employer including all managerial, temporary, confidential employees and statutory supervisors as described under the Act.  

",52,"Office and Professional Employees International Union, Local #8","Open"
"19-RC-277373","Del Monte Foods, Inc.","Aberdeen","05/18/2021","WA","Included:  All Farm Shop Employees.

Excluded:  Management.",10,"Teamsters Local 760","Open"
"19-RC-277637","Pacific Northwest Regional Council of Carpenters","Kent","05/25/2021","WA","Included:  Representatives, Leads, Market Recovery Rep., Regional Manager, Contract Reps.

Excluded:  All other employees, probationary employees, supervisors, and confidential employees.",24,"United Food and Commercial Workers Union Local 367","Open"
"19-RC-278342","Oregon Virtual Academy","North Bend","06/09/2021","OR","EMPLOYEES INCLUDED: All full-time and regular part-time professional employees including: Teachers, Counselors, School Psychologists, Instructional Coaches, and Coordinators. EMPLOYEES EXCLUDED: All non-professional employees, managers, supervisors, and guards as defined in the Act.",124,"Oregon Virtual Academy Educators United, AFT-Oregon, AFT, AFL-CIO","Open"
"19-RC-278433","WestRock Services LLC, Tacoma, WA","Tacoma","06/11/2021","WA","Included:  All Millwrights, Machinists and other employees currently represented by IAM.

Excluded:  All other employees, supervisors, guards and confidential employees.",18,"Pacific Northwest Regional Council of Carpenters","Open"
"19-RC-278837","Hanford Mission Integration Solutions, LLC","Richland","06/21/2021","WA","Included:  All customer service, telephone support, help desk agents, and field tech support.

Excluded:  All other employees, guards and supervisors.",17,"Hanford Atomic Metal Trades Council","Open"
"19-RC-279032","Safeway, Inc.","Portland","06/25/2021","OR","Included: All production Bakers, Utility Baker, and Cake decorators. Excluded: All other employees.",3,"Bakery, Confectionery, Tobacco Workers and Grain Millers International Union, AFL-CIO, Local 114","Open"
"19-RC-279041","NAES Corporation","Tacoma","06/24/2021","WA","Included:  All full-time and regular part-time employees employed by NAES at or out of its Port of Tacoma location.

Excluded:  All managerial employees, office clerical employees, guards and supervisors as defined in the Act.",11,"Inlandboatmen’s Union of the Pacific","Open"
"19-RC-279188","Aurora Energy Solutions, LLC","Fairbanks","06/29/2021","AK","Included: 

All full-time and part-time employees employed by the Employer and working at or out of its Fairbanks and North Pole, Alaska facilities. 

Excluded: 

All confidential employees, office clerical employees, and guards and supervisors as defined in the Act.",8,"Laborers' International Union of North America, Local 942","Open"
"19-RC-279392","Providence Health System","Oregon City","07/02/2021","OR","Included: All per diem nurses to be included in existing RN unit at Willamette Falls. Excluded: Supervisors, guards.",36,"Oregon Nurses Association","Open"
"19-RC-279443","Ponder LLC","Seattle","07/02/2021","WA","Included: 

All Budtenders and Floor Managers. 

Excluded: 

General Managers, Inventory Managers, Operational Managers and Security Guards.",8,"United Food and Commercial Workers Union Local 21","Open"
"19-RC-279446","The Conco Companies","Kent","07/02/2021","WA","Included: All full-time and part-time flatbed and delivery drivers employed by the employer at facility's located in Kent and Rochester, WA. Excluded: All other employees, including warehouse, office clerical, guards and supervisors as defined by the Act.",11,"General Teamsters Local Union #174","Open"
"19-RC-279480","Tri Med Ambulance LLC","Kent","07/06/2021","WA","Included:  All full time and regular part-time EMTs, Field Supervisors and CCT Nurses.

Excluded:  All other employees of Tri Med Ambulance LLC.",200,"IAFF Local I-98","Open"
"19-RC-279875","Safeway, Inc.","Portland","07/14/2021","OR","Included: All production Bakers, Utility Bakers, and Cake Decorators. Excluded: All other employees.",4,"Bakery, Confectionery, Tobacco Workers and Grain Millers Union,  Local 114, AFL-CIO, CLC","Open"
"19-RC-280018","Lourdes Health","Richland","07/16/2021","WA","Employees Included: The Petitioner seeks to add through a self-determination election all Perdiems in the Adult Psychiatric and Transitions inpatient units, including the following job titles: Care Coordinators, Case Managers,Court Coordinators, Health Unit Coordinators, Mental Health Aides, Mental Health Counselors, Mental Health Professionals, Registered Nurses, Secretaries, and Therapist employed by the employer at 1175 Carondelet Dr, Richland, WA 99354, to the existing bargaining unit. Employees Excluded: Excluding all guards, supervisors, managers and confidential employees as defined by the Act",31,NA,"Open"
"19-RD-204660","United Food and Commercial Workers Union, Local Union No. 21, AFL-CIO, CLC","Seattle","08/18/2017","WA","Included:  All union representatives, lead union representatives, grievance representatives, organizers, community organizers, political organizers, and researchers.

Excluded:  All office/clerical employees, confidential employees, guards, department heads, supervisors, student interns under the supervision of a Local 21 staff person and full time negotiators.",38,"Federation of Agents and International Representatives","Open"
