"18-RC-325082","Region 18, Minneapolis, Minnesota","Northland Chevrolet","Open","09/01/2023","","","Superior (Town)","WI",3,"","","Included:  All full-time and regular part-time Service Advisors, employed by the Employer at their facility located at 1420 Ogden Avenue, Superior, WI.

Excluded:  all other employees, office clerical employees, professional employees, guards and supervisors, as defined by the Act.",NA,NA,NA,NA,NA,NA,NA,NA,NA,NA,NA,NA,NA,NA,NA,NA,NA,NA,NA,NA,NA,NA,NA
"18-RD-321704","Region 18, Minneapolis, Minnesota","Starbucks Corporation","Open","07/13/2023","","","Bloomington","MN",17,"","","Included:
all full time and regular part time baristas and shift supervisors at store 2705
Excluded:
all other employees",NA,NA,NA,NA,NA,NA,NA,NA,NA,NA,NA,NA,NA,NA,NA,NA,NA,NA,NA,NA,NA,NA,"Chicago and Midwest Regional Joint Board, Workers United/SEIU"
"18-RD-321960","Region 18, Minneapolis, Minnesota","Brightspeed of Central Wisconsin, LLC","Open","07/17/2023","","","Holmen","WI",19,"","","Included: Employees of Brightspeed represented by CWA 4671 Excluded: None",NA,NA,NA,NA,NA,NA,NA,NA,NA,NA,NA,NA,NA,NA,NA,NA,NA,NA,NA,NA,NA,NA,"CWA 4671"
"18-UD-320917","Region 18, Minneapolis, Minnesota","Ridley USA, Inc., d/b/a Hubbard Feeds","Open","06/29/2023","","","Worthington","MN",5,"","","Included:  All truck drivers, production, and maintenance employees.

Excluded:  All clerical employees, guards, laboratory or quality control employees, and supervisors.",NA,NA,NA,NA,NA,NA,NA,NA,NA,NA,NA,NA,NA,NA,NA,NA,NA,NA,NA,NA,NA,NA,"Bakery, Confectionery, Tobacco  Workers and Grain Millers Local 50G"
"19-RC-295095","Region 19, Seattle, Washington","Franciscan Medical Group","Open","05/02/2022","","","Seattle","WA",45,"","","Included: All full time, part time, and per diem MD, PAs and ARNP employed at Attachment loc. Excluded: All other employees, supervisors, non-professional employees, as defined by the Act.",57,"A","Single Labor Organization","Initial","09/01/2022",57,NA,21,"",NA,"",NA,23,44,"",1,"","","Included:  All full-time, part-time, and per diem MDs, PAs and ARNPs employed by the Employer at the following locations:


St. Joseph Prompt Care
1812 J St., Suite 120, Tacoma, WA 98405

Burien Prompt Care
16045 1st Ave S, 1st Floor Burien, WA 98148

Canyon Road Prompt Care
15214 Canyon Rd E Puyallup, WA 98375

Gig Harbor Prompt Care
4700 Fosdick Dr. NW, Suite 102 Gig Harbor, WA 98335

Bonney Lake Prompt Care
9230 Sky Island Dr. E Bonney Lake, WA

University Place Urgent Care
3556 Marketplace W, Suite 109 University Place, WA 98466

Federal Way Urgent Care
31675 Pacific Hwy S Federal Way, WA 98003

West Seattle Urgent Care
4755 Fauntleroy Way SW, Suite 110, Seattle, WA 98116

Puyallup Urgent Care
12005 Meridian Ave E, Suite 101, Puyallup, WA

Bainbridge Island Urgent Care
1344 Wintergreen Ln NE, Suite 100, Bainbridge Island, WA

Belfair Urgent Care
21 North Romance Hill Rd, Belfair, WA

Port Orchard Urgent Care
450 S Kitsap Blvd, Suite 100, Port Orchard, WA

Excluded:  All other employees, urgent care medical directors, non-professional employees, managerial employees, office clerical employees, and guards and supervisors as defined in the Act.
","","","","Union of American Physicians and Dentists"
"19-RC-295095","Region 19, Seattle, Washington","Franciscan Medical Group","Open","05/02/2022",NA,NA,"Seattle","WA",45,NA,"","Included: All full time, part time, and per diem MD, PAs and ARNP employed at Attachment loc. Excluded: All other employees, supervisors, non-professional employees, as defined by the Act.",57,NA,NA,NA,NA,NA,NA,NA,NA,NA,NA,NA,NA,NA,NA,NA,NA,NA,NA,NA,NA,NA,"Union of American Physicians and Dentists"
"19-RC-295849","Region 19, Seattle, Washington","Starbucks Corporation","Open","05/13/2022","","","Seattle","WA",24,"","WORKERS UNITED","",24,NA,NA,NA,NA,NA,NA,NA,NA,NA,NA,NA,NA,NA,NA,NA,NA,NA,NA,NA,NA,NA,"Workers United"
"19-RC-295849","Region 28, Phoenix, Arizona","Starbucks Corporation","Open","05/13/2022","","","Seattle","WA",NA,NA,NA,NA,NA,"A","Single Labor Organization","Initial","10/06/2022",24,NA,4,"",NA,"",NA,4,8,"",2,"Y","WORKERS UNITED","All full-time and regular part-time baristas and shift supervisors employed by the Employer at its store located at 4115 4th Ave. S., Seattle, Washington; excluding all store managers, assistant store managers, office clerical employees, confidential employees, managerial employees, professional employees, and guards and supervisors as defined in the Act.
","","","","Workers United"
"19-RC-296056","Region 19, Seattle, Washington","Saint Alphonsus Medical Center - Ontario, Inc.","Open","05/18/2022","","","Ontario","OR",NA,NA,NA,NA,NA,"A","Single Labor Organization","Initial","10/19/2022",76,2,16,"",NA,"",NA,44,60,"",1,"","","Included:  All full-time and regular part-time Registered Nurses who perform patient care duties at the Employer’s acute care hospital located at 351 SW 9th St., Ontario Oregon.

Excluded:  All Registered Nurses working in the positions of Educator, Infection Control, Risk Manager, Case Manager/UR Clinical Documentation Specialist, and Clinical Resource Coordinator, Registered Nurses working as nurses, administrative personnel, all other employees, and guards and supervisors as defined by the Act.
","","","","Oregon Nurses Association"
"19-RC-296056","Region 19, Seattle, Washington","Saint Alphonsus Medical Center","Open","05/18/2022",NA,NA,"Ontario","OR",84,NA,"","Included: Registered Nurses performing patient care duties Excluded: Managers and supervisors",NA,NA,NA,NA,NA,NA,NA,NA,NA,NA,NA,NA,NA,NA,NA,NA,NA,NA,NA,NA,NA,NA,"Oregon Nurses Association"
"19-RC-296616","Region 19, Seattle, Washington","New Seasons Market LLC","Open","05/27/2022","","","Hillsboro","OR",100,"","United Food & Commercial Workers, Local 555","Included: All Asst. Managers, Grocery, Bakery, Deli, Produce, and Meat Department Employees. Excluded: All Managers, Culinary event specialist, guards, supervisors as defined by the Act.",108,"A","Single Labor Organization","Initial","09/01/2022",108,1,37,"",NA,"",NA,60,97,"",3,"","United Food & Commercial Workers, Local 555","INCLUDED: All full-time and regular part-time employees, including Assistant Department Managers , Leads, and Culinary Events Specialists employed by the Employer at its store located at 1453 NE 61st Avenue, Hillsboro, Oregon.

EXCLUDED: All Managers, Assistant Store Managers, Store Chefs, managerial employees, all other employees, and guards and supervisors as defined by the Act.
","","","","United Food and Commercial Workers Local 555"
"19-RC-296616","Region 19, Seattle, Washington","New Seasons Market LLC","Open","05/27/2022",NA,NA,"Hillsboro","OR",100,NA,"United Food & Commercial Workers, Local 555","Included: All Asst. Managers, Grocery, Bakery, Deli, Produce, and Meat Department Employees. Excluded: All Managers, Culinary event specialist, guards, supervisors as defined by the Act.",108,NA,NA,NA,NA,NA,NA,NA,NA,NA,NA,NA,NA,NA,NA,NA,NA,NA,NA,NA,NA,NA,"United Food and Commercial Workers Local 555"
"19-RC-300998","Region 19, Seattle, Washington","Raimore Construction, LLC","Open","08/08/2022","","","Portland","OR",17,"","Iron Workers District Council of the Pacific Northwest & affiliated Iron Worker Local #14, #29 and #86 of the International Association of Bridge, Structural, Ornamental and Reinforcing Iron Workers","Included: All workers doing Iron Workers bargaining work under the Master Labor Agreement between the Northwest Iron Workers Employers Association, Inc. and the Iron Workers District Council of the Pacific Northwest. Excluded: All office clerical, statutory supervisors, and guards as defined by the act and all other workers covered by another collective bargaining agreement",40,"A","Single Labor Organization","Initial","12/28/2022",40,1,10,"",NA,"",NA,NA,10,"",NA,"","Iron Workers District Council of the Pacific Northwest & affiliated Iron Worker Local #14, #29 and #86 of the International Association of Bridge, Structural, Ornamental and Reinforcing Iron Workers","INCLUDED: All full-time and regular part-time iron workers employed by the Employer and performing work in the State of Oregon and Clark County in the State of Washington. 
EXCLUDED: All other employees, employees represented by other labor organizations, and guards and supervisors as defined by the Act. 
","","","","Iron Workers District Council of the Pacific Northwest & affiliated Iron Worker Local #14, #29 and #86 of the International Association of Bridge, Structural, Ornamental and Reinforcing Iron Workers"
"19-RC-300998","Region 19, Seattle, Washington","Raimore Construction, LLC","Open","08/08/2022",NA,NA,"Portland","OR",17,NA,"Iron Workers District Council of the Pacific Northwest & affiliated Iron Worker Local #14, #29 and #86 of the International Association of Bridge, Structural, Ornamental and Reinforcing Iron Workers","Included: All workers doing Iron Workers bargaining work under the Master Labor Agreement between the Northwest Iron Workers Employers Association, Inc. and the Iron Workers District Council of the Pacific Northwest. Excluded: All office clerical, statutory supervisors, and guards as defined by the act and all other workers covered by another collective bargaining agreement",40,NA,NA,NA,NA,NA,NA,NA,NA,NA,NA,NA,NA,NA,NA,NA,NA,NA,NA,NA,NA,NA,"Iron Workers District Council of the Pacific Northwest & affiliated Iron Worker Local #14, #29 and #86 of the International Association of Bridge, Structural, Ornamental and Reinforcing Iron Workers"
"19-RC-302906","Region 19, Seattle, Washington","Thurman Street Gallery LLC d/b/a Power Plant on Thurman","Open","09/08/2022","","","Portland","OR",6,"","","Included: All Budtenders. Excluded: All Managers and Supervisors as defined by the Act.",7,"A","Single Labor Organization","Initial","11/08/2022",7,NA,NA,"",NA,"",NA,3,5,"",2,"","","Included:	All full-time and regular part-time budtenders employed by the Employer at its facility located at 2384 NW Thurman Street, Portland, Oregon 97210.
Excluded:	All agricultural employees, managerial employees, and guards and supervisors as defined by the Act
","","","","United Food and Commercial Workers Local 555"
"19-RC-302906","Region 19, Seattle, Washington","Thurman Street Gallery LLC d/b/a Power Plant on Thurman","Open","09/08/2022",NA,NA,"Portland","OR",6,NA,"","Included: All Budtenders. Excluded: All Managers and Supervisors as defined by the Act.",7,NA,NA,NA,NA,NA,NA,NA,NA,NA,NA,NA,NA,NA,NA,NA,NA,NA,NA,NA,NA,NA,"United Food and Commercial Workers Local 555"
"19-RC-303544","Region 19, Seattle, Washington","Heartwood Extended Health Care, LLC","Open","09/14/2022","","","Tacoma","WA",60,"","SEIU 775, affiliated with Service Employees International Union, AFL-CIO","Included: All full-time and regular part-time, service and maintenance employees, including RNs, LPNs, CNAs, nursing assistants, shower aides, restorative aides, housekeeping, laundry, dietary aides, and cooks employed by Heartwood at it’s 72nd St facility in Tacoma, WA.  Also, any other service and maintenance workers’ classifications established where eligibility remains consistent with the NLRA shall be included. Excluded: All other employees, including professional and technical employees, office clerical employees, managers, receptionists, agency employees, confidential employees, guards, and supervisors as defined in the NLRA.",78,"A","Single Labor Organization","Initial","11/14/2022",78,1,19,"",NA,"",NA,19,38,"",9,"Y","SEIU 775, affiliated with Service Employees International Union, AFL-CIO","All full-time and regular part-time employees employed by the Employer at its Tacoma, Washington facility; excluding office clerical employees, professional employees, Registered Nurses, temporary employees, individuals employed by third-party agencies, confidential employees, managers, and guards and supervisors as defined in the Act.


","","","","SEIU 775"
"19-RC-303544","Region 19, Seattle, Washington","Heartwood Extended Health Care, LLC","Open","09/14/2022",NA,NA,"Tacoma","WA",60,NA,"SEIU 775, affiliated with Service Employees International Union, AFL-CIO","Included: All full-time and regular part-time, service and maintenance employees, including RNs, LPNs, CNAs, nursing assistants, shower aides, restorative aides, housekeeping, laundry, dietary aides, and cooks employed by Heartwood at it’s 72nd St facility in Tacoma, WA.  Also, any other service and maintenance workers’ classifications established where eligibility remains consistent with the NLRA shall be included. Excluded: All other employees, including professional and technical employees, office clerical employees, managers, receptionists, agency employees, confidential employees, guards, and supervisors as defined in the NLRA.",78,NA,NA,NA,NA,NA,NA,NA,NA,NA,NA,NA,NA,NA,NA,NA,NA,NA,NA,NA,NA,NA,"SEIU 775"
"19-RC-303650","Region 19, Seattle, Washington","Envision Hospice of Washington, LLC","Open","09/16/2022","","","Federal Way","WA",4,"","International Association of Machinists and Aerospace Workers, District 751, affiliated with the International Association of Machinists and Aerospace Workers, AFL-CIO","Included: All Full time and regular part time bath aids, CNA’s, volunteer coordinators and leads working in King, Pierce, Kitsap and Thurston Counties. Excluded: All full time and regular part time social workers, chaplains, bereavement counselors/coordinators, directors, RN’s, RN case managers, maintenance, guards, account executives, administrator, admin assistant, intake coordinator, IT support specialist, education + QAPI nurse, medical director, office clerical and supervisors as defined by the ACT.",5,"A","Single Labor Organization","Initial","11/02/2022",5,1,1,"",NA,"",NA,2,3,"",NA,"","International Association of Machinists and Aerospace Workers, District 751, affiliated with the International Association of Machinists and Aerospace Workers, AFL-CIO","All full-time and regular part-time CNA’s, bath aids, CNA leads and bath aid leads employed by the Employer and working in King, Pierce, Kitsap and Thurston, Washington Counties; excluding all social workers, chaplains, bereavement counselors/coordinators, volunteer coordinators, lead social workers, lead chaplains, directors, RN’s, RN case managers, maintenance employees, account executives, administrators, administrative assistants, intake coordinators, IT support specialists, education + QAPI nurses, medical directors, office clerical employees, and guards and supervisors as defined by the Act. 
","","","","International Association of Machinists and Aerospace Workers, District Lodge 751"
"19-RC-303650","Region 19, Seattle, Washington","Envision Hospice of Washington, LLC","Open","09/16/2022",NA,NA,"Federal Way","WA",4,NA,"","Included: All Full time and regular part time bath aids, CNA’s, volunteer coordinators and leads working in King, Pierce, Kitsap and Thurston Counties. Excluded: All full time and regular part time social workers, chaplains, bereavement counselors/coordinators, directors, RN’s, RN case managers, maintenance, guards, account executives, administrator, admin assistant, intake coordinator, IT support specialist, education + QAPI nurse, medical director, office clerical and supervisors as defined by the ACT.",NA,NA,NA,NA,NA,NA,NA,NA,NA,NA,NA,NA,NA,NA,NA,NA,NA,NA,NA,NA,NA,NA,"International Association of Machinists and Aerospace Workers, District Lodge 751"
"19-RC-308441","Region 19, Seattle, Washington","Wood Mechanix Holding Company/Wood Mechanix LLC","Open","12/07/2022","","","Portland","OR",150,"","","Included: All Employees. Excluded: Foreman, Supervisors, owner, office staff.",138,"A","Single Labor Organization","Initial","04/13/2023",138,8,5,"",NA,"",NA,100,105,"",5,"","","Included: All full-time and regular part-time Carpenters and Apprentices employed by the Employer.

Excluded:  All Estimators, Project Managers, Foremen, Office Staff, and guards and supervisors as defined by the Act.
","","","","Pacific Northwest Regional Council of Carpenters (Local 1503)"
"19-RC-308441","Region 19, Seattle, Washington","Wood Mechanix Holding Company/Wood Mechanix LLC","Open","12/07/2022",NA,NA,"Portland","OR",150,NA,"","Included: All Employees. Excluded: Foreman, Supervisors, owner, office staff.",138,NA,NA,NA,NA,NA,NA,NA,NA,NA,NA,NA,NA,NA,NA,NA,NA,NA,NA,NA,NA,NA,"Pacific Northwest Regional Council of Carpenters (Local 1503)"
"19-RC-309505","Region 19, Seattle, Washington","Lee Publications, Inc. d/b/a The Daily News of Longview","Open","12/27/2022","","","Longview","WA",3,"","Pacific Northwest Newspaper Guild, TNG-CWA  37082","Included:  

All full and part-time advertising employees.  NOTE:  Petitioner seeks an Armour Globe election to place these newly represented employees within the existing Petitioner-represented bargaining unit.

Excluded:  

Statutory supervisors, guards, confidential employees, and all other persons appropriately excluded under the NLRA.",3,"A","Single Labor Organization","Initial","06/08/2023",3,NA,1,"",NA,"",NA,NA,1,"",NA,"","Pacific Northwest Newspaper Guild, TNG-CWA  37082","
All full-time and regular part-time advertising employees employed by the Employer at, or based out of, its Longview, Washington facility; excluding all other employees, employees employed at other locations, and managers, guards, and supervisors as defined in the Act.","","","","Pacific Northwest Newspaper Guild,  Local No. TNG-CWA 37082, affiliated with the NewsGuild - Communication Workers of  America"
"19-RC-309505","Region 19, Seattle, Washington","Lee Publications, Inc. d/b/a The Daily News of Longview","Open","12/27/2022",NA,NA,"Longview","WA",3,NA,"Pacific Northwest Newspaper Guild, TNG-CWA  37082","Included:  

All full and part-time advertising employees.  NOTE:  Petitioner seeks an Armour Globe election to place these newly represented employees within the existing Petitioner-represented bargaining unit.

Excluded:  

Statutory supervisors, guards, confidential employees, and all other persons appropriately excluded under the NLRA.",3,NA,NA,NA,NA,NA,NA,NA,NA,NA,NA,NA,NA,NA,NA,NA,NA,NA,NA,NA,NA,NA,"Pacific Northwest Newspaper Guild,  Local No. TNG-CWA 37082, affiliated with the NewsGuild - Communication Workers of  America"
"19-RC-311654","Region 19, Seattle, Washington","moovel North America LLC","Open","02/06/2023","","","Portland","OR",8,"","Communications Workers of America, AFL-CIO","Included: All full-time and regular part-time Engineering Department Employees (currently employees in the tiles of Senior Software Engineer, Lead Mobile Developer, Android Engineer, iOS Engineer, Technical Support Supervisor, and Technical Support Representative). Excluded: All supervisors, confidential, managerial employees and guards as defined by the Act.",6,"A","Single Labor Organization","Initial","08/15/2023",6,NA,3,"",NA,"",NA,NA,3,"",1,"","Communications Workers of America, AFL-CIO","All full-time and regular part-time Engineering Department professional and non-professional employees employed by the Employer who work in the following job classifications: Senior Software Engineer, Engineering Manager, Lead Mobile Developer, Android Engineer, iOS Engineer, and Technical Support Supervisor Technical Support Representative; but excluding all other employees, managerial employees, and guards and supervisors as defined in the Act.
","Included: All full-time and regular part-time Engineering Department non-professional employees employed by the Employer who work in the following job classification: Technical Support Representative.  
Excluded: All other employees, professional employees, managerial employees, and guards and supervisors as defined in the Act. 
","","","Communications Workers of America, AFL-CIO"
"19-RC-311654","Region 19, Seattle, Washington","moovel North America LLC","Open","02/06/2023",NA,NA,"Portland","OR",8,NA,"","Included: All full-time and regular part-time Engineering Department Employees (currently employees in the tiles of Senior Software Engineer, Lead Mobile Developer, Android Engineer, iOS Engineer, Technical Support Supervisor, and Technical Support Representative). Excluded: All supervisors, confidential, managerial employees and guards as defined by the Act.",NA,NA,NA,NA,NA,NA,NA,NA,NA,NA,NA,NA,NA,NA,NA,NA,NA,NA,NA,NA,NA,NA,"Communications Workers of America, AFL-CIO"
"19-RC-312623","Region 19, Seattle, Washington","Grow Op Farms, LLC","Open","02/21/2023","","","Spokane Valley","WA",19,"","United Food and Commercial Workers Local 3000, affiliated with the United Food and Commercial Workers International Union, AFL-CIO","Included: ESS, IT Technicians, Purchasing Agents, Inventory Clerks, Warehouse Clerks. Excluded: All other employees and supervisors and guards as defined by the Act.",20,"A","Single Labor Organization","Initial","04/12/2023",20,NA,8,"",NA,"",NA,12,20,"",6,"Y","United Food and Commercial Workers Local 3000, affiliated with the United Food and Commercial Workers International Union, AFL-CIO","All full-time and regular part-time Environmental Support Specialists (“ESS”), IT Technicians, Purchasing Agents, Inventory Clerks, Warehouse Clerks, Indoor Warehouse Administrative Assistant, and Maintenance Crew Members employed by the Employer at the Employer’s facility located at 2611 N. Woodruff Rd., Suite A, Spokane Valley, Washington 99206; excluding all other employees, office clerical employees, managers, and guards and supervisors as defined by the Act. 



","","","","United Food and Commercial Workers Local 3000"
"19-RC-312623","Region 19, Seattle, Washington","Grow Op Farms, LLC","Open","02/21/2023",NA,NA,"Spokane Valley","WA",19,NA,"","Included: ESS, IT Technicians, Purchasing Agents, Inventory Clerks, Warehouse Clerks. Excluded: All other employees and supervisors and guards as defined by the Act.",NA,NA,NA,NA,NA,NA,NA,NA,NA,NA,NA,NA,NA,NA,NA,NA,NA,NA,NA,NA,NA,NA,"United Food and Commercial Workers Local 3000"
"19-RC-315337","Region 19, Seattle, Washington","Grow Op Farms, LLC","Open","04/03/2023","","","Spokane Valley","WA",17,"","United Food and Commercial Workers Local 3000","Included: Sales Support: Representative Supervisor, Representatives, Admin Assistants, VMI 
Excluded: 
All other employees, supervisors and guards as defined by the Act",16,"A","Single Labor Organization","Initial","05/24/2023",16,NA,NA,"",NA,"",NA,5,5,"",10,"Y","United Food and Commercial Workers Local 3000","All full-time and regular part-time sales administrative assistants, sales service representatives, sales service supervisors, VMI order representatives and VMI team leads employed by the Employer at its Spokane Valley, Washington facility; but excluding all other employees, production employees, drivers, account managers, inventory assistants, and guards and supervisors as defined in the Act.","","","","United Food and Commercial Workers Local 3000, affiliated with the United Food and Commercial Workers International Union, AFL-CIO"
"19-RC-315337","Region 19, Seattle, Washington","Grow Op Farms, LLC","Open","04/03/2023",NA,NA,"Spokane Valley","WA",17,NA,"","Included: Sales Support: Representative Supervisor, Representatives, Admin Assistants, VMI 
Excluded: 
All other employees, supervisors and guards as defined by the Act",NA,NA,NA,NA,NA,NA,NA,NA,NA,NA,NA,NA,NA,NA,NA,NA,NA,NA,NA,NA,NA,NA,"United Food and Commercial Workers Local 3000, affiliated with the United Food and Commercial Workers International Union, AFL-CIO"
"19-RC-315803","Region 19, Seattle, Washington","Recreational Equipment, Inc.","Open","04/10/2023","","","Eugene","OR",53,"","","Included: All full-time and part-time non-supervisory employees including specialists, leads, technicians in all departments. Excluded: All supervisors as defined by the act including the Store Manager and Retail Sales Managers, and guards.",50,"A","Single Labor Organization","Initial","05/30/2023",50,NA,20,"",NA,"",NA,22,42,"",9,"Y","","INCLUDED: All full-time and regular part-time employees employed by the Employer at its Eugene, OR facility, including Retail Sales Specialists, Shop Mechanics Bike & Snow, and Shipping Receiving Specialists.

EXCLUDED: All professional employees, and guards and supervisors as defined by the Act. 
","","","","United Food and Commercial Workers Local 555"
"19-RC-315803","Region 19, Seattle, Washington","Recreational Equipment, Inc.","Open","04/10/2023",NA,NA,"Eugene","OR",53,NA,"","Included: All full-time and part-time non-supervisory employees including specialists, leads, technicians in all departments. Excluded: All supervisors as defined by the act including the Store Manager and Retail Sales Managers, and guards.",NA,NA,NA,NA,NA,NA,NA,NA,NA,NA,NA,NA,NA,NA,NA,NA,NA,NA,NA,NA,NA,NA,"United Food and Commercial Workers Local 555"
