"18-RC-312132","Region 18, Minneapolis, Minnesota","Allina Health d/b/a Mercy--Unity Campus","Open","02/14/2023","","","Fridley","MN",150,"","Doctors Council SEIU Local 10MD","Included: All full-time, regular pert-time, and per diem physicians and podiatrists employed by Allina at Mercy/Unity Hospital.

Excluded: All other contracted physicians and supervisors as defined by the National Labor Relations Act.",132,"A","Revised Single Labor Org","Initial","04/20/2023",132,NA,67,"",NA,"",NA,38,105,"",20,"","Doctors Council SEIU Local 10MD","Included: All full-time, regular part-time, and per diem physicians and podiatrists employed by the Employer at either the Employer’s facility currently located at 4050 Coon Rapids Blvd, Coon Rapids, MN or at the Employer’s facility currently located at 550 Osborne Road, Fridley, MN. 
Excluded: Business office clerical employees, office clerical employees, Registered Nurses, all other professionals, technical employees, non-professional employees, physicians and podiatrists who work less than 20% of their time at the Employer facilities identified above, confidential employees, managerial employees, and guards and supervisors as defined by the National Labor Relations Act, and all other employees.

Others permitted to vote: The parties have agreed that those individuals listed below in this section may vote in the election but their ballots will be challenged because their eligibility has not been resolved.  No decision has been made regarding whether the individuals in these classifications or groups are included in, or excluded from, the bargaining unit.  The Employer contends these individuals are supervisors within the meaning of Section 2(11) of the Act and/or managerial employees. The eligibility or inclusion of these individuals will be resolved, if necessary, following the election.
•	Ephraim Ghide
•	Ahmad Hazem
•	Krysta Koepke
•	Jonathan Lofgren
•	Terrance McLaughlin
•	Alberto Ricart
•	Amber Galarowicz
•	Ted Longinow
•	Michael Rudolph
•	Alia Sharif
The parties have agreed that those individuals listed below in this section may vote in the election but their ballots will be challenged because their eligibility has not been resolved.  No decision has been made regarding whether the individuals in these classifications or groups are included in, or excluded from, the bargaining unit.  The Employer contends these individuals do not qualify as dual-function employees because they spend less than 20% of their time performing unit functions The eligibility or inclusion of these individuals will be resolved, if necessary, following the election.
•	Nicole Cullen
•	Katie Esse
•	Nicholas Hamel
•	Jeffery Mich
","","","","Doctors Council SEIU Local 10MD"
"18-RC-312132","Region 18, Minneapolis, Minnesota","Allina Health d/b/a Mercy--Unity Campus","Open","02/14/2023",NA,NA,"Fridley","MN",150,NA,"","Included: All full-time, regular pert-time, and per diem physicians and podiatrists employed by Allina at Mercy/Unity Hospital.

Excluded: All other contracted physicians and supervisors as defined by the National Labor Relations Act.",NA,NA,NA,NA,NA,NA,NA,NA,NA,NA,NA,NA,NA,NA,NA,NA,NA,NA,NA,NA,NA,NA,"Doctors Council SEIU Local 10MD"
"18-RC-316034","Region 18, Minneapolis, Minnesota","Turner Construction Company","Open","04/13/2023","","","West Des Moines","IA",80,"","North Central States Regional Council of Carpenters, Local 106","Included: Carpenter craft employees in the Des Moines, IA metropolitan area.

Excluded: All non-carpenter craft employees, all supervisors and guards as defined under the NLRB.",43,"A","Single Labor Organization","Rerun","10/11/2023",43,NA,14,"",NA,"",NA,23,37,"",11,"Y","North Central States Regional Council of Carpenters, Local 106","All full-time and regular part-time carpenter craft employees performing work for the Employer in the Des Moines, Iowa metropolitan area, but excluding all non-carpenter craft employees and guards and supervisors as defined in the Act.
","","","","North Central States Regional Council of Carpenters Local 106"
"18-RC-316034","Region 18, Minneapolis, Minnesota","Turner Construction Company","Open","04/13/2023",NA,NA,"West Des Moines","IA",80,NA,"","Included: Carpenter craft employees in the Des Moines, IA metropolitan area.

Excluded: All non-carpenter craft employees, all supervisors and guards as defined under the NLRB.",NA,NA,NA,NA,NA,NA,NA,NA,NA,NA,NA,NA,NA,NA,NA,NA,NA,NA,NA,NA,NA,NA,"North Central States Regional Council of Carpenters Local 106"
"18-RC-316373","Region 18, Minneapolis, Minnesota","Lund Food Holdings, Inc.","Open","04/18/2023","","","Eden Prairie","MN",5,"","Teamsters Local 120","All regular full-time and regular part-time warehouse workers at the Eden Prairie facility; excluding all other employees, office employees, managers and guards and supervisors as defined by the National Labor Relations Act.",6,"A","Revised Single Labor Org","Initial","06/09/2023",6,NA,3,"",NA,"",NA,2,5,"",NA,"","Teamsters Local 120","All full-time and regular part-time shipping and receiving workers and truck stockers, including lead truck stockers, employed by the employer at its Eden Prairie facility at 7752 Mitchell Road, Eden Prairie, MN 55344; excluding all other employees, guards and supervisors as defined by the Act.","","","","Teamsters Local 120"
"18-RC-316373","Region 18, Minneapolis, Minnesota","Lund Food Holdings, Inc.","Open","04/18/2023",NA,NA,"Eden Prairie","MN",5,NA,"","All regular full-time and regular part-time warehouse workers at the Eden Prairie facility; excluding all other employees, office employees, managers and guards and supervisors as defined by the National Labor Relations Act.",6,NA,NA,NA,NA,NA,NA,NA,NA,NA,NA,NA,NA,NA,NA,NA,NA,NA,NA,NA,NA,NA,"Teamsters Local 120"
"18-RC-323609","Region 18, Minneapolis, Minnesota","Allina Health System","Open","08/11/2023","","","Minneapolis","MN",560,"","Doctors Council SEIU Local 10MD","Included: All full-time, part-time and per diem physicians, nurse practitioners, and physician assistants employed by Allina Health practicing primary/urgent care at its clinics listed in the appendix to this filing. Excluded: All other contracted clinicians and supervisors as defined by the National Labor Relations Act.",589,"A","Single Labor Organization","Initial","10/13/2023",589,4,325,"",NA,"",NA,200,525,"",24,"","Doctors Council SEIU Local 10MD","All full-time and regular part-time physicians, nurse practitioners, and physician assistants employed by the Employer and practicing primary care or urgent care in the Allina Health Group clinics listed in Exhibit A; excluding all business office clericals, office clericals, Registered Nurses, all other professionals, technical employees, non-professional employees, confidential employees, managers, all other employees, and guards and supervisors as defined in the Act, as amended.","","","","Doctors Council SEIU Local 10MD"
"18-RC-323609","Region 18, Minneapolis, Minnesota","Allina Health System","Open","08/11/2023","","","Minneapolis","MN",560,NA,"","Included: All full-time, part-time and per diem physicians, nurse practitioners, and physician assistants employed by Allina Health practicing primary/urgent care at its clinics listed in the appendix to this filing. Excluded: All other contracted clinicians and supervisors as defined by the National Labor Relations Act.",NA,NA,NA,NA,NA,NA,NA,NA,NA,NA,NA,NA,NA,NA,NA,NA,NA,NA,NA,NA,NA,NA,"Doctors Council SEIU Local 10MD"
"18-RC-324559","Region 18, Minneapolis, Minnesota","Vertical Endeavors - Minneapolis, Inc., St. Paul, Inc., Twin Cities Bouldering, Inc., Bloomington, Inc., Duluth, Inc","Open","08/25/2023","","","Saint Paul","MN",90,"","","Included: All full-time and regular part-time Vertical Endeavors (d/b/a Vertical Endeavors, Twin Cities Bouldering, and Nicros) employees in Minnesota (including in Bloomington, Minneapolis, St. Paul, and Duluth) including but not limited to counter rush, route setters, coaches, maintenance, managers on duty, hold makers, and guides. Excluded: Supervisors and guides, as defined by the Act.",NA,NA,NA,NA,NA,NA,NA,NA,NA,NA,NA,NA,NA,NA,NA,NA,NA,NA,NA,NA,NA,NA,"United Food and Commerical Workers"
"18-RC-324602","Region 18, Minneapolis, Minnesota","Sundby Sand & Gravel Co. Inc.","Open","08/28/2023","","","Stoughton","WI",10,"","","Included: Drivers and helpers 

Excluded: Clerical and supervisory",10,"A","Single Labor Organization","Initial","10/05/2023",10,NA,4,"",NA,"",NA,6,10,"",NA,"","","All full-time and regular part-time drivers; excluding quality control employees, clerical employees, confidential employees, safety officers, managers, mechanics, loaders, dispatchers, guards, and supervisors as defined in the National Labor Relations Act, as amended.","","","","Teamsters Local No. 695"
"18-RC-324602","Region 18, Minneapolis, Minnesota","Sundby Sand & Gravel Co. Inc.","Open","08/28/2023","","","Stoughton","WI",10,NA,"","Included: Drivers and helpers 

Excluded: Clerical and supervisory",NA,NA,NA,NA,NA,NA,NA,NA,NA,NA,NA,NA,NA,NA,NA,NA,NA,NA,NA,NA,NA,NA,"Teamsters Local No. 695"
"18-RC-325495","Region 18, Minneapolis, Minnesota","Northern States Power Company, A Minnesota Corporation, d/b/a/ Xcel Energy","Open","09/08/2023","","","Minneapolis","MN",4,"","","Employees Included:  All full-time and regular part-time Data Center Specialists

Employees Excluded:  Clerical, Guards, Supervisors, and others as defined by the Act.
",NA,NA,NA,NA,NA,NA,NA,NA,NA,NA,NA,NA,NA,NA,NA,NA,NA,NA,NA,NA,NA,NA,"International Brotherhood of Electrical Workers Local Union 160, AFL-CIO"
"18-RC-325636","Region 18, Minneapolis, Minnesota","Cass County Electric Cooperative","Open","09/12/2023","","","Fargo","ND",3,"","International Brotherhood of Electrical Workers, Local 1426","Included: All full-time and regular part-time Apparatus Supervisor and Apparatus Technician to be included in the current unit collective bargaining agreement dated January 1st 2022 through December 31st 2024 between Cass County Electric Cooperative, who may be hereinafter referred to as the Company, and Local Union 1426 of the International Brotherhood of Electrical Workers who may be hereinafter referred to individually and collectively as the Union.

Excluded:  All other employees, confidential employees, guards, and supervisors as defined by act.",3,"A","Single Labor Organization","Initial","10/12/2023",3,NA,2,"",NA,"",NA,NA,2,"",1,"","International Brotherhood of Electrical Workers, Local 1426","All full-time and regular part-time Meter and Apparatus Technicians employed by the Employer at its facility currently located at 4100 32nd Avenue South, Fargo, North Dakota; but excluding confidential employees, employees already represented by International Brotherhood of Electrical Workers, Local 1426, and guards and supervisors as defined in the National Labor Relations Act, as amended. 

If a majority of valid ballots are cast for International Brotherhood of Electrical Workers, Local 1426, they will be taken to have indicated the employees’ desire to be included in the existing electrical and warehouse employee unit employed at the Employer’s Fargo, North Dakota, facility currently represented by International Brotherhood of Electrical Workers, Local 1426. If a majority of valid ballots are not cast for representation, they will be taken to have indicated the employees’ desire to remain unrepresented. 

Others permitted to vote: The parties have agreed that the Meter and Apparatus Supervisor may vote in the election, but their ballot will be challenged since their eligibility has not been resolved. No decision has been made regarding whether the individual in this classification or group are included in, or excluded from, the bargaining unit. The eligibility or inclusion of this individuals will be resolved, if necessary, following the election.","","","","International Brotherhood of Electrical Workers Local 1426"
"18-RC-325636","Region 18, Minneapolis, Minnesota","Cass County Electric Cooperative","Open","09/12/2023","","","Fargo","ND",3,NA,"","Included: All full-time and regular part-time Apparatus Supervisor and Apparatus Technician to be included in the current unit collective bargaining agreement dated January 1st 2022 through December 31st 2024 between Cass County Electric Cooperative, who may be hereinafter referred to as the Company, and Local Union 1426 of the International Brotherhood of Electrical Workers who may be hereinafter referred to individually and collectively as the Union.

Excluded:  All other employees, confidential employees, guards, and supervisors as defined by act.",NA,NA,NA,NA,NA,NA,NA,NA,NA,NA,NA,NA,NA,NA,NA,NA,NA,NA,NA,NA,NA,NA,"International Brotherhood of Electrical Workers Local 1426"
"18-RC-325845","Region 18, Minneapolis, Minnesota","FPG Wisconsin, d/b/a Krause Funeral Home & Cremation Services","Open","09/14/2023","","","Milwaukee","WI",24,"","","Included: Full-Time and Part-Time / Funeral Directors & Apprentice's / Embalmers Excluded: All other employee's",NA,NA,NA,NA,NA,NA,NA,NA,NA,NA,NA,NA,NA,NA,NA,NA,NA,NA,NA,NA,NA,NA,"Teamsters Local No. 344 Sales and Service Industry"
"18-RC-326297","Region 18, Minneapolis, Minnesota","Stout Construction, LLC","Open","09/21/2023","","","Chetek","WI",10,"","","Included:  All full-time and regular part time equipment operators and foremen employed in the construction industry by the Employer in the State of Wisconsin.

Excluded:  All other employees, including employees in the Employer’s mining and/or sand and gravel hauling operations, clerical employees, guards and/or supervisors as defined by the Act.",NA,NA,NA,NA,NA,NA,NA,NA,NA,NA,NA,NA,NA,NA,NA,NA,NA,NA,NA,NA,NA,NA,"International Union of Operating Engineers Local 139 AFL-CIO"
"18-RC-326551","Region 18, Minneapolis, Minnesota","UNFI","Open","09/25/2023","","","Iowa City","IA",62,"","","Included: All full and part-time truck drivers, yard haulers, and dispatchers
Excluded: Managerial and supervisory employees",NA,NA,NA,NA,NA,NA,NA,NA,NA,NA,NA,NA,NA,NA,NA,NA,NA,NA,NA,NA,NA,NA,"IBT Local 238"
"18-RC-326592","Region 18, Minneapolis, Minnesota","MercyOne/Trinity","Open","09/25/2023","","","Des Moines","IA",39,"","","Included:  All full time and part time ambulance EMS, EMTs and Paramedics.

Excluded:  All others.
",NA,NA,NA,NA,NA,NA,NA,NA,NA,NA,NA,NA,NA,NA,NA,NA,NA,NA,NA,NA,NA,NA,"AFSCME COUNCIL 61"
"18-RC-327339","Region 18, Minneapolis, Minnesota","Jones, Lang, LaSalle","Open","10/04/2023","","","Saint Paul","MN",5,"","","Included: Mobile maintenance engineers, mobile building engineers, mobile tech engineers",NA,NA,NA,NA,NA,NA,NA,NA,NA,NA,NA,NA,NA,NA,NA,NA,NA,NA,NA,NA,NA,NA,"International Union of Operating Engineers, #70"
"18-RD-321704","Region 18, Minneapolis, Minnesota","Starbucks Corporation","Open","07/13/2023","","","Bloomington","MN",17,"","","Included:
all full time and regular part time baristas and shift supervisors at store 2705
Excluded:
all other employees",NA,NA,NA,NA,NA,NA,NA,NA,NA,NA,NA,NA,NA,NA,NA,NA,NA,NA,NA,NA,NA,NA,"Chicago and Midwest Regional Joint Board, Workers United/SEIU"
"18-RM-326389","Region 18, Minneapolis, Minnesota","Allina Health System d/b/a Allina Health Emergency Medical Services","Open","09/22/2023","","","St. Paul","MN",27,"","","Included:  All full-time and regular part-time Clinical Staff Educators and Clinical Instructors 
employed by the Employer out of its St. Paul, MN facility.

Excluded:  All other employees and guards and supervisors as defined by the Act.",NA,NA,NA,NA,NA,NA,NA,NA,NA,NA,NA,NA,NA,NA,NA,NA,NA,NA,NA,NA,NA,NA,"International Association of EMTs and Paramedics/NAGE Local 167"
"19-RC-295095","Region 19, Seattle, Washington","Franciscan Medical Group","Open","05/02/2022","","","Seattle","WA",45,"","","Included: All full time, part time, and per diem MD, PAs and ARNP employed at Attachment loc. Excluded: All other employees, supervisors, non-professional employees, as defined by the Act.",57,"A","Single Labor Organization","Initial","09/01/2022",57,NA,21,"",NA,"",NA,23,44,"",1,"","","Included:  All full-time, part-time, and per diem MDs, PAs and ARNPs employed by the Employer at the following locations:


St. Joseph Prompt Care
1812 J St., Suite 120, Tacoma, WA 98405

Burien Prompt Care
16045 1st Ave S, 1st Floor Burien, WA 98148

Canyon Road Prompt Care
15214 Canyon Rd E Puyallup, WA 98375

Gig Harbor Prompt Care
4700 Fosdick Dr. NW, Suite 102 Gig Harbor, WA 98335

Bonney Lake Prompt Care
9230 Sky Island Dr. E Bonney Lake, WA

University Place Urgent Care
3556 Marketplace W, Suite 109 University Place, WA 98466

Federal Way Urgent Care
31675 Pacific Hwy S Federal Way, WA 98003

West Seattle Urgent Care
4755 Fauntleroy Way SW, Suite 110, Seattle, WA 98116

Puyallup Urgent Care
12005 Meridian Ave E, Suite 101, Puyallup, WA

Bainbridge Island Urgent Care
1344 Wintergreen Ln NE, Suite 100, Bainbridge Island, WA

Belfair Urgent Care
21 North Romance Hill Rd, Belfair, WA

Port Orchard Urgent Care
450 S Kitsap Blvd, Suite 100, Port Orchard, WA

Excluded:  All other employees, urgent care medical directors, non-professional employees, managerial employees, office clerical employees, and guards and supervisors as defined in the Act.
","","","","Union of American Physicians and Dentists"
"19-RC-295095","Region 19, Seattle, Washington","Franciscan Medical Group","Open","05/02/2022",NA,NA,"Seattle","WA",45,NA,"","Included: All full time, part time, and per diem MD, PAs and ARNP employed at Attachment loc. Excluded: All other employees, supervisors, non-professional employees, as defined by the Act.",57,NA,NA,NA,NA,NA,NA,NA,NA,NA,NA,NA,NA,NA,NA,NA,NA,NA,NA,NA,NA,NA,"Union of American Physicians and Dentists"
"19-RC-295849","Region 19, Seattle, Washington","Starbucks Corporation","Open","05/13/2022","","","Seattle","WA",24,"","WORKERS UNITED","",24,NA,NA,NA,NA,NA,NA,NA,NA,NA,NA,NA,NA,NA,NA,NA,NA,NA,NA,NA,NA,NA,"Workers United"
"19-RC-295849","Region 28, Phoenix, Arizona","Starbucks Corporation","Open","05/13/2022","","","Seattle","WA",NA,NA,NA,NA,NA,"A","Single Labor Organization","Initial","10/06/2022",24,NA,4,"",NA,"",NA,4,8,"",2,"Y","WORKERS UNITED","All full-time and regular part-time baristas and shift supervisors employed by the Employer at its store located at 4115 4th Ave. S., Seattle, Washington; excluding all store managers, assistant store managers, office clerical employees, confidential employees, managerial employees, professional employees, and guards and supervisors as defined in the Act.
","","","","Workers United"
"19-RC-296056","Region 19, Seattle, Washington","Saint Alphonsus Medical Center - Ontario, Inc.","Open","05/18/2022","","","Ontario","OR",NA,NA,NA,NA,NA,"A","Single Labor Organization","Initial","10/19/2022",76,2,16,"",NA,"",NA,44,60,"",1,"","","Included:  All full-time and regular part-time Registered Nurses who perform patient care duties at the Employer’s acute care hospital located at 351 SW 9th St., Ontario Oregon.

Excluded:  All Registered Nurses working in the positions of Educator, Infection Control, Risk Manager, Case Manager/UR Clinical Documentation Specialist, and Clinical Resource Coordinator, Registered Nurses working as nurses, administrative personnel, all other employees, and guards and supervisors as defined by the Act.
","","","","Oregon Nurses Association"
"19-RC-296056","Region 19, Seattle, Washington","Saint Alphonsus Medical Center","Open","05/18/2022",NA,NA,"Ontario","OR",84,NA,"","Included: Registered Nurses performing patient care duties Excluded: Managers and supervisors",NA,NA,NA,NA,NA,NA,NA,NA,NA,NA,NA,NA,NA,NA,NA,NA,NA,NA,NA,NA,NA,NA,"Oregon Nurses Association"
"19-RC-296616","Region 19, Seattle, Washington","New Seasons Market LLC","Open","05/27/2022","","","Hillsboro","OR",100,"","United Food & Commercial Workers, Local 555","Included: All Asst. Managers, Grocery, Bakery, Deli, Produce, and Meat Department Employees. Excluded: All Managers, Culinary event specialist, guards, supervisors as defined by the Act.",108,"A","Single Labor Organization","Initial","09/01/2022",108,1,37,"",NA,"",NA,60,97,"",3,"","United Food & Commercial Workers, Local 555","INCLUDED: All full-time and regular part-time employees, including Assistant Department Managers , Leads, and Culinary Events Specialists employed by the Employer at its store located at 1453 NE 61st Avenue, Hillsboro, Oregon.

EXCLUDED: All Managers, Assistant Store Managers, Store Chefs, managerial employees, all other employees, and guards and supervisors as defined by the Act.
","","","","United Food and Commercial Workers Local 555"
"19-RC-296616","Region 19, Seattle, Washington","New Seasons Market LLC","Open","05/27/2022",NA,NA,"Hillsboro","OR",100,NA,"United Food & Commercial Workers, Local 555","Included: All Asst. Managers, Grocery, Bakery, Deli, Produce, and Meat Department Employees. Excluded: All Managers, Culinary event specialist, guards, supervisors as defined by the Act.",108,NA,NA,NA,NA,NA,NA,NA,NA,NA,NA,NA,NA,NA,NA,NA,NA,NA,NA,NA,NA,NA,"United Food and Commercial Workers Local 555"
"19-RC-300998","Region 19, Seattle, Washington","Raimore Construction, LLC","Open","08/08/2022","","","Portland","OR",17,"","Iron Workers District Council of the Pacific Northwest & affiliated Iron Worker Local #14, #29 and #86 of the International Association of Bridge, Structural, Ornamental and Reinforcing Iron Workers","Included: All workers doing Iron Workers bargaining work under the Master Labor Agreement between the Northwest Iron Workers Employers Association, Inc. and the Iron Workers District Council of the Pacific Northwest. Excluded: All office clerical, statutory supervisors, and guards as defined by the act and all other workers covered by another collective bargaining agreement",40,"A","Single Labor Organization","Initial","12/28/2022",40,1,10,"",NA,"",NA,NA,10,"",NA,"","Iron Workers District Council of the Pacific Northwest & affiliated Iron Worker Local #14, #29 and #86 of the International Association of Bridge, Structural, Ornamental and Reinforcing Iron Workers","INCLUDED: All full-time and regular part-time iron workers employed by the Employer and performing work in the State of Oregon and Clark County in the State of Washington. 
EXCLUDED: All other employees, employees represented by other labor organizations, and guards and supervisors as defined by the Act. 
","","","","Iron Workers District Council of the Pacific Northwest & affiliated Iron Worker Local #14, #29 and #86 of the International Association of Bridge, Structural, Ornamental and Reinforcing Iron Workers"
"19-RC-300998","Region 19, Seattle, Washington","Raimore Construction, LLC","Open","08/08/2022",NA,NA,"Portland","OR",17,NA,"Iron Workers District Council of the Pacific Northwest & affiliated Iron Worker Local #14, #29 and #86 of the International Association of Bridge, Structural, Ornamental and Reinforcing Iron Workers","Included: All workers doing Iron Workers bargaining work under the Master Labor Agreement between the Northwest Iron Workers Employers Association, Inc. and the Iron Workers District Council of the Pacific Northwest. Excluded: All office clerical, statutory supervisors, and guards as defined by the act and all other workers covered by another collective bargaining agreement",40,NA,NA,NA,NA,NA,NA,NA,NA,NA,NA,NA,NA,NA,NA,NA,NA,NA,NA,NA,NA,NA,"Iron Workers District Council of the Pacific Northwest & affiliated Iron Worker Local #14, #29 and #86 of the International Association of Bridge, Structural, Ornamental and Reinforcing Iron Workers"
"19-RC-302906","Region 19, Seattle, Washington","Thurman Street Gallery LLC d/b/a Power Plant on Thurman","Open","09/08/2022","","","Portland","OR",6,"","","Included: All Budtenders. Excluded: All Managers and Supervisors as defined by the Act.",7,"A","Single Labor Organization","Initial","11/08/2022",7,NA,NA,"",NA,"",NA,3,5,"",2,"","","Included:	All full-time and regular part-time budtenders employed by the Employer at its facility located at 2384 NW Thurman Street, Portland, Oregon 97210.
Excluded:	All agricultural employees, managerial employees, and guards and supervisors as defined by the Act
","","","","United Food and Commercial Workers Local 555"
"19-RC-302906","Region 19, Seattle, Washington","Thurman Street Gallery LLC d/b/a Power Plant on Thurman","Open","09/08/2022",NA,NA,"Portland","OR",6,NA,"","Included: All Budtenders. Excluded: All Managers and Supervisors as defined by the Act.",7,NA,NA,NA,NA,NA,NA,NA,NA,NA,NA,NA,NA,NA,NA,NA,NA,NA,NA,NA,NA,NA,"United Food and Commercial Workers Local 555"
