"10-RC-283707","Estron Chemical, Inc.","Calvert City","09/29/2021","KY","Included:  All full and regular part time maintenance technicians, warehouse workers, chemical operators, lead chemical operators, pilot plant chemical operators, and production clerk.

Excluded:  Office clerical employees, professional employees, managerial employees, guards, supervisors, as defined in the Act.",39,"International Association of Machinists and Aerospace Workers, AFL-CIO","Open"
"10-RC-283707","Estron Chemical, Inc.","Calvert City","09/29/2021","KY","Included:  All full and regular part time maintenance technicians, warehouse workers, chemical operators, lead chemical operators, pilot plant chemical operators, and production clerk.

Excluded:  Office clerical employees, professional employees, managerial employees, guards, supervisors, as defined in the Act.",39,"International Association of Machinists and Aerospace Workers, AFL-CIO","Open"
"10-RC-284521","National Audubon Society","Durham","10/14/2021","NC","All full time and regular part-time employees employed by the Employer in the North Carolina. Excluded: 
All other employees, including employees who report to the National Office, directors, seasonal employees, fellows, interns, confidential employees, guards and supervisors as defined by the Act",6,"Communications Workers of America, AFL-CIO","Open"
"10-RC-284521","National Audubon Society","Durham","10/14/2021","NC","All full time and regular part-time employees employed by the Employer in the North Carolina. Excluded: 
All other employees, including employees who report to the National Office, directors, seasonal employees, fellows, interns, confidential employees, guards and supervisors as defined by the Act",6,"Communications Workers of America, AFL-CIO","Open"
"10-RC-284521","National Audubon Society","Durham","10/14/2021","NC","All full time and regular part-time employees employed by the Employer in the North Carolina. Excluded: 
All other employees, including employees who report to the National Office, directors, seasonal employees, fellows, interns, confidential employees, guards and supervisors as defined by the Act",6,"Communications Workers of America, AFL-CIO","Open"
"10-RC-284521","National Audubon Society","Durham","10/14/2021","NC","All full time and regular part-time employees employed by the Employer in the North Carolina. Excluded: 
All other employees, including employees who report to the National Office, directors, seasonal employees, fellows, interns, confidential employees, guards and supervisors as defined by the Act",6,"Communications Workers of America, AFL-CIO","Open"
"10-RC-284694","The Martin Brower Company, L.L.C.","East Point","10/18/2021","GA","Included: All full-time and regular part-time drivers.
Excluded: All other employees, guards, and supervisors as defined in the Act.",68,"Teamsters Local 528","Open"
"10-RC-284945","Dave Steel Company","Chesnee","10/22/2021","SC","Included: All full-time and regular part-time hourly production, maintenance, and non­ supervisory employees employed at the employer's Chesnee, SC facility.

Excluded: All other employees, including but not limited to professional employees, guards, and supervisors as defined in the Act.
",47,"Iron Workers Local Union No. 854","Open"
"10-RC-286018","WAI Construction Group LLC","Huntsville","11/10/2021","AL","Included: Full Time and Part Time Instrument Mechanics, Engineer technicians III, IV, V, and VI. Excluded: All other Employees.",9,"International Union of Operating Engineers, Local 320","Open"
"10-RC-286288","Aramark Uniform Services","Savannah","11/16/2021","GA","All Full Time and Regular Part Time hourly and commission drivers. Excluded: All other employees",11,"Teamsters Local 728","Open"
"10-RC-286648","Piedmont Health Services","Chapel Hill","11/23/2021","NC","Included: All community health center medical providers (defined as physicians, nurse practitioners, certified nurse-midwives, and physician's assistants) employed by Piedmont Health Services at the Burlington Community Health Center, Carrboro Community Health Center, Chapel Hill Community Health Center, Charles Drew Community Health Center, IFC Health Center, Moncure Community Health Center, Prospect Hill Community Health Center, Scott Community Health Center, Siler City Community Health Center, Sylvan Community Health Center.

Excluded: All other employees including managers and supervisors as defined by the Act. ",49,"Piedmont Health Services Medical Providers United","Open"
"10-RD-284565","Comcast Cable Communications Management, LLC","Florence","10/14/2021","AL","Service and maintenance Department",1,"IBEW Local Union 558","Open"
"10-RD-284565","Comcast Cable Communications Management, LLC","Florence","10/14/2021","AL","Service and maintenance Department",1,"IBEW Local Union 558","Open"
"12-RC-282972","Nieves & Nieves Engineers and Contractors, Inc.","Lares","09/15/2021","PR","Included: all the full time and regular part time employees including but not limited to heavy equipment operators, workers, masons, bricklayers, etc. employed by the Employer at its facilities excluded: all other employees, office clerical employees, professional employees, confidential employees, guards and supervisors as defined by the Act.",30,"LIUNA District Council of Puerto Rico, Laborer's International Union of North America","Open"
"12-RC-283049","Intermodal Mexico USA, LLC","Jacksonville","09/16/2021","FL","Included: Full-Time / Part-Time Drivers, Operators, Groundsmen & Leads

Excluded: All Supervisors, Office Staff, Clerks and Mechanics
",42,"International Brotherhood of Teamsters, Local 512","Open"
"12-RC-283588","Seminole Electric Cooperative, Inc.","Tampa","09/24/2021","FL","Included:  All full time System Associates, Systems Coordinators I, Systems Coordinators II, Senior Systems Operators, and Systems Operators.  Excluded:  All Clerical employees, Supervisors, Management, guards, and all other defined by the law.",10,"International Brotherhood of Electrical Workers, Local 108","Open"
"12-RC-286390","G4S d/b/a Allied Universal","Florida City","11/16/2021","FL","INCLUDED: ALL full-time and part-time armed and unarmed Supervisor/Lieutenants performing guard duties as defined in Section 9(b)(3) of the National Labor Relations Act employed by G4S d/b/a Allied Universal @ 9060 SW 344 Street, Florida City, Florida, 33035.  

EXCLUDED:  All Office Clerical Employees, Professional Employees and Supervisors as defined by the Act.",24,"International Union, Security, Police & Fire Professionals of America (SPFPA)","Open"
"13-RC-274653","Wide Open West Illinois, LLC","Warrenville","03/25/2021","IL","Included: Service Techs, Field Service Techs, Fiber Techs, Commertical Techs, Laborers & Warehouse

Excluded:
Payment Center Clerks, Network Assurance Center employees & all other employees",48,"IBEW Local 21","Open"
"13-RC-284059","Roger Baldwin Foundation of ACLU, Inc.","Chicago","10/06/2021","IL","Included positions:
Administrative Assistant,
Advocacy Administrative Manager, Annual Fund and Engagement Manager, Communications and Marketing Manager, Deputy Communications Director (vacant), Director of Criminal Justice Policy, Director of Institutional Giving, Director of Leadership  Gifts and Engagement Officer, Director of Systems Reform Policy, Finance Associate, Legal Assistant, Legal Fellow, Legal Manager, Office Manager, Philanthropy and Engagement Associate, Philanthropy and engagement Special Assistant (vacant), Policy and Advocacy Strategist, Staff Attorney

Excluded positions: Associate Director, Deputy Legal Director (vacant), Director of Advocacy and Intergovernmental Affairs, Director of Communications and Public Policy, Director of Finance, Director of LGBTQ & HIV Project, Director of Philanthropy and Engagement, Director of the Corrections Reform Project, Director of the Institutional Reform Project, Director of Women's and Reproductive Rights Project, Executive Administrator, Executive Director, Human Resources Manager (vacant), Legal Director, Senior Supervising Attorney

",25,"National Organization of Legal Services Workers Local 2320","Open"
"13-RC-284411","Northwestern University","Evanston","10/12/2021","IL","Included:  Northwestern University library staff including those in the position of Administrative Assistant I; Administrative Assistant II; Administrative Assistant III; Business Coordinator; Circulation Services Supervisor; Communications Specialist; Clerk III; Conservation Technician; Curator; Customer Service Representative; Developer; Developer Lead; Developer Senior; Digitization Assistant; Financial Assistant; Librarian; Library Assistant I: Librarian Assistant II; Librarian Assistant III; Library Clerk I; Library Clerk II; Mail Delivery Worker; Senior Developer; Senior Librarian; Systems Administrator; Systems Administrator Senior; Technical Support Specialist; Technical Support Specialist Senior: University Archivist; User Service Representative II; User Services Representative 2.5; User Support Specialist; User Support Specialist Associate; Web and Electronic Communication Specialist; All other non-supervisory, non-guard employees working at Northwestern University's main library.

Excluded:  Northwestern University library staff working primarily in the Pritzker (Law School) or Galter (Medical School) libraries; statutory supervisors; statutory guards; student employees; University Press employees; library employees performing work primarily in the foreign State of Quatar; Employees of the Styberg Library located within Northwestern University; all other Northwestern University employees not included in the unit.",142,"SEIU (Service Employees International Union) Local 73","Open"
"13-RC-284411","Northwestern University","Evanston","10/12/2021","IL","Included:  Northwestern University library staff including those in the position of Administrative Assistant I; Administrative Assistant II; Administrative Assistant III; Business Coordinator; Circulation Services Supervisor; Communications Specialist; Clerk III; Conservation Technician; Curator; Customer Service Representative; Developer; Developer Lead; Developer Senior; Digitization Assistant; Financial Assistant; Librarian; Library Assistant I: Librarian Assistant II; Librarian Assistant III; Library Clerk I; Library Clerk II; Mail Delivery Worker; Senior Developer; Senior Librarian; Systems Administrator; Systems Administrator Senior; Technical Support Specialist; Technical Support Specialist Senior: University Archivist; User Service Representative II; User Services Representative 2.5; User Support Specialist; User Support Specialist Associate; Web and Electronic Communication Specialist; All other non-supervisory, non-guard employees working at Northwestern University's main library.

Excluded:  Northwestern University library staff working primarily in the Pritzker (Law School) or Galter (Medical School) libraries; statutory supervisors; statutory guards; student employees; University Press employees; library employees performing work primarily in the foreign State of Quatar; Employees of the Styberg Library located within Northwestern University; all other Northwestern University employees not included in the unit.",142,"SEIU (Service Employees International Union) Local 73","Open"
"13-RC-284495","PharmaCann Inc., d/b/a Verilife Cannabis Dispensary","Romeoville","10/13/2021","IL","Included:  All full-time and regular part-time Cannabis Sales Consultants (CSC) and Dispensing Inventory Specialist (DIS)

Excluded:  All salaried managers, temporary employees, other contracted employees, office clerical employees, confidential employees, and professional employees, guards and supervisors as defined in the Act.",19,"Teamsters Local 777","Open"
"13-RC-284536","National Audubon Society, Inc.","Chicago","10/14/2021","IL","Included:  All full-time and regular part-time employees employed by the Employer in the Great Lakes regional office, including employees at nature centers, sanctuaries, and preserves.

Excluded:  All other employees, including employees at the Aullwood Nature Center, employees who report to the National Office, directors, seasonal employees, fellows ,interns, confidential employees, guards and supervisors as defined by the Act.",14,"Communications Workers of America","Open"
"13-RC-284536","National Audubon Society, Inc.","Chicago","10/14/2021","IL","Included:  All full-time and regular part-time employees employed by the Employer in the Great Lakes regional office, including employees at nature centers, sanctuaries, and preserves.

Excluded:  All other employees, including employees at the Aullwood Nature Center, employees who report to the National Office, directors, seasonal employees, fellows ,interns, confidential employees, guards and supervisors as defined by the Act.",14,"Communications Workers of America","Open"
"13-RC-284536","National Audubon Society, Inc.","Chicago","10/14/2021","IL","Included:  All full-time and regular part-time employees employed by the Employer in the Great Lakes regional office, including employees at nature centers, sanctuaries, and preserves.

Excluded:  All other employees, including employees at the Aullwood Nature Center, employees who report to the National Office, directors, seasonal employees, fellows ,interns, confidential employees, guards and supervisors as defined by the Act.",14,"Communications Workers of America","Open"
"13-RC-284536","National Audubon Society, Inc.","Chicago","10/14/2021","IL","Included:  All full-time and regular part-time employees employed by the Employer in the Great Lakes regional office, including employees at nature centers, sanctuaries, and preserves.

Excluded:  All other employees, including employees at the Aullwood Nature Center, employees who report to the National Office, directors, seasonal employees, fellows ,interns, confidential employees, guards and supervisors as defined by the Act.",14,"Communications Workers of America","Open"
"13-RC-284891","Hopewell Services LLC d/b/a Hopewell Transportation","Carol Stream","10/21/2021","IL","Included:  All full-time and regular part-time drivers and monitors

Excluded;  All other employees, dispatchers and billing analysts, all Technicians, Trainers, professional employees, and guards and supervisors as defined by the Act.",135,"Teamsters Local 777","Open"
"13-RC-284956","PharmaCann Inc. d/b/a Verilife Cannabis Dispensary","Rosemont","10/21/2021","IL","Included:
All full-time and regular part-time Cannabis Sales Consultants (CSC) and Dispensing Inventory Specialists
(DIS)
Excluded:
All salaried managers, temporary employees, other contracted employees, office clerical employees,
confidential employees, and professional employees, guards and supervisors as defined in the Act.",27,"Teamsters Local 777","Open"
"13-RC-284981","Intralot, Inc.","Bolingbrook","10/22/2021","IL","Included:  All full-time and regular part-time Bench Technician, Senior Field Service Technician and Junior Field Service Technician employed with this group by the Employer in the state of Illinois.

Excluded:  Supervisory, Managerial and confidential employees and guards as defined by the Act and other employees.",45,"International Brotherhood of Electrical Workers, Local  Union No. 176","Open"
"13-RC-285109","The Fynder Group, Inc. d/b/a Nature’s Fynd","Chicago","10/26/2021","IL","Included:  All full-time and regular part-time skilled maintenance employees working for Nature's Fynd at 815 West Pershing Road, Chicago, Il 60609

Excluded:  Office clerical, professional employees, managers, guards and supervisors as defined by the Act.",3,"International Union of Operating Engineers, Local 399","Open"
"13-RC-285290","Xylem Dewatering Solutions, Inc.","Mokena","10/28/2021","IL","Included:  All regular full and part-time technicians, pump mechanics, field service/road mechanics, drivers, field operators, and yardmen.

Excluded:  All guards, supervisors, managers, and clericals as defined by the Act.",10,"International Union of Operating Engineers Local 150","Open"
"13-RC-285331","Sterigenics U.S., LLC","Gurnee","10/28/2021","IL","Included:  All full-time and part-time operators and maintenance employees.

Excluded:  All other employees, including office clericals, shipping and receiving employees, drivers, professional employees, confidential employees, guards, managers and supervisors as defined in the National Labor Relations Act.",27,"Laborers Local 681","Open"
"13-RC-285548","The Art Institute of Chicago","Chicago","11/02/2021","IL","Included: All full-time and regular part time employees in professional and non-professional classifications.

Excluded: All confidential and managerial employees; and guards and supervisors as defined by the Act.",290,"","Open"
"13-RC-285549","School of the Art Institute of Chicago","Chicago","11/02/2021","IL","Included: All full-time and regular part time employees in professional and non-professional classifications

Excluded: All confidential and managerial employees; and guards and supervisors as defined by the Act.",275,"","Open"
"13-RC-285742","Westmont Manor HRC, LLC d/b/a Westmont Manor Health & Rehab Center","Westmont","11/05/2021","IL","Employees Included
All unrepresented service and maintenance employees, including Certified Nursing
Assistants (CNAs), dietary aides, restorative aides, cooks, and housekeepers

Employees 
Excluded
Licensed practical and registered nurses, confidential employees, casual employees,
guards, managers, and supervisors as defined by the Act and all currently represented
employees",23,"SEIU Health Care Illinois, Indiana, Missouri and Kansas","Open"
"13-RC-285745","St. James Wellness Rehab and Villas, LLC","Crete","11/05/2021","IL","Employees Included
All unrepresented service and maintenance employees, including Certified Nursing
Assistants (CNAs), dietary aides, activity aides, cooks, housekeepers and laundry aides

Employees Excluded
Licensed practical and registered nurses, confidential employees, casual employees,
guards, managers, and supervisors as defined by the Act and all currently represented
employees",50,"SEIU HC Illinois, Indiana, Missouri and Kansas","Open"
"13-RC-285779","South Holland Manor Health & Rehab Center","South Holland","11/05/2021","IL","Employees Included
All unrepresented service and maintenance employees, including Certified Nursing
Assistants (CNAs), dietary aides, activity aides, supply clerks, cooks, housekeepers,
janitors, and laundry aides
Employees Excluded
Licensed practical and registered nurses, confidential employees, casual employees,
guards, managers, and supervisors as defined by the Act and all currently represented
employees",85,"SEIU HC Illinois, Indiana, Missouri and Kansas","Open"
"13-RC-286375","The Citadel of Glenview LLC","Glenview","11/16/2021","IL","Included: All unrepresented service and maintenance employees, including Certified Nursing Assistants (CNAs), dietary aides, cooks, housekeeping employees, laundry employees, activity aides, and maintenance employees
Excluded: Licensed practical and registered nurses, confidential employees, casual employees, guards, managers and supervisors as defined by the Act and all currently represented employees",50,"SEIU Healthcare Illinois & Indiana","Open"
"13-RC-286553","Intralot, Inc.","Bolingbrook","11/19/2021","IL","Included: All full-time and regular part-time Trainer, Field Service Dispatcher, and Call Center Operator employed with this
group by the employer in the state of Illinois.

Excluded:
Supervisory, Managerial and confidential employees and guards as defined by the Act and other employees.
",8,"International Brotherhood of Electrical Workers, Local  Union No. 176","Open"
"13-RC-286626","Zen Leaf","Highland Park","11/22/2021","IL","Included:
All FullTime & PartTime Store Associates employed by the Employer from it's facility

Excluded: Managers, guards, professional Employees & Supervisors",22,"United Food and Commercial Workers International Union, Local 881","Open"
"14-RC-278595","Union Electric Company d/b/a Ameren Missouri","Steedman","06/16/2021","MO","Included:  Employees of the Callaway Work Management department with the job title of planner.  Excluded:  Managers, Professional Employees and Guards as defined by the Act.",12,"International Union of Operating Engineers, Local 148","Open"
"14-RC-284000","Asplundh Tree Expert, L.L.C.","Neosho","10/05/2021","MO","Included: All regular and part-time employees working in the classifications of Foreperson, Trimmer, Trainee, and Groundperson Excluded: Supervisors",12,"International Brotherhood of Electrical Workers Local 53","Open"
"14-RC-284094","Asplundh Tree Expert, L.L.C.","Nevada","10/06/2021","MO","Included: All regular and part-time employees working in the classifications of Foreperson, Trimmer, Trainee, and Groundperson Excluded: Supervisors",9,"International Brotherhood of Electrical Workers Local 53","Open"
"14-RC-284094","Asplundh Tree Expert, L.L.C.","Nevada","10/06/2021","MO","Included: All regular and part-time employees working in the classifications of Foreperson, Trimmer, Trainee, and Groundperson Excluded: Supervisors",9,"International Brotherhood of Electrical Workers Local 53","Open"
"14-RC-284203","Centerra Group, LLC","Independence","10/08/2021","MO","Included: All full & part-time guards at the facility.
Excluded: Office clericals, professional employees, managers & supervisors as defined by NLRA",15,"International Union, Security, Police and Fire  Professionals of America (SPFPA)","Open"
"14-RC-284203","Centerra Group, LLC","Independence","10/08/2021","MO","Included: All full & part-time guards at the facility.
Excluded: Office clericals, professional employees, managers & supervisors as defined by NLRA",15,"International Union, Security, Police and Fire  Professionals of America (SPFPA)","Open"
"14-RC-284622","National Audubon Society, Inc.","West Alton","10/14/2021","MO","Included:  All full tie and regular part-time employees employed by the Employer in the Upper Mississippi regional office, covering the states of Missouri, Iowa, and Minnesota, including employees at nature centers, sanctuaries, and preserved.  Excluded:  All other employees, including employees who report to the National Office, directors, seasonal employees, fellows, interns, confidential employees, guards and supervisors as defined by the Act.",4,"Communications Workers of America, AFL-CIO","Open"
"14-RC-284622","National Audubon Society, Inc.","West Alton","10/14/2021","MO","Included:  All full tie and regular part-time employees employed by the Employer in the Upper Mississippi regional office, covering the states of Missouri, Iowa, and Minnesota, including employees at nature centers, sanctuaries, and preserved.  Excluded:  All other employees, including employees who report to the National Office, directors, seasonal employees, fellows, interns, confidential employees, guards and supervisors as defined by the Act.",4,"Communications Workers of America, AFL-CIO","Open"
"14-RC-285653","Wildcat Materials","Columbia","11/03/2021","MO","Included: Workers consisting of drywall material operators, handlers/laborers and drivers Excluded: office staff including supervisors and dispatchers",5,"LIUNA Laborers' Local 955","Open"
"14-RC-285712","Nestle Purina Petcare Company","Saint Louis","11/04/2021","MO","Included: Carpenters, carpenter millwrights, laborers, maintenance mechanics, drivers (Armour-Globe)

Excluded: electricians, painters, plumbers, operators, security guards, office employees",8,"St. Louis-Kansas City Carpenters' Regional Council","Open"
"14-RC-285712","Nestle Purina Petcare Company","Saint Louis","11/04/2021","MO","Included: Carpenters, carpenter millwrights, laborers, maintenance mechanics, drivers (Armour-Globe)

Excluded: electricians, painters, plumbers, operators, security guards, office employees",8,"St. Louis-Kansas City Carpenters' Regional Council","Open"
"14-RC-285712","Nestle Purina Petcare Company","Saint Louis","11/04/2021","MO","Included: Carpenters, carpenter millwrights, laborers, maintenance mechanics, drivers (Armour-Globe)

Excluded: electricians, painters, plumbers, operators, security guards, office employees",8,"St. Louis-Kansas City Carpenters' Regional Council","Open"
"14-RC-285712","Nestle Purina Petcare Company","Saint Louis","11/04/2021","MO","Included: Carpenters, carpenter millwrights, laborers, maintenance mechanics, drivers (Armour-Globe)

Excluded: electricians, painters, plumbers, operators, security guards, office employees",8,"St. Louis-Kansas City Carpenters' Regional Council","Open"
"14-RC-286226","Equipmentshare","Columbia","11/15/2021","MO","Included: all drivers Excluded: all supervisors and clerical",5,"Teamsters Local No. 833","Open"
"14-RC-286229","Intermodal Transportation and Rail Service d/b/a ITS","Kansas City","11/12/2021","MO","Included:  All full-time and regular part-time terminal operators, including lead terminal operators, crane operators, hostlers, gate checker leads, gate checkers, and groundsmen.  Excluded:  Office clerical employees, professionals, managers, supervisors and guards as defined by the National Labor Relations Act.",48,"International Brotherhood of Teamsters","Open"
"14-RD-284342","Noller Lincoln-Mercury Inc.","Topeka","10/12/2021","KS","Included: Service techs and lube techs Excluded: Sales, office personnel, supervisors",7,"International Brotherhood of Teamsters Local 696","Open"
"14-RD-284342","Noller Lincoln-Mercury Inc.","Topeka","10/12/2021","KS","Included: Service techs and lube techs Excluded: Sales, office personnel, supervisors",7,"International Brotherhood of Teamsters Local 696","Open"
"14-RD-284436","CSL-Columbia II, LLC d/b/a Reflections at Garden Place","Columbia","10/13/2021","IL","Included:  All included - hourly staff.  Excluded:  Office staff, maintenance supervisors.",15,"International Union of Operating Engineers, Local 148","Open"
