"22-RC-197006","Region 22, Newark, New Jersey","Mendez Trucking, Inc.","Open","04/18/2017","","","BELLEVILLE","NJ",35,"","Mendez Trucking Inc.","INCLUDED: ALL FULL TIME AND REGULAR PART TIME DRIVERS EMPLOYED BY THE EMPLOYER.

EXCLUDED: ALL OFFICE CLERICAL EMPLOYEES, SALES PERSONNEL, MANAGERS, GUARDS AND SUPERVISORS AS DEFINED BY THE ACT.",35,"A","Single Labor Organization","Initial","05/12/2017",35,NA,20,"",NA,"",NA,8,28,"",7,"","Mendez Trucking Inc.","INCLUDED:	All full-time and regular part-time drivers employed by the Employer at its Belleville, Newark and Elizabeth, New Jersey facilities.

Others permitted to vote: The parties have agreed that the dispatchers, mechanics and
drivers Jose Castro, Jesus Calero, Felipe Luzuriaga-Armijos, and Oscar Solanovaca may
vote in the election, but their ballots will be challenged since their eligibility has not been
resolved. No decision has been made regarding whether these named individuals,
dispatchers and mechanics are included in, or excluded from, the bargaining unit. The
eligibility or inclusion of these individuals will be resolved, if necessary, following the
election.

EXCLUDED:	All office clerical employees, casual drivers, sales personnel, managers, guards and supervisors as defined in the Act, and all other employees.","","","","Teamsters Local 282"
"22-RC-197006","Region 22, Newark, New Jersey","Mendez Trucking, Inc.","Open","04/18/2017","","","BELLEVILLE","NJ",35,NA,"Mendez Trucking Inc.","INCLUDED: ALL FULL TIME AND REGULAR PART TIME DRIVERS EMPLOYED BY THE EMPLOYER.

EXCLUDED: ALL OFFICE CLERICAL EMPLOYEES, SALES PERSONNEL, MANAGERS, GUARDS AND SUPERVISORS AS DEFINED BY THE ACT.",35,NA,NA,NA,NA,NA,NA,NA,NA,NA,NA,NA,NA,NA,NA,NA,NA,NA,NA,NA,NA,NA,"Teamsters Local 282"
"22-RC-261504","Region 22, Newark, New Jersey","Russell Reid Waste Hauling & Disposal Service Company, Inc.","Open","06/11/2020","","","Keasbey","NJ",NA,NA,NA,NA,NA,"A","Single Labor Organization","Initial","09/14/2020",43,1,11,"",NA,"",NA,23,34,"",4,"","","All full-time and regular part-time Bulk Technicians, Grease Technicians, Jet Rod Technicians, Master Service Technicians, Roll-Off Technicians, Septic Technicians, Equipment Specialists, Equipment Specialist Leads, Mechanics, and Mechanic Leads employed by the Employer at its facility located at 200 Smith Street, Keasbey, New Jersey, and at a satellite facility located at 635 Delancey Street, Newark, New Jersey, but excluding all office clerical employees, managerial employees, professional employees, guards and supervisors as defined in the Act, and all other employees.","","","","International Union of Operating Engineers, Local 825"
"22-RC-276709","Region 22, Newark, New Jersey","IMPACT SITE WORKS, LLC","Open","05/06/2021","","","Lyndhurst","NJ",9,"","","Included: all full time and part-time operators, and junior operators working at Employer's Newark and Cinnaminson jobsites Excluded: all other employees, including all office clerical employees, managerial employees, guards and supervisors defined by the Act",NA,NA,NA,NA,NA,NA,NA,NA,NA,NA,NA,NA,NA,NA,NA,NA,NA,NA,NA,NA,NA,NA,"INTERNATIONAL UNION OF OPERATING ENGINEERS LOCAL 825"
"22-RC-279374","Region 22, Newark, New Jersey","Edison Lithograph and Printing Corp.","Open","07/02/2021","","","North Bergen","NJ",NA,NA,NA,NA,NA,"A","Two Labor Organizations","Initial","11/19/2021",33,NA,5,"LOCAL 17-18 UNITED PRODUCTION WORKERS UNION ",2,"",NA,NA,7,"",NA,"","Transportation, Production, Warehouse Employees Union Local 438","INCLUDED: All full-time and regular part-time laborers, general labor, operators, and warehouse employees employed at the Employer’s Tonnelle Avenue, North Bergen, New Jersey 07047 location.

EXCLUDED: All office clerical employees, guards and supervisors as defined in the Act.
","","","","Transportation, Production, Warehouse Employees Union Local 438"
"22-RC-292717","Region 22, Newark, New Jersey","Swissport Cargo Services, LP","Open","03/23/2022","","","Newark","NJ",342,NA,"","INCLUDED:  All full time and regular part time warehouse employees including, without limitation, cargo, document and mail handlers, export office agents, import office agents, export warehouse agents, import warehouse agents, mail agents, QuikPak agents, and truck coordinators. 

EXCLUDED:  Professional, office clerical, and managerial employees, guards, and supervisors as defined by the Act.
",NA,NA,NA,NA,NA,NA,NA,NA,NA,NA,NA,NA,NA,NA,NA,NA,NA,NA,NA,NA,NA,NA,"International Association of Machinists and Aerospace Workers, AFL-CIO"
"22-RC-297330","Region 22, Newark, New Jersey","3, LLC","Open","06/07/2022","","","Kearny","NJ",10,"","","INCLUDED:  All full-time and regular part-time laborers, including demolition workers, employed by the Employer at its New York and New Jersey jobsites.

EXCLUDED:  All drivers, office clerical employees, confidential employees, guards and supervisors as defined in the Act.",NA,NA,NA,NA,NA,NA,NA,NA,NA,NA,NA,NA,NA,NA,NA,NA,NA,NA,NA,NA,NA,NA,"New Jersey Building Laborers District Council"
"22-RC-297792","Region 22, Newark, New Jersey","STARBUCKS CORPORATION","Open","06/16/2022","","","Montclair","NJ",15,"","Workers United","INCLUDED  All full-time and regular part-time baristas, shift supervisors, and assist. store managers.

EXCLUDED:  Store managers, office clericals, guards, and supervisors as defined by the Act.
",17,"A","Single Labor Organization","Initial","08/10/2022",17,NA,7,"",NA,"",NA,NA,7,"",NA,"","WORKERS UNITED","Included:  All full-time and regular part-time Baristas and Shift Supervisors employed by the Employer at its Store #13856 located at 40 South Park Street, Montclair, New Jersey.

Excluded: All Store managers, confidential employees, office clerical employees, managerial employees, professional employees, guards and supervisors as defined by the Act, and all other employees.  
","","","","Workers United"
"22-RC-297792","Region 22, Newark, New Jersey","STARBUCKS CORPORATION","Open","06/16/2022","","","Montclair","NJ",15,NA,"","INCLUDED  All full-time and regular part-time baristas, shift supervisors, and assist. store managers.

EXCLUDED:  Store managers, office clericals, guards, and supervisors as defined by the Act.
",NA,NA,NA,NA,NA,NA,NA,NA,NA,NA,NA,NA,NA,NA,NA,NA,NA,NA,NA,NA,NA,NA,"Workers United"
"22-RC-298961","Region 22, Newark, New Jersey","Givaudan Flavors Corp.","Open","07/06/2022","","","East Hanover","NJ",175,"","","INCLUDED:  All full-time and regular part-time warehouse workers, compounders, dispensers, utility operators, flavor operators, raw material handlers, shipping employees, receiving employees, material handlers, lead employees, maintenance employees, boiler room employees, and waste water employees employed by the Employer at its East Hanover, New Jersey facilities. 

EXCLUDED:  All office clerical employees, laboratory employees, schedulers, engineers, temporary employers, guards and supervisors as defined in the Act, and all other employees.",NA,NA,NA,NA,NA,NA,NA,NA,NA,NA,NA,NA,NA,NA,NA,NA,NA,NA,NA,NA,NA,NA,"Local 210, International Brotherhood of Teamsters"
"22-RC-301159","Region 22, Newark, New Jersey","Jacobs/Operations Management Int'l, Inc.","Open","08/10/2022","","","Hoboken","NJ",35,"","","INCLUDED:  F/T/ & P/T Operations, Maintenance, Collection, Lab, and admin clerks, inc. leads

EXCLUDED:  Supervisors, Manager, Guards; elected and apptd personnel of North Hudson Sewage",NA,NA,NA,NA,NA,NA,NA,NA,NA,NA,NA,NA,NA,NA,NA,NA,NA,NA,NA,NA,NA,NA,"LOCAL 1158, INTERNATIONAL BROTHERHOOD OF ELECTRICAL WORKERS"
"22-RD-190318","Region 22, Newark, New Jersey","Laminated Board, Inc.","Open","12/21/2016","","","Linden","NJ",38,"","","Included:  All full time and regular part time mechanics & Warehouse employees.
Excluded:  Office clerical employees, confidential employees, officers, managers, professional  guards and supervisors.",NA,NA,NA,NA,NA,NA,NA,NA,NA,NA,NA,NA,NA,NA,NA,NA,NA,NA,NA,NA,NA,NA,"Retail, Wholesale, Department Store Union, Local 262 (RWDSU/UFCW)"
"22-RD-290559","Region 22, Newark, New Jersey","M. Chasen & Son, Inc.","Open","02/14/2022",NA,NA,"Irvington","NJ",9,NA,"","INCLUDED:  The unit is responsible for processing the product & packaging it for distribution.

EXCLUDED:  N/A",NA,NA,NA,NA,NA,NA,NA,NA,NA,NA,NA,NA,NA,NA,NA,NA,NA,NA,NA,NA,NA,NA,"United Electrical, Radio and Machine Workers of America (UE), Local 155"
"22-UD-000401","Region 22, Newark, New Jersey","New York Fast Ferry","Open","10/12/2001","","","Highlands","NJ",15,"",""," Inc. Full-Time and regular part-time employees, including, but not limited, to Port Captain, Galley, Engine, Mechanic and Deck(Captain, Mate and Deckland)

Exc. All office , clerical, mangerial employees and supervisors as defined by the act.",NA,NA,NA,NA,NA,NA,NA,NA,NA,NA,NA,NA,NA,NA,NA,NA,NA,NA,NA,NA,NA,NA,"LOCAL 333, UNITED MARINE DIVISION, ILA"
"25-RC-243735","Region 25, Indianapolis, Indiana","Needham Excavating, Inc.","Open","06/21/2019","","","Walcott","IA",9,"","","Included: all full-time heavy equipment operators; Excluded: Other classifications, supervisors, managers, office clerical, and guards.",17,"A","Single Labor Organization","Initial","07/12/2019",17,NA,3,"",NA,"",NA,5,8,"",9,"","","Included:  All full-time and regular part-time heavy equipment operators employed by the Employer at its facility located at 137 North Main Street, Walcott, Iowa, 52773:
Excluded:  All other employees, and office clerical employees, managers, and guards and supervisors as defined in the Act.","","","","International Union of Operating Engineers, Local 150, AFL-CIO"
"25-RC-243735","Region 25, Indianapolis, Indiana","Needham Excavating, Inc.","Open","06/21/2019","","","Walcott","IA",9,NA,"","Included: all full-time heavy equipment operators; Excluded: Other classifications, supervisors, managers, office clerical, and guards.",17,NA,NA,NA,NA,NA,NA,NA,NA,NA,NA,NA,NA,NA,NA,NA,NA,NA,NA,NA,NA,NA,"International Union of Operating Engineers, Local 150, AFL-CIO"
"25-RC-279310","Region 25, Indianapolis, Indiana","Hall Aluminum Products, Inc.","Open","06/30/2021","","","Fort Wayne","IN",43,"","","Included:  All full and part-time glaziers, architectural metal and glass workers

Excluded:  All statutory exemptions and shop employees",63,"A","Single Labor Organization","Initial","08/24/2021",63,2,17,"",NA,"",NA,25,42,"",6,"","","INCLUDED: All full-time and regular part-time glaziers, architectural metal workers, and architectural glass workers employed by the Employer at its Fort Wayne, Indiana facility,  
EXCLUDED: All janitorial employees, office clerical employees, professional employees, managers, temporary employees, and guards and supervisors as defined in the Act.","","","","International Union of Painters and Allied Trades, District Council 91"
"25-RC-279310","Region 25, Indianapolis, Indiana","Hall Aluminum Products, Inc.","Open","06/30/2021","","","Fort Wayne","IN",43,NA,"","Included:  All full and part-time glaziers, architectural metal and glass workers

Excluded:  All statutory exemptions and shop employees",63,NA,NA,NA,NA,NA,NA,NA,NA,NA,NA,NA,NA,NA,NA,NA,NA,NA,NA,NA,NA,NA,"International Union of Painters and Allied Trades, District Council 91"
"25-RC-295115","Region 25, Indianapolis, Indiana","Starbucks Corporation","Open","05/03/2022","","","Peoria","IL",21,"","","Included: All full-time and regular part-time Baristas and Shift Supervisors

Excluded: Store Managers, Office Clericals, Guards, Professional Employees, and Supervisors",8,"A","Single Labor Organization","Initial","07/12/2022",8,NA,2,"",NA,"",NA,2,4,"",NA,"","","Included:  All full-time and regular part-time baristas and shift supervisors employed by the Employer at its store located at 707 W Pioneer Parkway, Peoria, IL.  
Excluded:  All store managers, assistant store managers, office clerical employees, confidential employees, managerial employees, professional employees, guards and supervisors as defined in the Act, and all other employees.","","","","Chicago and Midwest Regional Joint Board, Workers United/SEIU"
"25-RC-295115","Region 25, Indianapolis, Indiana","Starbucks Corporation","Open","05/03/2022","","","Peoria","IL",21,NA,"","Included: All full-time and regular part-time Baristas and Shift Supervisors

Excluded: Store Managers, Office Clericals, Guards, Professional Employees, and Supervisors",NA,NA,NA,NA,NA,NA,NA,NA,NA,NA,NA,NA,NA,NA,NA,NA,NA,NA,NA,NA,NA,NA,"Chicago and Midwest Regional Joint Board, Workers United/SEIU"
"25-RC-296418","Region 25, Indianapolis, Indiana","Oak Street Health MSO, LLC","Open","05/25/2022","","","Indianapolis","IN",24,"","","",25,"A","Single Labor Organization","Initial","07/29/2022",25,1,7,"",NA,"",NA,9,16,"",3,"Y","","INCLUDED: All full-time and regular part-time medical assistants, clinical testing medical assistants, medical assistant/phlebotomists, community health workers, welcome coordinators, outreach executives I, outreach executives II, medical social workers, patient representatives/patient relations managers, clinical informatics specialists, and lead clinical informatics specialists employed by the Employer at its clinic located at 4200 S. East St., Indianapolis, Indiana 46227;  
EXCLUDED: All office clerical employees, professional employees, temporary employees, managerial employees, guards and supervisors as defined in the Act, and all other employees.","","","","SEIU Healthcare Illinois & Indiana"
"25-RC-296418","Region 25, Indianapolis, Indiana","Oak Street Health MSO, LLC","Open","05/25/2022","","","Indianapolis","IN",24,NA,"","",NA,NA,NA,NA,NA,NA,NA,NA,NA,NA,NA,NA,NA,NA,NA,NA,NA,NA,NA,NA,NA,NA,"SEIU Healthcare Illinois & Indiana"
"25-RC-297000","Region 25, Indianapolis, Indiana","SOLV Energy and Aerotek, Joint-Employers","Open","06/03/2022","","","Bass Lake","IN",25,"","","Included: All regular full- and part-time heavy equipment operators and mechanics.  Excluded:  All supervisors, guards, and clericals, as defined by the Act.",NA,NA,NA,NA,NA,NA,NA,NA,NA,NA,NA,NA,NA,NA,NA,NA,NA,NA,NA,NA,NA,NA,"International Union of Operating Engineers Local 150, AFL-CIO"
"25-RC-297432","Region 25, Indianapolis, Indiana","First Student, Inc., a division of FirstGroup America, Inc.","Open","06/10/2022","","","South Bend","IN",48,"","Chauffeurs, Teamsters, and Helpers, Local Union No. 364","Included: All full-time and regular part-time drivers, monitors, aides, and mechanics employed by the Employer at its workplace located at 701 West Chippewa, South Bend, Indiana.

Excluded: All dispatchers, office clerical employees, professional employees, managerial employees, and guard and supervisors as defined in the Act.",64,"A","Single Labor Organization","Initial","08/12/2022",64,4,18,"",NA,"",NA,1,19,"",NA,"","Chauffeurs, Teamsters, and Helpers, Local Union No. 364","Included: All full-time and regular part-time drivers, monitors, aides, and mechanics employed by the Employer at its workplace located at 701 West Chippewa, South Bend, Indiana

Excluded: All dispatchers, office clerical employees, professional employees, managerial employees, and guards and supervisors as defined in the Act.
","","","","Chauffeurs, Teamsters, and Helpers, Local Union No. 364"
"25-RC-297432","Region 25, Indianapolis, Indiana","First Student, Inc., a division of FirstGroup America, Inc.","Open","06/10/2022","","","South Bend","IN",48,NA,"","Included: All full-time and regular part-time drivers, monitors, aides, and mechanics employed by the Employer at its workplace located at 701 West Chippewa, South Bend, Indiana.

Excluded: All dispatchers, office clerical employees, professional employees, managerial employees, and guard and supervisors as defined in the Act.",NA,NA,NA,NA,NA,NA,NA,NA,NA,NA,NA,NA,NA,NA,NA,NA,NA,NA,NA,NA,NA,NA,"Chauffeurs, Teamsters, and Helpers, Local Union No. 364"
"25-RC-297909","Region 25, Indianapolis, Indiana","Shino'e Hana LLC‎‎‎‎","Open","06/21/2022","","","Springfield","IL",10,"","Local 881, United Food and Commercial Workers","Included: All Full-Time and Regular Part-Time Agents

Excluded: Managers, Professional employees, Guards, Supervisors & AIC",11,"A","Single Labor Organization","Initial","08/18/2022",11,2,7,"",NA,"",NA,NA,7,"",NA,"","Local 881, United Food and Commercial Workers","Included: All full-time and regular part-time agents employed by the Employer at the Maribis of Springfield West dispensary located at 3025 Lindbergh Blvd., Springfield, Illinois location. 

Excluded: All Agents-In-Charge, managers, office clerical employees, professional employees, guards and supervisors as defined in the Act
","","","","United Food and Commercial Workers Union Local 881"
"25-RC-297909","Region 25, Indianapolis, Indiana","Shino'e Hana LLC‎‎‎‎","Open","06/21/2022","","","Springfield","IL",10,NA,"","Included: All Full-Time and Regular Part-Time Agents

Excluded: Managers, Professional employees, Guards, Supervisors & AIC",NA,NA,NA,NA,NA,NA,NA,NA,NA,NA,NA,NA,NA,NA,NA,NA,NA,NA,NA,NA,NA,NA,"United Food and Commercial Workers Union Local 881"
"25-RC-298327","Region 25, Indianapolis, Indiana","Step-Up Incorporated (Services, Training, Education, Prevention-Understanding People)","Open","06/27/2022","","","Indianapolis","IN",20,"","","Included: ALL STAFF

Excluded: DIRECTORS/SUPERVISORS",NA,NA,NA,NA,NA,NA,NA,NA,NA,NA,NA,NA,NA,NA,NA,NA,NA,NA,NA,NA,NA,NA,"AFSCME Council 962"
"25-RC-298959","Region 25, Indianapolis, Indiana","Regal Industrial Midwest LLC","Open","07/08/2022","","","Pekin","IL",6,"","","Included: All hourly full-time and regular part-time production and maintenance employees including but not limited to Blasters, Painters, metalizers, machine operators, welders, fabricators, general laborer, material handler, employed at 14425 Wagonseller Road Pekin, Il 61554

Excluded: All other employees, including but not limited to salaried employees, janitorial employees, professional employees, office clerical employees, temporary workers, guards, and supervisors as defined in the Act.",NA,NA,NA,NA,NA,NA,NA,NA,NA,NA,NA,NA,NA,NA,NA,NA,NA,NA,NA,NA,NA,NA,"Iron Workers St. Louis District Council"
"25-RC-299162","Region 25, Indianapolis, Indiana","Semper Fi Express, LLC","Open","07/11/2022","","","Bloomington","IL",21,"","","Included
All full-time and regular part-time employees working at or out of Bloomington, IL

Excluded:
managers, clerical employees, guards and supervisors as defined in theAct",NA,NA,NA,NA,NA,NA,NA,NA,NA,NA,NA,NA,NA,NA,NA,NA,NA,NA,NA,NA,NA,NA,"International Brotherhood of Teamsters, Local Union No. 26"
"25-RC-299313","Region 25, Indianapolis, Indiana","Thoburn Burton Two, Inc. d/b/a 20 Past 4 and More","Open","07/13/2022","","","Indianapolis","IN",15,"","","Included:
       All full-time and part-time clerks.

Excluded:
       Supervisors, Management, and Guards as defined by the Act.",NA,NA,NA,NA,NA,NA,NA,NA,NA,NA,NA,NA,NA,NA,NA,NA,NA,NA,NA,NA,NA,NA,"United Food and Commercial Workers, Local 700"
"25-RC-299921","Region 25, Indianapolis, Indiana","Brad Manning Ford, Inc.","Open","07/22/2022","","","DeKalb","IL",14,"","","Included: All full-time and regular part-time Service Technicians, including journeyman, apprentices, semi-skilled and lube rack technicians who are employed by the employer whose facility is located at 402 Manning Dr. DeKalb, IL

Excluded: All other employees, office clerical employees, professional employees, managerial employees, guards, and supervisors as defined by the Act.",NA,NA,NA,NA,NA,NA,NA,NA,NA,NA,NA,NA,NA,NA,NA,NA,NA,NA,NA,NA,NA,NA,"International Association of Machinists and Aerospace Workers, AFL-CIO"
"25-RC-300014","Region 25, Indianapolis, Indiana","CPC Special Logistics East, LLC","Open","07/25/2022","","","Rockford","IL",19,"","","Included:
Divers",NA,NA,NA,NA,NA,NA,NA,NA,NA,NA,NA,NA,NA,NA,NA,NA,NA,NA,NA,NA,NA,NA,"Teamsters Local 325"
"25-RC-301215","Region 25, Indianapolis, Indiana","Lyons Fire and Safety, Inc.","Open","08/11/2022","","","Danville","IN",5,"","","Included: All full-time and regular part-time employees engaged in the installation of fire sprinkler systems employed by the Employer

Excluded: All other employed, fire alarm technicians, office clerical, guards, managers, and supervisors, as defined by the Act",NA,NA,NA,NA,NA,NA,NA,NA,NA,NA,NA,NA,NA,NA,NA,NA,NA,NA,NA,NA,NA,NA,"Road Sprinkler Fitters Local Union 669, United Association of Journeymen and Apprentices of the Plumbing Industry US and Canada, AFL-CIO"
"25-RC-301261","Region 25, Indianapolis, Indiana","JLL","Open","08/12/2022","","","Indianapolis","IN",6,"","","Included: All full-time and regular part-time skilled maintenance employees working for JLL at PNC facilities in North and Central Indiana

Excluded: Office clerical, professional employees, managers, guards and supervisors as defined in the Act",NA,NA,NA,NA,NA,NA,NA,NA,NA,NA,NA,NA,NA,NA,NA,NA,NA,NA,NA,NA,NA,NA,"International Union of Operating Engineers, Local 399"
"25-RD-300125","Region 25, Indianapolis, Indiana","Regional Ready Mix","Open","07/26/2022","","","Rochelle","IL",13,"","","Included: FT/PT plant operators, mechanics, operators, maintenance, workers, + truck drivers

Excluded: All other employees of the company",NA,NA,NA,NA,NA,NA,NA,NA,NA,NA,NA,NA,NA,NA,NA,NA,NA,NA,NA,NA,NA,NA,"IUOE, Local 150"
"25-UD-301441","Region 25, Indianapolis, Indiana","Springfield Pepsi-Cola Bottling Co.","Open","08/16/2022","","","Springfield","IL",24,"","","Included: All full-time service employees, presell delivery/merchandisers, warehouse, employees, service and bulk system

Excluded: Part-time, seasonal service dept, office clerical, sales dept, bulk merchandisers, professional, guards and supervisors",NA,NA,NA,NA,NA,NA,NA,NA,NA,NA,NA,NA,NA,NA,NA,NA,NA,NA,NA,NA,NA,NA,"Teamsters Local Union 916"
"27-RC-268059","Region 27, Denver, Colorado","Brinderson, LLC","Open","10/23/2020","","","Billings","MT",16,"","","Include: All full-time and regular part-time welders, pipefitters, pipefitter/welders, and maintenance mechanics employed by the Employer at the Exxonmobil facility located at 700 Exxonmobil Road Billings, Montana 59101. Exclude: All other employees, managers, office clericals, guards and supervisors as defined in the Act.",30,"A","Revised Single Labor Org","Initial","09/20/2021",30,1,7,"",NA,"",NA,7,14,"",NA,"","","Include: All full-time and regular part time welders, pipefitters, pipefitters/welders, maintenance mechanics and foremen employed by the Employer at the Exxonmobil facility located in Billings, Montana.
Exclude: All general Foremen, managers, office clerical employees, professional employees, guards, and supervisors as define in the Act.","","","","Plumbers and Pipefitters Union Local 30, a/w United Association of Journeymen and Apprentices of the Plumbing and Pipe Fitting Industry of the United States and Canada, AFL-CIO"
"27-RC-279265","Region 27, Denver, Colorado","Hall Aluminum Products, Inc.","Open","06/30/2021","","","Kiowa","CO",22,"","","Included: All Glaziers, Architectural Metal and Glass Workers, Industrial Workers within the State of Colorado.
Excluded: All other employees, guards and supervisors",37,"A","Single Labor Organization","Initial","08/19/2021",37,3,5,"",NA,"",NA,10,22,"",8,"Y","","Include: All full-time and regular part-time glaziers, architectural metal and glass workers, and industrial workers employed by the Employer on projects located in the State of Colorado. Exclude: All other employees, office clerical employees, guards, and supervisors, as defined in the Act.","","","","IUPAT District Council 81 - Glaziers, Architectural Metal & Glass Workers Union, Local Union No. 930, AFL-CIO"
"27-RC-279265","Region 27, Denver, Colorado","Hall Aluminum Products, Inc.","Open","06/30/2021","","","Kiowa","CO",22,NA,"","Included: All Glaziers, Architectural Metal and Glass Workers, Industrial Workers within the State of Colorado.
Excluded: All other employees, guards and supervisors",37,NA,NA,NA,NA,NA,NA,NA,NA,NA,NA,NA,NA,NA,NA,NA,NA,NA,NA,NA,NA,NA,"IUPAT District Council 81 - Glaziers, Architectural Metal & Glass Workers Union, Local Union No. 930, AFL-CIO"
"27-RC-283492","Region 27, Denver, Colorado","Staker & Parson Companies d/b/a Jack B. Parson Ready Mix Concrete","Open","09/24/2021","","","Draper","UT",220,"","Independent Union of Concrete Handlers, Drivers and Operators","Include: Ready Mix employees in Northern Utah and Southern Idaho. Exclude: office/clerical, guards, supervisors, and professional employees",266,"A","Single Labor Organization","Initial","12/10/2021",266,5,139,"",NA,"",NA,69,208,"",8,"","Independent Union of Concrete Handlers, Drivers and Operators","Include: All full-time and regular part-time Ready Mix Drivers employed by the Employer in (1) the following counties in Utah: Utah, Wasatch, Summit, Salt Lake, Tooele, Davis, Weber, Box Elder, and Cache, and (2) the following counties in Idaho: Bear Lake and Caribou. Exclude: All non-ready mix drivers, office clerical employees, managerial employees, professional employees guards, and Supervisors, as defined by the Act.","","","","Independent Union of Concrete Handlers, Drivers and Operators"
"27-RC-283492","Region 27, Denver, Colorado","Staker & Parson Companies d/b/a Jack B. Parson Ready Mix Concrete","Open","09/24/2021","","","Draper","UT",220,NA,"Independent Union of Concrete Handlers, Drivers and Operators","Include: Ready Mix employees in Northern Utah and Southern Idaho. Exclude: office/clerical, guards, supervisors, and professional employees",266,NA,NA,NA,NA,NA,NA,NA,NA,NA,NA,NA,NA,NA,NA,NA,NA,NA,NA,NA,NA,NA,"Independent Union of Concrete Handlers, Drivers and Operators"
