"22-RD-315731","Region 22, Newark, New Jersey","The Arc Mercer","Open","04/07/2023","","","Ewing","NJ",120,"","Communication Workers of America , Local 1040","INCLUDED:  Direct support professionals, drivers, laborers, crew leaders, food services employees, behavioral employees

EXCLUDED:  Office clerical Employees, admin Employees, professional Employees, day camp Employees, guards, mgmt",139,"A","Single Labor Organization","Initial","06/02/2023",139,1,14,"",NA,"",NA,17,31,"",NA,"","Communication Workers of America , Local 1040","INCLUDED:	All nonsupervisory, non-administrative, nonprofessional full-time and regular part-time and per diem, and floater and aides, employed by the Employer at its Mercer County locations, who provide direct care and services to consumers, including nonsupervisory, non-administrative, nonprofessional direct support professionals (DSPs), DSP Floats, Medical Direct Support Professional (Medical DSPs), Overnight DSP, and Behavioral Direct Support Professional (Behavioral DSPs), and also including nonsupervisory, non-administrative, nonprofessional non-DSP employees employed by the Employer at its Mercer County locations in the titles of drivers, laborers, crew leaders, food services employees, and behavioral day program employees, and all substitutes in such positions employed by the Employer at its Mercer County locations.

EXCLUDED:	All office clerical employees, administrative employees, day camp employees, managerial employees, (including Assistant Group Home Managers/Shift Group Home Managers), professional employees, guards and supervisors as defined in the Act, including Food Service Supervisor, Assistant Driver Supervisor, Shift Supervisors, Professional, Clinical, and Clerical Employees including Community Direct Support Professionals' whose services are reimbursed under Fee for Service as in home community-based supports. 

","","","","Communication Workers of America , Local 1040"
"22-RD-315731","Region 22, Newark, New Jersey","The Arc Mercer","Open","04/07/2023",NA,NA,"Ewing","NJ",120,NA,"","INCLUDED:  Direct support professionals, drivers, laborers, crew leaders, food services employees, behavioral employees

EXCLUDED:  Office clerical Employees, admin Employees, professional Employees, day camp Employees, guards, mgmt",NA,NA,NA,NA,NA,NA,NA,NA,NA,NA,NA,NA,NA,NA,NA,NA,NA,NA,NA,NA,NA,NA,"Communication Workers of America , Local 1040"
"22-RD-323558","Region 22, Newark, New Jersey","Medieval Times Dinner and Tournament","Open","08/10/2023","","","Lyndhurst","NJ",50,"","","INCLUDED: Live preformanc with animals/showcast, knights, stables, squire, falconer

EXCLUDED:  Retail, cash control, kitchen, servers, sound and lighting, bar and maintenance
",NA,NA,NA,NA,NA,NA,NA,NA,NA,NA,NA,NA,NA,NA,NA,NA,NA,NA,NA,NA,NA,NA,"American Guild of Variety Artists"
"22-RD-325649","Region 22, Newark, New Jersey","L'OREAL USA PRODUCTS, INC. D/B/A L'OREAL","Open","09/12/2023","","","Piscataway","NJ",171,"","","INCLUDED:  All production and maintenance, truck drivers and warehouse workers employed at Piscataway facility

EXCLUDED:  All others",NA,NA,NA,NA,NA,NA,NA,NA,NA,NA,NA,NA,NA,NA,NA,NA,NA,NA,NA,NA,NA,NA,"RWDSU/UFCW Local 262"
"22-RM-311853","Region 22, Newark, New Jersey","POMPTONIAN FOOD SERVICE","Open","02/08/2023","","","Springfield","NJ",21,"","","INCLUDED:  All F/T and regular P/T food services workers

EXCLUDED: All other employees, guards & supervisors as defined in the Act",NA,NA,NA,NA,NA,NA,NA,NA,NA,NA,NA,NA,NA,NA,NA,NA,NA,NA,NA,NA,NA,NA,"Service Employees International Union, Local 32BJ"
"22-RM-325076","Region 22, Newark, New Jersey","Shimmick Construction Company, Inc.","Open","08/29/2023","","","Jersey City","NJ",6,"","","INCLUDED:  Transportation Managers

EXCLUDED:  All others",NA,NA,NA,NA,NA,NA,NA,NA,NA,NA,NA,NA,NA,NA,NA,NA,NA,NA,NA,NA,NA,NA,"National Association of Transportation Supervisors Local 352"
"22-RM-327718","Region 22, Newark, New Jersey","Foundation Building Materials, L.L.C.","Open","10/12/2023","","","Hillside","NJ",10,"","","INCLUDED:  All full-time and regular part-time drivers, stockers, and warehouse personnel employees employed by the Employer at its 470 Mundet Pl, Hillside, NJ 07205 facility, except those who transitioned to Hillside from the 850 Flora Street, Elizabeth, New Jersy facility and their replacements.

EXCLUDED:  All sales employees, o?ce clerical employees, professional employees, guards, and supervisors as de?ned by the Act.",NA,NA,NA,NA,NA,NA,NA,NA,NA,NA,NA,NA,NA,NA,NA,NA,NA,NA,NA,NA,NA,NA,"Teamsters Local 11"
"22-UD-000401","Region 22, Newark, New Jersey","New York Fast Ferry","Open","10/12/2001","","","Highlands","NJ",15,"",""," Inc. Full-Time and regular part-time employees, including, but not limited, to Port Captain, Galley, Engine, Mechanic and Deck(Captain, Mate and Deckland)

Exc. All office , clerical, mangerial employees and supervisors as defined by the act.",NA,NA,NA,NA,NA,NA,NA,NA,NA,NA,NA,NA,NA,NA,NA,NA,NA,NA,NA,NA,NA,NA,"LOCAL 333, UNITED MARINE DIVISION, ILA"
"25-RC-243735","Region 25, Indianapolis, Indiana","Needham Excavating, Inc.","Open","06/21/2019","","","Walcott","IA",9,"","","Included: all full-time heavy equipment operators; Excluded: Other classifications, supervisors, managers, office clerical, and guards.",17,"A","Single Labor Organization","Initial","07/12/2019",17,NA,3,"",NA,"",NA,5,8,"",9,"","","Included:  All full-time and regular part-time heavy equipment operators employed by the Employer at its facility located at 137 North Main Street, Walcott, Iowa, 52773:
Excluded:  All other employees, and office clerical employees, managers, and guards and supervisors as defined in the Act.","","","","International Union of Operating Engineers, Local 150, AFL-CIO"
"25-RC-243735","Region 25, Indianapolis, Indiana","Needham Excavating, Inc.","Open","06/21/2019",NA,NA,"Walcott","IA",9,NA,"","Included: all full-time heavy equipment operators; Excluded: Other classifications, supervisors, managers, office clerical, and guards.",17,NA,NA,NA,NA,NA,NA,NA,NA,NA,NA,NA,NA,NA,NA,NA,NA,NA,NA,NA,NA,NA,"International Union of Operating Engineers, Local 150, AFL-CIO"
"25-RC-279310","Region 25, Indianapolis, Indiana","Hall Aluminum Products, Inc.","Open","06/30/2021","","","Fort Wayne","IN",43,"","","Included:  All full and part-time glaziers, architectural metal and glass workers

Excluded:  All statutory exemptions and shop employees",63,"A","Single Labor Organization","Initial","08/24/2021",63,2,17,"",NA,"",NA,25,42,"",6,"","","INCLUDED: All full-time and regular part-time glaziers, architectural metal workers, and architectural glass workers employed by the Employer at its Fort Wayne, Indiana facility,  
EXCLUDED: All janitorial employees, office clerical employees, professional employees, managers, temporary employees, and guards and supervisors as defined in the Act.","","","","International Union of Painters and Allied Trades, District Council 91"
"25-RC-279310","Region 25, Indianapolis, Indiana","Hall Aluminum Products, Inc.","Open","06/30/2021",NA,NA,"Fort Wayne","IN",43,NA,"","Included:  All full and part-time glaziers, architectural metal and glass workers

Excluded:  All statutory exemptions and shop employees",63,NA,NA,NA,NA,NA,NA,NA,NA,NA,NA,NA,NA,NA,NA,NA,NA,NA,NA,NA,NA,NA,"International Union of Painters and Allied Trades, District Council 91"
"25-RC-297000","Region 25, Indianapolis, Indiana","SOLV Energy, LLC and Aerotek, Inc. Joint-Employers","Open","06/03/2022","","","Bass Lake","IN",25,"","","Included: All regular full- and part-time heavy equipment operators and mechanics.  Excluded:  All supervisors, guards, and clericals, as defined by the Act.",78,"A","Single Labor Organization","Initial","12/07/2022",78,NA,6,"",NA,"",NA,22,28,"",41,"Y","","Included:  All regular full- and part-time excavator operators, skid steer operators, loader operators, 12k telehandlers, pile driver operators, fuel/water truck tractor operators, rubber tire roller operators, street sweeper operators, leads, and mechanics jointly employed by Aerotek, Inc. and SOLV Energy LLC at the Mammoth North Solar project. 

Excluded:  All office clerical employees, safety employees, professional employees, managers, foremen, quality control employees, temporary employees, general laborers, and guards and supervisors as defined in the Act.","","","","International Union of Operating Engineers Local 150, AFL-CIO"
"25-RC-297000","Region 25, Indianapolis, Indiana","SOLV Energy, LLC and Aerotek, Inc. Joint-Employers","Open","06/03/2022","","","Bass Lake","IN",25,NA,"","Included: All regular full- and part-time heavy equipment operators and mechanics.  Excluded:  All supervisors, guards, and clericals, as defined by the Act.",78,NA,NA,NA,NA,NA,NA,NA,NA,NA,NA,NA,NA,NA,NA,NA,NA,NA,NA,NA,NA,NA,"International Union of Operating Engineers Local 150, AFL-CIO"
"25-RC-326435","Region 25, Indianapolis, Indiana","Alpha Baking Co., Inc.","Open","09/25/2023","","","Indianapolis","IN",7,"","","Included: The Union seeks an Armour-Globe self-determination election to determine whether Shippers wish to be represented by Teamsters Local 135 and added to the existing bargaining unit of route sales drivers.

Excluded: Office clerical. professional employees, guards, supervisors as defined in the Act, and all other employees.",NA,NA,NA,NA,NA,NA,NA,NA,NA,NA,NA,NA,NA,NA,NA,NA,NA,NA,NA,NA,NA,NA,"Teamsters Local 135"
"25-RC-326539","Region 25, Indianapolis, Indiana","Road & Rail Services, Inc.","Open","09/25/2023","","","Terre Haute","IN",14,"","","Included: Full-Time & Regular Part-Time employees employed by employer at Gate G facility

Excluded: All Office Clerical, Professionals, Guards, and Supervisors and all other employees",NA,NA,NA,NA,NA,NA,NA,NA,NA,NA,NA,NA,NA,NA,NA,NA,NA,NA,NA,NA,NA,NA,"LIUMA, State of Indiana District Council"
"25-RC-327079","Region 25, Indianapolis, Indiana","Jasper County REMC","Open","10/03/2023","","","Rensselaer","IN",14,"","","Included: Foreman Linemen, Journeyman Linemen, Apprentice Linemen, Metering Technicians, & Tree Trimmers

Excluded: All other employees",NA,NA,NA,NA,NA,NA,NA,NA,NA,NA,NA,NA,NA,NA,NA,NA,NA,NA,NA,NA,NA,NA,"Local 1393, International Brotherhood of Electrical Workers"
"25-RC-327091","Region 25, Indianapolis, Indiana","Conagra Brands","Open","10/02/2023","","","Indianapolis","IN",25,"","","Included: All full-time and part-time maintenance workers.  Excluded: All guards, supervisors and managers as defined by the Act.",NA,NA,NA,NA,NA,NA,NA,NA,NA,NA,NA,NA,NA,NA,NA,NA,NA,NA,NA,NA,NA,NA,"United Food and Commercial Workers Local 700"
"25-RC-327168","Region 25, Indianapolis, Indiana","Lakeshore Recycling Systems","Open","10/03/2023","","","Atkinson","IL",15,"","","Included: Drivers, Helpers
Excluded: Supervisors, Management",NA,NA,NA,NA,NA,NA,NA,NA,NA,NA,NA,NA,NA,NA,NA,NA,NA,NA,NA,NA,NA,NA,"Teamsters Local 371"
"25-RC-327269","Region 25, Indianapolis, Indiana","IKG US, LLC","Open","10/04/2023","","","Garrett","IN",35,"","","Included: All   regular full-time and part-time production and maintenance workers at the employer's facility located at 1801 Forrest Park Dr in Garrett, IN 46738.
Excluded: All other employees, office clerical employees, supervisory employees, employees employed by other employers and guards as defined by the Act.",NA,NA,NA,NA,NA,NA,NA,NA,NA,NA,NA,NA,NA,NA,NA,NA,NA,NA,NA,NA,NA,NA,"International Brotherhood of Boilermakers, Iron Ship Builders, Blacksmiths, Forgers and Helpers, AFL-CIO"
"25-RC-327709","Region 25, Indianapolis, Indiana","DeKalb Motor Company d/b/a DeKalb Sycamore Chevrolet Buick GMC","Open","10/11/2023","","","Sycamore","IL",31,"","","Included: All full-time and regular part-time Service & Bodyshop Technicians, including Journeyman, Apprentices, Skilled, Lube Rack Technicians, Painters and Bodyshop Helpers who are employed by the Employer at their 1925 Mercantile Dr. Sycamore, IL facility.
Excluded: All other employees, Parts Department Employees, Service Writers, Porters, Sales Employees, Office Clerical employees, Professional employees, Managerial employees, Guards and Supervisors as defined by the Act.",NA,NA,NA,NA,NA,NA,NA,NA,NA,NA,NA,NA,NA,NA,NA,NA,NA,NA,NA,NA,NA,NA,"District Lodge 6, International Association of Machinists & Aerospace Workers, AFL-CIO"
"25-RD-301657","Region 25, Indianapolis, Indiana","Regional Ready Mix, LLC","Open","08/18/2022","","","Rochelle","IL",13,"","","Included: FT/PT plant operators, mechanics, operators, maintenance, truck drivers

Excluded: All other employees of the company",27,"A","Single Labor Organization","Initial","10/19/2022",27,NA,7,"",NA,"",NA,1,8,"",13,"Y","","Included: All full-time and regular part-time plant operators, mechanics, concrete belt-placers, conveyor operators, loader operators, concrete pumping operators, maintenance workers, electricians, truck-drivers and oilers employed by the Employer at its facility located at 15051 E. Lind Road, Rochelle, IL 61068.

Excluded: all office clerical employees, management employees, guards and supervisors as defined in the Act, and all other employees.
","","","","IUOE, Local 150"
"25-RD-301657","Region 25, Indianapolis, Indiana","Regional Ready Mix, LLC","Open","08/18/2022",NA,NA,"Rochelle","IL",13,NA,"","Included: FT/PT plant operators, mechanics, operators, maintenance, truck drivers

Excluded: All other employees of the company",27,NA,NA,NA,NA,NA,NA,NA,NA,NA,NA,NA,NA,NA,NA,NA,NA,NA,NA,NA,NA,NA,"IUOE, Local 150"
"25-RM-327450","Region 25, Indianapolis, Indiana","Conagra Food Packaged Foods LLC","Open","10/10/2023","","","Indianapolis","IN",30,"","","Included: All full-time and regular part-time maintenance and refrigeration department workers.

Excluded: All guards, supervisors, and managers as defined by the Act, and all other employees.",NA,NA,NA,NA,NA,NA,NA,NA,NA,NA,NA,NA,NA,NA,NA,NA,NA,NA,NA,NA,NA,NA,"United Food and Commercial Workers Local 700"
"27-RC-292261","Region 27, Denver, Colorado","Starbucks Corporation","Open","03/15/2022","","","Colorado Springs","CO",27,"","","Include: All full-time and regular part-time Baristas and Shift Supervisors. Exclude: Store managers, Office Clericals, Guards, Professional Employees, and Supervisors",29,"A","Revised Single Labor Org","Initial","02/09/2023",29,NA,10,"",NA,"",NA,10,20,"",NA,"","","Include: All full-time and regular part-time baristas and shift supervisors employed by the Employer at its Store #10897 located in Colorado Springs, CO. Exclude: All Store Managers, office clerical employees, confidential employees, managerial employees, professional employees, guards, and supervisors, as defined in the Act.","","","","Chicago and Midwest Regional Joint Board, Workers United/SEIU"
"27-RC-292261","Region 27, Denver, Colorado","Starbucks Corporation","Open","03/15/2022",NA,NA,"Colorado Springs","CO",27,NA,"","Include: All full-time and regular part-time Baristas and Shift Supervisors. Exclude: Store managers, Office Clericals, Guards, Professional Employees, and Supervisors",29,NA,NA,NA,NA,NA,NA,NA,NA,NA,NA,NA,NA,NA,NA,NA,NA,NA,NA,NA,NA,NA,"Chicago and Midwest Regional Joint Board, Workers United/SEIU"
"27-RC-309425","Region 27, Denver, Colorado","Right Now Heating, Cooling & Plumbing, LLC","Open","12/23/2022","","","Caldwell","ID",23,"","","Included:  All full time and regular part time Lead Plumbers, Plumbers, Plumbing Helpers, and Plumbing Apprentices employed by the Employer out of its Caldwell, Idaho office.

Excluded:  All other employees, HVAC technicians, comfort advisors, clericals, professionals, guards, managers and supervisors as defined by the Act.",15,"A","Single Labor Organization","Initial","01/25/2023",15,NA,NA,"",NA,"",NA,14,20,"",6,"","","Include: All full-time and regular part-time lead plumbers, plumbers, plumbing helpers, and plumbing apprentices employed by the Employer out of its Caldwell, Idaho facility. Exclude: Office clerical employees, HVAC technicians, comfort advisors, professional employees, managers, guards, and supervisors, as defined in the Act, and all other employees.","","","","United Association of Journeymen and Apprentices of the Plumbers and Pipe Fitting Industry of the United States and Canada Local 296"
"27-RC-309425","Region 27, Denver, Colorado","Right Now Heating, Cooling & Plumbing, LLC","Open","12/23/2022",NA,NA,"Caldwell","ID",23,NA,"","Included:  All full time and regular part time Lead Plumbers, Plumbers, Plumbing Helpers, and Plumbing Apprentices employed by the Employer out of its Caldwell, Idaho office.

Excluded:  All other employees, HVAC technicians, comfort advisors, clericals, professionals, guards, managers and supervisors as defined by the Act.",15,NA,NA,NA,NA,NA,NA,NA,NA,NA,NA,NA,NA,NA,NA,NA,NA,NA,NA,NA,NA,NA,"United Association of Journeymen and Apprentices of the Plumbers and Pipe Fitting Industry of the United States and Canada Local 296"
"27-RC-318054","Region 27, Denver, Colorado","The Whitestone Group, Inc.","Open","05/15/2023","","","Loveland","CO",7,"","","Included: All full-time and regular part-time Security Officers performing guard duties as defined in section 9(b)(3) of the National Labor Relations Act, employed by the Employer at Department of Energy (DOE), Western Area Power Administration (WAPA), Federal Facilities located at 555 East Crossroads Boulevard, Loveland, CO 80538. Excluded: All office clerical employees, professional employees and supervisors as defined by the Act.",NA,NA,NA,NA,NA,NA,NA,NA,NA,NA,NA,NA,NA,NA,NA,NA,NA,NA,NA,NA,NA,NA,"United Federation LEOS-PBA Law Enforcement Officers Security & Police Benevolent Association"
"27-RC-319208","Region 27, Denver, Colorado","MX Technologies, Inc.","Open","06/02/2023","","","Lehi","UT",25,"","","Included: QA Engineers. Excluded: Employees not in the QA department.",NA,NA,NA,NA,NA,NA,NA,NA,NA,NA,NA,NA,NA,NA,NA,NA,NA,NA,NA,NA,NA,NA,"International Brotherhood of Teamsters Local 222"
"27-RC-319226","Region 27, Denver, Colorado","Opera Colorado","Open","06/01/2023","","","Englewood","CO",100,"","","Included: All solo singers, narrators, stage directors and their assistants, stage managers and their assistants, performers who have speaking parts, choreographers, solo and ensemble dancers, chorus singers, Artists in Residence. Excluded: All supervisors as defined by the Act.",NA,NA,NA,NA,NA,NA,NA,NA,NA,NA,NA,NA,NA,NA,NA,NA,NA,NA,NA,NA,NA,NA,"American Guild of Musical Artists"
"27-RC-321091","Region 27, Denver, Colorado","SWCA Environmental Consulting","Open","07/05/2023","","","Salt Lake City","UT",16,"","","Includes: Archaeologist, Archaeologist Techs, and Interns.

Excludes: Non-archaeologist, office clerical employees, janitors and guards.",NA,NA,NA,NA,NA,NA,NA,NA,NA,NA,NA,NA,NA,NA,NA,NA,NA,NA,NA,NA,NA,NA,"International Brotherhood of Teamsters Local 222"
"27-RC-325276","Region 27, Denver, Colorado","Eagle Rock Distributing Company of Colorado","Open","09/07/2023","","","Colorado Springs","CO",33,"","International Brotherhood of Teamsters, Local 455","Included: All regular Colorado Springs full-time and part-time Delivery Drivers, Drive trainers, and all CDL drivers Driver Leads, Operators, Receivers, Pickers, Replenishers, Returns Processor Loaders, and Warehouse Leads employed at the Colorado Springs location. Excluded: Account Managers, Merchandisers, Janitorial/maintenance Employees, Inventory Counters, Line Cleaners, Analysts, Clerical Employees and Supervisors as defined in the Act.",32,"A","Single Labor Organization","Initial","10/12/2023",32,NA,18,"",NA,"",NA,8,26,"",NA,"","International Brotherhood of Teamsters, Local 455","Included: All full-time and regular part-time Delivery Drivers, Driver Trainers, CDL Driver Leads, Operators, Receivers, Pickers, Replenishers, and Warehouse Leads employed by the Employer at its Colorado Springs facility. Excluded: Account Managers, Merchandisers, Janitorial/Maintenance Employees, Inventory Counters, Liner Cleaners, Analysts, Driver Check Up, office clerical employees, professional employees, guards, all other employees, and supervisors, as defined in the Act.","","","","International Brotherhood of Teamsters Local 455"
"27-RC-325276","Region 27, Denver, Colorado","Eagle Rock Distributing Company of Colorado","Open","09/07/2023","","","Colorado Springs","CO",33,NA,"International Brotherhood of Teamsters, Local 455","Included: All regular Colorado Springs full-time and part-time Delivery Drivers, Drive trainers, and all CDL drivers Driver Leads, Operators, Receivers, Pickers, Replenishers, Returns Processor Loaders, and Warehouse Leads employed at the Colorado Springs location. Excluded: Account Managers, Merchandisers, Janitorial/maintenance Employees, Inventory Counters, Line Cleaners, Analysts, Clerical Employees and Supervisors as defined in the Act.",32,NA,NA,NA,NA,NA,NA,NA,NA,NA,NA,NA,NA,NA,NA,NA,NA,NA,NA,NA,NA,NA,"International Brotherhood of Teamsters Local 455"
"27-RC-325418","Region 27, Denver, Colorado","ImageFIRST LLC","Open","09/08/2023","","","Denver","CO",19,"","","Included: Customer aviate, Shuttle Drivers, CDL Drivers, Route Specialists. Excluded: Managers, Supervisors, Clerical Employees, Account Managers, Sales Rep.",NA,NA,NA,NA,NA,NA,NA,NA,NA,NA,NA,NA,NA,NA,NA,NA,NA,NA,NA,NA,NA,NA,"International Brotherhood of Teamsters Local 455"
"27-RC-325759","Region 27, Denver, Colorado","Brundage Bone Concrete Pumping, Inc.","Open","09/14/2023","","","Boise","ID",30,"","","Included: All full-time and regular part-time concrete pump operators and mechanics. Excluded: Office and clerical employees, guards, supervisors, and all other employees.",NA,NA,NA,NA,NA,NA,NA,NA,NA,NA,NA,NA,NA,NA,NA,NA,NA,NA,NA,NA,NA,NA,"International Union of Operating Engineers, Local 302"
"27-RC-326280","Region 27, Denver, Colorado","Penske Truck Leasing Co., L.P.","Open","09/21/2023","","","West Valley City","UT",64,"","","Included:  Mechanics, Techs, CSR/Fuelers, Leads

Excluded:  Administration and Counter, Supervisors, Office Clerical Employees, Janitors, and Guards.",NA,NA,NA,NA,NA,NA,NA,NA,NA,NA,NA,NA,NA,NA,NA,NA,NA,NA,NA,NA,NA,NA,"International Brotherhood of Teamsters Local 222"
"27-RC-326631","Region 27, Denver, Colorado","Albertsons LLC","Open","09/26/2023","","","Star","ID",12,"","","Included: All Journeyperson and Apprentice Meatcutter, Butcher Block, Meat Wrapper, and Meat Clean-Up employees in Boise, Nampa, and Caldwell, ID CBA.
Excluded: All other employees, including supervisors, managers, and guards as defined by the Act.
",NA,NA,NA,NA,NA,NA,NA,NA,NA,NA,NA,NA,NA,NA,NA,NA,NA,NA,NA,NA,NA,NA,"United Food and Commercial Workers International Local 555, AFL-CIO"
"27-RC-326645","Region 27, Denver, Colorado","Albertsons LLC","Open","09/26/2023","","","Ammon","ID",67,"","","Included: All full time and regular part time employees employed at 1901 South 25th East, Ammon, ID, 83406 Excluded: All other employees, including employees working in the Meat Department, the Store Director, and guards and supervisors as defined by the Act.",NA,NA,NA,NA,NA,NA,NA,NA,NA,NA,NA,NA,NA,NA,NA,NA,NA,NA,NA,NA,NA,NA,"United Food and Commercial Workers International Local 555, AFL-CIO"
"27-RC-326700","Region 27, Denver, Colorado","10 Roads Express, LLC","Open","09/27/2023","","","Salt Lake City","UT",40,"","","Included: Drivers. Excluded: Administration, supervisors, office clerical employees, janitors and guards.",NA,NA,NA,NA,NA,NA,NA,NA,NA,NA,NA,NA,NA,NA,NA,NA,NA,NA,NA,NA,NA,NA,"International Brotherhood of Teamsters Local 222"
"27-RC-326942","Region 27, Denver, Colorado","Albertsons, LLC","Open","09/29/2023","","","Payette","ID",7,"","","Included: All Journeyperson and Apprentice Meatcutter, Butcher Block, Meat Wrapper, and Meat Clean-Up employees in Boise, Nampa, and Caldwell, ID CBA.

Excluded: All other employees, including supervisors, managers, and guards as defined by the Act.
",NA,NA,NA,NA,NA,NA,NA,NA,NA,NA,NA,NA,NA,NA,NA,NA,NA,NA,NA,NA,NA,NA,"United Food and Commercial Workers, Local 555"
"27-RC-326961","Region 27, Denver, Colorado","Albertsons LLC","Open","09/29/2023","","","Caldwell","ID",7,"","","Included: All full- and part-time Bakery Production and Cake Decorators in Caldwell, ID (Stores
 #103 and #166) CBA.

Excluded: All other employees, including supervisors, managers, and guards as defined by the
 Act",NA,NA,NA,NA,NA,NA,NA,NA,NA,NA,NA,NA,NA,NA,NA,NA,NA,NA,NA,NA,NA,NA,"United Food and Commercial Workers, Local 555"
"27-RC-326963","Region 27, Denver, Colorado","Albertsons LLC","Open","09/29/2023","","","Meridian","ID",14,"","","Included: All Journeyperson and Apprentice Meatcutter, Butcher Block, Meat Wrapper, and Meat Clean-Up employees in Boise, Nampa, and Caldwell, ID CBA.

Excluded: All other employees, including supervisors, managers, and guards as defined by the Act.
",NA,NA,NA,NA,NA,NA,NA,NA,NA,NA,NA,NA,NA,NA,NA,NA,NA,NA,NA,NA,NA,NA,"United Food and Commercial Workers, Local 555"
"27-RC-326968","Region 27, Denver, Colorado","Albertsons LLC","Open","09/29/2023","","","Boise","ID",7,"","","Included: See attached Excluded: See attached",NA,NA,NA,NA,NA,NA,NA,NA,NA,NA,NA,NA,NA,NA,NA,NA,NA,NA,NA,NA,NA,NA,"United Food and Commercial Workers Local 555"
"27-RC-327154","Region 27, Denver, Colorado","Swissport Cargo Services","Open","10/03/2023","","","Boise","ID",58,"","","Included: Warehouse workers/agent. Excluded: First line supervisors, Managers, confidential employees, clerks and guards as defined in the Act.",NA,NA,NA,NA,NA,NA,NA,NA,NA,NA,NA,NA,NA,NA,NA,NA,NA,NA,NA,NA,NA,NA,"General Teamsters, Warehousemen and Helpers Local Union 483"
"27-RC-327518","Region 27, Denver, Colorado","Albertsons LLC","Open","10/10/2023","","","Mountain Home","ID",5,"","","Included: All other non-supervisory employees employed by the Employer at 528 North Main Street, Mountain Home, ID 837647.

Excluded: All managers, guards, and supervisors as defined by the act.
",NA,NA,NA,NA,NA,NA,NA,NA,NA,NA,NA,NA,NA,NA,NA,NA,NA,NA,NA,NA,NA,NA,"United Food and Commercial Workers, Local 555, AFL-CIO"
