"05-RC-263925","Washington Hospital Center Corporation d/b/a MedStar Washington Hospital Center","Washington","07/22/2020","DC","Included:  All Full-time and Part-time Armed and Unarmed Security Officers performing guard duties as defined in section 9(b)(3) of the National Labor Relations Act, employed by MedStar Washington Hospital Center @ 110 Irving St., NW, Washington, D.C. 20010.  

Excluded:  All Office Clerical employees, Professional employees and Supervisors as defined by the Act.",62,"International Union, Security, Police and Fire Professionals of America (SPFPA)","Open"
"05-RC-268024","Pyramid Baltimore Mgt. LLC d/b/a Residence Inn by Marriott at the Johns Hopkins Medical Campus","Baltimore","10/23/2020","MD","Included: All regular full-time and regular part-time hotel service, housekeeping, food and
beverage, laundry and maintenance employees (including room cleaners, housepersons, kitchen
employees, cooks, servers, runners, bartenders, cashiers, hosts, laundry workers, engineering and parking
employees) employed by the Employer at the Hotel
Excluded: secretarial, office clerical, front desk, sales employees and all managers, supervisors,
and guards as defined in the National Labor Relations Act.",28,"International Union of Operating Engineers, Local 37","Open"
"05-RC-277535","ADT, LLC","Bowie","05/21/2021","MD","Included: 
Service Tech, Installer, Processor and Material Handler employees at Bowie, MD SSO
Excluded:
Other employees and supervisors as defined by the Act.",27,"Local 2, Office and Professional Employees International Union, AFL-CIO","Open"
"05-RC-277661","Institute for Policy Studies","Washington","05/26/2021","DC","Included:  All full-time and regular part-time employees, including fellows.  

Excluded:  Supervisors, managerial employees, confidential employees as defined in Act.
",17,"Washington-Baltimore Newspaper Guild, Local 32035","Open"
"05-RC-277741","CBRE, Inc.","Washington","05/26/2021","DC","Included: All full-time and regular part-time employees employed by the employer working on the employers account for Fed-Ex retail establishments in the Washington, DC Metropolitan Area. Excluded: Office Clerical employees,  Professional employees, managers, guards and supervisors as defined by the Act.",2,"International Union of Operating Engineers, Local 99 a/w International Union of Operating Engineers, AFL-CIO","Open"
"05-RC-278074","Cushman Wakefield U.S. Inc.","Washington","06/04/2021","DC","Included: All Fulltime and regular part-time employees employed by the employer and engaged in facilities Maintenance at 950 L'Enfant Plaza, SW, Washington, DC. Excluded: All clerical employees, all managerial employees, all confidential employees, all professional employees , all guards and supervisors as defined by the act.",3,"International Union of Operating Engineers, Local 99","Open"
"05-RC-278524","Transdev Services, Inc.","Baltimore","06/14/2021","MD","Included: All full-time and regular part-time road supervisors, safety trainers, ready desk clerks, quality assurance employees, lot attendants, and schedule analysts. Excluded: All other employees, guards, and supervisors as defined in the Act.",22,"Amalgamated Transit Union Local 1764","Open"
"05-RC-278676","Sunik, LLC, a subsidiary of Akima, LLC, and American Eagle Protective Services Corporation, as Joint Employers","Triangle","06/17/2021","VA","Included:  All full time and part time armed and unarmed security officers employed by the Employer.

Excluded:  Clerical, managerial, salaried and supervisory personnel as defined by the Act.
",28,"International Union, United Government Security Officers of America and its Local 290","Open"
"05-RC-278832","Hana Industries, Inc.","Washington","06/22/2021","DC","INVOLVED:  ALL FULL-TIME AND PART-TIME ARMED AND UNARMED SECURITY OFFICERS, PSO'S
PERFORMING GUARD DUTIES AS DEFINED IN SECTION 9(b)(3) OF THE NATIONAL LABOR
RELATIONS ACT, EMPLOYED BY HANA INDUSTRIES, INC @ 600 PENNSYLVANIA AVE NW, 601 NEW
JERSEY AVE NW, 999 E STREET NW, WASHINGTON, DC. 
EXCLUDED:  ALL OFFICE CLERICAL EMPLOYEES, PROFESSIONAL EMPLOYEES AND SUPERVISORS AS DEFINED BY THE ACT.",22,"International Union, Security, Police and Fire Professionals of America (SPFPA)","Open"
"05-RC-278906","Washingtonian Media, Inc.","Washington","06/23/2021","DC","Included: All full-time and regular part-time editorial, art and digital products employees.

Excluded: Supervisors, managerial employees and confidential employees as defined in the Act.",22,"Washington-Baltimore News Guild, Local 32035","Open"
"05-RC-279327","LAZ Parking","Washington","07/01/2021","DC","Included:
All full-time and regular part-time operators working at or out of the facility located at 66 New York
Ave NE, Washington DC 20002.

Excluded:
All other employees, guards, and supervisors.",57,"Amalgamated Transit Union","Open"
"05-RC-279371","Georgetown University","Washington","07/01/2021","DC","INCLUDED:  ALL FULL-TIME AND PART-TIME ARMED AND UNARMED SECURITY OFFICERS, SPECIAL POLICE OFFICERS I AND II, MASTER POLICE OFFICERS, INVESTIGATORS AND COMMUNICATION OFFICERS PERFORMING GUARD DUTIES AS DEFINED IN SECTION 9(B)(3) OF THE NATIONAL LABOR RELATIONS ACT, EMPLOYED BY GEORGETOWN UNIVERSITY @ 3700 O STREET, N.W. & 600 NEW JERSEY AVE, WASHINGTON, DC.
EXCLUDED:  ALL OFFICE CLERICAL EMPLOYEES, PROFESSIONAL EMPLOYEES AND SUPERVISORS AS DEFINED BY THE ACT.
",73,"International Union, Security, Police and Fire Professionals of America (SPFPA)","Open"
"05-RC-279427","First Transit, Inc.","Baltimore","07/02/2021","MD","Included:  All full-time and regular part-time facility technicians working at or out of the Employer’s current facility at 2600 Sisson St, Baltimore. The Union seeks an Armour-Globe election.  Excluded:  All other employees, guards, and supervisors under the Act.",2,"Amalgamated Transit Union Local 1764","Open"
"05-RC-279540","Paragon Systems, Inc.","Washington","07/07/2021","DC","Included:  All full-time and regular part-time security officers employed by the Employer at the National Institutes of Health (NIH).

Excluded:  All officer, clerical employees, professional employees, lieutenants and captain
",300,"Union Rights For Security Officers (URSO)","Open"
"05-RC-279596","Constellis","Washington","07/08/2021","DC","Included: All full-time and regular part-time security officers employed by the Employer at the EPA Building 

Excluded: Excluding office clerical employees, professional employees, managerial employees, Project Managers, Assistant Project Managers, and supervisors as defined by the Act",70,"United Career Professionals (UCP)","Open"
"05-RC-279676","Defenders of Wildlife","Washington","07/09/2021","DC","Included:  All full-time and regular part time employees employed by the Employer.

Excluded:  All confidential employees, managers, guards and supervisors as defined in the Act.
",96,"Office & Professional Employees International Union, Local 2","Open"
"05-RC-279973","Keurig Dr. Pepper Inc.","Windsor","07/16/2021","VA","Included: All full-time and regular part time production and maintenance employees, including plant clericals, and employees in the following departments: Coffee Processing, Production, Shipping and Receiving, and Facilities/Maintenance. 

Excluded: Office clericals, temporary employees, coaches, quality personnel, subcontracted employees, managers, drivers, guards, and supervisors as defined in the Act.
",400,NA,"Open"
"05-RC-279989","Chenega Infinity, LLC","Cheltenham","07/16/2021","MD","Included:  All full-time and part-time armed and unarmed dispatchers, commercial vehicle inspectors and security officers performing guard duties as defined in section 9(b)(3) of the National Labor Relations Act, employed by Chenega Infinity, LLC at 9000 Commo Rd, Bldg 6, Cheltenham, MD 20623.  Excluded:  All office clerical employees, professional employees and supervisors as defined by the Act.",28,NA,"Open"
"05-RD-256888","Mountaire Farms Inc.","Selbyville","02/25/2020","DE","Included: 1st Processing, 2nd Processing and Tray Pack;  Excluded:  Transportation, Live Haul Drivers, Shipping, Coolers, Maintenance, HR, Box room, QA, Paws, Giblets",800,"United Food and Commercial Workers Union Local 27 a/w United Food and Commercial Workers International Union, AFL-CIO","Open"
"05-RM-275681","Keolis Transit Services, LLC","Leesburg","04/15/2021","VA","Included: Driver/Operators, Dispatchers, Road Supervisors, Maintenance Foreman, Mechanic, Utility Workers, and Parts Clerks.

Excluded: All other employees, Office clericals, Guards and Supervisors as defined in the Act.",94,"Amalgamated Transit Union, Local 689","Open"
"05-UD-277647","Excalibur Associates","Gaithersburg","05/25/2021","MD","Included:  Excalibur Associates Dispatch and Guard Force.  Excluded:  Supervision",36,"Security, Police and Fire Professionals of America (SPFPA)","Open"
"05-UD-279719","Security Walls, LLC","Washington","07/09/2021","DC","security officers at National Agriculture Library (NAL) MD, Beltsville Agricultural Research Center (BARC) MD, U.S. National Arboretum (USNA) DC.",38,"International Union, Security, Police and Fire Professionals of America (SPFPA)","Open"
"06-RC-279245","JSP Resins, LLC","Butler","06/29/2021","PA","Included: All full-time and regular part-time production and maintenance employees of JSP Resins, LLC at the Butler, Pennsylvania facility.

Excluded: All temporary employees, office clerical and professional employees, managers, guards and supervisors as defined in the Act, Safety Coordinators, and all employees of JSP International LLC and JSP Specialty Foams LLC at the Butler, Pennsylvania facility.",40,"United Steel, Paper and Forestry, Rubber, Manufacturing, Energy, Allied & Industrial Service Workers International Union, AFL-CIO/CLC","Open"
"06-RC-279869","Hometown Disposal","Selinsgrove","07/14/2021","PA","Included: All slingers, drivers and mechanics

Excluded: All other employees as defined by the Act.",22,"Teamsters Local Union No. 764","Open"
"06-RD-273153","GBC Advanced Materials, LLC","Latrobe","02/22/2021","PA","Included: All production and maintenance employees, including plant clerical employees, of the Company at Latrobe, PA plant.

Excluded: Office clerical employees, draftsmen, salesmen, confidential employees, all other employees, all other employees and guards, professional employees and supervisors as defined in the Labor Management Act of 1947, as amended.",20,"IUE-CWA, The Industrial Division of the Communications Workers of America, AFL-CIO, CLC","Open"
"06-RD-279255","ST Engineering","Montgomery","06/29/2021","PA","Included: All full-time and regular part-time production, maintenance, shipping and receiving and Quality Control employees
Excluded: All temporary employees, office clerical employees and guards, professional employees and supervisors as defined by the Act.",109,"United Steel, Paper and Forestry, Rubber, Manufacturing, Energy, Allied Industrial and Service Workers International Union, AFL-CIO/CLC","Open"
"06-RD-279339","Duritza's Enterprises, Inc. d/b/a Rostraver Shop' N Save","Belle Vernon","07/01/2021","PA","Included: Deli, Produce, Front End, Stockers, Meat, Dairy, Frozen, Floral Departments
Excluded:",60,"United Steel, Paper and Forestry, Rubber, Manufacturing, Energy, Allied Industrial and Service Workers International Union, Local 3403, AFL-CIO, CLC","Open"
"06-UD-279304","Kinzua Healthcare and Rehabilitation Center","Warren","06/30/2021","PA","Included:  CNAs, LPNs, van drivers/maintenance, housekeeping and laundry aide employees

Excluded:  Receptionists, Dietary employees, central supply employees, office clerical employees, and guards and supervisors",58,"SEIU","Open"
"07-RC-269162","American Steel Construction","Livonia","11/18/2020","MI","Included: Full time and regular part time journeyman and apprentice field ironworkers

Excluded: All others including clerical, professional, guards and supervisors under the act",8,"Local 25, International  Association of Bridge, Structural, Ornamental and Reinforcing Iron Workers (Iron Workers), AFL-CIO","Open"
"07-RC-269780","AT&T Mobility Services, LLC","Southfield","12/04/2020","MI","All Outside Premise Sales Representatives employed within the AT&T Mobility Home Solutions
Departrnent holding the titles of Integrated Solutions Consultants (""""ISCs"""") and Integrated Sales
Support Specialists (""""IS S S""""), and reporting to 23500 Northwestern Hwy, Bldg. S, Southfield, MI
48075.",47,"Communications Workers of America","Open"
"07-RC-279145","I Am Detroit, Inc.","Plymouth","06/28/2021","MI","Included:  Any and all full and part-time Screen Printers, Embroiderer, Sales, Graphic Designer

Excluded:  All office personnel, supervisors, guards as defined in the Act.",5,"Teamsters Local Union No. 337 affiliated with the International Brotherhood of Teamsters (IBT)","Open"
"07-RC-279146","Anji Logistics USA Inc.","Lake Orion","06/28/2021","MI","Included: All Full and Part Time Warehouse Workers, Material Handlers, Forklift Operators 

Excluded: Supervisors, Managers, Office, Clerical and Guards as defined in the act.",8,"Local 9699, International Union, United Automobile, Aerospace and Agricultural Implement Workers of America (UAW), AFL-CIO","Open"
"07-RC-279155","Eissmann Automotive Port Huron LLC","Port Huron","06/28/2021","MI","Included: All Full and Part Time Production Workers, Quality Control Workers, Maintenance, Logistics, Trainers, Line Leaders 

Excluded: Supervisors, Managers, Clerical and Guards as defined in the Act.",155,"Local 9699, International Union, United Automobile, Aerospace and Agricultural Implement Workers of America (UAW), AFL-CIO","Open"
"07-RC-279452","Power Home Solar, LLC","Chesterfield","07/06/2021","MI","Included: All Licensed Masters, Journeymen and Apprentice Installers and Electricians employed

Excluded: Owner, Supervisor, Office Staff,
Guards",30,"Local 58, International Brotherhood of Electrical Workers  (IBEW), AFL-CIO","Open"
"07-RD-264330","Rieth-Riley Construction Co., Inc.","Grand Rapids, Kalamazoo, Petoskey, Lansing","08/07/2020","MI","Included:  All full and regular part-time asphalt plant employees, paving and grading employees in Michigan

Excluded:  Guards and Supervisors",161,"Local 324, International Union of Operating Engineers (IUOE)","Open"
"07-RD-276540","Lutheran Homes of Michigan d/b/a Wellspring Lutheran Services","Frankenmuth","05/03/2021","MI","Included: Nursing and Social Work

Excluded: NA",17,"International Union, United Automobile, Aerospace and Agricultural Implement Workers of America (UAW), AFL-CIO","Open"
"07-RD-279735","Wellspring Lutheran Services","Frankenmuth","07/12/2021","MI","Included: Nursing and Social Work

Excluded: NA",17,"International Union, United Automobile, Aerospace and Agricultural Implement Workers of America (UAW), AFL-CIO","Open"
"08-RC-275374","The American National Red Cross","Cleveland","04/09/2021","OH","All Volunteer Engagement Representatives I and II managed through Blood Services Northern Ohio Region of the American Red Cross to be included in the Petitioner's existing unit consisting of the Employer's regular full-time and regular  part-time Donor Recruitment Department Account Managers, as certified in NLRB Case Nos. 8-RC-153338, but excluding any Volunteer Engagement Representatives managed by other Regions of the American Red Cross.",7,"Teamsters Local Union No. 507","Open"
"08-RC-276098","Trinity Health System","Steubenville","04/23/2021","OH","Included: Service and maintenance employees including all physical therapy aides,
the physical therapy transporter, pharmacy technicians I and II, noncertified
inhalation therapy technicians, anesthesia aides, EEG technicians,
EKG technicians, laundry aides, laundry porters, laundry finishing
supervisor, laundry washer supervisor, laundry packing and distribution
supervisor, radiology transporters, radiology darkroom technician,
radiology patient control clerk, laboratory helper, laboratory porters, dietary
aides, dietary porters, diet writers, dietary inventory clerk, head cook,
assistant cooks, vegetable cook, baker, dietary cashier, relief aides,
housekeepers I, housekeepers II, housekeeping aide II, seamstresses,
assistant engineers, engineers, general maintenance men, groundsman I,
groundsman II, painter I, painter II, nurses' aides, ward helpers, ward clerks,
orderlies, instrument and supply technician, the fireman, medical records
clerks I and II, blood bank secretary, storeroom manager, storeroom clerk,
secretary to director of pharmacy, secretary to director of anesthesiology,
radiology department secretaries, laboratory secretaries, secretary to the
director of housekeeping, secretary to director of maintenance, all clerical
employees other than business office clerical employees, including
employees in the following job classifications: Behavioral Medicine Clerk,
Cook, Dietary Aide, Environmental Services Technician, Environmental
Services Technician Lead, Fireman, Groundsman, Head Cook,
Housekeeper, HVAC Engineer II, Inventory Technician, Licensed Boiler
Operator, Linen Distribution Attendant, LPN, Maintenance Mechanic,
Maintenance Mechanic Lead, Nursing Assistant, Nursing Attendant,
Nursing Attendant/Clerk, Phlebotomist, Porter, Registered Radiographer,
Sanitation Attendant, Storeroom Clerk, Vegetable Cook, Therapeutic
Technician, Ward Clerk.
Excluded: All other employees, business officer clerical employees, nursing school
housemothers, casual employees, professional employees, guards and
supervisors as defined in the Act, all employees enrolled as students in
Hospital training programs, relief employees, and temporary employees.",58,"Office & Professional Employees International Union, AFL-CIO, Local 457","Open"
"08-RC-276665","Ohio Ready Mix, Inc.","Huntsville","05/05/2021","OH","Included: All driver and bundlers Excluded: All management, office clerical, and supervisors as defined by the Act.",24,"International Brotherhood of Teamsters (IBT), Local Union 908","Open"
"08-RC-277762","Golden SVCS, LLC","Cleveland","05/27/2021","OH","Included: All full-time and part-time Security Officers employed by the Employer at the NASA Glenn Research Center/Lewis Field Excluded: All clerical employees, professional employees, and supervisors as defined under the Act.",45,"Ohio Patrolmen's Benevolent Association","Open"
"08-RC-277782","Linxx Global Solutions, Inc.","Sandusky","05/27/2021","OH","Included: All full-time and part-time Security Officers employed by the Employer at the NASA Neil Armstrong Test Facility/Plum Brook. Excluded: All clerical employees, professional employees, and supervisors as defined under the Act.",18,"Ohio Patrolmen's Benevolent Association","Open"
"08-RC-278766","INEOS Pigments USA, Inc.","Ashtabula","06/21/2021","OH","Included: All full and regular part-time production, maintenance, instrumenticians and electricians, shipping and receiving, and warehouse employees.

Excluded: All office clerical employees, professional employees, lab employees, guards and supervisors, as defined in the Act.",129,"International Chemical Workers Union Council of the UFCW, Local 1033C","Open"
"08-RC-279485","Gannett Media Corporation","Kent","07/06/2021","OH","All full and regular part time news department employees of the Record Courier.",7,"Northeast Ohio Newspaper Guild/TNG-CWA Local 34001","Open"
"09-RC-278921","ZEON CHEMICALS L.P.","Louisville","06/23/2021","KY","Included:  All Warehouse associates, all sample center coordinators, all quality inspection specialists.  Excluded:  All customer service coordinators, administrative employees, security, janitorial, and all supervisors and managers defined by the Act",7,"General Drivers, Warehouseman and Helpers, Local Union No. 89, affiliated with the International Brotherhood of Teamsters","Open"
"09-RD-200329","LEGGETT & PLATT, INC.","Winchester","06/09/2017","KY","Included:  Production & Maintenance employees at the New St. and Ecton Rd., Winchester, KY facility including inspectors and shipping and receiving employees.

Excluded:  Over the road drivers, office clerical emplooyees, quality auditors, inventory control employees, parts attendants, guards, professional employees, and supervisors.",50,"International Association of Machinists and Aerospace Workers, AFL-CIO (IAM), Local 619","Open"
"10-RC-253354","Johnston Fire Services, LLC","Paducah","12/13/2019","KY","Included: Sprinkler fitters, laborers, and Mechanics",6,"Road Sprinkler Fitters Local Union 669","Open"
"10-RC-273024","Nissan North America, Inc.","Smyrna","02/19/2021","TN","Included: Tool and Die Maintenance Technicians

Excluded: Maintenance, Production, all other employees, & usual exclusions under the Act",87,"International Association of Machinists and Aerospace Workers, (IAM) District Lodge 1888","Open"
"10-RC-276292","The Atlanta Opera, Inc.","Atlanta","04/28/2021","GA","Included: All Make-Up Artists and Hair Stylists employed by the Employer. Excluded: All other employees, including all clerical workers, managers, guards, and supervisors as defined by the Act.",16,"Make-Up Artists and Hair Stylists Union, Local 798, IATSE","Open"
"10-RC-276475","Duke University","Durham","05/03/2021","NC","Included:  All full-time and regular part-time employees.

Excluded:  Supervisors, managerial employees, and confidential employees as defined in the Act.
",77,"Washington-Baltimore News Guild, Local 32035","Open"
"10-RC-277931","Atlanta Gas Light Company","Atlanta","06/02/2021","GA","Included: Fleet Mechanic, I, II & III and Fleet Mechanic Specialists 

Excluded: All Clerical, office employees, security guards, janitorial, grounds keeping and supervisory personnel as defined by the NLRA.",9,"International Brotherhood of Electrical Workers Local Union 1997","Open"
"10-RC-277986","Elite Aire, LLC","Mayfield","06/03/2021","KY","Included: All full time and regular part-time HVAC technicians, installers, and helpers employed by Elite Aire, LLC; Excluded: All full time and regular part-time HVAC technicians, installers, and helpers employed by Elite Aire, LLC;",3,"Plumbers & Steamfitters Local 184","Open"
"10-RC-278675","Titan Distribution, Inc.","Jefferson","06/17/2021","GA","Included:  All full-time and regular part-time production and maintenance employees at the Employer's facility in Jefferson, GA.

Excluded:  All temporary employees, office clerical and professional employees, guards, and supervisors as defined in the Act.",30,"United Steel, Paper and Forestry, Rubber, Manufacturing, Energy, Allied Industrial and Service Workers International Union (USW), AFL-CIO, CLC","Open"
"10-RC-278879","Goldbelt C6","Elizabeth City","06/23/2021","NC","Included:
CNC Programmer, Draftsmen/CAD Operator-pro
Excluded:
All others Including managers, supervisors, office clerical, engineers, and guards.",7,"International Association of Machinists and Aerospace Workers","Open"
"10-RC-279259","Garten Trucking LLC","Covington","06/30/2021","VA","Included: All full time and part time truck drivers, Maintenance, truck wash and Dispatch employees. 

Excluded: All temporary employees, guards, and supervisors as defined by the Act.",104,"Association of Western Pulp and Paper Workers","Open"
"10-RC-279386","Vulcan Heating and Air Conditioning Service, Inc.","Madison","07/02/2021","AL","Included: All full-time and regular part-time HVAC service technicians employed by the Employer at its 7243 Greenbriar Road, Madison, Alabama facility. Excluded: All other employees, office clerical employees, guards and supervisors as defined by the Act.",11,"Plumbers and Pipefitters Local 760, United Association of Journeymen and Apprentices of the Plumbing and Pipe Fitting Industry of the United States and Canada, AFL-CIO","Open"
"10-RC-279607","Middle Tennessee Electric Membership Corporation","Murfreesboro","07/08/2021","TN","Included: This petition seeks a self-determination election for the presently unrepresented all full-time and regular part-time Fleet Maintenance Mechanics at the Middle Tennessee Electric Membership Corporation, Murfreesboro TN. facilities, and to be included in current unit in collective bargaining agreement dated the 26th day of August 2018 between the Middle Tennessee Electric Membership Corporation and Local Union No. 175 of the International Brotherhood of Electrical Workers. 

Excluded: All other employees, confidential employees, and guards and supervisors as defined by the act.",6,"International Brotherhood of Electrical Workers Local 175","Open"
"10-RC-279628","ADC LTD NM","Hapeville","07/08/2021","GA","Included:  All full-time and part-time armed and unarmed security officers employed by the Employer.

Excluded:  Clerical, managerial, salaried, and supervisory personnel as defined by the Act.",8,"United Government Security Officers of America and its Local 291","Open"
"10-RC-279779","Carmeuse North America","Macon","07/13/2021","GA","Included: All full-time and regular part-time production and maintenance employees at the Employer's facility in Macon, GA; Excluded: All temporary employees, office clerical and professional employees, guards, and supervisors as defined in the Act",4,"U","Open"
"10-RC-279837","Specialty Foundry Products Inc.","Bessemer","07/13/2021","AL","Included: All bricklayers and masons employed by the Employer. Excluded: General laborers, shop hands, mason tenders, supervisors, guards, and office staff as defined by the Act.",6,"Bricklayers and Allied Craftworkers Local 8 Southeast","Open"
"12-RC-273568","Easy Rental Equipment, Inc.","Ponce","03/02/2021","PR","Included: All the full time and regular part time crane operators employed by the employer at its Ponce facilities Excluded: All other employees, office clerical employees, professional employees, confidential employees, guards and supervisors as defined by the Act",5,"Laborers’ International Union of North America (LIUNA), District Council of Puerto Rico, AFL-CIO","Open"
